Question,Response,Contexts,Ground Truth,Token Count,Total Cost (USD),Completion Tokens,Number of Retrieved documents,Response time,answer_relevancy,context_precision,context_recall,faithfulness,BleuScore,RougeScore
What ist die gesetzliche Verjährungsfrist für die Auszahlung des Restguthabens einer gekündigten Prepaid-Karte?,Die gesetzliche Verjährungsfrist für die Auszahlung des Restguthabens einer gekündigten Prepaid-Karte beträgt das laufende Jahr der Kündigung und weitere 3 Jahre. Sie können Ihr Restguthaben über das Kontaktformular bei Telekom auszahlen lassen. Weitere Informationen finden Sie auf der [Telekom-Hilfeseite](https://www.telekom.de/hilfe/mobilfunk/tarife-optionen/prepaid-tarife/restguthaben-auszahlen).,"[""page_content='Source URL: https://www.telekom.de/hilfe/mobilfunk/tarife-optionen/prepaid-tarife/restguthaben-auszahlen\n\nQuestion: Wie kann ich mir das Restguthaben der gekündigten Prepaid-Karte auszahlen lassen? Answer: Über unserKontaktformularhaben Sie die Möglichkeit, Ihr Prepaid Restguthaben innerhalb der gesetzlichen Verjährungsfrist (laufendes Jahr der Kündigung und 3 weitere Jahre) auszahlen zu lassen.' metadata={'source': 'data/Hilfe bei Störungen/https___www.telekom.de_hilfe_mobilfunk_tarife-optionen_prepaid-tarife_restguthaben-auszahlen.txt'}"", ""page_content='Sobald Sie Ihr Guthaben wieder aufgeladen haben, ziehen wir nur noch den Differenzbetrag zwischen dem bereits anteilig abgezogenen und dem tatsächlichen Grundpreis für 4 Wochen ab. Beispiel-RechnungWenn Ihr Prepaid-Tarif monatlich9,95 Eurokostet und am Abbuchungstag nicht mehr ausreichend Guthaben auf Ihrer Karte ist, dann ziehen wir anteilig pro Tag gerundet 36 Cent von Ihrem Guthaben ab. Das entspricht 9,95 Euro geteilt durch 28 Tage.' metadata={'source': 'data/Hilfe bei Störungen/https___www.telekom.de_hilfe_mobilfunk_tarife-optionen_prepaid-tarife_grundpreis-anteilig.txt'}"", 'page_content=\'Source URL: https://www.telekom.de/hilfe/mobilfunk/tarife-optionen/prepaid-tarife/restguthaben-vertragswechsel\n\nQuestion: Was passiert mit meinem Restguthaben, wenn ich meine Prepaid-Karte in einen Laufzeitvertrag umwandle? Answer: Ihr Restguthaben wird automatisch auf einer der ersten Rechnungen unter dem Punkt ""Prepaid-Guthabenübertrag"" ausgewiesen und mit dem Gesamtbetrag verrechnet.\' metadata={\'source\': \'data/Hilfe bei Störungen/https___www.telekom.de_hilfe_mobilfunk_tarife-optionen_prepaid-tarife_restguthaben-vertragswechsel.txt\'}', 'page_content=\'Die Karten sind verjährt. Die Möglichkeit, die Umtauschkarte Plus im Internet letztmalig in eine ""Verlängerungskarte UTK Plus"" zu transferieren, um das Guthaben zu verbrauchen, war ein Angebot und erfolgte aus Kulanz und ohne Anerkennung einer Rechtspflicht. Dieses Angebot wurde zum 31.\' metadata={\'source\': \'data/Hilfe bei Störungen/https___www.telekom.de_hilfe_internet-telefonie_telefonie_abgelaufene-telefonkarten.txt\'}', ""page_content='Ich finde leider in der App nirgendwo eine Angabe zur Kündigungsfrist, die müsste aber nach Ablauf von 24 Monaten 4 Wochen betragen?' metadata={'source': 'data/Hilfe bei Störungen/telekomhilft.telekom.de_t5_Festnetz-Internet_Kuendigungsfrist-Magenta-Zuhause-M_td-p_6977148_jump-to_first-unread-message.txt'}"", ""page_content='Source URL: https://www.telekom.de/hilfe/vertrag-rechnung/rechnung/auszahlung-guthaben\n\nQuestion: Wie wird das Guthaben meiner Schlussrechnung oder einer Gutschrift ausgezahlt? Answer: Das Guthaben überweisen wir Ihnen auf die bei uns hinterlegte Bankverbindung innerhalb von 3 - 10 Werktagen.' metadata={'source': 'data/Hilfe bei Störungen/https___www.telekom.de_hilfe_vertrag-rechnung_rechnung_auszahlung-guthaben.txt'}"", ""page_content='Source URL: https://www.telekom.de/hilfe/vertrag-rechnung/vertrag/kuendigung/reaktivierung-frist\n\nQuestion: Wie lange kann ich meinen Mobilfunk-Vertrag oder meine Prepaid-Karte reaktivieren? Answer: Sie haben 112 Kalendertage Zeit, um Ihren Laufzeit- oder Prepaid-Vertrag nach einer Kündigung kostenlos zu reaktivieren.' metadata={'source': 'data/Hilfe bei Störungen/https___www.telekom.de_hilfe_vertrag-rechnung_vertrag_kuendigung_reaktivierung-frist.txt'}"", ""page_content='Source URL: https://www.telekom.de/hilfe/mobilfunk/tarife-optionen/prepaid-tarife/startguthaben\n\nQuestion: Was passiert mit meinem Prepaid-Startguthaben? Answer: Wenn eine neue\xa0Prepaid-Karte aktiviert wird, buchen wir automatisch für\xa0den ersten Zahlungszeitraum den\xa0Betrag des gewählten Tarifs\xa0vom Startguthaben ab.' metadata={'source': 'data/Hilfe bei Störungen/https___www.telekom.de_hilfe_mobilfunk_tarife-optionen_prepaid-tarife_startguthaben.txt'}""]",Die gesetzliche Verjährungsfrist für die Auszahlung des Restguthabens einer gekündigten Prepaid-Karte beträgt das laufende Jahr der Kündigung und 3 weitere Jahre.,1350,0.00024704999999999996,99,8,80.34493398666382,0.8891630633112767,0.9999999999,1.0,0.5,0.45643796175209217,0.6046511627906976
What sind die Bedingungen für die Nutzung der Travel Mobil Optionen im Ausland?,"Die Bedingungen für die Nutzung der Travel Mobil Optionen im Ausland beinhalten, dass Sie die für Ihr Reiseland passende Option auswählen. Es gibt verschiedene Optionen, wie Travel Mobil und Travel Mobil World, die es Ihnen ermöglichen, Ihr Telekom-Datenvolumen im Ausland zu nutzen. Diese Optionen sind ideal, wenn Sie viel Datenvolumen benötigen oder regelmäßig telefonieren und SMS senden möchten.

Zusätzlich haben die Travel Mobil Basic Optionen ein Minuten- und SMS-Budget, das bei Verbrauch keine Benachrichtigung sendet. Es wird empfohlen, den Verbrauch über die Anrufliste und die Anzahl der versendeten SMS zu überprüfen. Für mehr Highspeed-Datenvolumen können Sie jederzeit einen Travel & Surf Pass buchen.

Für weitere Details und spezifische Bedingungen empfehle ich Ihnen, die Informationen auf der Telekom-Website zu besuchen: [Telekom Hilfe](https://www.telekom.de/hilfe/mobilfunk/tarife-optionen/ausland-roaming/erklaerung-travel-mobil).","[""page_content='Source URL: https://www.telekom.de/unterwegs/tarife-und-optionen/roaming/travel-mobil-optionen\n\nQuestion: Welche Travel Mobil Option ist für mich die Richtige? Answer: Zunächst schauen Sie, mit welcher Travel Mobil Option Ihr Reiseland abgedeckt wird. So kommen für Länder wie Australien, Neuseeland, China oder Thailand nur die World Optionen in Frage. Dann entscheiden Sie, wie intensiv Sie im Reiseland Ihr Handy nutzen möchten.Möchten Sie sich keine Gedanken um die Mobilfunknutzung machen und benötigen eher viel Datenvolumen? Dann sind Travel Mobil bzw. Travel Mobil World die richtige Wahl. Damit können Sie das Telekom-Datenvolumen Ihres Inlandstarifs mit ins Ausland nehmen und dort surfen und telefonieren, wie Sie es von zuhause gewohnt sind.Wenn Ihnen ein 1 GB Internetnutzung, 60 Minuten Telefonie und 100 SMS als Basispaket ausreichen, dann sind unsere Basic Optionen genau das Richtige für Sie - optimal für Mobile Payment, das Versenden von Textnachrichten per Whatsapp, Google Maps Navigation unterwegs oder die gelegentliche Nutzung von Social Media. Für mehr Highspeed-Datenvolumen können Sie jederzeit einen Travel & Surf Pass dazu buchen. Und wenn das Minuten- oder SMS-Budget verbraucht ist, haben Sie mit den Travel Mobil Basic Optionen vergünstigte Nutzungspreise.Falls Sie sich nicht sicher sind, empfehlen wir Ihnen zunächst die Basic-Optionen. Die lohnen sich schon ab 11 Minuten Telefonie oder geringer Internetnutzung. Damit behalten Sie Ihre Mobilfunk-Kosten auch außerhalb der EU bequem im Griff. Question: Was passiert, wenn ich mit Travel Mobil oder Travel\xa0Mobil\xa0World bei Reiseantritt bereits mein Datenvolumen verbraucht habe? Answer: Für diesen Fall kann innerhalb der ersten 30 Tage nach Buchung einmalig ein kostenloser SpeedOn Pass gebucht werden. Damit stehen 1 GB für 30 Tage zur Verfügung. Nach Verbrauch des SpeedOn Passes bzw. des Inlandsvolumens wird die Bandbreite im jeweiligen Kalendermonat auf max. 64 KBit/s im Download und 16 KBit/s im Upload beschränkt. Zur Wiederherstellung der maximal verfügbaren Bandbreite sind SpeedOn Pässe aus dem Inland buchbar. Zu Beginn des nächsten Kalendermonats steht wieder das volle Inlandsvolumen zur Verfügung. Question: Wie erfahre ich, wann bei Nutzung von Travel Mobil Basic und Travel Mobil Basic World die Inklusivleistungen verbraucht sind? Answer: Nach Verbrauch der Minuten- und SMS-Budgets erfolgt keine Benachrichtigung. Am besten prüfen Sie in Ihrer Anrufliste die verbrauchten Telefonminuten (abgehend und ankommend) sowie in Ihren Nachrichten die Anzahl der versendeten SMSen. Der Verbrauch des Datenbudgets ist über pass.telekom.de einsehbar. Für Full-Speed-Datenroaming oder nach Verbrauch von 1 GB sind jederzeit Travel & Surf Pässe buchbar. Question: Welche Alternativen gibt es zu den beiden Optionen? Answer: Telefonate und SMS werden außerhalb Europas nach Verbrauch (d.h. je Minute oder SMS) abgerechnet. Die jeweiligen Preise für Ihr Reiseland finden Siehier. Für die mobile Datennutzung außerhalb Europas können Sie auch unsere günstigen Travel & Surf Pässe buchen. Diese sind unter www.pass.telekom.de buchbar, sobald Sie in Ihrem Reiseland angekommen sind.' metadata={'source': 'data/Hilfe bei Störungen/https___www.telekom.de_unterwegs_tarife-und-optionen_roaming_travel-mobil-optionen.txt'}"", ""page_content='Source URL: https://www.telekom.de/hilfe/mobilfunk/tarife-optionen/ausland-roaming/erklaerung-travel-mobil\n\nQuestion: Was ist Travel Mobil? Answer: Mit den unterschiedlichen Auslandsoptionen Travel Mobil können Sie in vielen Ländern außerhalb der EU Telefonieren, SMS schreiben und Surfen.' metadata={'source': 'data/Hilfe bei Störungen/https___www.telekom.de_hilfe_mobilfunk_tarife-optionen_ausland-roaming_erklaerung-travel-mobil.txt'}"", ""page_content='Source URL: https://www.telekom.de/hilfe/mobilfunk/tarife-optionen/ausland-roaming/travel-mobil-buchen\n\nQuestion: Wie buche ich eine Travel Mobil Option? Answer: Sie können die unterschiedlichen Auslandsoptionen Travel & Mobil im Kundencenter und der MeinMagenta App selbst buchen.' metadata={'source': 'data/Hilfe bei Störungen/https___www.telekom.de_hilfe_mobilfunk_tarife-optionen_ausland-roaming_travel-mobil-buchen.txt'}"", ""page_content='Weitere Informationen finden Sie unterTravel & Surf. Question: Wie kann ich die Option bei einer Vorabbuchung stornieren? Answer: Rufen Sie einfach unsere Hotline an (Kurzwahl2202) und lassen Sie die Option stornieren. Eine Vorabbuchung ist bis drei Stunden vor Beginn der Gültigkeit jederzeit stornierbar. Question: Entstehen zusätzliche Kosten für ankommende Anrufe im Ausland, wenn ich eine Travel Mobil Option nutze? Answer: Innerhalb des jeweils zur Verfügung stehenden Minuten-Budgets entstehen keine zusätzlichen Kosten für ankommende Anrufe, auch nicht für eventuelle Zuschläge lokaler Netzbetreiber. Question: Gelten die Travel Mobil Optionen auch für WLAN Call? Answer: Nein, die Optionen gelten nicht für Telefonate über WLAN Call. Das bedeutet, dass für Telefonate über WLAN Call zusätzliche Kosten anfallen können. Wir empfehlen daher, im Ausland WLAN Call zu deaktivieren, wenn Sie Travel Mobil oder Travel Mobil World gebucht haben. Weitere Informationen finden Sie unterWLAN Call im Ausland. Question: Was genau bedeutet eine Laufzeit von einem Monat? Answer: Die Option gilt immer bis inklusive des Vortages des Folgemonats. Wenn Sie z.' metadata={'source': 'data/Hilfe bei Störungen/https___www.telekom.de_unterwegs_tarife-und-optionen_roaming_travel-mobil-optionen.txt'}"", ""page_content='Source URL: https://www.telekom.de/hilfe/mobilfunk/tarife-optionen/ausland-roaming/kosten-ankommende-anrufe-travel-mobil\n\nQuestion: Entstehen zusätzliche Kosten für ankommende Anrufe im Ausland, wenn ich eine Travel Mobil Option nutze? Answer: Bei Travel Mobil Optionen haben Sie ein Minutenbudget zum Telefonieren inklusive.' metadata={'source': 'data/Hilfe bei Störungen/https___www.telekom.de_hilfe_mobilfunk_tarife-optionen_ausland-roaming_kosten-ankommende-anrufe-travel-mobil.txt'}""]","Die Bedingungen für die Nutzung der Travel Mobil Optionen im Ausland sind nicht direkt im Kontext angegeben. Es wird jedoch erwähnt, dass die Optionen nicht für Telefonate über WLAN Call gelten und dass innerhalb des verfügbaren Minuten-Budgets keine zusätzlichen Kosten für ankommende Anrufe entstehen. Weitere Informationen sind unter WLAN Call im Ausland verfügbar.",1795,0.00035925,200,5,73.81027507781982,0.9200819029201405,0.8041666666465626,0.75,1.0,0.10042280544004875,0.23809523809523814
What should you do if your Mobilteil is too far from the base station?,"Wenn Ihr Mobilteil zu weit von der Basisstation entfernt ist, kann es zu Verbindungsproblemen kommen. In diesem Fall sollten Sie versuchen, sich näher an die Basisstation zu begeben. Sollte die Meldung auch bei Annäherung an die Basisstation nicht verschwinden, empfehlen wir Ihnen, die Software neu zu starten. Dazu entfernen Sie bitte den Netzstecker und das Telefonkabel der Basisstation für zwei Minuten. 

Wenn das Problem weiterhin besteht, können Sie weitere Unterstützung auf www.telekom.de/hilfe finden.","[""page_content='Answer: Es kann sein, dass sich Ihr Mobilteil zu weit von der Basisstation entfernt befindet.' metadata={'source': 'data/Hilfe bei Störungen/https___www.telekom.de_hilfe_geraete-zubehoer_telefone-und-anlagen_informationen-zu-unseren-aktuellen-telefonen_display-anzeige-suche-reichweite.txt'}"", ""page_content='Der derzeit beste Strahlungsschutz sorgt dafür, dass die Sendeleistung entsprechend der Entfernung zwischen Basisstation und Mobilteil automatisch angepasst wird. Im Ruhezustand bleibt der Sender der Basisstation ganz abgeschaltet.' metadata={'source': 'data/Hilfe bei Störungen/https___www.telekom.de_hilfe_geraete-zubehoer_telefone-und-anlagen_informationen-zu-unseren-aktuellen-telefonen_full-eco-mode-plus.txt'}"", ""page_content='Source URL: https://www.telekom.de/hilfe/hilfe-bei-stoerungen/probleme-mit-mobilfunk\n\nQuestion: Störung der Mobilfunk-Verbindung: Was kann ich tun? Answer: Wenn Ihr Smartphone kein Funknetz erreichen kann\xa0ist grundsätzlich zu klären,\n\n• ob ein Verbindungsproblem an Ihrem Smartphone vorliegt oder\n• ob es sich um eine Störung der Funkverbindung auf Seiten der Telekom handelt.' metadata={'source': 'data/Hilfe bei Störungen/https___www.telekom.de_hilfe_hilfe-bei-stoerungen_probleme-mit-mobilfunk.txt'}"", ""page_content='Sollte die Meldung auch bei Annäherung an die Basisstation nicht verschwinden, empfehlen wir Ihnen die Software neu zu starten. So führen Sie den Softwareneustart durch:\n• Entfernen Sie bitte aus der Basisstation den Netzstecker und das Telefonkabel für zwei Minuten.' metadata={'source': 'data/Hilfe bei Störungen/https___www.telekom.de_hilfe_geraete-zubehoer_telefone-und-anlagen_informationen-zu-unseren-aktuellen-telefonen_display-anzeige-suche-reichweite.txt'}"", ""page_content='Den Repeater sollten Sie dabei in der Reichweite des schnurlosen Haustelefons platzieren, um das Signal zu verstärken. Question: Wodurch zeichnen sich seniorengerechte Festnetztelefone aus?' metadata={'source': 'data/Hilfe bei Störungen/https___www.telekom.de_zuhause_geraete-und-zubehoer_festnetz-telefone.txt'}"", ""page_content='Source URL: https://www.telekom.de/hilfe/geraete-zubehoer/telefone-und-anlagen/gigaset/dect-repeater-hx\n\nQuestion: Kann ich die Reichweite meines schnurlosen Gigaset Telefons erhöhen?' metadata={'source': 'data/Hilfe bei Störungen/https___www.telekom.de_hilfe_geraete-zubehoer_telefone-und-anlagen_gigaset_dect-repeater-hx.txt'}"", ""page_content='Source URL: https://www.telekom.de/hilfe/mobilfunk/mobiles-internet/hotspot/maximale-entfernung\n\nQuestion: Wie groß darf die maximale Entfernung zu einem HotSpot sein? Answer: In geschlossenen Räumen sind Reichweiten von bis zu 100 Metern möglich.' metadata={'source': 'data/Hilfe bei Störungen/https___www.telekom.de_hilfe_mobilfunk_mobiles-internet_hotspot_maximale-entfernung.txt'}"", ""page_content='Source URL: https://www.telekom.de/zuhause/geraete-und-zubehoer/festnetz-telefone\n\nQuestion: Wie wird ein Festnetztelefon installiert? Answer: Damit Sie IhrenTelefonanschlussnutzen können, verbinden Sie die Basisstation Ihres Telefons mit Kabel an der Telefonsteckdose oder dem WLAN-Router. Ein Schnurtelefon ist damit sofort einsatzbereit, bei einem schnurlosen Modell platzieren Sie das Mobilteil zunächst auf der Ladeschale, bis der Akku ausreichend geladen ist. Question: Wie kann das Signal eines schnurlosen Festnetztelefons verstärkt werden? Answer: Mit einem DECT-Repeater erweitern Sie wirksam die Reichweite eines schnurlosen Telefons mit Anrufbeantworter. Dabei handelt es sich um eine kleine Box, die das Sendesignal der Basisstation aufnimmt, verstärkt und weiterleitet.' metadata={'source': 'data/Hilfe bei Störungen/https___www.telekom.de_zuhause_geraete-und-zubehoer_festnetz-telefone.txt'}""]","If your Mobilteil is too far from the base station, it is recommended to restart the software. To do this, you should unplug the power cord and telephone cable from the base station for two minutes, and at the same time, remove the battery from all registered Mobilteile for two minutes.",1289,0.00024104999999999998,106,8,72.42112112045288,0.9106312141950329,0.249999999975,0.6666666666666666,1.0,0.0024874082113819154,0.030303030303030304
What issues did the customer experience with the Kundenservice regarding the Gutschrift for the Persönliche Installation 2.0?,"Der Kunde hatte Probleme mit dem Kundenservice bezüglich der Gutschrift für die Persönliche Installation 2.0. Nachdem der Techniker bei der Installation war, erhielt der Kunde eine Rechnung, auf der unerwartet fast 90 Euro brutto für die Installation vermerkt waren, von der nie die Rede war. Trotz mehrfacher Telefonate mit dem Kundenservice, bei denen teilweise das Gespräch nach langen Wartezeiten einfach beendet wurde, wurde schließlich bestätigt, dass der Betrag gutgeschrieben werden würde. Allerdings blieb der Betrag auch nach der nächsten Rechnung auf dem Konto des Kunden weiterhin bestehen, was zu weiterer Frustration führte.","[""page_content='Source URL: https://telekomhilft.telekom.de/t5/Festnetz-Internet/Gutschrift-Persoenliche-Installation-2-0/td-p/6944838/jump-to/first-unread-message\nSubject: Gutschrift Persönliche Installation 2.0\nContent: Hallo zusammen,ich bin Juli in eine neue Wohnung gezogen und die Telekom kam um den Hausanschluss freizuschalten. Wie hier im Forum schon mehrfach beschrieben wurde mir dann vom Servicetechniker das Tablet zur Unterschrift entgegengestreckt um “zu bestätigen dass er da war” und auf der Rechnung, die ich dann später bekam, standen überraschenderweise fast 90 Euro brutto für eine Persönliche Installation 2.0 von der nie die Rede war!Nach mehrfachen Telefonaten mit dem Kundenservice (teilweise wurde nach 30 Minuten warten mitten im Gespräch aufgelegt) wurde mir bestätigt, dass mir der Betrag wieder gutgeschrieben wird.' metadata={'source': 'data/Hilfe bei Störungen/telekomhilft.telekom.de_t5_Festnetz-Internet_Gutschrift-Persoenliche-Installation-2-0_td-p_6944838_jump-to_first-unread-message.txt'}"", ""page_content='Accepted Solutions:\n- @yofranz,herzlichen Dank für das sehr freundliche Telefonat.Ich habe die Gutschrift für die Pers. Installation 2.0 eingestellt.Das Geld wird in den nächsten Tagen auf dein Konto überwiesen.Bei Fragen gern wieder hier melden.Lieben Gruß, Melanie\n- @yofranz,herzlichen Dank für das sehr freundliche Telefonat.Ich habe die Gutschrift für die Pers. Installation 2.0 eingestellt.Das Geld wird in den nächsten Tagen auf dein Konto überwiesen.Bei Fragen gern wieder hier melden.Lieben Gruß, Melanie\n' metadata={'source': 'data/Hilfe bei Störungen/telekomhilft.telekom.de_t5_Festnetz-Internet_Gutschrift-Persoenliche-Installation-2-0_td-p_6944838_jump-to_first-unread-message.txt'}"", ""page_content='Als ich dann die erste Rechnung erhielt und der Betrag dort zu finden war, war ich wieder am Telefon und mir wurde versichert, dass es nächste Rechnung gutgeschrieben wird.Ich habe nun die Rechnung für September und der Saldo meines Kontos beinhaltet immer noch die Persönliche Installation 2.0.' metadata={'source': 'data/Hilfe bei Störungen/telekomhilft.telekom.de_t5_Festnetz-Internet_Gutschrift-Persoenliche-Installation-2-0_td-p_6944838_jump-to_first-unread-message.txt'}"", ""page_content='' metadata={'source': 'data/Hilfe bei Störungen/telekomhilft.telekom.de_t5_Festnetz-Internet_Neukunde-und-nix-geht-vernuenftig-Danke-fuer-NIX_td-p_6978234_jump-to_first-unread-message.txt'}"", ""page_content='' metadata={'source': 'data/Hilfe bei Störungen/telekomhilft.telekom.de_t5_Festnetz-Internet_Gutschein-fuer-naechste-Monatsrechnung-einloesen_td-p_6962005_jump-to_first-unread-message.txt'}"", ""page_content='' metadata={'source': 'data/Hilfe bei Störungen/youtube_Kuriose Kundennachrichten … #shorts #telekom #magenta #comedy #jokes #funny #fyp #like #follow.txt'}"", ""page_content='News, T-Online, Weckaufträge, usw.Beste GrüßeMario Sa. ' metadata={'source': 'data/Hilfe bei Störungen/telekomhilft.telekom.de_t5_Mobilfunk_Verrechnung-alter-Treuebonus-und-altes-Kulanzguthaben_td-p_6976863_jump-to_first-unread-message.txt'}"", ""page_content='Lieferung war komplett.Allerdings erhielt ich für August eine Rechnung in der mir 3 Geräte in Höhe von ca 500€ als „gekauft“ In Rechnung gestellt wurden! Mehrmalige Reklamation beim Kundenservice und schriftliche Beschwerden (inklusive Nachweis über die Rücksendungen) über das Online-Formular zur Schadensmeldung haben bis jetzt nichts bewirkt: auf die schriftlichen Meldungen wurde überhaupt nicht reagiert und der Kundenservice zeigt zwar Verständnis, kann aber laut eigener Aussage einen so hohen Betrag nicht selbst korrigieren!Ich überlege jetzt, einen Anwalt einzuschalten…Kann hier jemand weiter helfen? Accepted Solutions:\n- Vielen Dank@ulfgraeber,für Ihre Zeit und Geduld am Telefon.Freut mich, dass wir die Frage nach den zurückgesandten Geräten gleich klären konnten.Diese wurden mittlerweile ausgebucht sowie eine zum 3.' metadata={'source': 'data/Hilfe bei Störungen/telekomhilft.telekom.de_t5_Festnetz-Internet_Geraete-berechnet-die-laengst-zurueckgeschickt-wurden_td-p_6952589_jump-to_first-unread-message.txt'}"", ""page_content='Wo ist hier der Servicegedanke? Sprachlos machte mich auch die rufschädigende Art und Weise, wie sich der Mitarbeiter über die Telekom äußerte. Es kann doch nicht sein, dass man lediglich als Neukunde hofiert wird, aber wenn ein Problem auftaucht bleibt man im Regen stehen.Ich weiß, dass sich das Gerät bereits außerhalb der Garantie befindet. Mir wurde damals extra zum Kauf und nicht nur zur Miete des Gerätes geraten. Ein Gerät in diesem Preissegment sollte meines Erachtens aber länger als 3 Jahre funktionieren. Und wenn dies im Einzelfall nicht so ist, würde ich hier schon einen entsprechenden Support erwarten.Kann dieser Displayschaden auf einen Gerätedefekt hindeuten? Was kann ich tun?Vielen Dank und freundliche Grüße\n\nAccepted Solutions:\n- @Raphaela T.vielen Dank für die Hilfe und das nette Telefonat. Das Gerät ist gestern angekommen und ist bereits in Betrieb😊Ich möchte auch hier nochmals Danke an alle sagen (schreiben).' metadata={'source': 'data/Hilfe bei Störungen/telekomhilft.telekom.de_t5_Festnetz-Internet_Speedport-Smart-4-Displayschaden-Geraet-defekt_td-p_6976998_jump-to_first-unread-message.txt'}"", ""page_content='Kleine games zocken. Videos anschauen und surfen ist kaum möglich der ping/Latenz springt in die Höhe. Dies war vom 25september -17 oktober aufjedenfall der Fall das das Internet nicht ging. Anrufen kann ich leider nicht da es mir sehr schwer fällt zu reden aufgrund meiner Behinderung.ich versteh es nicht wieso manche im Kundenservice können und manche nicht. Ist für mich unerklärlich.Bitte um Hilfe bzw einfach mal um eine Überprüfung. Selbst im Internet auf gibt eseinestörung.de im Bereich 66123 saarbrücken wurden zahlreiche Meldungen eingereicht das leute störungen haben.Mit freundlichen GrüßenSascha\n\nAccepted Solutions:\n- @Sascha6693Ich verstehe deine Frustration vollkommen, besonders wenn du den Eindruck hast, dass nicht transparent oder einheitlich kommuniziert wird.Es ist jedoch wichtig, einen Punkt zu klären:Die Gutschriften, die du in der Vergangenheit erhalten hast, waren aus Kulanz, was bedeutet, dass sie freiwillig gewährt wurden. Das ist eine Entscheidung, die in Einzelfällen getroffen werden kann, aber es gibt keine Garantie, dass das immer der Fall sein wird.' metadata={'source': 'data/Hilfe bei Störungen/telekomhilft.telekom.de_t5_Mobilfunk_Magentamobil-prepaid-Max-stoerungen-Gutschrift_td-p_6982558_jump-to_first-unread-message.txt'}"", ""page_content='Source URL: https://telekomhilft.telekom.de/t5/Festnetz-Internet/Gutschrift-nicht-vollstaendig/td-p/6972044/jump-to/first-unread-message\nSubject: Gutschrift nicht vollständig\nContent: Hallo,ich hatte ca drei Monate kein Internet bzw Festnetz.Habe aber nur ungefähr die Häfte meiner Ausgaben zurückerhalten.Mir wurde eben am Telefon gesagt,dass für den Zeitraum der angegeben Störung alles erstattet wurde.Dabei hatte ich durchgängig kein Internet,keine Möglichkeit erreicht zu werden via Festnetz,zweimal wartete ich in der Zeit auf Rückrufe,die nie kamen.Ich musste mein Datenvolumen für mein Handy aufstocken und konnte natürlich Dienste via Magenta TV auch nicht nutzen.Finde ich sehr schade,dass das alles so unfassbar mühselig ist.Was habe ich für Möglichkeiten das zu klären?Vielen Dank\n\nAccepted Solutions:\n- Vielen lieben Dank für das sehr nette Gespräch@csgomes.😊Wie besprochen habe ich den Störungszeitraum nun erstattet und dir einen Router zur Miete gebucht.Wenn in der Zukunft nochmal etwas sein sollte, dann melde dich liebend gerne erneut bei mir.💗Liebe Grüße und einen schönen Tag,Neele\n- Vielen lieben Dank für das sehr nette Gespräch@csgomes.😊Wie besprochen habe ich den Störungszeitraum nun erstattet und dir einen Router zur Miete gebucht.Wenn in der Zukunft nochmal etwas sein sollte, dann melde dich liebend gerne erneut bei mir.💗Liebe Grüße und einen schönen Tag,Neele\n' metadata={'source': 'data/Hilfe bei Störungen/telekomhilft.telekom.de_t5_Festnetz-Internet_Gutschrift-nicht-vollstaendig_td-p_6972044_jump-to_first-unread-message.txt'}""]","The customer experienced several issues with the Kundenservice regarding the Gutschrift for the Persönliche Installation 2.0. After being charged almost 90 Euro for a service that was not discussed, the customer had multiple phone calls with the Kundenservice, during which they faced long wait times and were sometimes disconnected. Although the customer was assured that the amount would be credited back, the first subsequent bill still included the charge for the Persönliche Installation 2.0, leading to further frustration.",2419,0.00041909999999999994,125,11,83.35492992401123,0.9283340820866416,0.5881313131195505,1.0,1.0,0.014543364191042536,0.12972972972972974
What are the options for adding MagentaCloud to an existing Telekom contract?,"Um MagentaCloud zu einem bestehenden Telekom-Vertrag hinzuzufügen, können Sie sich direkt in Ihrem Telekom-Kundenkonto anmelden und die Optionen dort überprüfen. Alternativ können Sie die MagentaEINS-Vorteile aktivieren, wenn Sie bereits einen entsprechenden Vertrag haben. Für genauere Informationen und Anleitungen empfehle ich Ihnen, die Webseite [www.telekom.de/hilfe](https://www.telekom.de/hilfe) zu besuchen, wo Sie weitere Unterstützung finden können.","[""page_content='Source URL: https://www.telekom.de/hilfe/magenta-eins/vorteil-beauftragen\n\nQuestion: Wie kann ich MagentaEINS beauftragen? Answer: Mit unsererAnleitungkönnen Sie den MagentaEINS Vorteil selbst für Ihre Verträge freischalten oder sich direkt Ihr MagentaEINS Paket konfigurieren.' metadata={'source': 'data/Hilfe bei Störungen/https___www.telekom.de_hilfe_magenta-eins_vorteil-beauftragen.txt'}"", ""page_content='Source URL: https://www.telekom.de/hilfe/geraete-zubehoer/smart-home/nutzung-und-funktionen-von-smart-home/das-alarmsytem-von-smart-home/magentacloud\n\nQuestion: Muss ich mich für die MagentaCLOUD registrieren, wenn ich das Mediencenter der Telekom genutzt habe? Answer: Nein, Sie nutzen weiterhin Ihre Benutzerdaten/Ihren Telekom Login (E-Mail Adresse und Ihr Passwort).' metadata={'source': 'data/Hilfe bei Störungen/https___www.telekom.de_hilfe_geraete-zubehoer_smart-home_nutzung-und-funktionen-von-smart-home_das-alarmsytem-von-smart-home_magentacloud.txt'}"", 'page_content=\'Source URL: https://www.telekom.de/hilfe/tv/magenta-tv-app/magenta-tv-plus-aufrufen\n\nQuestion: Wie kann ich MagentaTV+ in der MagentaTV App aufrufen? Answer: Um MagentaTV+ in der MagentaTV App aufzurufen, melden Sie sich mit Ihrem Telekom Login an und gehen Sie auf der Startseite auf den Reiter ""MagentaTV+"".\' metadata={\'source\': \'data/Hilfe bei Störungen/https___www.telekom.de_hilfe_tv_magenta-tv-app_magenta-tv-plus-aufrufen.txt\'}', ""page_content='Question:\nKönnen Sie mehr Informationen über den zusätzlichen Service geben, den ich erhalte, wenn ich Magenta zu Hause oder Magenta zu Hause TV kaufe? Answer:\nHallo, ich bin Florian von der Telekom. In diesem Format präsentieren wir unseren Service.' metadata={'source': 'data/Hilfe bei Störungen/youtube_Kennst Du...unseren proaktiven Heimnetzservice？ I Telekom.txt'}"", ""page_content='Source URL: https://www.telekom.de/hilfe/vertrag-rechnung/vertrag/aenderung/magenta-tv-kuendigen-festnetz-behalten\n\nQuestion: Wie kann ich MagentaTV kündigen, wenn ich meinen Festnetz-Anschluss behalten möchte? Answer: Wenn Sie MagentaTV kündigen und Ihren Festnetz-Anschluss behalten möchten, ist dies über einen Tarifwechsel zum Ende der Vertragslaufzeit möglich.' metadata={'source': 'data/Hilfe bei Störungen/https___www.telekom.de_hilfe_vertrag-rechnung_vertrag_aenderung_magenta-tv-kuendigen-festnetz-behalten.txt'}"", ""page_content='Damit verwalten Sie Ihre Verträge, können Rechnungen einsehen und vieles mehr. Question: Wie erhalte ich den Telekom Login? Answer: Sofern Sie sich noch keinen Telekom Login erstellt haben, können Sie sich hier schnell und einfach einen selbst einrichten:\n\nQuestion: Was ist die MeinMagenta App? Answer: Die MeinMagenta App ist Ihr direkter Draht zur Telekom: Service, Verträge und Vorteile – alles in einer App. Melden Sie sich einfach mit Ihrem Telekom Login an.' metadata={'source': 'data/Hilfe bei Störungen/https___www.telekom.de_hilfe_telekom-login.txt'}"", ""page_content='Source URL: https://www.telekom.de/hilfe/erleben\n\nQuestion: Für welche Produkte finde ich hier meine Lösungen? Answer: Auf dieser Seite finden Sie Lösungen zu MagentaTV inklusive Zubuchoptionen wie z.' metadata={'source': 'data/Hilfe bei Störungen/https___www.telekom.de_hilfe_erleben.txt'}"", ""page_content='Source URL: https://www.telekom.de/hilfe/internet-telefonie/tarife-optionen/magenta-zuhause-start/datenvolumen-nachbuchen\n\nQuestion: Wo kann ich das Datenvolumen meines MagentaZuhause Start nachbuchen? Answer: Mit der SpeedOn Option können Sie imKundencenterDatenvolumen nachbuchen.' metadata={'source': 'data/Hilfe bei Störungen/https___www.telekom.de_hilfe_internet-telefonie_tarife-optionen_magenta-zuhause-start_datenvolumen-nachbuchen.txt'}"", ""page_content='Question: Welcher Tarif wird zur Nutzung auf meinem Android TV Gerät benötigt? Answer: Du kannst MagentaTV auf deinem Gerät mit Android TV mit allen MagentaTV Tarifen nutzen (außer MagentaTV Basic). Solltest du bereits Telekom Kunde sein, kannst duMagentaTV Zubuchoptionenhinzufügen. So kannst du die App auf Android TV Geräten verwenden.' metadata={'source': 'data/Hilfe bei Störungen/https___www.telekom.de_magenta-tv_tarife-und-optionen_magenta-tv-mit-app_android-tv.txt'}""]","The options for adding MagentaCloud to an existing Telekom contract include adding it to a Festnetz-Vertrag, where the billing is done through the linked bank account (SEPA mandate), or to an independent Telekom login, which only allows payment via credit card or PayPal. Additionally, there is an option called 'Zugang zu Telekom Diensten', which provides access credentials to book corresponding paid services, with billing also done through a bank account.",1414,0.00025574999999999996,97,9,74.48359394073486,0.9763018345453215,0.9999999999,0.0,0.6,0.002963056226184974,0.07092198581560284
What should you check if your device is unable to synchronize due to a lack of internet connection?,"Wenn Ihr Gerät aufgrund einer fehlenden Internetverbindung nicht synchronisieren kann, sollten Sie Folgendes überprüfen:

1. **Internet-Verbindung**: Stellen Sie sicher, dass Ihre Datenverbindung, WLAN oder Hotspot aktiviert ist. Warten Sie gegebenenfalls, bis Sie wieder eine Verbindung haben.
2. **Neustart des Geräts**: Oft kann ein einfacher Neustart des Geräts helfen, Verbindungsprobleme zu beheben.
3. **Synchronisation ein- und ausschalten**: Deaktivieren Sie die Synchronisation und aktivieren Sie sie erneut.
4. **Einstellungen überprüfen**: Überprüfen Sie die Einstellungen Ihres Geräts, insbesondere die für E-Mail und Kalender, ob die richtigen Kontoinformationen und Serveradressen eingetragen sind.

Wenn das Problem weiterhin besteht, besuchen Sie bitte www.telekom.de/hilfe für weitere Unterstützung.","[""page_content='Answer: Hier einige allgemeine Tipps, die Ihnen weiterhelfen können, wenn Sync-Plus nicht fehlerfrei arbeiten sollte:\n1. Überprüfen der Internet-Verbindung\n2.' metadata={'source': 'data/Hilfe bei Störungen/https___www.telekom.de_hilfe_apps-dienste_apps_sync-plus_android_funktioniert-nicht.txt'}"", 'page_content=\'Neustarten des Telefons\n3. Aus- und Einschalten der Synchronisation\n4. Überprüfen der Einstellungen im iPhone oder iPad\n5. Führen Sie ein Software-Update für Ihr Telefon durch\n6. Neueinrichtung von Sync-Plus\n7. Überprüfen, ob der richtige Kalender für die Termine verwendet wird\n8. Überprüfen, ob das richtige Adressbuch für die Kontakte verwendet wird\n• Möglicherweise hat Ihr Gerät keine Verbindung ins Internet. In diesem Fall kann keine\xa0Synchronisation\xa0stattfinden. Überprüfen Sie, ob die Internet-Verbindung (Datenverbindung,\xa0WLAN\xa0oder\xa0HotSpot) Ihres Geräts eingeschaltet ist und warten Sie gegebenenfalls, bis Sie wieder Kontakt haben. Dann läuft die Synchronisation wie gewohnt weiter. • Oft können Fehler nur durch das einmalige Aus- und Einschalten des iPhones oder iPads behoben werden. Schalten Sie dazu Ihr Telefon aus und warten Sie einige Minuten ab, bevor Sie das Gerät erneut einschalten. Sollte der Fehler dann nochmals auftreten, fahren Sie mit dem nächsten Schritt fort. • Öffnen Sie die Einstellungen Ihres iPhones oder iPads und wählen Sie ""Mail /Accounts"". Stellen Sie dort den Datenabgleich auf ""Manuell"". Nach einem Geräteneustart stellen Sie auf gleichem Weg den Datenabgleich wieder auf ""Push"". • Rufen Sie die Einstellungen auf und wählen Sie dann ""Mail, Kontakte, Kalender"". • Überprüfen Sie, ob im Eingabefeld ""E-Mail"" Ihre E-Mail-Adresse @magenta.de/@t-online.de eingetragen ist. Als Benutzername und Kennwort sollten Ihre E-Mail-Adresse @magenta.de/@t-online.de und das zugehörige Passwort eingetragen sein. • Abschließend sollten Sie überprüfen, ob im Feld ""Server"" die Serveradresse ""spica.t-online.de"" eingetragen ist. Bestätigen Sie Ihre Überprüfung mit Klicks auf <Weiter> bzw.\' metadata={\'source\': \'data/Hilfe bei Störungen/https___www.telekom.de_hilfe_apps-dienste_apps_sync-plus_ios_funktioniert-nicht.txt\'}', ""page_content='Answer: Wenn die WLAN-Verbindung für einzelne oder sämtliche Geräte fehlschlägt und auch ein Neustart nicht geholfen hat,\xa0finden Sie hier die häufigsten Fehlerquellen und Tipps zur Behebung. ' metadata={'source': 'data/Hilfe bei Störungen/https___www.telekom.de_hilfe_geraete-zubehoer_heimnetzwerk-powerline-wlan_wlan-und-mehr_keine-wlan-verbindung.txt'}"", ""page_content='Neustarten des Telefons\n3. Aus- und Einschalten der Synchronisation\n4. Überprüfen der Einstellungen im Gerät\n5. Führen Sie ein Software-Update für Ihr Telefon durch\n6. Neueinrichtung von Sync-Plus\n7. Überprüfen, dass der richtige Kalender für die Termine verwendet wird\n8. Überprüfen, dass das richtige Adressbuch für die Kontakte verwendet wird\nHinweis:Bitte beachten Sie, dass bei Android-Smartphones aufgrund der großen Vielfalt von Herstellern, Gerätetypen und Betriebssystemversionen eine reibungslose Synchronisation nicht für alle Geräte sichergestellt werden kann. • Möglicherweise hat Ihr Gerät keine Verbindung ins Internet.' metadata={'source': 'data/Hilfe bei Störungen/https___www.telekom.de_hilfe_apps-dienste_apps_sync-plus_android_funktioniert-nicht.txt'}"", ""page_content='Answer: Hier finden Sie einige allgemeine Tipps, die Ihnen weiterhelfen können, wenn Sync-Plus nicht einwandfrei funktionieren sollte:\n1. Überprüfen der Mobilfunk-Verbindung\n2.' metadata={'source': 'data/Hilfe bei Störungen/https___www.telekom.de_hilfe_apps-dienste_apps_sync-plus_ios_funktioniert-nicht.txt'}""]","You should check whether the internet connection (data connection, WLAN, or HotSpot) of your device is turned on and wait until you regain contact. Once the connection is restored, synchronization should continue as usual.",1269,0.00027045,178,5,67.92013311386108,0.9524150860781303,0.99999999998,1.0,0.8571428571428571,0,0.04026845637583893
What are the eligibility requirements for the Mobile Happy Hour?,"Es tut mir leid, aber ich habe keine spezifischen Informationen zu den Anforderungen für die Teilnahme an der Mobile Happy Hour. Ich empfehle Ihnen, die offizielle Webseite [www.telekom.de/hilfe](https://www.telekom.de/hilfe) zu besuchen, um weitere Unterstützung zu erhalten.","[""page_content='Source URL: https://telekomhilft.telekom.de/t5/Mobilfunk/Mobile-Happy-Hour-nicht-bei-Zusatzkarte/td-p/6973822/jump-to/first-unread-message\nSubject: Mobile Happy Hour nicht bei Zusatzkarte\nContent: Hauptvertrag: MagentaMobil S,Zusatzkarte ebenso.Problem: In der Magenta-App gibt es \xa0bei der Zusatzkarte keine Möglichkeit, die Mobile Happy Hour zu aktivieren. Ist das beabsichtigt oder liegt ein Fehler vor?Vielen Dank im Voraus für aufklärende Antworten.' metadata={'source': 'data/Hilfe bei Störungen/telekomhilft.telekom.de_t5_Mobilfunk_Mobile-Happy-Hour-nicht-bei-Zusatzkarte_td-p_6973822_jump-to_first-unread-message.txt'}"", 'page_content=\'Source URL: https://www.telekom.de/hilfe/apps-dienste/apps/mein-magenta-app/magenta-moments/erhalten\n\nQuestion: Wie erhalte ich die Vorteile von Magenta Moments? Answer: Um sich die Magenta Moments Vorteile zu sichern, klicken Sie in derMeinMagenta Appauf ""Moments"" und anschließend auf den jeweiligen Vorteil.\' metadata={\'source\': \'data/Hilfe bei Störungen/https___www.telekom.de_hilfe_apps-dienste_apps_mein-magenta-app_magenta-moments_erhalten.txt\'}', ""page_content='Source URL: https://www.telekom.de/hilfe/apps-dienste/apps/mein-magenta-app/magenta-moments/einloesen\n\nQuestion: Wie löse ich Magenta Moments Vorteile ein? Answer: Es gibt je nach Vorteilsaktion unterschiedliche Möglichkeiten.' metadata={'source': 'data/Hilfe bei Störungen/https___www.telekom.de_hilfe_apps-dienste_apps_mein-magenta-app_magenta-moments_einloesen.txt'}"", ""page_content='Source URL: https://www.telekom.de/hilfe/apps-dienste/apps/mein-magenta-app/magenta-moments/verpasst\n\nQuestion: Ich habe einen Magenta Moments Vorteil verpasst, kann ich ihn noch einlösen? Answer: Die Gültigkeitsdauer der zeitlich begrenzten Magenta Moments Vorteile sind in derMeinMagenta Appbei den jeweiligen Deals angegeben.' metadata={'source': 'data/Hilfe bei Störungen/https___www.telekom.de_hilfe_apps-dienste_apps_mein-magenta-app_magenta-moments_verpasst.txt'}"", ""page_content='Source URL: https://www.telekom.de/hilfe/apps-dienste/apps/mein-magenta-app/magenta-moments/anmelden\n\nQuestion: Muss ich mich bei Magenta Moments gesondert anmelden? Answer: Wenn Sie sich in derMeinMagenta Appmit Ihrem Telekom Login angemeldet haben, ist eine weitere Anmeldung für Magenta Moments nicht erforderlich.' metadata={'source': 'data/Hilfe bei Störungen/https___www.telekom.de_hilfe_apps-dienste_apps_mein-magenta-app_magenta-moments_anmelden.txt'}""]",The eligibility requirement for the Mobile Happy Hour is that the mobile contract must be newer than 01.08.2024. Contracts older than this date are not eligible for Happy Hour.,895,0.00016079999999999998,59,5,62.38582992553711,0.0,0.0,0.0,0.5,0.014782064491589643,0.07894736842105263
What benefits does the MagentaMobil Prepaid XL offer?,"Der MagentaMobil Prepaid XL Tarif bietet eine Vielzahl von Vorteilen, darunter:

1. **Unbegrenztes Datenvolumen** für die Nutzung im Inland.
2. **Kostenlose MultiSIM-Karten**: Sie können die ersten zwei MultiSIM-Karten kostenlos dazu buchen, um das Datenvolumen auf anderen Geräten zu nutzen.
3. **Zusätzliche Vorteile mit MagentaEINS**: Wenn Sie auch MagentaEINS Kunde sind, erhalten Sie ein zusätzliches Datenvolumen von 1 GB pro Monat.

Für weitere Details und spezifische Informationen besuchen Sie bitte [www.telekom.de/hilfe](https://www.telekom.de/hilfe).","[""page_content='Source URL: https://www.telekom.de/hilfe/magenta-eins/prepaid-vorteil\n\nQuestion: Was beinhaltet der MagentaEINS Prepaid-Vorteil? Answer: Mit dem MagentaEINS Prepaid-Vorteil erhalten Sie ein zusätzliches Datenvolumen von 1 GB pro Monat.' metadata={'source': 'data/Hilfe bei Störungen/https___www.telekom.de_hilfe_magenta-eins_prepaid-vorteil.txt'}"", ""page_content='Source URL: https://www.telekom.de/hilfe/magenta-eins/prepaid-vorteil-tarife\n\nQuestion: Welche Tarife erhalten den MagentaEINS Prepaid-Vorteil? Answer: Für den MagentaEINS Prepaid-Vorteil sind aktuelleMagentaMobil Prepaid-Tarifeab MagentaMobil Prepaid M berechtigt.' metadata={'source': 'data/Hilfe bei Störungen/https___www.telekom.de_hilfe_magenta-eins_prepaid-vorteil-tarife.txt'}"", ""page_content='Source URL: https://www.telekom.de/hilfe/mobilfunk/tarife-optionen/smartphone-tarife/magenta-mobil-xl-premium-datenvolumen\n\nQuestion: Kann ich das unbegrenzte Datenvolumen meines MagentaMobil XL Premium-Tarifs auch auf anderen Geräten nutzen? Answer: Ja, im Tarif MagentaMobil XL Premium können die ersten zwei\xa0MultiSIM-Karten kostenlos\xa0dazu gebucht werden.' metadata={'source': 'data/Hilfe bei Störungen/https___www.telekom.de_hilfe_mobilfunk_tarife-optionen_smartphone-tarife_magenta-mobil-xl-premium-datenvolumen.txt'}"", ""page_content='Source URL: https://www.telekom.de/hilfe/magenta-eins/prepaid-vorteil-gutaben\n\nQuestion: Wie bekomme ich den MagentaEINS Prepaid-Vorteil, wenn ich kein Guthaben mehr habe? Answer: Laden Sie mindestens so viel Prepaid-Guthaben auf, dass es für die Abbuchung Ihres Grundpreises reicht.' metadata={'source': 'data/Hilfe bei Störungen/https___www.telekom.de_hilfe_magenta-eins_prepaid-vorteil-gutaben.txt'}"", ""page_content='' metadata={'source': 'data/Hilfe bei Störungen/https___www.telekom.de_hilfe_magenta-eins_prepaid-vorteil-tarife.txt'}"", ""page_content='' metadata={'source': 'data/Hilfe bei Störungen/telekomhilft.telekom.de_t5_Mobilfunk_MagentaMobile-Prepaid_td-p_6956152_jump-to_first-unread-message.txt'}"", ""page_content='' metadata={'source': 'data/Hilfe bei Störungen/https___www.telekom.de_hilfe_mobilfunk_tarife-optionen_smartphone-tarife_magenta-mobil-xl-premium-datenvolumen.txt'}"", ""page_content='' metadata={'source': 'data/Hilfe bei Störungen/https___www.telekom.de_hilfe_mobilfunk_tarife-optionen_prepaid-tarife_freiminuten-abfragen.txt'}""]",The answer to given question is not present in context,1020,0.00021375000000000002,135,8,62.92054200172424,0.9768478173407042,0.0,1.0,0.5714285714285714,0,0.0
What benefits do the new Magenta-Mobil-Tarife offer in relation to the 5G-Netz?,"Die neuen Magenta-Mobil-Tarife bieten Vorteile in Bezug auf das 5G-Netz, indem sie eine schnellere und stabilere Internetverbindung ermöglichen, wenn 5G verfügbar ist. Insbesondere profitieren Kunden von höheren Download- und Upload-Geschwindigkeiten. Die Tarife sind so konzipiert, dass sie die 5G-Technologie effektiv nutzen, um ein besseres Nutzererlebnis zu gewährleisten, insbesondere in Gebieten mit hoher Netzlast. Für spezifische Informationen zu den Geschwindigkeiten und weiteren Details empfehle ich, die offizielle Telekom-Website zu besuchen oder sich direkt an den Kundensupport zu wenden.","['page_content=\'Source URL: https://telekomhilft.telekom.de/t5/Festnetz-Internet/Wechsel-MagentaZuhause-L-2-mit-5G-Option-zu-Magenta-Hybrid-XL/td-p/6952914/jump-to/first-unread-message\nSubject: Wechsel MagentaZuhause L (2) mit 5G Option zu Magenta Hybrid XL sinnvoll? ist Magenta Hybrid XL gedrosselt? Content: Hallo zusammen, Hallo@Telekom-hilft-Team,direkt das nächste ThemaWährend des letzten Telefonates mit der Störungshotline (sieheStröung DSL) wurde mir jetzt der Wechsel auf Magenta XL Hybrid empfohlen. Ich war ein wenig verwirrt, die da Kollegin mir auf Nachfrage versicherte, das ich dann eine 250er Leitung mit zusätzlicher5GOption bekomme. Mein letzter Stand war, dass ich hier aufgrund der Dämpfung definitiv keine 250er Leitung bekommen kann.Ich war erfreut und habe das Angebot angenommen, bin nun aber komplett verunsichert!Aktuell habe ich einen ""MagentaZuhause L (2) mit5GOption"" Vertrag.An guten Tagen komme ich damit auf Datenraten >= 450/130Mbit.Bei Recherchen zu Magenta Hybrid XL meine ich immer rauszulesen, dass dies auch lediglich eine 100er Leitung (also wie gehabt) ist, die ""neuen"" Hybrid Tarife aber bei 250/40Mbit DL Gesamtleistung ""drosseln"" würden ... ist das so? Hat jemand Erfahrung?Wenn ich jetzt am Ende ein (für mich) schlechteres Produkt verkauft bekommen habe, möchte ich bitte umgehend von der angekündigten/bestätigten Änderung zurücktreten.LG,Michael\n\nAccepted Solutions:\n- @Jacqueline G.schrieb:Bei einem Tarifwechsel gehen die Corporate Benefit Konditionen immer verloren, wenn es außerhalb es Benefits-Portals gebucht wird. Und durch den neuen Vertrag gehen auch neue Vertragsbedingungen (Preise, Mindestvertragslaufzeit) einher.Was den letzten Punkt betrifft: Auch bei XL greift Hybrid, wenn VDSL ausgelastet ist und wird bedarfsgerecht aktiviert (also der Zugriff über 5G). Was genau soll da anders laufen?Hallo@Jacqueline G.,vielen Dank für Deine Antwort.Ich habe mich einfach ein wenig über mich selbst geärgert, dass ich auf ein solches Angebot ""reinfalle"", ohne hier Vorsatz o.ä.\' metadata={\'source\': \'data/Hilfe bei Störungen/telekomhilft.telekom.de_t5_Festnetz-Internet_Wechsel-MagentaZuhause-L-2-mit-5G-Option-zu-Magenta-Hybrid-XL_td-p_6952914_jump-to_first-unread-message.txt\'}', ""page_content='' metadata={'source': 'data/Hilfe bei Störungen/https___www.telekom.de_hilfe_apps-dienste_apps_mein-magenta-app_magenta-moments_beschreibung.txt'}"", ""page_content='' metadata={'source': 'data/Hilfe bei Störungen/youtube_Kennst Du...unseren proaktiven Heimnetzservice？ I Telekom.txt'}"", ""page_content='' metadata={'source': 'data/Hilfe bei Störungen/https___www.telekom.de_hilfe_magenta-eins_prepaid-vorteil.txt'}"", ""page_content='' metadata={'source': 'data/Hilfe bei Störungen/https___www.telekom.de_hilfe_mobilfunk_tarife-optionen_zusatzkarten_plus-karte-datenvolumen.txt'}"", ""page_content='Source URL: https://www.telekom.de/hilfe/magenta-eins/prepaid-vorteil\n\nQuestion: Was beinhaltet der MagentaEINS Prepaid-Vorteil? Answer: Mit dem MagentaEINS Prepaid-Vorteil erhalten Sie ein zusätzliches Datenvolumen von 1 GB pro Monat.' metadata={'source': 'data/Hilfe bei Störungen/https___www.telekom.de_hilfe_magenta-eins_prepaid-vorteil.txt'}"", ""page_content='Source URL: https://www.telekom.de/hilfe/magenta-eins/prepaid-vorteil-tarife\n\nQuestion: Welche Tarife erhalten den MagentaEINS Prepaid-Vorteil? Answer: Für den MagentaEINS Prepaid-Vorteil sind aktuelleMagentaMobil Prepaid-Tarifeab MagentaMobil Prepaid M berechtigt.' metadata={'source': 'data/Hilfe bei Störungen/https___www.telekom.de_hilfe_magenta-eins_prepaid-vorteil-tarife.txt'}"", ""page_content='Source URL: https://www.telekom.de/hilfe/apps-dienste/apps/mein-magenta-app/ueberblick-video\n\nQuestion: Kennen Sie unsere MeinMagenta App? Answer: Sie möchten alles rund um Ihr Handy, Festnetz und Internet immer dabei und rund um die Uhr im Blick haben?' metadata={'source': 'data/Hilfe bei Störungen/https___www.telekom.de_hilfe_apps-dienste_apps_mein-magenta-app_ueberblick-video.txt'}"", ""page_content='Source URL: https://www.telekom.de/hilfe/mobilfunk/tarife-optionen/smartphone-tarife/magenta-mobil-xl-premium-datenvolumen\n\nQuestion: Kann ich das unbegrenzte Datenvolumen meines MagentaMobil XL Premium-Tarifs auch auf anderen Geräten nutzen? Answer: Ja, im Tarif MagentaMobil XL Premium können die ersten zwei\xa0MultiSIM-Karten kostenlos\xa0dazu gebucht werden.' metadata={'source': 'data/Hilfe bei Störungen/https___www.telekom.de_hilfe_mobilfunk_tarife-optionen_smartphone-tarife_magenta-mobil-xl-premium-datenvolumen.txt'}"", 'page_content=\'Nach erfolgreichem Neustart der Leitung hat der Kunde wieder WLAN. Der digitale Assistent ""Frag Magenta"" verbessert sich ständig und wird im Laufe der Zeit immer besser bei der Beantwortung von Fragen. Sollte der Assistent einmal keine Antwort haben, wird die Frage gesammelt und bald eine passende Antwort erstellt. Außerdem wird der Kundenservice eingeschaltet, wenn der Assistent an seine Grenzen stößt. ""Frag Magenta"" bietet eine schnelle und einfache Lösung für Kundenprobleme.\' metadata={\'source\': \'data/Hilfe bei Störungen/youtube_Frag Magenta - Digitaler Service auf neue und innovative Weise I Telekom.txt\'}', ""page_content='Source URL: https://telekomhilft.telekom.de/t5/Festnetz-Internet/5-g-hybrid-empfaenger-empfangsstaerke/td-p/6956318/jump-to/first-unread-message\nSubject: 5 g hybrid empfänger empfangsstärke\nContent: Hallo. Ich habe Magenta M Hybrid 5 G.Empfangsstärke5G— 102,0 dBmEmpfangsstärkeLTE— \xa096,0 dBmIst die Empfangstärke jetzt gut oder schlecht. Sollte da nicht ein größerer Unterschied sein zwischen der Empfangsstärke 5 G zuLTE.Erreiche ich denn die 50 MBbits. Ich verstehe die Bedeutung dBm und MBits nicht so richtig.🤔Im Vertrag steht mitHybrid 5G/LTE mit bis zu 50 MBit/s Download und\xa020 MBit/s Upload.Mfg. Peter\n\nAccepted Solutions:\n- Hallo.' metadata={'source': 'data/Hilfe bei Störungen/telekomhilft.telekom.de_t5_Festnetz-Internet_5-g-hybrid-empfaenger-empfangsstaerke_td-p_6956318_jump-to_first-unread-message.txt'}"", ""page_content='Source URL: https://telekomhilft.telekom.de/t5/Festnetz-Internet/Problem-mit-Magenta-M-5G-Hybrid-Tarif-bzw-Modem/td-p/6948654/jump-to/first-unread-message\nSubject: Problem mit Magenta M 5G Hybrid Tarif bzw. Modem\nContent: Hallo zusammen,an meinem Standort sollte eigentlich mal ein Glasfaserausbau stattfinden, weshalb ich einen Speedport Smart 4 Plus habe.Dieser ist aber durch den Eigentümer aktuell auf Eis gelegt.' metadata={'source': 'data/Hilfe bei Störungen/telekomhilft.telekom.de_t5_Festnetz-Internet_Problem-mit-Magenta-M-5G-Hybrid-Tarif-bzw-Modem_td-p_6948654_jump-to_first-unread-message.txt'}"", ""page_content='Source URL: https://www.telekom.de/hilfe/apps-dienste/apps/mein-magenta-app/magenta-moments/beschreibung\n\nQuestion: Was ist Magenta Moments? Answer: Magenta Momentsist das exklusive Treueprogramm für Privatkund*innen der Telekom.' metadata={'source': 'data/Hilfe bei Störungen/https___www.telekom.de_hilfe_apps-dienste_apps_mein-magenta-app_magenta-moments_beschreibung.txt'}""]","Die neuen Magenta-Mobil-Tarife bieten im Zusammenhang mit dem 5G-Netz exklusive Servicevorteile, wie zum Beispiel einen kostenlosen Handy-Ersatz innerhalb von 48 Stunden, und machen das beste Netz der Telekom noch preiswerter und bieten viel Spaß im 5G-Netz.",2310,0.000405,130,13,88.69490504264832,0.9565285377303466,0.14285714284285714,0.0,0.125,0.03590865304709055,0.17054263565891473
What type of coverage does Sky Sport Kompakt offer for Bundesliga matches?,"Sky Sport Kompakt bietet umfassende Berichterstattung über Bundesliga-Spiele, einschließlich aller Samstagsspiele der Bundesliga und aller Spiele der 2. Bundesliga, die live und in der Konferenz gestreamt werden können. Zusätzlich sind auch alle Freitags- und Sonntagsspiele der Bundesliga verfügbar.","[""page_content='Source URL: https://www.telekom.de/sport\n\nQuestion: Was beinhalten die Telekom Sport-Angebote auf MagentaTV? Answer: Zu MagentaTV lassen sich verschiedene Sport-Angebote hinzubuchen:Mit WOW Live-Sport inkl. WOW Premium streamen Sie alle Samstagsspiele der Bundesliga und alle Spiele der 2. Bundesliga einzeln & in der Konferenz live. Außerdem sind alle Spiele der Premier League und des DFB-Pokals verfügbar, sowie Formel 1, NHL, Tennis, Golf u.v.m.Auf DAZN sehen Sie alle Freitags- und Sonntagsspiele der Bundesliga und 186 Spiele der UEFA Champions League inklusive der Konferenz. Dazu die europäischen Topligen mit LaLiga, Serie A und Ligue1 sowie US-Sport mit NFL, NBA, NCAA und Kampfsport mit UFC und die wichtigsten Schwergewichtskämpfe von Matchroom und Golden Boy.Bei MagentaSport erleben Sie Fußball, Eishockey, Basketball und vieles mehr live. Alle Spiele der 3.' metadata={'source': 'data/Hilfe bei Störungen/https___www.telekom.de_sport.txt'}"", ""page_content='Konferenz live\n• Alle Freitags- und Sonntags\xadspiele der Bundesliga live\n• US-Sport mit NFL, NBA und der UFC live\n• Alle Spiele der 3. Liga und der Google Pixel Frauen-Bundesliga\n• Alle Spiele der Penny\xa0DEL und Länderspiele des DEB\n• Alle Spiele der Turkish Airlines EuroLeague und Länderspiele des DBB\n\nQuestion: Welchen Live-Sport kann man bei der Telekom streamen? Answer: • Alle Freitags- und Sonntagsspiele der Bundesliga\n• Alle Samstagsspiele der Bundesliga und alle Spiele der 2.' metadata={'source': 'data/Hilfe bei Störungen/https___www.telekom.de_magenta-tv_live-sport-stream.txt'}"", ""page_content='Komfortabler mitfiebern geht nicht! Sie brauchen nur eine Zubuchoption, statt für jeden Partnerinhalt ein separates Abo zur IhremMagentaTV Tarifabzuschließen. Zudem sichern Sie sich bei der Buchung überMagentaTVeinen besonderen Vorteilspreis gegenüber der Buchung der separaten Abos. Question: Was sind die genauen Sport-Inhalte in der MegaSport Option? Answer: • Streamen Sie mitWOW Live-Sportinkl. WOW Premium den besten Live-Sport von Sky. Alle Samstagsspiele der Bundesliga sowie alle Spiele der 2.' metadata={'source': 'data/Hilfe bei Störungen/https___www.telekom.de_sport_megasport-option.txt'}"", ""page_content='MagentaTV\nzzgl. MagentaTV\n• Der komplette Live-Sport in einem\xa0Paket\n• Die Sportinhalte von WOW Live-Sport inklusive WOW Premium, DAZN und MagentaSport\n• Alle Samstagsspiele der Bundesliga live und exklusiv\n• Alle Spiele der 2. Bundesliga live\n• Alle Rennen der Formel 1 live – exklusiv auf Sky\n• WOW Premium inklusive\n• UEFA Champions League inkl.' metadata={'source': 'data/Hilfe bei Störungen/https___www.telekom.de_magenta-tv_live-sport-stream.txt'}"", ""page_content='Über eine Verlängerung des Zeitraums konnte sich Sky mit der Handball-Bundesliga nicht einigen. Alle anderen Live-Übertragungen können Sie aber wie gewohnt nutzen.' metadata={'source': 'data/Hilfe bei Störungen/https___www.telekom.de_hilfe_tv_inhalte_wow_handball.txt'}"", ""page_content='Fußball-Liga und Inhalte von Sky können nicht abgerufen werden. ' metadata={'source': 'data/Hilfe bei Störungen/https___www.telekom.de_hilfe_tv_inhalte_magenta-sport_ausland.txt'}""]",Sky Sport Kompakt offers original Sky conference coverage for Bundesliga matches.,1061,0.00018614999999999994,60,6,65.52976584434509,0.9872497144198707,0.6388888888675925,0.0,0.2,0.025922896763081092,0.14814814814814814
Was erfährt man beim Versand eines eSIM-Profils und wo findet man den PUK?,"Beim Versand eines eSIM-Profils erhalten Sie die PIN und den PUK in einem separaten Brief. Wenn Sie das eSIM-Profil per Download angefordert haben oder den Brief nicht mehr finden, können Sie den PUK im Kundencenter einsehen.","[""page_content='Beim postalischen Versand eines eSIM-Profils (auch Zugangsprofil genannt), erhalten Sie die PIN und den PUK in einem separaten Brief. Wenn Sie das eSIM-Profil per Download angefordert haben oder Sie den Brief nicht mehr finden, steht Ihnen der PUK im Kundencenter zur Verfügung.' metadata={'source': 'data/Hilfe bei Störungen/https___www.telekom.de_hilfe_mobilfunk_esim_sicherheit_pin-puk.txt'}"", ""page_content='Source URL: https://www.telekom.de/hilfe/mobilfunk/esim/sicherheit/pin-puk\n\nQuestion: Wo finde ich PIN und PUK meiner eSIM?' metadata={'source': 'data/Hilfe bei Störungen/https___www.telekom.de_hilfe_mobilfunk_esim_sicherheit_pin-puk.txt'}"", ""page_content='Source URL: https://www.telekom.de/hilfe/mobilfunk/sim-karte/sicherheit/puk\n\nQuestion: Wo finde ich den PUK meiner SIM-Karte? Answer: Den PUK Ihrer SIM-Karte finden Sie zum einen in dem Schreiben, mit dem Sie Ihre SIM-Karte erhalten haben und zum anderen können Sie den PUK im Kundencenter auslesen.' metadata={'source': 'data/Hilfe bei Störungen/https___www.telekom.de_hilfe_mobilfunk_sim-karte_sicherheit_puk.txt'}"", ""page_content='' metadata={'source': 'data/Hilfe bei Störungen/https___www.telekom.de_hilfe_mobilfunk_esim_wissenswertes_esim-direct.txt'}"", ""page_content='' metadata={'source': 'data/Hilfe bei Störungen/https___www.telekom.de_hilfe_mobilfunk_esim_sicherheit_pin-puk.txt'}"", ""page_content='' metadata={'source': 'data/Hilfe bei Störungen/https___www.telekom.de_hilfe_mobilfunk_esim.txt'}"", ""page_content='' metadata={'source': 'data/Hilfe bei Störungen/https___www.telekom.de_hilfe_mobilfunk_esim_wissenswertes_aktivierungscode-definition.txt'}"", ""page_content='Die Daten erhalten Sie erst, wenn Sie Ihrer eSIM ein eSIM-Profil zugewiesen haben.' metadata={'source': 'data/Hilfe bei Störungen/https___www.telekom.de_hilfe_mobilfunk_esim_sicherheit_pin-puk.txt'}"", ""page_content='Source URL: https://www.telekom.de/hilfe/mobilfunk/sim-karte/puk-kundencenter\n\nQuestion: Wie finde ich den PUK im Kundencenter? Answer: Loggen Sie sich imKundencenterein.' metadata={'source': 'data/Hilfe bei Störungen/https___www.telekom.de_hilfe_mobilfunk_sim-karte_puk-kundencenter.txt'}""]","Beim Versand eines eSIM-Profils erhält man die PIN und den PUK in einem separaten Brief. Wenn der Brief nicht mehr gefunden wird, steht der PUK im Kundencenter zur Verfügung.",878,0.00015554999999999996,53,9,66.51996421813965,0.9380228321232112,0.8111111110948889,1.0,0.8,0.383940965192231,0.5915492957746479
What's the right way to sync settings on iPhone/iPad?,"Um die Einstellungen auf Ihrem iPhone oder iPad zu synchronisieren, können Sie die folgenden Schritte befolgen:

1. **Einstellungen überprüfen**: Öffnen Sie die Einstellungen Ihres iPhones oder iPads und gehen Sie zu ""Mail, Kontakte, Kalender"". Stellen Sie sicher, dass Ihre E-Mail-Adresse (z.B. @magenta.de oder @t-online.de) korrekt eingegeben ist.

2. **Datenabgleich einstellen**: Setzen Sie den Datenabgleich zunächst auf ""Manuell"". Nach einem Neustart des Geräts können Sie den Datenabgleich wieder auf ""Push"" einstellen.

3. **Internetverbindung prüfen**: Stellen Sie sicher, dass Ihr Gerät mit dem Internet verbunden ist, entweder über mobile Daten oder WLAN. Ohne Internetverbindung kann keine Synchronisation stattfinden.

4. **Neustart des Geräts**: Oft hilft es, das iPhone oder iPad neu zu starten. Schalten Sie es aus, warten Sie einige Minuten und schalten Sie es dann wieder ein.

5. **Sync-Plus neu einrichten**: Wenn die Probleme weiterhin bestehen, könnte es helfen, die Sync-Plus Anwendung neu einzurichten.

6. **Kalender und Adressbuch überprüfen**: Achten Sie darauf, dass Sie den richtigen Telekom Kalender und das richtige Telekom Adressbuch für die Synchronisation verwenden.

Für eine detaillierte Anleitung können Sie auch die Webseite [www.telekom.de/hilfe](https://www.telekom.de/hilfe) besuchen.","['page_content=\'Klicken Sie auf ""Nach Updates suchen …"" und folgen Sie den Anweisungen auf dem Bildschirm. • Löschen Sie das bisherige Konto @magenta.de/@t-online.de, so dass die Synchronisation zunächst nicht mehr aktiviert ist. Gehen Sie dazu in die Einstellungen und öffnen Sie ""Mail, Kontakte, Kalender"". • In Ihrem iPhone/iPad haben Sie die Möglichkeit, mehrere Kalender anzulegen und sich anzeigen zu lassen. Darum müssen Sie darauf achten, für die Synchronisation den Telekom Kalender zu nutzen. • In Ihrem iPhone/iPad haben Sie die Möglichkeit, mehrere Adressbücher anzulegen und sich anzeigen zu lassen. Darum müssen Sie darauf achten, für die Synchronisation das\xa0Telekom Adressbuch zu nutzen. \' metadata={\'source\': \'data/Hilfe bei Störungen/https___www.telekom.de_hilfe_apps-dienste_apps_sync-plus_ios_funktioniert-nicht.txt\'}', 'page_content=\'Neustarten des Telefons\n3. Aus- und Einschalten der Synchronisation\n4. Überprüfen der Einstellungen im iPhone oder iPad\n5. Führen Sie ein Software-Update für Ihr Telefon durch\n6. Neueinrichtung von Sync-Plus\n7. Überprüfen, ob der richtige Kalender für die Termine verwendet wird\n8. Überprüfen, ob das richtige Adressbuch für die Kontakte verwendet wird\n• Möglicherweise hat Ihr Gerät keine Verbindung ins Internet. In diesem Fall kann keine\xa0Synchronisation\xa0stattfinden. Überprüfen Sie, ob die Internet-Verbindung (Datenverbindung,\xa0WLAN\xa0oder\xa0HotSpot) Ihres Geräts eingeschaltet ist und warten Sie gegebenenfalls, bis Sie wieder Kontakt haben. Dann läuft die Synchronisation wie gewohnt weiter. • Oft können Fehler nur durch das einmalige Aus- und Einschalten des iPhones oder iPads behoben werden. Schalten Sie dazu Ihr Telefon aus und warten Sie einige Minuten ab, bevor Sie das Gerät erneut einschalten. Sollte der Fehler dann nochmals auftreten, fahren Sie mit dem nächsten Schritt fort. • Öffnen Sie die Einstellungen Ihres iPhones oder iPads und wählen Sie ""Mail /Accounts"". Stellen Sie dort den Datenabgleich auf ""Manuell"". Nach einem Geräteneustart stellen Sie auf gleichem Weg den Datenabgleich wieder auf ""Push"". • Rufen Sie die Einstellungen auf und wählen Sie dann ""Mail, Kontakte, Kalender"". • Überprüfen Sie, ob im Eingabefeld ""E-Mail"" Ihre E-Mail-Adresse @magenta.de/@t-online.de eingetragen ist. Als Benutzername und Kennwort sollten Ihre E-Mail-Adresse @magenta.de/@t-online.de und das zugehörige Passwort eingetragen sein. • Abschließend sollten Sie überprüfen, ob im Feld ""Server"" die Serveradresse ""spica.t-online.de"" eingetragen ist. Bestätigen Sie Ihre Überprüfung mit Klicks auf <Weiter> bzw.\' metadata={\'source\': \'data/Hilfe bei Störungen/https___www.telekom.de_hilfe_apps-dienste_apps_sync-plus_ios_funktioniert-nicht.txt\'}', ""page_content='Source URL: https://www.telekom.de/hilfe/apps-dienste/apps/sync-plus/ios/funktioniert-nicht\n\nQuestion: Sync-Plus funktioniert nicht mit meinem iPhone/iPad. Was kann ich tun?' metadata={'source': 'data/Hilfe bei Störungen/https___www.telekom.de_hilfe_apps-dienste_apps_sync-plus_ios_funktioniert-nicht.txt'}"", ""page_content='<Fertig>. • Überprüfen Sie die Einrichtung von Sync-Plus. Eine Anleitung der Einrichtung finden Sie hier. • Schließen Sie Ihr iPhone an Ihren PC oder Mac an und öffnen Sie das Programm iTunes. Sollten Sie aufgefordert werden, das Programm iTunes selbst zu aktualisieren, so führen Sie zunächst dieses Update durch. Anschließend klicken Sie in iTunes auf Ihr iPhone.' metadata={'source': 'data/Hilfe bei Störungen/https___www.telekom.de_hilfe_apps-dienste_apps_sync-plus_ios_funktioniert-nicht.txt'}"", ""page_content='Source URL: https://www.telekom.de/hilfe/apps-dienste/apps/sync-plus/ios/e-mails-kontakte-termine-synchronisieren\n\nQuestion: Wie synchronisiere ich meine E-Mails, Kontakte und Termine von meinem Telekom Mail-Konto auf meinem Apple-Gerät? Answer: Damit Sie die Kontakte aus Ihrem Adressbuch, die Termine aus Ihrem Kalender und Ihre E-Mails aus Ihrem@t-online.de/@magenta.deAccount auf Ihrem iPhone, iPad oder Mac abrufen und mit Ihren Apps synchronisieren können, haben wir folgende Anleitungen für Sie zusammengestellt:\n\n' metadata={'source': 'data/Hilfe bei Störungen/https___www.telekom.de_hilfe_apps-dienste_apps_sync-plus_ios_e-mails-kontakte-termine-synchronisieren.txt'}""]","The right way to sync settings on iPhone/iPad includes several steps: 1. Restart the phone. 2. Turn off and on the synchronization. 3. Check the settings on the iPhone or iPad. 4. Perform a software update for your phone. 5. Reconfigure Sync-Plus. 6. Ensure the correct calendar is used for appointments. 7. Verify that the correct address book is used for contacts. Additionally, check if the device has an internet connection, as synchronization cannot occur without it. If errors persist, try turning the device off and on again, and adjust the data sync settings in 'Mail/Accounts' to 'Manual' and then back to 'Push' after a restart.",1514,0.00036344999999999997,303,5,75.92810082435608,0.9524229003769539,0.9166666666361111,1.0,1.0,0.001657631507544038,0.07006369426751594
How does the telekom hilft Team handle contract disputes from user feedback?,"Das Telekom hilft Team behandelt Vertragsstreitigkeiten in der Regel, indem sie den betroffenen Kunden an die zuständigen Stellen weiterleiten, um eine angemessene Klärung zu gewährleisten. Kunden können ihre Beschwerden direkt über die Kontaktseite von Telekom einreichen, um Unterstützung zu erhalten. Weitere Informationen finden Sie auf www.telekom.de/hilfe.","['page_content=\'Pressestelle können diese Vorgänge gemeldet werden und der Vorgang wirdunmittelbarmit dem verantwortlichen Mitarbeiter besprochen.Wohin ganz genau ist das zu melden damit T unmittelbar mit dem Mitarbeiter das Gespräch aufnimmt?Bitte keine generischen Antworten wie: Wie man uns immer erreichtVielen Dankhttps://www.telekom.com/de/konzern/details/haustuergeschaefte-bei-der-telekom-nur-mit-klaren-regeln-... Accepted Solutions:\n- @alexander18schrieb:Sorry, aber ich sehe da nur, dass ich eine Sperre veranlassen kann über den ""normalen Weg""Eine Sperre meiner Adresse strebe ich nicht an, sondern ich möchte mich aktive darüber beschweren.Und auf den letzten Kommentar von@RoadrunnerDDhin wurde in diesem Beitrag leider nicht geantwortet.Und nein, ich kann da nichts hineinschreiben, vielleicht weil ich kein ComunityGuide binWenn du dich direkt beschweren willst dann hier ->https://www.telekom.de/kontakt/e-mail-kontakt/festnetz/beschwerde-allgemein?fs_id=1158968d-fa21-4efe... - @alexander18schrieb:Sorry, aber ich sehe da nur, dass ich eine Sperre veranlassen kann über den ""normalen Weg""Eine Sperre meiner Adresse strebe ich nicht an, sondern ich möchte mich aktive darüber beschweren.Und auf den letzten Kommentar von@RoadrunnerDDhin wurde in diesem Beitrag leider nicht geantwortet.Und nein, ich kann da nichts hineinschreiben, vielleicht weil ich kein ComunityGuide binWenn du dich direkt beschweren willst dann hier ->https://www.telekom.de/kontakt/e-mail-kontakt/festnetz/beschwerde-allgemein?fs_id=1158968d-fa21-4efe... \' metadata={\'source\': \'data/Hilfe bei Störungen/telekomhilft.telekom.de_t5_Festnetz-Internet_Beschwerden-ueber-Ranger-wohin_td-p_6971553_jump-to_first-unread-message.txt\'}', ""page_content='Wie hilft die Telekom und wie wird er dann von der Telekom ausgewechselt?' metadata={'source': 'data/Hilfe bei Störungen/telekomhilft.telekom.de_t5_Festnetz-Internet_telefonmast-leicht-defekt_td-p_6981550_jump-to_first-unread-message.txt'}"", ""page_content='Source URL: https://telekomhilft.telekom.de/t5/Festnetz-Internet/Beschwerde-ueber-Vertragsaenderung-durch-Vertreter-am-mobilen/td-p/6946790/jump-to/first-unread-message\nSubject: Beschwerde über Vertragsänderung durch Vertreter am mobilen Telekomwagen\nContent: Hallo,Ich habe heute von der Telekom-Hotline diese Adresse bekommen, welche aber so nicht funktioniert:www.telekom.de/kontakt/e-mail-kontakt/festnetz/beschwerdeWie oder wo kann ich mich bei der Telekom beschweren, denn die Widerrufsfrist ist wegen längerer Abwesenheit schon verstrichen? Die Hotline konnte leider nicht weiterhelfen.Vielen Dank und freundliche Grüße\n\nAccepted Solutions:\n- Hallo@usmiko,das tut mir wirklich sehr leid, dass Sie immer noch auf die Auftragsbestätigung warten.Ich habe mir den Vorgang noch einmal angeschaut.' metadata={'source': 'data/Hilfe bei Störungen/telekomhilft.telekom.de_t5_Festnetz-Internet_Beschwerde-ueber-Vertragsaenderung-durch-Vertreter-am-mobilen_td-p_6946790_jump-to_first-unread-message.txt'}"", ""page_content='Source URL: https://www.telekom.de/hilfe/vertrag-rechnung/kontakt/umfrage\n\nQuestion: Warum werde ich von der Telekom kontaktiert, um an einer Umfrage teilzunehmen? Answer: Sie hatten innerhalb der letzten Tage Kontakt mit dem Service-Team der Telekom und wir möchten sicherstellen, dass Ihr Anliegen geklärt wurde.' metadata={'source': 'data/Hilfe bei Störungen/https___www.telekom.de_hilfe_vertrag-rechnung_kontakt_umfrage.txt'}"", ""page_content='Source URL: https://telekomhilft.telekom.de/t5/Festnetz-Internet/Widerruf/td-p/6943497/jump-to/first-unread-message\nSubject: Widerruf\nContent: Liebes telekom hilft Team,ich habe heute einen Widerspruch für meinen Vertrag eingereicht & würde gerne wissen wie lange die Bearbeitung dauert.Vielen Dank & LGLena\n\nAccepted Solutions:\n- Liebes telekomhilft Team,ich schließe hiermit den Thread, da ich heute morgen direkt die Bestätigung im Postfach hatte & sich somit alles erledigt hat. Vielen Dank für all eure Hilfe hier\n- Liebes telekomhilft Team,ich schließe hiermit den Thread, da ich heute morgen direkt die Bestätigung im Postfach hatte & sich somit alles erledigt hat.' metadata={'source': 'data/Hilfe bei Störungen/telekomhilft.telekom.de_t5_Festnetz-Internet_Widerruf_td-p_6943497_jump-to_first-unread-message.txt'}""]",The answer to given question is not present in context,1372,0.00023729999999999997,70,5,60.813788175582886,0.9667892412006416,0.0,0.0,0.5,0.003997395604823099,0.03125
"Wie starte ich die Software neu, wenn das Mobilteil nicht reagiert?","Um die Software Ihres Mobilteils neu zu starten, versuchen Sie bitte Folgendes:

1. Entfernen Sie den Netzstecker und das Telefonkabel von der Basisstation und warten Sie zwei Minuten.
2. Stecken Sie das Telefonkabel und den Netzstecker wieder ein.

Falls das Mobilteil weiterhin nicht reagiert, könnte ein Werkreset erforderlich sein, der allerdings alle Einstellungen und Daten löscht. 

Wenn Sie weitere Unterstützung benötigen, besuchen Sie bitte www.telekom.de/hilfe für detaillierte Anleitungen.","[""page_content='Dazu schlägt der Sprecher vor, die Neustarttaste zu drücken oder für hartnäckige Fälle einen Werkreset durchzuführen, der alle Einstellungen und Daten löscht.' metadata={'source': 'data/Hilfe bei Störungen/youtube_Gönn deinem Router eine Auszeit - Wie und weshalb？! #shorts #telekom #hilfe #router #reset #magenta.txt'}"", ""page_content='Neustarten des Telefons\n3. Aus- und Einschalten der Synchronisation\n4. Überprüfen der Einstellungen im Gerät\n5. Führen Sie ein Software-Update für Ihr Telefon durch\n6. Neueinrichtung von Sync-Plus\n7. Überprüfen, dass der richtige Kalender für die Termine verwendet wird\n8. Überprüfen, dass das richtige Adressbuch für die Kontakte verwendet wird\nHinweis:Bitte beachten Sie, dass bei Android-Smartphones aufgrund der großen Vielfalt von Herstellern, Gerätetypen und Betriebssystemversionen eine reibungslose Synchronisation nicht für alle Geräte sichergestellt werden kann. • Möglicherweise hat Ihr Gerät keine Verbindung ins Internet.' metadata={'source': 'data/Hilfe bei Störungen/https___www.telekom.de_hilfe_apps-dienste_apps_sync-plus_android_funktioniert-nicht.txt'}"", ""page_content='Erst nach kompletten neustart des Smart4 hat geholfen. Das kann echt nicht war sein, ich kann doch nicht jedesmal diese Kiste neustarten damit ich wieder telefonieren kann!' metadata={'source': 'data/Hilfe bei Störungen/telekomhilft.telekom.de_t5_Festnetz-Internet_Festnetztelefonie-zum-2-mal-fehlerhaft-obwohl-Techniker-da-war_td-p_6952336_jump-to_first-unread-message.txt'}"", ""page_content='Sollte die Meldung auch bei Annäherung an die Basisstation nicht verschwinden, empfehlen wir Ihnen die Software neu zu starten. So führen Sie den Softwareneustart durch:\n• Entfernen Sie bitte aus der Basisstation den Netzstecker und das Telefonkabel für zwei Minuten.' metadata={'source': 'data/Hilfe bei Störungen/https___www.telekom.de_hilfe_geraete-zubehoer_telefone-und-anlagen_informationen-zu-unseren-aktuellen-telefonen_display-anzeige-suche-reichweite.txt'}"", ""page_content='Source URL: https://www.telekom.de/hilfe/apps-dienste/apps/sync-plus/android/funktioniert-nicht\n\nQuestion: Sync-Plus funktioniert nicht auf meinem Android-Gerät. Was kann ich tun?' metadata={'source': 'data/Hilfe bei Störungen/https___www.telekom.de_hilfe_apps-dienste_apps_sync-plus_android_funktioniert-nicht.txt'}"", ""page_content='Source URL: https://www.telekom.de/hilfe/geraete-zubehoer/magenta-tv-geraete/magenta-tv-stick/neustart\n\nQuestion: Wie kann ich meinen MagentaTV Stick neu starten? Answer: Sollte Ihr MagentaTV Stick einmal nicht reagieren, kann ein Neustart bereits helfen.' metadata={'source': 'data/Hilfe bei Störungen/https___www.telekom.de_hilfe_geraete-zubehoer_magenta-tv-geraete_magenta-tv-stick_neustart.txt'}"", ""page_content='ein Techniker einmal ansehen? Ich hoffe, dass nicht alle Geräte und Einstellungen futsch sind...Wie kann das passieren und wie kann ich es in Zukunft verhindern?VGHeino\n\nAccepted Solutions:\n- Hi,ich hatte eben mal bei der Hotline angerufen. Ich wurde dann in die Fachabteilung für Smart Home durchgestellt.' metadata={'source': 'data/Hilfe bei Störungen/telekomhilft.telekom.de_t5_Smart-Home_Homebase-2-kann-nicht-re-aktiviert-werden_td-p_6967997_jump-to_first-unread-message.txt'}"", ""page_content='ZURÜCK….Ein-/ausschalten und App neu starten hab ich natürlich alles probiert…hat jemand eine Idee…? Accepted Solutions:\n- Hallo@Ingrid-007,herzlich willkommen in der Telekom hilft Community.Ich würde Ihnen empfehlen, die MagentaTV App zu deinstallieren, den Fernseher ausschalten, dann noch für 1 Minute stromlos machen (Stecker ziehen), Fernseher wieder anschalten und die App neu installieren.Viele Grüße,Coole Katze\n- Hallo@Ingrid-007,herzlich willkommen in der Telekom hilft Community.Ich würde Ihnen empfehlen, die MagentaTV App zu deinstallieren, den Fernseher ausschalten, dann noch für 1 Minute stromlos machen (Stecker ziehen), Fernseher wieder anschalten und die App neu installieren.Viele Grüße,Coole Katze\n' metadata={'source': 'data/Hilfe bei Störungen/telekomhilft.telekom.de_t5_TV_Magenta-tv-nur-sehr-sporadisch-verfuegbar_td-p_6974624_jump-to_first-unread-message.txt'}"", ""page_content='Sollten Sie in diesem Zeitraum Defekte an Ihrem Smartphone feststellen, so senden Sie Ihr defektes Gerät an unserenHandy-Reparatur-Servicezurück.' metadata={'source': 'data/Hilfe bei Störungen/https___www.telekom.de_hilfe_geraete-zubehoer_umwelt_reuse-mymobile_gewaehrleistung.txt'}""]","Um die Software neu zu starten, entfernen Sie bitte aus der Basisstation den Netzstecker und das Telefonkabel für zwei Minuten. Gleichzeitig entfernen Sie aus allen angemeldeten Mobilteilen für zwei Minuten den Akku.",1473,0.00026864999999999994,106,9,80.16951894760132,0.8645368724276571,0.249999999975,0.5,0.8571428571428571,0.1030019432644136,0.3272727272727273
What perks come with unlimited data and Multi SIM in Telekom XL Premium?,"Im Tarif MagentaMobil XL Premium profitieren Sie von unbegrenztem Datenvolumen und der Möglichkeit, die ersten zwei MultiSIM-Karten kostenlos dazuzubuchen. Mit einer MultiSIM können Sie das unbegrenzte Datenvolumen auf anderen Geräten nutzen, wie zum Beispiel Tablets oder Smartwatches, und dabei gleichzeitig Ihre Hauptnummer verwenden. 

Für weitere Details besuchen Sie bitte die [Telekom-Hilfeseite](https://www.telekom.de/hilfe/mobilfunk/tarife-optionen/smartphone-tarife/magenta-mobil-xl-premium-datenvolumen).","[""page_content='Source URL: https://www.telekom.de/hilfe/mobilfunk/tarife-optionen/smartphone-tarife/magenta-mobil-xl-premium-datenvolumen\n\nQuestion: Kann ich das unbegrenzte Datenvolumen meines MagentaMobil XL Premium-Tarifs auch auf anderen Geräten nutzen? Answer: Ja, im Tarif MagentaMobil XL Premium können die ersten zwei\xa0MultiSIM-Karten kostenlos\xa0dazu gebucht werden.' metadata={'source': 'data/Hilfe bei Störungen/https___www.telekom.de_hilfe_mobilfunk_tarife-optionen_smartphone-tarife_magenta-mobil-xl-premium-datenvolumen.txt'}"", ""page_content='Source URL: https://www.telekom.de/hilfe/magenta-eins/prepaid-vorteil\n\nQuestion: Was beinhaltet der MagentaEINS Prepaid-Vorteil? Answer: Mit dem MagentaEINS Prepaid-Vorteil erhalten Sie ein zusätzliches Datenvolumen von 1 GB pro Monat.' metadata={'source': 'data/Hilfe bei Störungen/https___www.telekom.de_hilfe_magenta-eins_prepaid-vorteil.txt'}"", ""page_content='für meinen Partner)? Answer: Wir bieten mit unseren MagentaMobil PlusKarten Zusatzkarten zu einem attraktiven Preis an, die immer das gleiche Volumen haben wie die Hauptkarte. Das heißt, egal in welchem Tarif Sie eine PlusKarte dazu buchen, kostet diese immer gleich viel. Es ändert sich lediglich der Preis für die Hauptkarte, sofern ein erhöhtes Volumen benötigt wird. Question: Kann ich zu meinen PlusKarten ebenfalls Endgeräte dazu buchen? Answer: Bei jeder unserer Zusatzkarten (PlusKarte / PlusKarte Kids & Teens / etc.) können Sie ebenfalls attraktive Endgeräte dazu buchen. Question: Wie viel Datenvolumen erhält jeder in der Familie und muss dieses geteilt werden? Answer: Wie viel Datenvolumen die neuen PlusKarten erhalten, hängt von dem gebuchten Tarif der Hauptkarte ab. So erhält jede PlusKarte bspw. ein Datenvolumen von 10 GB, wenn ein MagentaMobil S Tarif gebucht wurde. Jede Zusatzkarte erhält dabei ihr eigenes Inklusiv-Volumen und es muss nicht geteilt werden. Question: Was ist der Unterschied zwischen PlusKarte und MultiSIM? Answer: PlusKarten erhalten im Gegensatz zu MultiSIM eine eigene Rufnummer und eigenes Datenvolumen. Diese können also sehr gut für weitere Familienmitglieder oder Freunde genutzt werden. MultiSIM Karten sind für die Nutzung in Tablets oder Smartwatches vorgesehen, da sie die gleiche Rufnummer des Hauptvertrags haben, inkl. parallelem Surfen, Telefonieren und Streamen. Question: Kann ich eine eSIM für die PlusKarten erhalten? Answer: Natürlich kann die PlusKarte wie gewohnt auch als eSIM kostenlos gebucht werden. ' metadata={'source': 'data/Hilfe bei Störungen/https___www.telekom.de_unterwegs_tarife-und-optionen_zweitkarten.txt'}"", ""page_content='' metadata={'source': 'data/Hilfe bei Störungen/https___www.telekom.de_hilfe_apps-dienste_apps_mein-magenta-app_ueberblick-video.txt'}"", ""page_content='' metadata={'source': 'data/Hilfe bei Störungen/https___www.telekom.de_hilfe_geraete-zubehoer_handy-smartphone-tablet_google-geraete_kann-ich-google-pixel-3-und-pixel-3-xl-auch-ohne-sim-lock-erhalten.txt'}"", ""page_content='' metadata={'source': 'data/Hilfe bei Störungen/https___www.telekom.de_hilfe_vertrag-rechnung_vorteile_andere-firmen.txt'}"", ""page_content='Source URL: https://www.telekom.de/hilfe/mobilfunk/tarife-optionen/zusatzkarten/plus-karte-datenvolumen\n\nQuestion: Wie viel Datenvolumen habe ich bei der PlusKarte? Answer: Die PlusKarte erhält automatisch so viel Datenvolumen wie der MagentaMobil Hauptvertrag.' metadata={'source': 'data/Hilfe bei Störungen/https___www.telekom.de_hilfe_mobilfunk_tarife-optionen_zusatzkarten_plus-karte-datenvolumen.txt'}"", ""page_content='' metadata={'source': 'data/Hilfe bei Störungen/https___www.telekom.de_unterwegs_tarife-und-optionen_roaming_travel-mobil-optionen.txt'}"", ""page_content='Source URL: https://www.telekom.de/hilfe/vertrag-rechnung/vorteile/andere-firmen\n\nQuestion: Welche Angebote bekomme ich als Mitarbeiter ausgewählter Unternehmen? Answer: Für Mitarbeitende bestimmter Unternehmen bietet die Telekom einen monatlichen Rabatt auf die Mobilfunk-Tarife und attraktive Preise für Smartphones & Tablets an.' metadata={'source': 'data/Hilfe bei Störungen/https___www.telekom.de_hilfe_vertrag-rechnung_vorteile_andere-firmen.txt'}""]","The perks that come with unlimited data in the Telekom XL Premium plan include unlimited data in the Inland, EU, Switzerland, Turkey, and the USA/Canada. Additionally, the new Plus cards provide 93 GB in the EU and Switzerland. The plan includes 2 Multi SIM cards, and any additional Multi SIM cards (up to 7) can be booked for 30€ each. There is also a telephone flat rate to the EU, Switzerland, Turkey, USA, and Canada.",1396,0.00026474999999999996,123,9,67.29551219940186,0.8976616557938538,0.8333333332916666,0.25,0.5,0.004746672306766226,0.040540540540540536
"What are my options for adding MagentaCloud to my Telekom plan without Kreditkarten-Info, and how might it impact my current terms?","Es tut mir leid, aber ich kann Ihnen nicht direkt bei der Hinzufügung von MagentaCloud zu Ihrem Telekom-Plan ohne Kreditkarteninformationen helfen oder die Auswirkungen auf Ihre aktuellen Vertragsbedingungen erläutern. Für detaillierte Informationen und Unterstützung empfehle ich, die Website www.telekom.de/hilfe zu besuchen. Dort finden Sie umfassende Informationen und können sich bei Bedarf an den Kundenservice wenden.","[""page_content='Source URL: https://www.telekom.de/hilfe/geraete-zubehoer/smart-home/nutzung-und-funktionen-von-smart-home/das-alarmsytem-von-smart-home/magentacloud\n\nQuestion: Muss ich mich für die MagentaCLOUD registrieren, wenn ich das Mediencenter der Telekom genutzt habe? Answer: Nein, Sie nutzen weiterhin Ihre Benutzerdaten/Ihren Telekom Login (E-Mail Adresse und Ihr Passwort).' metadata={'source': 'data/Hilfe bei Störungen/https___www.telekom.de_hilfe_geraete-zubehoer_smart-home_nutzung-und-funktionen-von-smart-home_das-alarmsytem-von-smart-home_magentacloud.txt'}"", ""page_content='Damit verwalten Sie Ihre Verträge, können Rechnungen einsehen und vieles mehr. Question: Wie erhalte ich den Telekom Login? Answer: Sofern Sie sich noch keinen Telekom Login erstellt haben, können Sie sich hier schnell und einfach einen selbst einrichten:\n\nQuestion: Was ist die MeinMagenta App? Answer: Die MeinMagenta App ist Ihr direkter Draht zur Telekom: Service, Verträge und Vorteile – alles in einer App. Melden Sie sich einfach mit Ihrem Telekom Login an.' metadata={'source': 'data/Hilfe bei Störungen/https___www.telekom.de_hilfe_telekom-login.txt'}"", ""page_content='Source URL: https://www.telekom.de/hilfe/apps-dienste/apps/mein-magenta-app/magenta-moments/anmelden\n\nQuestion: Muss ich mich bei Magenta Moments gesondert anmelden? Answer: Wenn Sie sich in derMeinMagenta Appmit Ihrem Telekom Login angemeldet haben, ist eine weitere Anmeldung für Magenta Moments nicht erforderlich.' metadata={'source': 'data/Hilfe bei Störungen/https___www.telekom.de_hilfe_apps-dienste_apps_mein-magenta-app_magenta-moments_anmelden.txt'}"", ""page_content='' metadata={'source': 'data/Hilfe bei Störungen/https___www.telekom.de_hilfe_apps-dienste_apps_mein-magenta-app_magenta-moments_anmelden.txt'}"", ""page_content='' metadata={'source': 'data/Hilfe bei Störungen/https___www.telekom.de_hilfe_telekom-login.txt'}"", ""page_content='' metadata={'source': 'data/Hilfe bei Störungen/https___www.telekom.de_hilfe_tv_magenta-tv-app_magenta-tv-plus-aufrufen.txt'}"", ""page_content='' metadata={'source': 'data/Hilfe bei Störungen/https___www.telekom.de_hilfe_tv_inhalte_registrierungslink-nicht-erhalten.txt'}"", ""page_content='Source URL: https://www.telekom.de/hilfe/mobilfunk/tarife-optionen/zusatzkarten/plus-karte-vertragsuebernahme\n\nQuestion: Wie kann ich eine Rufnummer von einem anderen Anbieter als PlusKarte buchen, wenn der Vertrag dort auf eine andere Person läuft? Answer: Sie buchen die MagentaMobil PlusKarte und geben\xa0bei der Bestellung an, dass die Rufnummer mitgenommen werden soll.' metadata={'source': 'data/Hilfe bei Störungen/https___www.telekom.de_hilfe_mobilfunk_tarife-optionen_zusatzkarten_plus-karte-vertragsuebernahme.txt'}"", ""page_content='Outlook abrufen. Die einzige Voraussetzung sind hier Ihre Zugangsdaten (E-Mail-Adresse undPasswort) zu Ihrem Telekom Mail Konto. • Was ist Magenta Mail?Mit der nun möglichen Domain-Endung „@magenta.de“ lassen sich Wunsch-E-Mail-Adressen bei der Telekom anlegen, die bisher schon vergeben waren. Daher passt die Bezeichnung Magenta Mail noch besser zu dem aktuellen Telekom E-Mail Angebot. Magenta Mail ist somit kein Ersatz für die Telekom Mail, sondern eine passende Ergänzung.Aus diesem Grund bietet Magenta Mail auch dieselben Vorteile wie die Telekom E-Mail. Dazu zählen z. B. sicheres, modernes und kostenloses Mailen mit 1 GB Speicherplatz, hohe Sicherheitsstandards und ein eigenes\xa0E-Mail Center.Bisherige E-Mail-Adressen mit „@t-online.de“ bleiben bestehen – aber auch Kunden, die bereits eine „@t-online“-Adresse besitzen, können sich einfach und kostenlos zusätzliche „@magenta.de“-Adressen über ihr Telekom Mail Konto einrichten. • Was sind die Vorteile von Telekom Freemail?Telekom Freemail ist das kostenlose E-Mail-Paket der Telekom. Hier sind 1 GB Speicherplatz enthalten und Sie können bis zu 100 E-Mails am Tag bzw. 1.000 E-Mails pro Monat mit bis zu 32 MB großen Anhängen versenden. Ein weiterer Vorteil ist die Sicherheit Ihrer Daten durch die standardmäßige Verschlüsselung der Kommunikation und die Datenhaltung in deutschen Rechenzentren nach deutschen Datenschutzstandards.Auch als Nicht-Telekom Kunde können Sie Telekom Freemail nutzen und sich kostenlos registrieren. Für Nutzer mit mehr Speicherbedarf bietet die Telekom darüber hinaus auch das kostenpflichtige E-Mail-Paket „Mail M“ mit 15 GB Speicherplatz und weiteren Vorteilen an. • Was macht die Telekom E-Mail-Adresse so sicher?Die Telekom bietet einen hohen Sicherheits- und Datenschutzstandard, ist darüber hinaus auch Gründungsmitglied der Brancheninitiative „E-Mail made in Germany“ und verpflichtet sich somit, die Sicherheitsregeln dauerhaft einzuhalten.Des Weiteren wird die E-Mail-Kommunikation SSL-verschlüsselt übertragen – dies gilt auch für den Datenverkehr zwischen den teilnehmenden Rechenzentren. Die Speicherung Ihrer Daten wird nur in Rechenzentren mit Standort Deutschland, mit modernster Sicherheitstechnik und nach deutschem Datenschutzgesetz vorgenommen.Zusätzlich werden Adressaten anderer Anbieter, die ebenfalls die „E-Mail made in Germany“-Standards verwenden in der Telekom E-Mail App, sowie im E-Mail Center gesondert hervorgehoben – somit ist leicht erkennbar, welcher Ihrer E-Mail-Kontakte ebenfalls mit diesem hohen Sicherheitsstandard kommuniziert.Trotzdem können Sie selbst gegenPhishingetwas tun. Was genau, erklärt Tim in seinem VideoCyber Security.Weitere5 wichtige Tippsund Fragen zu denSicherheitsthemenbeantworten Ihnen gerne unsere Experten imService Forum.PS: Ihre Passwörter können Sie jederzeit im E-Mail Center unter Einstellungen zurücksetzen. • Wo finde ich weitere Informationen zum Thema E-Mail Adresse für mein Kind?Als Grundlage für digitale Spiele, Homeschooling oder Chats benötigen Kinder häufig eine eigene E-Mail-Adresse. Wir helfen Ihnen dabei, Ihrem Kind eine sichere E-Mail-Adresse zu erstellen. Welche Faktoren dafür wichtig sind, haben wir für Sie gesondert zusammengefasst.Erfahren Sie hier mehr über die Erstellung einer E-Mail-Adresse für Ihr Kind. • Was muss ich tun, wenn ich meinen Benutzernamen oder mein Passwort für mein Telekom Mail Postfach vergessen habe?Um über das E-Mail Center oder die Telekom Mail App auf Ihr Telekom Mail Postfach zuzugreifen, benötigen Sie Benutzernamen und Passwort des Telekom Logins.Benutzername oder Passwort des Telekom Logins vergessenWenn Sie ein E-Mail Programm (Outlook, Windows Live Mail, Mozilla Thunderbird oder Apple Mail) nutzen, benötigen Sie ein spezielles E-Mail Passwort für E-Mail Programme. Dieses können Sie in den Einstellungen vom E-Mail Center neu erstellen.E-Mail Passwort für E-Mail Programme erstellen\n• Wie kann ich meine Telekom E-Mails abrufen?Mit demE-Mail Centerder Telekom haben Sie über jeden Browser Zugriff auf Ihr Postfach. Für mobile Endgeräte eignet sich die Telekom Mail App, die sowohl fürAndroid-, als auchiOS-Geräteverfügbar ist. Sie können Ihre Nachrichten alternativ auch über Standard E-Mail-Programme, wie z. B. Outlook abrufen. Die einzige Voraussetzung sind hier Ihre Zugangsdaten (E-Mail-Adresse undPasswort) zu Ihrem Telekom Mail Konto. • Was ist Magenta Mail?Mit der nun möglichen Domain-Endung „@magenta.de“ lassen sich Wunsch-E-Mail-Adressen bei der Telekom anlegen, die bisher schon vergeben waren. Daher passt die Bezeichnung Magenta Mail noch besser zu dem aktuellen Telekom E-Mail Angebot. Magenta Mail ist somit kein Ersatz für die Telekom Mail, sondern eine passende Ergänzung.Aus diesem Grund bietet Magenta Mail auch dieselben Vorteile wie die Telekom E-Mail. Dazu zählen z. B. sicheres, modernes und kostenloses Mailen mit 1 GB Speicherplatz, hohe Sicherheitsstandards und ein eigenes\xa0E-Mail Center.Bisherige E-Mail-Adressen mit „@t-online.de“ bleiben bestehen – aber auch Kunden, die bereits eine „@t-online“-Adresse besitzen, können sich einfach und kostenlos zusätzliche „@magenta.de“-Adressen über ihr Telekom Mail Konto einrichten. • Was sind die Vorteile von Telekom Freemail?Telekom Freemail ist das kostenlose E-Mail-Paket der Telekom. Hier sind 1 GB Speicherplatz enthalten und Sie können bis zu 100 E-Mails am Tag bzw. 1.000 E-Mails pro Monat mit bis zu 32 MB großen Anhängen versenden. Ein weiterer Vorteil ist die Sicherheit Ihrer Daten durch die standardmäßige Verschlüsselung der Kommunikation und die Datenhaltung in deutschen Rechenzentren nach deutschen Datenschutzstandards.Auch als Nicht-Telekom Kunde können Sie Telekom Freemail nutzen und sich kostenlos registrieren. Für Nutzer mit mehr Speicherbedarf bietet die Telekom darüber hinaus auch das kostenpflichtige E-Mail-Paket „Mail M“ mit 15 GB Speicherplatz und weiteren Vorteilen an. • Was macht die Telekom E-Mail-Adresse so sicher?Die Telekom bietet einen hohen Sicherheits- und Datenschutzstandard, ist darüber hinaus auch Gründungsmitglied der Brancheninitiative „E-Mail made in Germany“ und verpflichtet sich somit, die Sicherheitsregeln dauerhaft einzuhalten.Des Weiteren wird die E-Mail-Kommunikation SSL-verschlüsselt übertragen – dies gilt auch für den Datenverkehr zwischen den teilnehmenden Rechenzentren. Die Speicherung Ihrer Daten wird nur in Rechenzentren mit Standort Deutschland, mit modernster Sicherheitstechnik und nach deutschem Datenschutzgesetz vorgenommen.Zusätzlich werden Adressaten anderer Anbieter, die ebenfalls die „E-Mail made in Germany“-Standards verwenden in der Telekom E-Mail App, sowie im E-Mail Center gesondert hervorgehoben – somit ist leicht erkennbar, welcher Ihrer E-Mail-Kontakte ebenfalls mit diesem hohen Sicherheitsstandard kommuniziert.Trotzdem können Sie selbst gegenPhishingetwas tun. Was genau, erklärt Tim in seinem VideoCyber Security.Weitere5 wichtige Tippsund Fragen zu denSicherheitsthemenbeantworten Ihnen gerne unsere Experten imService Forum.PS: Ihre Passwörter können Sie jederzeit im E-Mail Center unter Einstellungen zurücksetzen. • Wo finde ich weitere Informationen zum Thema E-Mail Adresse für mein Kind?Als Grundlage für digitale Spiele, Homeschooling oder Chats benötigen Kinder häufig eine eigene E-Mail-Adresse. Wir helfen Ihnen dabei, Ihrem Kind eine sichere E-Mail-Adresse zu erstellen. Welche Faktoren dafür wichtig sind, haben wir für Sie gesondert zusammengefasst.Erfahren Sie hier mehr über die Erstellung einer E-Mail-Adresse für Ihr Kind. • Was muss ich tun, wenn ich meinen Benutzernamen oder mein Passwort für mein Telekom Mail Postfach vergessen habe?Um über das E-Mail Center oder die Telekom Mail App auf Ihr Telekom Mail Postfach zuzugreifen, benötigen Sie Benutzernamen und Passwort des Telekom Logins.Benutzername oder Passwort des Telekom Logins vergessenWenn Sie ein E-Mail Programm (Outlook, Windows Live Mail, Mozilla Thunderbird oder Apple Mail) nutzen, benötigen Sie ein spezielles E-Mail Passwort für E-Mail Programme. Dieses können Sie in den Einstellungen vom E-Mail Center neu erstellen.E-Mail Passwort für E-Mail Programme erstellen\n\nQuestion: Wie kann ich meine Telekom E-Mails abrufen? Answer: Mit demE-Mail Centerder Telekom haben Sie über jeden Browser Zugriff auf Ihr Postfach. Für mobile Endgeräte eignet sich die Telekom Mail App, die sowohl fürAndroid-, als auchiOS-Geräteverfügbar ist. Sie können Ihre Nachrichten alternativ auch über Standard E-Mail-Programme, wie z. B. Outlook abrufen. Die einzige Voraussetzung sind hier Ihre Zugangsdaten (E-Mail-Adresse undPasswort) zu Ihrem Telekom Mail Konto. Question: Was ist Magenta Mail? Answer: Mit der nun möglichen Domain-Endung „@magenta.de“ lassen sich Wunsch-E-Mail-Adressen bei der Telekom anlegen, die bisher schon vergeben waren. Daher passt die Bezeichnung Magenta Mail noch besser zu dem aktuellen Telekom E-Mail Angebot. Magenta Mail ist somit kein Ersatz für die Telekom Mail, sondern eine passende Ergänzung. Aus diesem Grund bietet Magenta Mail auch dieselben Vorteile wie die Telekom E-Mail. Dazu zählen z.' metadata={'source': 'data/Hilfe bei Störungen/https___www.telekom.de_e-mail.txt'}"", ""page_content='KundencenterMelden Sie sich per Telekom Login imKundencenteran und folgen Sie den weiteren Schritten:\nMeinMagenta AppMelden Sie sich per Telekom Login in derMeinMagenta Appan und folgen Sie den weiteren Schritten:\nKontaktformularMöchten Sie die Änderung nicht selbst durchführen, melden Sie sich perKontaktformularbei uns.' metadata={'source': 'data/Hilfe bei Störungen/https___www.telekom.de_hilfe_vertrag-rechnung_vertrag_aenderung_e-mail-adresse.txt'}""]","You can add MagentaCloud to your Telekom plan without providing Kreditkarten-Info by choosing to add it to your Festnetz-Vertrag, where the billing will occur through your linked bank account (SEPA-Mandat). Alternatively, you can use the ""Zugang zu Telekom Diensten"" option, which also allows billing through a bank account. Adding MagentaCloud does not change the contract duration of your existing Festnetz-Hauptvertrag.",3092,0.0004998,80,10,83.53998303413391,0.0,0.11111111109999999,0.0,0.6,0.0036100836632253384,0.0625
Was braucht's für die Standardmontage der Glasfaser-Dose im EFH und welche Zusatzkosten bei abweichender Position?,"Für die Standardmontage der Glasfaser-Dose in einem Einfamilienhaus wird die Dose bis zu drei Meter vom Glasfaser-Hausanschluss montiert, der sich in der Regel im Keller befindet. Diese Montage ist kostenfrei.

Wenn Sie die Glasfaser-Dose an einem anderen Ort installieren lassen möchten, entstehen zusätzliche Kosten, da Sie den Leitungsweg vorbereiten müssen. Die genauen Kosten hängen von den individuellen Anforderungen ab, wie z.B. der Verlegung von zusätzlichen Kabeln oder anderen notwendigen Arbeiten. Weitere Informationen dazu finden Sie auf www.telekom.de/hilfe.","[""page_content='Dafür stehen Ihnen zwei Optionen zur Verfügung:\n\nQuestion: Kommen beim Anschluss Kosten auf mich zu? Answer: Die Installation der Glasfaser-Dose innerhalb von drei Metern vom Hausanschluss bei Einfamilienhäusern bzw. vom Wohnungseintritt bei Mehrfamilienhäusern ist Teil der Standardmontage und mit keinen zusätzlichen Kosten verbunden.Die Verlegung der Glasfaser-Dose an einem Wunschort erfordert die Vorbereitung der Leitungswege Ihrerseits und kann demnach mit individuellen Kosten verbunden sein.Sollten Sie sich nach erfolgreicher Standardmontage für einen weiteren Installationspunkt entscheiden, um Ihre Konnektivität zu verbessern, können Sie außerdem unseren ServiceInstallation Glasfaserkostenpflichtig buchen oder dieGlasfaser Verlängerungsboxbestellen. Question: Was ist der Service „Installation Glasfaser“? Answer: Das Service-ProduktInstallation Glasfasersieht es vor, die bereits bei Ihnen angebrachte Glasfaser-Dose an Ihren Wunschort zu verlängern und beinhaltet folgende Leistungsinhalte:\nLeistungsinhalte darüber hinaus werden nach Aufwand verrechnet. • Verlegung von zusätzlichen 10 Metern im Klebekanal\n• Ein Wand- oder Deckendurchbruch\n• Ggf. anfallende Spleißarbeiten\n• Installation einer zweiten Glasfaser-Dose am Wunschort\n• Aktivierung Ihres Glasfaser-Anschlusses\n\n' metadata={'source': 'data/Hilfe bei Störungen/https___www.telekom.de_netz_glasfaser_glasfaserausbau.txt'}"", ""page_content='Als Mieter erkundigen Sie sich bei Ihrem Vermieter über die geplante Montageposition der Glasfaser-Dose. In den meisten Fällen wird sie in der Nähe Ihrer Wohnungstür installiert. StandardmontageDie Glasfaser-Dose wird bis zu drei Meter vom Glasfaser-Hausanschluss montiert. Bei einem Einfamilienhaus ist das in der Regel im Keller, bei einer Wohnung hinter der Eingangstür.' metadata={'source': 'data/Hilfe bei Störungen/https___www.telekom.de_hilfe_internet-telefonie_internet_glasfaser_dose-montageposition.txt'}"", 'page_content=\'Source URL: https://www.telekom.de/hilfe/internet-telefonie/internet/glasfaser/dose-montageposition\n\nQuestion: Wo wird die Glasfaser-Dose montiert? Answer: Als Hauseigentümer können Sie während des Bereitstellungsprozesses zwischen der ""Standardmontage"" und der ""Montage am Wunschort"" wählen.\' metadata={\'source\': \'data/Hilfe bei Störungen/https___www.telekom.de_hilfe_internet-telefonie_internet_glasfaser_dose-montageposition.txt\'}', ""page_content='' metadata={'source': 'data/Hilfe bei Störungen/telekomhilft.telekom.de_t5_Festnetz-Internet_Glasfaseranschluss-erweitern_td-p_6948196_jump-to_first-unread-message.txt'}"", ""page_content='' metadata={'source': 'data/Hilfe bei Störungen/telekomhilft.telekom.de_t5_Festnetz-Internet_Neue-Verkabelung-an-1-TAE_td-p_6964711_jump-to_first-unread-message.txt'}"", ""page_content='' metadata={'source': 'data/Hilfe bei Störungen/https___www.telekom.de_hilfe_internet-telefonie_internet_glasfaser_dose-montageposition.txt'}"", ""page_content='' metadata={'source': 'data/Hilfe bei Störungen/telekomhilft.telekom.de_t5_Festnetz-Internet_Glasfaser-Modem-2-mit-Speedport-Smart-3-Kompatibilitaet-bei_td-p_6952387_jump-to_first-unread-message.txt'}"", ""page_content='Question: Wo finde ich die Glasfaser-Dose? Answer: In Einfamilienhäusern befindet sich die Dose in der Regel im Keller in einem Umkreis von bis zu 3 Metern um den Hausanschluss bzw. Eintrittspunkt des Kabels ins Gebäude. Falls die Leitung durch Wände oder Decken verlängert wurde, dann ist die Glasfaser-Dose am Ende dieses Leitungswegs platziert. In Mehrfamilienhäusern befindet sich die Dose meist im Eingangsbereich hinter der Wohnungstür. Question: Woran erkenne ich die Glasfaser-Dose?' metadata={'source': 'data/Hilfe bei Störungen/https___www.telekom.de_hilfe_internet-telefonie_internet_glasfaser_glasfaser-id.txt'}"", ""page_content='Allerdings können wir Ihnen die uneingeschränkte Funktionsfähigkeit nicht garantieren. Außerdem benötigen Sie einen passendenGlasfaser-Tarif. Question: Wo befindet sich der Hausanschluss? Answer: Der Glasfaser-Hausanschluss befindet sich in der Regel im Keller oder einem Anschlussraum. Falls das Gebäude keinen Keller hat, legen Sie einen Raum für den Hausanschluss fest. Jedes Gebäude benötigt nur einen Hausanschluss. Question: Wo wird die Glasfaser-Dose montiert? Answer: Der Ort der Montage richtet sich danach, ob Sie in einem Ein- oder Mehrfamilienhaus wohnen:Einfamilienhaus:Bei der kostenfreien Standardmontage wird die Glasfaser-Dose in einem Umkreis von bis zu drei Metern vom Glasfaser-Hausanschluss installiert, dieser liegt meist im Keller.Mehrfamilienhaus:Bei der kostenfreien Standardmontage in einer Wohnung in einem Mehrfamilienhaus verlegen wir vom Hausanschluss aus Steigleitungen im Treppenhaus bis in die Wohnung. Dort erfolgt die Montage der Glasfaser-Dose im Umkreis von drei Metern um die Wohnungstür.Wenn Sie die Glasfaser-Dose an einem anderen Ort, z.B. im Büro oder Wohnzimmer, haben möchten, installieren wir Ihnen die Glasfaser-Dose kostenlos in einem Umkreis von 20 Metern vom Wohnungseintritt, wenn Sie den Leitungsweg entsprechend vorbereitet haben. Wie Sie die Leitungswege vorbereiten müssen, erfahren Sie in unsererAnleitung zur Vorbereitung des Leitungswegs. Question: Kann ich die Glasfaser-Dose auch an einem Wunschort montiert bekommen? Answer: Ja, falls Sie Ihre Glasfaser-Dose an einem anderen Standort haben möchten als bei der Standardmontage, verlegen wir im Rahmen des Anschlusstermins kostenlos bis zu 20 Meter Glasfaser-Kabel in Ihrer Wohnung.Hinweis:Hierfür müssen Sie den Leitungsweg in Ihrer Wohnung vorbereiten. In unsererAnleitung zur Vorbereitung des Leitungswegserklären wir Ihnen, was zu tun ist.Alternativ haben Sie die Möglichkeit, auch nachträglich noch den Standort zu verändern bzw.' metadata={'source': 'data/Hilfe bei Störungen/https___www.telekom.de_netz_glasfaser_glasfaserausbau.txt'}""]","Für die Standardmontage der Glasfaser-Dose im Einfamilienhaus (EFH) ist die Installation innerhalb von drei Metern vom Glasfaser-Hausanschluss Teil der Standardmontage und mit keinen zusätzlichen Kosten verbunden. Bei abweichender Position, wenn die Glasfaser-Dose an einem Wunschort installiert werden soll, müssen Sie den Leitungsweg vorbereiten, was mit individuellen Kosten verbunden sein kann.",1802,0.0003242999999999999,120,9,88.26665019989014,0.0,0.8263888888751157,1.0,0.875,0.10739192113852504,0.3561643835616438
Was braucht's für eine Vertragsverlängerung als Telekom for Friends Kunde mit MagentaEINS Vorteilen?,"Um eine Vertragsverlängerung als Telekom for Friends Kunde mit MagentaEINS Vorteilen durchzuführen, benötigen Sie in der Regel folgende Informationen und Schritte:

1. **Identifikation**: Stellen Sie sicher, dass Sie Ihre Kundendaten zur Hand haben, wie Kundennummer oder Mobilnummer.
2. **Tarifwahl**: Wählen Sie den Tarif, den Sie nach der Verlängerung haben möchten. Achten Sie darauf, ob der gewählte Tarif die MagentaEINS Vorteile unterstützt.
3. **Online oder telefonisch**: Sie können die Vertragsverlängerung online über die Telekom-Website oder telefonisch beim Kundenservice anfragen.
4. **Dokumente**: Halten Sie eventuell benötigte Unterlagen bereit, falls diese angefordert werden.

Für spezifische Details oder um den Prozess zu starten, empfehle ich, die Webseite www.telekom.de/hilfe zu besuchen oder den Kundenservice direkt zu kontaktieren.","[""page_content='Question:\nKönnen Sie mir sagen, wann ich meinen Handyvertrag verlängern kann? Answer:\nIn dem Transkript sucht eine Person Unterstützung bei der Telekom, speziell durch eine Assistenz namens Frau Magenta.' metadata={'source': 'data/Hilfe bei Störungen/youtube_Frag Magenta： Der digitale Assistent #shorts#telekom#fragmagenta#support#tech#digitalart#fyp#like.txt'}"", ""page_content='Source URL: https://www.telekom.de/hilfe/magenta-eins/vorteil-beauftragen\n\nQuestion: Wie kann ich MagentaEINS beauftragen? Answer: Mit unsererAnleitungkönnen Sie den MagentaEINS Vorteil selbst für Ihre Verträge freischalten oder sich direkt Ihr MagentaEINS Paket konfigurieren.' metadata={'source': 'data/Hilfe bei Störungen/https___www.telekom.de_hilfe_magenta-eins_vorteil-beauftragen.txt'}"", ""page_content='Source URL: https://www.telekom.de/hilfe/vertrag-rechnung/vertrag/aenderung/magenta-tv-kuendigen-festnetz-behalten\n\nQuestion: Wie kann ich MagentaTV kündigen, wenn ich meinen Festnetz-Anschluss behalten möchte? Answer: Wenn Sie MagentaTV kündigen und Ihren Festnetz-Anschluss behalten möchten, ist dies über einen Tarifwechsel zum Ende der Vertragslaufzeit möglich.' metadata={'source': 'data/Hilfe bei Störungen/https___www.telekom.de_hilfe_vertrag-rechnung_vertrag_aenderung_magenta-tv-kuendigen-festnetz-behalten.txt'}"", 'page_content=\'Source URL: https://www.telekom.de/hilfe/vertrag-rechnung/vorteile/empfehlen-freundschaftswerbung\n\nQuestion: Was ist ""Die Freundschaftswerbung der Telekom""? Answer: Wenn Sie an Verwandte oder Bekannte einen Telekom Tarif oder Vertrag empfehlen, erhalten Sie bei erfolgreichem Vertragsabschluss eine Prämie.\' metadata={\'source\': \'data/Hilfe bei Störungen/https___www.telekom.de_hilfe_vertrag-rechnung_vorteile_empfehlen-freundschaftswerbung.txt\'}', ""page_content='Und dann wieder NEU bei der Telekom abzuschließen(Hoffen wir mal, dass nicht schon 20.000 Kunden abgeschlossen haben ...)\n- @Pawelski2801schrieb:Hallo Telekom Team,ist es möglich mit eine Vertragsverlängerung in einen höheren Magenta Mobil Tarif (Mobil M -> Mobil L) an der Cashback-Aktion teilzunehmen. Würde dies als neu abgeschlossener Vertrag gelten (neue Tarifbedingungen & neue Generation)Über eine Rückmeldung würde ich mich freuen.LGPawel600 € gibt es erst bei Mobil XLUnd so wie ich das verstanden habe nur bei kompletten Neuabschlüssen, keineVVLoder Update. - @Pawelski2801schrieb:Hallo Telekom Team,ist es möglich mit eine Vertragsverlängerung in einen höheren Magenta Mobil Tarif (Mobil M -> Mobil L) an der Cashback-Aktion teilzunehmen. Würde dies als neu abgeschlossener Vertrag gelten (neue Tarifbedingungen & neue Generation)Über eine Rückmeldung würde ich mich freuen.LGPawelAlso Neuabschluss .JaKeine VLUnd 600 sind es beim M sowieso nicht so nebenbei\n- @Pawelski2801schrieb:Hallo Telekom Team,ist es möglich mit eine Vertragsverlängerung in einen höheren Magenta Mobil Tarif (Mobil M -> Mobil L) an der Cashback-Aktion teilzunehmen. Würde dies als neu abgeschlossener Vertrag gelten (neue Tarifbedingungen & neue Generation)Über eine Rückmeldung würde ich mich freuen.LGPawelAlso Neuabschluss .JaKeine VLUnd 600 sind es beim M sowieso nicht so nebenbei\n- @Pawelski2801schrieb:Hallo Telekom Team,ist es möglich mit eine Vertragsverlängerung in einen höheren Magenta Mobil Tarif (Mobil M -> Mobil L) an der Cashback-Aktion teilzunehmen. Würde dies als neu abgeschlossener Vertrag gelten (neue Tarifbedingungen & neue Generation)Über eine Rückmeldung würde ich mich freuen.LGPawel600 € gibt es erst bei Mobil XLUnd so wie ich das verstanden habe nur bei kompletten Neuabschlüssen, keineVVLoder Update. - @Pawelski2801schrieb:Deshalb meine Frage, ob es dann so gelten würde für die TeilnahNein,es ist ein Tarifwechsel als Bestandkunde !Neuvertrag wäre für Kunden, die noch keinen Vertrag hatten.Da man immer sofort als Neukunde gilt, wenn man neu abschließt, wäre die Idee, deine Nummer zu einem anderen Anbieter zu portieren mit monatl.' metadata={'source': 'data/Hilfe bei Störungen/telekomhilft.telekom.de_t5_Mobilfunk_Vertragsverlaengerung-mit-neuer-quot-Bis-zu-600-Euro-Cashback_td-p_6960218_jump-to_first-unread-message.txt'}"", ""page_content='Source URL: https://www.telekom.de/hilfe/magenta-eins/prepaid-vorteil-tarife\n\nQuestion: Welche Tarife erhalten den MagentaEINS Prepaid-Vorteil? Answer: Für den MagentaEINS Prepaid-Vorteil sind aktuelleMagentaMobil Prepaid-Tarifeab MagentaMobil Prepaid M berechtigt.' metadata={'source': 'data/Hilfe bei Störungen/https___www.telekom.de_hilfe_magenta-eins_prepaid-vorteil-tarife.txt'}"", ""page_content='Question:\nKönnen Sie mehr Informationen über den zusätzlichen Service geben, den ich erhalte, wenn ich Magenta zu Hause oder Magenta zu Hause TV kaufe? Answer:\nHallo, ich bin Florian von der Telekom. In diesem Format präsentieren wir unseren Service.' metadata={'source': 'data/Hilfe bei Störungen/youtube_Kennst Du...unseren proaktiven Heimnetzservice？ I Telekom.txt'}"", ""page_content='Source URL: https://www.telekom.de/hilfe/vertrag-rechnung/vorteile/for-friends-tarife\n\nQuestion: Was sind for Friends Tarife? Answer: Mit Telekom for Friends erhalten Freunde von Mitarbeitern der Telekom einen Sparvorteil auf den Grundpreis für Mobilfunk- und Festnetz-Tarife.' metadata={'source': 'data/Hilfe bei Störungen/https___www.telekom.de_hilfe_vertrag-rechnung_vorteile_for-friends-tarife.txt'}""]",Die Antwort auf die gegebene Frage ist nicht im Kontext vorhanden,1788,0.00035279999999999996,188,8,73.21039891242981,0.9286451992455468,0.49999999995,1.0,0.0,0.0016093850171181648,0.02877697841726619
What to do if a router won't reboot post-reset and needs alternative login?,"Wenn Ihr Router nach dem Zurücksetzen auf die Werkseinstellungen nicht neu startet, folgen Sie diesen vier Schritten, um das Problem zu beheben:

1. Trennen Sie den Router vom Stromnetz, indem Sie das Netzkabel abziehen.
2. Warten Sie mindestens 30 Sekunden, um sicherzustellen, dass alle Restspannungen abgebaut sind.
3. Schließen Sie den Router wieder an das Stromnetz an.
4. Warten Sie, bis der Router vollständig hochgefahren ist, was einige Minuten dauern kann.

Falls der Router weiterhin nicht neu startet, empfehle ich Ihnen, die Leitungsprüfung auf der Telekom-Website zu nutzen oder eine Störung zu melden. Weitere Unterstützung finden Sie auf www.telekom.de/hilfe.","[""page_content='Source URL: https://www.telekom.de/hilfe/hilfe-bei-stoerungen/netzreset-router\n\nQuestion: Wie kann ich meinen Router neu starten? Answer: Bei Fehlfunktionen des Anschlusses hilft in vielen Fällen ein Neustart des Routers.' metadata={'source': 'data/Hilfe bei Störungen/https___www.telekom.de_hilfe_hilfe-bei-stoerungen_netzreset-router.txt'}"", ""page_content='Source URL: https://www.telekom.de/hilfe/werksreset-speedport/werksreset-faq/kein-neustart-nach-reset\n\nQuestion: Was mache ich wenn mein Router nach dem Zurücksetzen auf Werkseinstellungen nicht neu startet? Answer: Folgen Sie diesen vier Schritten, um Ihren Router neu zu starten:\n\n' metadata={'source': 'data/Hilfe bei Störungen/https___www.telekom.de_hilfe_werksreset-speedport_werksreset-faq_kein-neustart-nach-reset.txt'}"", ""page_content='Folgen Sie diesen vier Schritten, um Ihren\xa0Router\xa0neu zu starten:\nHat dieser Tipp nicht geholfen, dann nutzen Sie gerne unsereLeitungsprüfung, um den Fehler zu beheben oder eine Störung zu melden.' metadata={'source': 'data/Hilfe bei Störungen/https___www.telekom.de_hilfe_hilfe-bei-stoerungen_netzreset-router.txt'}"", ""page_content='Wie lösche ich die Daten vom Router, wenn ich nur mein Handy zur Verfügung habe? Reset habe ich ausgeführt, doch erkenne nicht, ob es funktioniert hat.' metadata={'source': 'data/Hilfe bei Störungen/telekomhilft.telekom.de_t5_Festnetz-Internet_Speedport-3-Daten-loeschen_td-p_6943142_jump-to_first-unread-message.txt'}""]",The answer to given question is not present in context,723,0.00017685,152,4,68.48368787765503,0.8952753172152277,0.0,1.0,0.3333333333333333,0,0.0
Wie wirkt sich die automatische Sendeleistungsanpassung auf den Full ECO Mode aus?,"Die automatische Sendeleistungsanpassung beeinflusst den Full ECO Mode, indem sie die Sendeleistung der Basisstation optimiert, sodass diese nur dann Funksignale sendet, wenn es notwendig ist. Im Full ECO Mode wird der Sender in der Basisstation komplett abgeschaltet, wenn keine Gesprächsverbindung besteht. Daher sorgt die automatische Anpassung dafür, dass die Sendeleistung nur bei Bedarf aktiviert wird, was zu einer weiteren Reduzierung des Energieverbrauchs und der Strahlung führt. 

Wenn Sie mehr Informationen benötigen, können Sie die Webseite [www.telekom.de/hilfe](https://www.telekom.de/hilfe) besuchen.","[""page_content='Source URL: https://www.telekom.de/hilfe/geraete-zubehoer/umwelt/nachhaltigkeit/full-eco-mode\n\nQuestion: Was heißt Full ECO Mode? Answer: Bei aktivem Full ECO Mode wird der Sender in der Basis komplett abgeschaltet, wenn einige Zeit keine Gesprächsverbindung besteht.' metadata={'source': 'data/Hilfe bei Störungen/https___www.telekom.de_hilfe_geraete-zubehoer_umwelt_nachhaltigkeit_full-eco-mode.txt'}"", ""page_content='Source URL: https://www.telekom.de/hilfe/geraete-zubehoer/telefone-und-anlagen/informationen-zu-unseren-aktuellen-telefonen/full-eco-mode-plus\n\nQuestion: Was bedeutet Full ECO Mode plus? Answer: Full ECO Mode plus ist eine Funktion neuer Telefone der Telekom, die die ausgehende Strahlungsleistung auf ein Minimum reduziert. Im Full ECO Mode plus sendet die Basisstation nur dann Funksignale, wenn es erforderlich ist.' metadata={'source': 'data/Hilfe bei Störungen/https___www.telekom.de_hilfe_geraete-zubehoer_telefone-und-anlagen_informationen-zu-unseren-aktuellen-telefonen_full-eco-mode-plus.txt'}"", ""page_content='Im Full ECO Mode plus sendet die Basisstation nur dann, wenn es erforderlich ist – etwa, wenn ein Anruf ankommt, während eines Gesprächs oder beim Verbindungsaufbau.' metadata={'source': 'data/Hilfe bei Störungen/https___www.telekom.de_hilfe_geraete-zubehoer_umwelt_blauer-engel_blauer-engel-full-eco-mode.txt'}"", ""page_content='Im Ruhezustand bleibt der Sender der Basisstation ganz abgeschaltet. DerBlue Eco Modebedeutet, dass der Verbraucher selbst die gewünschte Sendeleistung an der Basisstation einstellen und jederzeit verändern kann.' metadata={'source': 'data/Hilfe bei Störungen/https___www.telekom.de_hilfe_geraete-zubehoer_umwelt_blauer-engel_blauer-engel-full-eco-mode.txt'}""]","Die automatische Sendeleistungsanpassung sorgt dafür, dass die Sendeleistung entsprechend der Entfernung zwischen Basisstation und Mobilteil angepasst wird. Im Full ECO Mode sendet die Basisstation nur dann, wenn es erforderlich ist, was bedeutet, dass die Sendeleistung optimiert wird, um Energie zu sparen.",772,0.0001761,134,4,74.79029703140259,0.9802726687489455,0.999999999975,0.5,0.4444444444444444,0.09366679862533844,0.27272727272727276
