Question,Response,Contexts,Ground Truth,Token Count,Total Cost (USD),Completion Tokens,Number of Retrieved documents,Response time,answer_relevancy,context_precision,context_recall,faithfulness,BleuScore,RougeScore
What Optionen bietet MagentaTV im Bereich Live-Sport an?,"Mit der MegaSport Option bei MagentaTV können Sie Ihren Live-Sport in einem Paket genießen. Sie erhalten Zugang zu exklusiven Inhalten von WOW Live-Sport, DAZN und MagentaSport, wobei WOW Premium immer inklusive ist. Dies ermöglicht Ihnen ein komfortableres Sporterlebnis, da Sie nur eine Zubuchoption benötigen, anstatt für jeden Partnerinhalt ein separates Abo abzuschließen.","[""page_content='Source URL: https://www.telekom.de/sport/megasport-option\n\nQuestion: Welchen Vorteil bietet mir die MegaSport Option?\nAnswer: Mit der MegaSport Option schauen Sie Ihren Live-Sport vereint in einem Paket bei MagentaTV. Genießen Sie exklusive Inhalte von WOW Live-Sport, DAZN und MagentaSport. WOW Premium ist immer inklusive. Komfortabler mitfiebern geht nicht! Sie brauchen nur eine Zubuchoption, statt für jeden Partnerinhalt ein separates Abo zur IhremMagentaTV Tarifabzuschließen. Zudem sichern Si'"", ""page_content='Source URL: https://www.telekom.de/sport/megasport-option\n\nQuestion: Welchen Vorteil bietet mir die MegaSport Option?\nAnswer: Mit der MegaSport Option schauen Sie Ihren Live-Sport vereint in einem Paket bei MagentaTV. Genießen Sie exklusive Inhalte von WOW Live-Sport, DAZN und MagentaSport. WOW Premium ist immer inklusive. Komfortabler mitfiebern geht nicht! Sie brauchen nur eine Zubuchoption, statt für jeden Partnerinhalt ein separates Abo zur IhremMagentaTV Tarifabzuschließen. Zudem sichern Si'"", ""page_content='Source URL: https://www.telekom.de/sport/megasport-option\n\nQuestion: Welchen Vorteil bietet mir die MegaSport Option?\nAnswer: Mit der MegaSport Option schauen Sie Ihren Live-Sport vereint in einem Paket bei MagentaTV. Genießen Sie exklusive Inhalte von WOW Live-Sport, DAZN und MagentaSport. WOW Premium ist immer inklusive. Komfortabler mitfiebern geht nicht! Sie brauchen nur eine Zubuchoption, statt für jeden Partnerinhalt ein separates Abo zur IhremMagentaTV Tarifabzuschließen. Zudem sichern Si'"", ""page_content='Source URL: https://www.telekom.de/sport/megasport-option\n\nQuestion: Welchen Vorteil bietet mir die MegaSport Option?\nAnswer: Mit der MegaSport Option schauen Sie Ihren Live-Sport vereint in einem Paket bei MagentaTV. Genießen Sie exklusive Inhalte von WOW Live-Sport, DAZN und MagentaSport. WOW Premium ist immer inklusive. Komfortabler mitfiebern geht nicht! Sie brauchen nur eine Zubuchoption, statt für jeden Partnerinhalt ein separates Abo zur IhremMagentaTV Tarifabzuschließen. Zudem sichern Si'""]","MagentaTV bietet im Bereich Live-Sport die WOW Pakete an, die Live-Sport (inkl. Premium) und Sport umfassen.",731,0.00014745,84,4,48.67665910720825,0.9275187863744554,0.999999999975,0.0,1.0,0.0049811554679751145,0.17948717948717952
What sind die Kosten für Inlandsgespräche bei der Nutzung von WLAN Call?,"WLAN Call innerhalb Deutschlands wird genauso abgerechnet wie Gespräche über das Mobilfunknetz. Das gleiche gilt für SMS und MMS-Nachrichten. Wenn Sie z. B. einen Tarif mit einer Flatrate nutzen, fallen keine Gebühren für Inlandsgespräche an.","[""page_content='Source URL: https://www.telekom.de/hilfe/mobilfunk/telefonieren-sms-mms/wlan-call/kosten-inland\n\nQuestion: Was kostet WLAN Call innerhalb Deutschlands?\nAnswer: WLAN Call innerhalb Deutschlands wird genauso abgerechnet wie Gespräche über das Mobilfunknetz. Das gleiche gilt für SMS und MMS-Nachrichten. Wenn Sie z. B. einen Tarif mit einer Flatrate nutzen, fallen keine Gebühren für Inlandsgespräche an.'"", ""page_content='Source URL: https://www.telekom.de/hilfe/mobilfunk/telefonieren-sms-mms/wlan-call/kosten-inland\n\nQuestion: Was kostet WLAN Call innerhalb Deutschlands?\nAnswer: WLAN Call innerhalb Deutschlands wird genauso abgerechnet wie Gespräche über das Mobilfunknetz. Das gleiche gilt für SMS und MMS-Nachrichten. Wenn Sie z. B. einen Tarif mit einer Flatrate nutzen, fallen keine Gebühren für Inlandsgespräche an.'"", ""page_content='Source URL: https://www.telekom.de/hilfe/mobilfunk/telefonieren-sms-mms/wlan-call/kosten-inland\n\nQuestion: Was kostet WLAN Call innerhalb Deutschlands?\nAnswer: WLAN Call innerhalb Deutschlands wird genauso abgerechnet wie Gespräche über das Mobilfunknetz. Das gleiche gilt für SMS und MMS-Nachrichten. Wenn Sie z. B. einen Tarif mit einer Flatrate nutzen, fallen keine Gebühren für Inlandsgespräche an.'"", ""page_content='Source URL: https://www.telekom.de/hilfe/mobilfunk/telefonieren-sms-mms/wlan-call/kosten-inland\n\nQuestion: Was kostet WLAN Call innerhalb Deutschlands?\nAnswer: WLAN Call innerhalb Deutschlands wird genauso abgerechnet wie Gespräche über das Mobilfunknetz. Das gleiche gilt für SMS und MMS-Nachrichten. Wenn Sie z. B. einen Tarif mit einer Flatrate nutzen, fallen keine Gebühren für Inlandsgespräche an.'""]","Die Kosten für Inlandsgespräche bei der Nutzung von WLAN Call sind die gleichen wie für Gespräche über das Mobilfunknetz. Wenn ein Tarif mit einer Flatrate genutzt wird, fallen keine Gebühren für Inlandsgespräche an.",604,0.0001149,54,4,47.40508317947388,0.9011144042198787,0.999999999975,1.0,1.0,0.29187438961211887,0.54320987654321
"What sollte bei der Rücksendung der Endgeräte beachtet werden, um Nachberechnungen zu vermeiden?","Bei der Rücksendung der Endgeräte solltest du darauf achten, diese rechtzeitig zurückzuschicken, um Nachberechnungen zu vermeiden. Überprüfe auch, ob du alle anderen Services, die du kündigen wolltest, separat gekündigt hast. Es ist wichtig, dass du alles fristgerecht erledigst, um zusätzliche Kosten zu vermeiden. Wenn du weitere Fragen hast, stehe ich gerne zur Verfügung!","[""page_content='Answer:\nBei der Kündigung deines Festnetzvertrags erhältst du von uns eine Schlussrechnung, die etwas später als gewohnt kommen könnte. Wir warten bis zum bestätigten Kündigungsdatum, um dir eine abschließende Rechnung bereitzustellen, in der alle genutzten Services abgerechnet werden. Beachte, dass einige Gebühren, wie die monatliche Grundgebühr, im Voraus berechnet werden. Bei der Kündigung kündigst du nur den Anschluss, nicht aber weitere Services. Kündige diese separat und nutze unser Kontaktformular. Bitte denke daran, uns deine Endgeräte rechtzeitig zurückzuschicken, um Nachberechnungen zu vermeiden. Prüfe nach Erhalt der Schlussrechnung, ob du alles gekündigt hast, was du kündigen wolltest. Der fällige Betrag wird in den nächsten Tagen von deinem Konto abgebucht. Mit der Zustellung der Schlussrechnung ist die Kündigung deines Festnetzvertrags abgeschlossen. Wir wünschen dir alles Gute und stehen gerne bei weiteren Anfragen zur Verfügung.'"", ""page_content='Answer:\nBei der Kündigung deines Festnetzvertrags erhältst du von uns eine Schlussrechnung, die etwas später als gewohnt kommen könnte. Wir warten bis zum bestätigten Kündigungsdatum, um dir eine abschließende Rechnung bereitzustellen, in der alle genutzten Services abgerechnet werden. Beachte, dass einige Gebühren, wie die monatliche Grundgebühr, im Voraus berechnet werden. Bei der Kündigung kündigst du nur den Anschluss, nicht aber weitere Services. Kündige diese separat und nutze unser Kontaktformular. Bitte denke daran, uns deine Endgeräte rechtzeitig zurückzuschicken, um Nachberechnungen zu vermeiden. Prüfe nach Erhalt der Schlussrechnung, ob du alles gekündigt hast, was du kündigen wolltest. Der fällige Betrag wird in den nächsten Tagen von deinem Konto abgebucht. Mit der Zustellung der Schlussrechnung ist die Kündigung deines Festnetzvertrags abgeschlossen. Wir wünschen dir alles Gute und stehen gerne bei weiteren Anfragen zur Verfügung.'"", ""page_content='Answer:\nBei der Kündigung deines Festnetzvertrags erhältst du von uns eine Schlussrechnung, die etwas später als gewohnt kommen könnte. Wir warten bis zum bestätigten Kündigungsdatum, um dir eine abschließende Rechnung bereitzustellen, in der alle genutzten Services abgerechnet werden. Beachte, dass einige Gebühren, wie die monatliche Grundgebühr, im Voraus berechnet werden. Bei der Kündigung kündigst du nur den Anschluss, nicht aber weitere Services. Kündige diese separat und nutze unser Kontaktformular. Bitte denke daran, uns deine Endgeräte rechtzeitig zurückzuschicken, um Nachberechnungen zu vermeiden. Prüfe nach Erhalt der Schlussrechnung, ob du alles gekündigt hast, was du kündigen wolltest. Der fällige Betrag wird in den nächsten Tagen von deinem Konto abgebucht. Mit der Zustellung der Schlussrechnung ist die Kündigung deines Festnetzvertrags abgeschlossen. Wir wünschen dir alles Gute und stehen gerne bei weiteren Anfragen zur Verfügung.'"", ""page_content='Answer:\nBei der Kündigung deines Festnetzvertrags erhältst du von uns eine Schlussrechnung, die etwas später als gewohnt kommen könnte. Wir warten bis zum bestätigten Kündigungsdatum, um dir eine abschließende Rechnung bereitzustellen, in der alle genutzten Services abgerechnet werden. Beachte, dass einige Gebühren, wie die monatliche Grundgebühr, im Voraus berechnet werden. Bei der Kündigung kündigst du nur den Anschluss, nicht aber weitere Services. Kündige diese separat und nutze unser Kontaktformular. Bitte denke daran, uns deine Endgeräte rechtzeitig zurückzuschicken, um Nachberechnungen zu vermeiden. Prüfe nach Erhalt der Schlussrechnung, ob du alles gekündigt hast, was du kündigen wolltest. Der fällige Betrag wird in den nächsten Tagen von deinem Konto abgebucht. Mit der Zustellung der Schlussrechnung ist die Kündigung deines Festnetzvertrags abgeschlossen. Wir wünschen dir alles Gute und stehen gerne bei weiteren Anfragen zur Verfügung.'""]","Bitte denke daran, uns deine Endgeräte rechtzeitig zurückzuschicken, um Nachberechnungen zu vermeiden.",1097,0.00020279999999999997,85,4,53.245768785476685,0.858091192374112,0.999999999975,1.0,1.0,0.08792400740884215,0.24
"What sind die verschiedenen Alarmereignisse, die in einem Alarmsystem erkannt werden können?","Die verschiedenen Alarmereignisse, die in einem Alarmsystem erkannt werden können, sind:

- Wassereinbruch
- Rauch erkannt
- Bei ""Abwesend"": Tür oder Fenster geöffnet
- Bewegung erkannt

Diese Alarmereignisse können individuell konfiguriert werden, je nachdem, wie Sie Ihr Alarmsystem einrichten. Es gibt auch die Möglichkeit, Sensoren in Warnzonen oder Alarmzonen zuzuordnen, um unterschiedliche Reaktionen und Benachrichtigungen zu erhalten.","['page_content=\'Question: Wie funktioniert das Alarmsystem bei Magenta SmartHome?\nAnswer: Was ist ein Alarm und wie wird er ausgelöst?Alarme sind alle Ereignisse, die an Rauch- und Wassermeldern, Tür-, Fensterkontakten und Bewegungsmeldern festgestellt werden.Die App unterscheidet dabei zwischen Einbruch- und Gefahren-Alarmen (Rauch, Wasser), die individuell eingerichtet werden können.Erkennt das Alarmsystem ein solches Ereignis, erhalten Sie zwei Nachrichten. Die erste Benachrichtigung erfolgt als Information, sobald Ihr Smart Home einen Alarm erkennt:\nDanach folgt eine Alarmmeldung, wenn zu Hause tatsächlich ein Alarmsignal ausgelöst wird. Das Alarmsignal kann optisch per Licht und/oder akustisch per Sirene konfiguriert werden.Sie haben jetzt die Möglichkeit, nach der ersten Push-Nachricht über den dargestellten Button ""Ausschalten"" die Auslösung eines aktiven Alarmsignals zu verhindern. Dadurch wird jedoch nur der aktive Alarm mit Alarmsignal verhindert, das Alarmsystem selbst bleibt weiterhin scharf geschaltet.\nWird der Button ""Ausschalten"" oder ""Details"" nicht betätigt, wird ein aktiver Alarm ausgelöst. Details zeigen im Nachrichtenbereich weitere Informationen an. Gleichzeitig werden mit dem Alarmsystem verbundene Dimmer, Leuchten und Sirenen eingeschaltet. Die Sirenen bleiben für eine Minute eingeschaltet, die Dimmer und Lampen leuchten 60 Minuten weiter. Das System verbleibt in einem alarmfähigen Zustand, d. h. es ist in der Lage, neue Alarmereignisse zu erkennen und zu signalisieren.\nDas Alarmsystem aktivieren und deaktivierenDas Alarmsystem wird automatisch aktiviert, wenn Sie Ihren Anwesenheitsstatus auf ""Abwesend"" wechseln. Daneben können Sie es auch über eine zugeordnete Funk-Fernbedienung, einen Wandtaster oder über das Menü ""Alarmsystem"" aktivieren und deaktivieren. Gefahren-Alarme sind jederzeit aktiv und müssen nicht scharf geschaltet werden.\nDringlichkeitsstufen für Ihr ZuhauseSie können unterschiedliche Dringlichkeitsstufen für Ihr Alarmsystem bestimmen, je nachdem ob Sie zu Hause sind und Ihr Alarmsystem aktiv schalten, oder ob Sie es aktivieren, wenn Sie Ihr Magenta SmartHome auf ""Abwesend"" stellen.Push-Nachrichten informieren Sie in jedem Fall über das erkannte Alarmereignis, egal welche Dringlichkeitsstufe Sie festgelegt haben.\nWarnzone und Alarmzone festlegenIn Ihrem Alarmsystem wählen Sie aus, welche Sensoren in welchen Ihrer Räume für Sie sicherheitsrelevant sind und somit als Alarmmelder arbeiten sollen.Sie ordnen darüber hinaus Ihre Räume entweder einer Warnzone oder einer Alarmzone zu und legen damit fest, auf welche Art Sie von den Alarmereignissen benachrichtigt werden wollen und wie das Magenta SmartHome System reagieren soll.\nSo können Sie zum Beispiel entscheiden, dass Sie bei einer Bewegung draußen in Ihrem Garten eine Warnmeldung erhalten und Lampen eingeschaltet werden, wohingegen ein geöffnetes Wohnzimmerfenster zusätzlich eine Aktivierung der Sirenen und Kameras auslöst und zudem eine SMS-Nachricht an Ihren Nachbarn versendet wird.\nDie Alarmmelder\nHinweis:Interne Bewegungsmelder von Kameras haben teilweise eine so hohe Sensitivität, dass Alarme bereits bei Lichtreflexionen ausgelöst werden können.Um Fehlalarme zu vermeiden, empfehlen wir, die Funktionsweise Ihrer Kamera mit Bewegungsmelder erst zu testen und ggf. aus dem Alarmsystem auszuschließen.\nDie Aktivierungsverzögerung einstellenZur Konfiguration des Alarmsystems können Sie die Zeitspanne zwischen ""Aktivieren des Alarmsystems"" und ""Aktivieren des Alarmmelders"" von 0 bis 180 Sekunden festlegen. In dieser Zeit können Sie sich noch in Ihrem Haus bewegen oder Türen und Fenster öffnen oder schließen, ohne dass ein Alarm erzeugt wird. Ist die von Ihnen eingestellte Verzögerungszeit für Ihr Alarmsystem vergangen, ist es für die Erkennung von Alarmereignissen scharfgeschaltet.\nRufnummern für Benachrichtigungen eingebenAlles zum Thema ""SMS im Alarmfall"" haben wir in einem gesonderten Ratgeber für Sie zusammengestellt.\n• Wassereinbruch\n• Rauch erkannt\n• Bei ""Abwesend"": Tür oder Fenster geöffnet, Bewegung erkannt\n• Die Alarmmelder wählen Sie für die Warnzone und Alarmzone separat aus. Innen- und Außensirenen sind dabei der Alarmzone vorbehalten.\n• Es kann jede über einen Zwischenstecker angeschlossene dimmbare Leuchte oder jede smarte LED-Lampe eingeschaltet werden.\n• Smarte Lautsprecher wie z. B. von SONOS spielen im Alarmfall einen Alarmton, bei Ereignissen in der Warnzone einen ausgewählten Sound wie z. B. Hundegebell.\n• Sofern Sie Kameras ausgewählt haben, starten diese für jedes Alarmereignis drei Aufzeichnungen von jeweils einer Minute, die in der MagentaCLOUD abgespeichert und von dort abgespielt werden können.\'', 'page_content=\'Question: Wie funktioniert das Alarmsystem bei Magenta SmartHome?\nAnswer: Was ist ein Alarm und wie wird er ausgelöst?Alarme sind alle Ereignisse, die an Rauch- und Wassermeldern, Tür-, Fensterkontakten und Bewegungsmeldern festgestellt werden.Die App unterscheidet dabei zwischen Einbruch- und Gefahren-Alarmen (Rauch, Wasser), die individuell eingerichtet werden können.Erkennt das Alarmsystem ein solches Ereignis, erhalten Sie zwei Nachrichten. Die erste Benachrichtigung erfolgt als Information, sobald Ihr Smart Home einen Alarm erkennt:\nDanach folgt eine Alarmmeldung, wenn zu Hause tatsächlich ein Alarmsignal ausgelöst wird. Das Alarmsignal kann optisch per Licht und/oder akustisch per Sirene konfiguriert werden.Sie haben jetzt die Möglichkeit, nach der ersten Push-Nachricht über den dargestellten Button ""Ausschalten"" die Auslösung eines aktiven Alarmsignals zu verhindern. Dadurch wird jedoch nur der aktive Alarm mit Alarmsignal verhindert, das Alarmsystem selbst bleibt weiterhin scharf geschaltet.\nWird der Button ""Ausschalten"" oder ""Details"" nicht betätigt, wird ein aktiver Alarm ausgelöst. Details zeigen im Nachrichtenbereich weitere Informationen an. Gleichzeitig werden mit dem Alarmsystem verbundene Dimmer, Leuchten und Sirenen eingeschaltet. Die Sirenen bleiben für eine Minute eingeschaltet, die Dimmer und Lampen leuchten 60 Minuten weiter. Das System verbleibt in einem alarmfähigen Zustand, d. h. es ist in der Lage, neue Alarmereignisse zu erkennen und zu signalisieren.\nDas Alarmsystem aktivieren und deaktivierenDas Alarmsystem wird automatisch aktiviert, wenn Sie Ihren Anwesenheitsstatus auf ""Abwesend"" wechseln. Daneben können Sie es auch über eine zugeordnete Funk-Fernbedienung, einen Wandtaster oder über das Menü ""Alarmsystem"" aktivieren und deaktivieren. Gefahren-Alarme sind jederzeit aktiv und müssen nicht scharf geschaltet werden.\nDringlichkeitsstufen für Ihr ZuhauseSie können unterschiedliche Dringlichkeitsstufen für Ihr Alarmsystem bestimmen, je nachdem ob Sie zu Hause sind und Ihr Alarmsystem aktiv schalten, oder ob Sie es aktivieren, wenn Sie Ihr Magenta SmartHome auf ""Abwesend"" stellen.Push-Nachrichten informieren Sie in jedem Fall über das erkannte Alarmereignis, egal welche Dringlichkeitsstufe Sie festgelegt haben.\nWarnzone und Alarmzone festlegenIn Ihrem Alarmsystem wählen Sie aus, welche Sensoren in welchen Ihrer Räume für Sie sicherheitsrelevant sind und somit als Alarmmelder arbeiten sollen.Sie ordnen darüber hinaus Ihre Räume entweder einer Warnzone oder einer Alarmzone zu und legen damit fest, auf welche Art Sie von den Alarmereignissen benachrichtigt werden wollen und wie das Magenta SmartHome System reagieren soll.\nSo können Sie zum Beispiel entscheiden, dass Sie bei einer Bewegung draußen in Ihrem Garten eine Warnmeldung erhalten und Lampen eingeschaltet werden, wohingegen ein geöffnetes Wohnzimmerfenster zusätzlich eine Aktivierung der Sirenen und Kameras auslöst und zudem eine SMS-Nachricht an Ihren Nachbarn versendet wird.\nDie Alarmmelder\nHinweis:Interne Bewegungsmelder von Kameras haben teilweise eine so hohe Sensitivität, dass Alarme bereits bei Lichtreflexionen ausgelöst werden können.Um Fehlalarme zu vermeiden, empfehlen wir, die Funktionsweise Ihrer Kamera mit Bewegungsmelder erst zu testen und ggf. aus dem Alarmsystem auszuschließen.\nDie Aktivierungsverzögerung einstellenZur Konfiguration des Alarmsystems können Sie die Zeitspanne zwischen ""Aktivieren des Alarmsystems"" und ""Aktivieren des Alarmmelders"" von 0 bis 180 Sekunden festlegen. In dieser Zeit können Sie sich noch in Ihrem Haus bewegen oder Türen und Fenster öffnen oder schließen, ohne dass ein Alarm erzeugt wird. Ist die von Ihnen eingestellte Verzögerungszeit für Ihr Alarmsystem vergangen, ist es für die Erkennung von Alarmereignissen scharfgeschaltet.\nRufnummern für Benachrichtigungen eingebenAlles zum Thema ""SMS im Alarmfall"" haben wir in einem gesonderten Ratgeber für Sie zusammengestellt.\n• Wassereinbruch\n• Rauch erkannt\n• Bei ""Abwesend"": Tür oder Fenster geöffnet, Bewegung erkannt\n• Die Alarmmelder wählen Sie für die Warnzone und Alarmzone separat aus. Innen- und Außensirenen sind dabei der Alarmzone vorbehalten.\n• Es kann jede über einen Zwischenstecker angeschlossene dimmbare Leuchte oder jede smarte LED-Lampe eingeschaltet werden.\n• Smarte Lautsprecher wie z. B. von SONOS spielen im Alarmfall einen Alarmton, bei Ereignissen in der Warnzone einen ausgewählten Sound wie z. B. Hundegebell.\n• Sofern Sie Kameras ausgewählt haben, starten diese für jedes Alarmereignis drei Aufzeichnungen von jeweils einer Minute, die in der MagentaCLOUD abgespeichert und von dort abgespielt werden können.\'', 'page_content=\'Question: Wie funktioniert das Alarmsystem bei Magenta SmartHome?\nAnswer: Was ist ein Alarm und wie wird er ausgelöst?Alarme sind alle Ereignisse, die an Rauch- und Wassermeldern, Tür-, Fensterkontakten und Bewegungsmeldern festgestellt werden.Die App unterscheidet dabei zwischen Einbruch- und Gefahren-Alarmen (Rauch, Wasser), die individuell eingerichtet werden können.Erkennt das Alarmsystem ein solches Ereignis, erhalten Sie zwei Nachrichten. Die erste Benachrichtigung erfolgt als Information, sobald Ihr Smart Home einen Alarm erkennt:\nDanach folgt eine Alarmmeldung, wenn zu Hause tatsächlich ein Alarmsignal ausgelöst wird. Das Alarmsignal kann optisch per Licht und/oder akustisch per Sirene konfiguriert werden.Sie haben jetzt die Möglichkeit, nach der ersten Push-Nachricht über den dargestellten Button ""Ausschalten"" die Auslösung eines aktiven Alarmsignals zu verhindern. Dadurch wird jedoch nur der aktive Alarm mit Alarmsignal verhindert, das Alarmsystem selbst bleibt weiterhin scharf geschaltet.\nWird der Button ""Ausschalten"" oder ""Details"" nicht betätigt, wird ein aktiver Alarm ausgelöst. Details zeigen im Nachrichtenbereich weitere Informationen an. Gleichzeitig werden mit dem Alarmsystem verbundene Dimmer, Leuchten und Sirenen eingeschaltet. Die Sirenen bleiben für eine Minute eingeschaltet, die Dimmer und Lampen leuchten 60 Minuten weiter. Das System verbleibt in einem alarmfähigen Zustand, d. h. es ist in der Lage, neue Alarmereignisse zu erkennen und zu signalisieren.\nDas Alarmsystem aktivieren und deaktivierenDas Alarmsystem wird automatisch aktiviert, wenn Sie Ihren Anwesenheitsstatus auf ""Abwesend"" wechseln. Daneben können Sie es auch über eine zugeordnete Funk-Fernbedienung, einen Wandtaster oder über das Menü ""Alarmsystem"" aktivieren und deaktivieren. Gefahren-Alarme sind jederzeit aktiv und müssen nicht scharf geschaltet werden.\nDringlichkeitsstufen für Ihr ZuhauseSie können unterschiedliche Dringlichkeitsstufen für Ihr Alarmsystem bestimmen, je nachdem ob Sie zu Hause sind und Ihr Alarmsystem aktiv schalten, oder ob Sie es aktivieren, wenn Sie Ihr Magenta SmartHome auf ""Abwesend"" stellen.Push-Nachrichten informieren Sie in jedem Fall über das erkannte Alarmereignis, egal welche Dringlichkeitsstufe Sie festgelegt haben.\nWarnzone und Alarmzone festlegenIn Ihrem Alarmsystem wählen Sie aus, welche Sensoren in welchen Ihrer Räume für Sie sicherheitsrelevant sind und somit als Alarmmelder arbeiten sollen.Sie ordnen darüber hinaus Ihre Räume entweder einer Warnzone oder einer Alarmzone zu und legen damit fest, auf welche Art Sie von den Alarmereignissen benachrichtigt werden wollen und wie das Magenta SmartHome System reagieren soll.\nSo können Sie zum Beispiel entscheiden, dass Sie bei einer Bewegung draußen in Ihrem Garten eine Warnmeldung erhalten und Lampen eingeschaltet werden, wohingegen ein geöffnetes Wohnzimmerfenster zusätzlich eine Aktivierung der Sirenen und Kameras auslöst und zudem eine SMS-Nachricht an Ihren Nachbarn versendet wird.\nDie Alarmmelder\nHinweis:Interne Bewegungsmelder von Kameras haben teilweise eine so hohe Sensitivität, dass Alarme bereits bei Lichtreflexionen ausgelöst werden können.Um Fehlalarme zu vermeiden, empfehlen wir, die Funktionsweise Ihrer Kamera mit Bewegungsmelder erst zu testen und ggf. aus dem Alarmsystem auszuschließen.\nDie Aktivierungsverzögerung einstellenZur Konfiguration des Alarmsystems können Sie die Zeitspanne zwischen ""Aktivieren des Alarmsystems"" und ""Aktivieren des Alarmmelders"" von 0 bis 180 Sekunden festlegen. In dieser Zeit können Sie sich noch in Ihrem Haus bewegen oder Türen und Fenster öffnen oder schließen, ohne dass ein Alarm erzeugt wird. Ist die von Ihnen eingestellte Verzögerungszeit für Ihr Alarmsystem vergangen, ist es für die Erkennung von Alarmereignissen scharfgeschaltet.\nRufnummern für Benachrichtigungen eingebenAlles zum Thema ""SMS im Alarmfall"" haben wir in einem gesonderten Ratgeber für Sie zusammengestellt.\n• Wassereinbruch\n• Rauch erkannt\n• Bei ""Abwesend"": Tür oder Fenster geöffnet, Bewegung erkannt\n• Die Alarmmelder wählen Sie für die Warnzone und Alarmzone separat aus. Innen- und Außensirenen sind dabei der Alarmzone vorbehalten.\n• Es kann jede über einen Zwischenstecker angeschlossene dimmbare Leuchte oder jede smarte LED-Lampe eingeschaltet werden.\n• Smarte Lautsprecher wie z. B. von SONOS spielen im Alarmfall einen Alarmton, bei Ereignissen in der Warnzone einen ausgewählten Sound wie z. B. Hundegebell.\n• Sofern Sie Kameras ausgewählt haben, starten diese für jedes Alarmereignis drei Aufzeichnungen von jeweils einer Minute, die in der MagentaCLOUD abgespeichert und von dort abgespielt werden können.\'', 'page_content=\'Question: Wie funktioniert das Alarmsystem bei Magenta SmartHome?\nAnswer: Was ist ein Alarm und wie wird er ausgelöst?Alarme sind alle Ereignisse, die an Rauch- und Wassermeldern, Tür-, Fensterkontakten und Bewegungsmeldern festgestellt werden.Die App unterscheidet dabei zwischen Einbruch- und Gefahren-Alarmen (Rauch, Wasser), die individuell eingerichtet werden können.Erkennt das Alarmsystem ein solches Ereignis, erhalten Sie zwei Nachrichten. Die erste Benachrichtigung erfolgt als Information, sobald Ihr Smart Home einen Alarm erkennt:\nDanach folgt eine Alarmmeldung, wenn zu Hause tatsächlich ein Alarmsignal ausgelöst wird. Das Alarmsignal kann optisch per Licht und/oder akustisch per Sirene konfiguriert werden.Sie haben jetzt die Möglichkeit, nach der ersten Push-Nachricht über den dargestellten Button ""Ausschalten"" die Auslösung eines aktiven Alarmsignals zu verhindern. Dadurch wird jedoch nur der aktive Alarm mit Alarmsignal verhindert, das Alarmsystem selbst bleibt weiterhin scharf geschaltet.\nWird der Button ""Ausschalten"" oder ""Details"" nicht betätigt, wird ein aktiver Alarm ausgelöst. Details zeigen im Nachrichtenbereich weitere Informationen an. Gleichzeitig werden mit dem Alarmsystem verbundene Dimmer, Leuchten und Sirenen eingeschaltet. Die Sirenen bleiben für eine Minute eingeschaltet, die Dimmer und Lampen leuchten 60 Minuten weiter. Das System verbleibt in einem alarmfähigen Zustand, d. h. es ist in der Lage, neue Alarmereignisse zu erkennen und zu signalisieren.\nDas Alarmsystem aktivieren und deaktivierenDas Alarmsystem wird automatisch aktiviert, wenn Sie Ihren Anwesenheitsstatus auf ""Abwesend"" wechseln. Daneben können Sie es auch über eine zugeordnete Funk-Fernbedienung, einen Wandtaster oder über das Menü ""Alarmsystem"" aktivieren und deaktivieren. Gefahren-Alarme sind jederzeit aktiv und müssen nicht scharf geschaltet werden.\nDringlichkeitsstufen für Ihr ZuhauseSie können unterschiedliche Dringlichkeitsstufen für Ihr Alarmsystem bestimmen, je nachdem ob Sie zu Hause sind und Ihr Alarmsystem aktiv schalten, oder ob Sie es aktivieren, wenn Sie Ihr Magenta SmartHome auf ""Abwesend"" stellen.Push-Nachrichten informieren Sie in jedem Fall über das erkannte Alarmereignis, egal welche Dringlichkeitsstufe Sie festgelegt haben.\nWarnzone und Alarmzone festlegenIn Ihrem Alarmsystem wählen Sie aus, welche Sensoren in welchen Ihrer Räume für Sie sicherheitsrelevant sind und somit als Alarmmelder arbeiten sollen.Sie ordnen darüber hinaus Ihre Räume entweder einer Warnzone oder einer Alarmzone zu und legen damit fest, auf welche Art Sie von den Alarmereignissen benachrichtigt werden wollen und wie das Magenta SmartHome System reagieren soll.\nSo können Sie zum Beispiel entscheiden, dass Sie bei einer Bewegung draußen in Ihrem Garten eine Warnmeldung erhalten und Lampen eingeschaltet werden, wohingegen ein geöffnetes Wohnzimmerfenster zusätzlich eine Aktivierung der Sirenen und Kameras auslöst und zudem eine SMS-Nachricht an Ihren Nachbarn versendet wird.\nDie Alarmmelder\nHinweis:Interne Bewegungsmelder von Kameras haben teilweise eine so hohe Sensitivität, dass Alarme bereits bei Lichtreflexionen ausgelöst werden können.Um Fehlalarme zu vermeiden, empfehlen wir, die Funktionsweise Ihrer Kamera mit Bewegungsmelder erst zu testen und ggf. aus dem Alarmsystem auszuschließen.\nDie Aktivierungsverzögerung einstellenZur Konfiguration des Alarmsystems können Sie die Zeitspanne zwischen ""Aktivieren des Alarmsystems"" und ""Aktivieren des Alarmmelders"" von 0 bis 180 Sekunden festlegen. In dieser Zeit können Sie sich noch in Ihrem Haus bewegen oder Türen und Fenster öffnen oder schließen, ohne dass ein Alarm erzeugt wird. Ist die von Ihnen eingestellte Verzögerungszeit für Ihr Alarmsystem vergangen, ist es für die Erkennung von Alarmereignissen scharfgeschaltet.\nRufnummern für Benachrichtigungen eingebenAlles zum Thema ""SMS im Alarmfall"" haben wir in einem gesonderten Ratgeber für Sie zusammengestellt.\n• Wassereinbruch\n• Rauch erkannt\n• Bei ""Abwesend"": Tür oder Fenster geöffnet, Bewegung erkannt\n• Die Alarmmelder wählen Sie für die Warnzone und Alarmzone separat aus. Innen- und Außensirenen sind dabei der Alarmzone vorbehalten.\n• Es kann jede über einen Zwischenstecker angeschlossene dimmbare Leuchte oder jede smarte LED-Lampe eingeschaltet werden.\n• Smarte Lautsprecher wie z. B. von SONOS spielen im Alarmfall einen Alarmton, bei Ereignissen in der Warnzone einen ausgewählten Sound wie z. B. Hundegebell.\n• Sofern Sie Kameras ausgewählt haben, starten diese für jedes Alarmereignis drei Aufzeichnungen von jeweils einer Minute, die in der MagentaCLOUD abgespeichert und von dort abgespielt werden können.\'']","Die verschiedenen Alarmereignisse, die in einem Alarmsystem erkannt werden können, sind: Wassereinbruch, Rauch erkannt, bei ""Abwesend"": Tür oder Fenster geöffnet, Bewegung erkannt.",4560,0.0007303499999999999,103,4,55.18427109718323,0.9816818463953337,0.999999999975,1.0,1.0,0.21918056094115815,0.6024096385542169
What sind die Vorteile einer Allnet-Flat in Prepaid-Tarifen?,"Die Vorteile einer Allnet-Flat in Prepaid-Tarifen sind vielfältig. Mit einer Allnet-Flat können Sie unbegrenzt in alle deutschen Netze telefonieren und SMS versenden, ohne sich um zusätzliche Kosten sorgen zu müssen. Dies ist besonders praktisch, wenn Sie häufig telefonieren oder Nachrichten senden. Zudem haben Sie die Flexibilität, jeden Monat Ihren Tarif neu zu wählen und anzupassen, je nach Ihren individuellen Bedürfnissen und Nutzungsgewohnheiten. Dadurch können Sie sicherstellen, dass Sie genau die Leistungen erhalten, die Sie benötigen, ohne langfristige Vertragsbindungen.","[""page_content='oder Anrufe tätigen kann. Mit unseren Prepaid-Tarifen mit unterschiedlichen Tarif-Konditionen erhalten Sie genau die Leistungen, die Sie benötigen. Möchten Sie eineAllnet-Flat, eine HotSpot-Flat oder ein hohes Datenvolumen? Sie entscheiden jeden Monat neu, welche Dienste Sie benötigen und wählen Ihren entsprechenden Tarif.'"", ""page_content='Question: Wann lohnt sich ein Prepaid-Tarif?'"", ""page_content='Answer: Das ist von Ihren individuellen Nutzungsgewohnheiten abhängig. Wenn Sie das mobile Internet nur wenig nutzen, ist unser MagentaMobil Prepaid S die richtige Wahl für Sie. Vielsurfer sollten sich hingegen für einen Prepaid-Tarif mit hohem inklusiven Highspeed-Volumen wie beispielsweise den MagentaMobil Prepaid Max mit unbegrenztem Datenvolumen entscheiden. Für Vieltelefonierer bieten sich unsere Tarife mitAllnet Flatab MagentaMobil Prepaid M an.'"", ""page_content='Question: Welcher Prepaid-Tarif passt zu mir?'""]",Die Antwort auf die gegebene Frage ist im Kontext nicht vorhanden.,485,0.00012585,118,4,19.869307041168213,0.9329084133738604,0.0,1.0,0.25,0.0030596043365166605,0.058823529411764705
How to switch from Young Tarif to MagentaMobil?,"Um von einem Young Tarif zu einem regulären MagentaMobil Tarif zu wechseln, können Sie dies jederzeit tun. Nachdem Sie den Wechsel durchgeführt haben, haben Sie auch die Möglichkeit, PlusKarten dazu zu buchen. Für weitere Informationen und eine detaillierte Anleitung besuchen Sie bitte [www.telekom.de/hilfe](https://www.telekom.de/hilfe).","[""page_content='Source URL: https://www.telekom.de/hilfe/mobilfunk/tarife-optionen/zusatzkarten/plus-karte-young-vertrag\n\nQuestion: Kann ich eine PlusKarte auch zu einem Young Vertrag dazu buchen?\nAnswer: Nein, das ist nicht möglich. Sie können aber jederzeit von einem Young Tarif in einen regulären MagentaMobil Tarif wechseln und dann auch PlusKarten dazu buchen.'"", ""page_content='Source URL: https://www.telekom.de/hilfe/mobilfunk/tarife-optionen/zusatzkarten/plus-karte-young-vertrag\n\nQuestion: Kann ich eine PlusKarte auch zu einem Young Vertrag dazu buchen?\nAnswer: Nein, das ist nicht möglich. Sie können aber jederzeit von einem Young Tarif in einen regulären MagentaMobil Tarif wechseln und dann auch PlusKarten dazu buchen.'"", ""page_content='Source URL: https://www.telekom.de/hilfe/mobilfunk/tarife-optionen/prepaid-tarife/wechsel-laufzeitvertrag\n\nQuestion: Wie kann ich meinen Prepaid-Vertrag in einen Laufzeitvertrag ändern?\nAnswer: Um Ihren Prepaid-Vertrag in einen MagentaMobil Laufzeitvertrag ändern zu können, benötigen wir detaillierte Angaben von Ihnen. Dazu laden Sie sich bitte das Auftragsdokument herunter und schicken es ausgefüllt als Anlage über unser Kontaktformular an uns.'"", ""page_content='Source URL: https://www.telekom.de/hilfe/mobilfunk/tarife-optionen/prepaid-tarife/wechsel-laufzeitvertrag\n\nQuestion: Wie kann ich meinen Prepaid-Vertrag in einen Laufzeitvertrag ändern?\nAnswer: Um Ihren Prepaid-Vertrag in einen MagentaMobil Laufzeitvertrag ändern zu können, benötigen wir detaillierte Angaben von Ihnen. Dazu laden Sie sich bitte das Auftragsdokument herunter und schicken es ausgefüllt als Anlage über unser Kontaktformular an uns.'""]",The answer to given question is not present in context,613,0.00012345,70,4,15.966475009918213,0.9395715619939861,0.4166666666458333,0.0,0.6666666666666666,0,0.0
Welche Quelle informiert die Deutschen am Warntag?,"Es tut mir leid, aber ich kann Ihnen bei dieser Anfrage nicht helfen. Für weitere Informationen empfehle ich, die Webseite www.telekom.de/hilfe zu besuchen.","[""page_content='Source URL: https://telekomhilft.telekom.de/t5/TV/Welchen-Magenta-TV-Tarif/td-p/6954618/jump-to/first-unread-message\nSubject: Welchen Magenta TV Tarif?'"", ""page_content='Source URL: https://telekomhilft.telekom.de/t5/TV/Welchen-Magenta-TV-Tarif/td-p/6954618/jump-to/first-unread-message\nSubject: Welchen Magenta TV Tarif?'"", ""page_content='Source URL: https://telekomhilft.telekom.de/t5/TV/Welchen-Magenta-TV-Tarif/td-p/6954618/jump-to/first-unread-message\nSubject: Welchen Magenta TV Tarif?'"", ""page_content='Source URL: https://telekomhilft.telekom.de/t5/TV/Sachsen-Fernsehen-in-Magenta-TV-nicht-verfuegbar/td-p/6954982/jump-to/first-unread-message\nSubject: Sachsen-Fernsehen in Magenta TV nicht verfügbar\nContent: Hallo,in der Senderliste wird angegeben, dass Sachsen-Fernsehen auf den Kanälen 535, 536, 542 ausgestrahlt wird. Seit dem ich Magenta TV\xa0 Smart 2.0 habe sind diese Sender nicht mehr zu finden.Liegt es an Magenta?'""]","Die Quelle, die die Deutschen am Warntag informiert, ist die Webseite www.warnung-der-bevoelkerung.de.",472,8.565e-05,33,4,16.19210195541382,0.0,0.0,0.0,0.0,0.017514895362802613,0.18604651162790697
"How can I add MagentaCloud to my Telekom plan without a credit card, considering Magenta TV?","Sie können die MagentaCloud zu Ihrem Telekom-Plan hinzufügen, ohne eine Kreditkarte zu benötigen. In der Regel wird die Rechnung für die MagentaCloud direkt über Ihre bestehende Telekom-Rechnung abgebucht. Wenn Sie weitere Informationen oder Unterstützung benötigen, empfehle ich Ihnen, die Webseite www.telekom.de/hilfe zu besuchen. Dort finden Sie detaillierte Anleitungen und Hilfe.","[""page_content='nahe liegend, die Rechnung für die MagentaCloud gleich mit abzubuchen. Oder muss ich mir jetzt eine Kreditkarte anschaffen, um die MagentaCloud buchen zu können?Viele Grüße'"", ""page_content='nahe liegend, die Rechnung für die MagentaCloud gleich mit abzubuchen. Oder muss ich mir jetzt eine Kreditkarte anschaffen, um die MagentaCloud buchen zu können?Viele Grüße'"", ""page_content='nahe liegend, die Rechnung für die MagentaCloud gleich mit abzubuchen. Oder muss ich mir jetzt eine Kreditkarte anschaffen, um die MagentaCloud buchen zu können?Viele Grüße'"", ""page_content='nahe liegend, die Rechnung für die MagentaCloud gleich mit abzubuchen. Oder muss ich mir jetzt eine Kreditkarte anschaffen, um die MagentaCloud buchen zu können?Viele Grüße'""]",The answer to given question is not present in context,412,9.645e-05,77,4,16.8775851726532,0.9113609885910231,0.0,1.0,0.0,0,0.028169014084507043
"What's the max SMS alert limit for mobile numbers during an alarm, and why is the SMS center number important?","Der maximale SMS-Alarm-Limit für Mobilnummern während eines Alarms kann je nach Dienst oder Vertrag variieren. Es ist wichtig, dies direkt bei Telekom zu überprüfen oder in den spezifischen Vertragsbedingungen nachzulesen.

Die SMS-Zentralnummer ist wichtig, da sie die Telefonnummer ist, über die SMS-Nachrichten gesendet und empfangen werden. Eine korrekte Einstellung dieser Nummer stellt sicher, dass Ihre Nachrichten zuverlässig zugestellt werden. 

Für genauere Informationen empfehle ich Ihnen, die Telekom-Hilfeseite unter www.telekom.de/hilfe zu besuchen.","[""page_content='Answer:'"", ""page_content='Answer:'"", ""page_content='Answer:'"", ""page_content='Answer:'""]","The maximum SMS alert limit for mobile numbers during an alarm is 3, as you can specify up to 3 mobile numbers to which an SMS will be sent simultaneously in case of an alarm. The SMS center number is important because it is necessary for the sending of SMS messages, and it is usually automatically entered when a SIM card is activated in a phone.",302,9.839999999999998e-05,118,4,17.713469982147217,0.0,0.0,0.0,0.0,0.0025590065762365363,0.08
"In welchen Sprachen werden Warnmeldungen unterstützt, und welche Sprache wird auf Mobilfunk-Geräten mit deutschen Spracheinstellungen angezeigt?",Die Aussendung der Cell Broadcast-Warnmeldungen erfolgt in Deutsch und Englisch. In der Regel werden auf Mobilfunk-Geräten mit deutschen Spracheinstellungen nur Warnmeldungen auf Deutsch angezeigt.,"[""page_content='Question: In welchen Sprachen werden Warnmeldungen unterstützt?\nAnswer: Die Aussendung der Cell Broadcast-Warnmeldungen erfolgt in Deutsch und Englisch. In der Regel werden\xa0auf Mobilfunk-Geräten mit deutschen Spracheinstellungen nur Warnmeldungen auf\xa0Deutsch angezeigt.'"", ""page_content='Question: In welchen Sprachen werden Warnmeldungen unterstützt?\nAnswer: Die Aussendung der Cell Broadcast-Warnmeldungen erfolgt in Deutsch und Englisch. In der Regel werden\xa0auf Mobilfunk-Geräten mit deutschen Spracheinstellungen nur Warnmeldungen auf\xa0Deutsch angezeigt.'"", ""page_content='Question: In welchen Sprachen werden Warnmeldungen unterstützt?\nAnswer: Die Aussendung der Cell Broadcast-Warnmeldungen erfolgt in Deutsch und Englisch. In der Regel werden\xa0auf Mobilfunk-Geräten mit deutschen Spracheinstellungen nur Warnmeldungen auf\xa0Deutsch angezeigt.'"", ""page_content='Question: In welchen Sprachen werden Warnmeldungen unterstützt?\nAnswer: Die Aussendung der Cell Broadcast-Warnmeldungen erfolgt in Deutsch und Englisch. In der Regel werden\xa0auf Mobilfunk-Geräten mit deutschen Spracheinstellungen nur Warnmeldungen auf\xa0Deutsch angezeigt.'""]",Warnmeldungen werden in Deutsch und Englisch unterstützt. Auf Mobilfunk-Geräten mit deutschen Spracheinstellungen werden in der Regel nur Warnmeldungen auf Deutsch angezeigt.,440,8.265e-05,37,4,14.782876014709473,0.8469160619351249,0.999999999975,1.0,1.0,0.3207714281451772,0.6666666666666667
