Question,Response,Contexts,Ground Truth,Token Count,Total Cost (USD),Completion Tokens,Number of Retrieved documents,Response time,answer_relevancy,context_precision,context_recall,faithfulness,BleuScore,RougeScore
Welche Geräte können an den Airties-Produkten betrieben werden?,"An den Airties-Produkten können sowohl WLAN-Geräte als auch Geräte über LAN-Kabel betrieben werden. Jede Airties-Box verfügt über zwei LAN-Ports, die Geschwindigkeiten von bis zu 1 GBit/s unterstützen. So können Sie eine Vielzahl von Geräten integrieren, nicht nur WLAN-Geräte. Wenn Sie weitere Informationen benötigen, besuchen Sie bitte www.telekom.de/hilfe.","[""page_content='Source URL: https://www.telekom.de/hilfe/geraete-zubehoer/heimnetzwerk-powerline-wlan/airties/wlan-geraete-an-airties-betreiben\n\nQuestion: Kann ich nur WLAN-Geräte an den Airties-Produkten betreiben? Answer: Nein. Jede Airties-Box hat zwei LAN-Ports, die eine Geschwindigkeit bis 1 GBit/s unterstützen. Über diese Ports können Sie alle möglichen Geräte auch über ein LAN-Kabel einbinden. Richten Sie z.'"", 'page_content=\'a\xa0App– das macht die Einrichtung besonders einfach.\nAußerdem unterstützt Speed Home WiFi die Funktion ""Seamless Handover"". Das bedeutet, dass Ihre Geräte wie z. B. Smartphones, Tablets und Laptops nahtlos von Mesh-Gerät zu Mesh-Gerät weitergereicht werden, damit Sie in den Genuss einer optimalen und störungsfreien Verbindungsqualität kommen.\'', ""page_content='Source URL: https://www.telekom.de/hilfe/apps-dienste/apps/voicemail-app/parallelnutzung\n\nQuestion: Kann ich die App mit mehreren Smartphones und Tablets gleichzeitig nutzen?\nAnswer: Ja, Sie können die App mit bis zu neun Geräten gleichzeitig nutzen.\nAktivieren Sie die Voicemail darüber hinaus auf einem weiteren Gerät, wird die App auf dem ersten Gerät deaktiviert. Für Apps, bei der nur Mobilbox Pro für den Mobilfunk-Anschluss eingerichtet ist, können Sie die App beliebig oft installieren.'"", ""page_content='n live mit Bild und Ton zur Seite.\n\nQuestion: Warum sollten Sie MagentaService Live nutzen?\nAnswer: • Wir zeigen MagentaTV, statt\xa0es nur zu beschreiben\n• Wir stellen Geräte vor: wie sie aussehen und wie sie funktionieren\n• Wir zeigen Ihnen die Möglichkeiten der Heimvernetzung und wie einfach die Einrichtung sein kann\n• Wir zeigen Ihnen, wie SmartHome bei Ihnen funktionieren kann\n\nQuestion: Was kann MagentaService Live alles?\nAnswer: Ein neues Smartphone oder ein Smartes Home? Aber Sie sind sich'"", ""page_content='40 finden seither dieSSIDnicht und können somit nicht mit dem WLANverbunden werden.In der Verschlüsselung habe ich dem Frequenzband 2,4 GHZ\xa0 (Übertragungsmodus 802.11b/g/n) einen anderen Namen zugeteilt, als\xa0 für 5 GHZ.Drucker und Kamera sind nur für 2,4 GHZ ausgerichtet. Trotzdem erscheint\xa0 in den Netzwerkeinstellungen keine passendeSSID.Auch die VerbindungsanwendungWPSzwischen Router\xa0 und Drucker funktioniert nicht - keine Netzwerkverbindung.Beide Geräte stehen maximal 3 m auseinander.Ich brau'""]",Die Antwort auf die gegebene Frage ist nicht im Kontext vorhanden,794,0.00015465,79,5,52.44126892089844,0.9933867809698921,0.0,1.0,0.8571428571428571,0.004649189828106597,0.05194805194805195
Wie beeinflusst der Leitungsausbau die Verfügbarkeit von DSL-/VDSL-Tarifen an meinem Wohnort?,"Der Leitungsausbau beeinflusst die Verfügbarkeit von DSL-/VDSL-Tarifen an Ihrem Wohnort erheblich. Welche Tarife für Sie infrage kommen, hängt vom aktuellen Stand des Leitungsnetzes in Ihrer Region ab. In Gebieten, in denen der Ausbau vorangetrieben wurde, stehen in der Regel höhere Internetgeschwindigkeiten zur Verfügung. Daher ist es wichtig, einen Verfügbarkeitscheck durchzuführen, um herauszufinden, welche DSL- oder VDSL-Optionen Ihnen zur Verfügung stehen. Sie können dies ganz einfach auf der Telekom-Website tun, indem Sie Ihre Adresse eingeben und die verfügbaren Tarife prüfen.","[""page_content='Bei dieser Frage hilft Ihnen ein LTE- und VDSL/DSL-Verfügbarkeitscheck weiter. So sehen Sie mit einem Klick, welche Optionen Ihnen für Ihren Wohnort offenstehen. AlsInternetanbietertreiben wir den Ausbau unseres Netzes stetig voran, weshalb wir in immer mehr Regionen hohe Internet-Geschwindigkeiten ermöglichen können. Machen Sie jetzt für Ihre Adresse bei der Telekom den Check, indem Sie die DSL/VDSL- und LTE-Verfügbarkeit prüfen. Anschließend können Sie aus passenden Angeboten für Ihren Wohnort auswählen. Question: Wie prüfe ich die DSL-Verfügbarkeit für meinen Wohnsitz? Answer: Mit unserer Verfügbarkeitsprüfung erfahren Sie schnell und einfach, welcher DSL-Tarif mit welcher Bandbreite für Sie infrage kommt. Geben Sie dazu einfach Ihre Adresse in die entsprechenden Felder ein und wir zeigen Ihnen, welche DSL-Geschwindigkeiten bei Ihnen möglich sind. Question: Warum muss ich die DSL-Verfügbarkeit an meinem Wohnort prüfen? Answer: Um herauszufinden, welcherDSL-Tariffür Sie der richtige ist, sollten Sie wissen, welche Down- und Uploadraten bei Ihnen zu Hause möglich sind. Dementsprechend wählen Sie anschließend Ihren Wunsch-Tarif. Question: Warum sind bestimmte DSL-/VDSL-Tarife an meinem Wohnort nicht verfügbar? Answer: Welche Tarife für Sie infrage kommen, hängt immer mit dem Leitungsausbau in Ihrem Wohnort zusammen. Nicht überall sind zum Beispiel Glasfaserleitungen verlegt.'"", ""page_content='herauszufinden, welcherDSL-Tariffür Sie der richtige ist, sollten Sie wissen, welche Down- und Uploadraten bei Ihnen zu Hause möglich sind. Dementsprechend wählen Sie anschließend Ihren Wunsch-Tarif.\n\nQuestion: Warum sind bestimmte DSL-/VDSL-Tarife an meinem Wohnort nicht verfügbar?\nAnswer: Welche Tarife für Sie infrage kommen, hängt immer mit dem Leitungsausbau in Ihrem Wohnort zusammen. Nicht überall sind zum Beispiel Glasfaserleitungen verlegt. Hinzu kommen weitere Faktoren wie die Leitungsl'"", ""page_content='Adresse und können Ihnen somit alle sinnvollen Tarife anzeigen.\n\nQuestion: Wo finde ich eine Karte zur DSL- und LTE-Verfügbarkeit?\nAnswer: Sie möchten auf einen Blick sehen, welche DSL-Geschwindigkeiten in Ihrem Wohnort möglich sind? Wir haben alleInformationen zum Netzausbaufür Sie gesammelt und auf dieser Basis eine Deutschlandkarte angefertigt, die die DSL-Verfügbarkeiten anzeigt. Analog dazu lesen Sie auf dieser Karte zumNetzausbauab, welche Geschwindigkeiten im Mobilfunk bei Ihnen zu Hause'"", ""page_content='rt auswählen.\n\nQuestion: Wie prüfe ich die DSL-Verfügbarkeit für meinen Wohnsitz?\nAnswer: Mit unserer Verfügbarkeitsprüfung erfahren Sie schnell und einfach, welcher DSL-Tarif mit welcher Bandbreite für Sie infrage kommt. Geben Sie dazu einfach Ihre Adresse in die entsprechenden Felder ein und wir zeigen Ihnen, welche DSL-Geschwindigkeiten bei Ihnen möglich sind.\n\nQuestion: Warum muss ich die DSL-Verfügbarkeit an meinem Wohnort prüfen?\nAnswer: Um herauszufinden, welcherDSL-Tariffür Sie der richt'"", ""page_content='SL-Verfügbarkeitscheck weiter. So sehen Sie mit einem Klick, welche Optionen Ihnen für Ihren Wohnort offenstehen.\nAlsInternetanbietertreiben wir den Ausbau unseres Netzes stetig voran, weshalb wir in immer mehr Regionen hohe Internet-Geschwindigkeiten ermöglichen können. Machen Sie jetzt für Ihre Adresse bei der Telekom den Check, indem Sie die DSL/VDSL- und LTE-Verfügbarkeit prüfen. Anschließend können Sie aus passenden Angeboten für Ihren Wohnort auswählen.\n\nQuestion: Wie prüfe ich die DSL-Ver'""]","Der Leitungsausbau beeinflusst die Verfügbarkeit von DSL-/VDSL-Tarifen an Ihrem Wohnort, da die Tarife, die für Sie infrage kommen, immer mit dem Leitungsausbau in Ihrem Wohnort zusammenhängen. Nicht überall sind zum Beispiel Glasfaserleitungen verlegt.",1064,0.00021899999999999998,132,5,57.01852369308472,0.0,0.99999999998,1.0,1.0,0.1353330724554679,0.30303030303030304
What is the function of Timeshift in MagentaTV?,"Timeshift in MagentaTV allows you to watch live TV shows with a time delay. This feature enables you to pause, rewind, and resume live broadcasts, giving you the flexibility to watch your favorite programs at your convenience.","[""page_content='Source URL: https://www.telekom.de/magenta-tv/tarife-und-optionen/magenta-tv-mit-app/zubuchoptionen\n\nQuestion: Du hast Magenta TV noch nicht? Answer: Über 150 TV-Sender in HD, exklusive Serien und Filme bei MagentaTV+. Zeitversetztes Fernsehen durch Timeshift, Restart und Aufnahmefunktion. Auf dem Fernseher, Laptop, Tablet, Smartphone. Auf Smartphone und Tablet downloaden und offline schauen. Unabhängig vom Internetanbieter. Monatlich online kündbar. • Über 150 TV-Sender in HD, exklusive Serien und Filme bei MagentaTV+. • Zeitversetztes Fernsehen durch Timeshift, Restart und Aufnahmefunktion. • Auf dem Fernseher, Laptop, Tablet, Smartphone. • Auf Smartphone und Tablet downloaden und offline schauen. • Unabhängig vom Internetanbieter.'"", ""page_content='e connection at the end of the contract term. Unfortunately, we have no other option.Best regardsTimur\n- @cilouThank you for the conversation earlier.It's a pity that we couldn't come to an agreement. As your current contract can be moved 1:1 to the new address and your friend's contract is with a different provider, there is unfortunately no special right of termination.The only option is for you to move the contract to the new address or to cancel the connection at the end of the contract term'"", ""page_content='sent back. Please help me in terminating my contract the earliest possible.\n\nAccepted Solutions:\n- @cilouThank you for the conversation earlier.It's a pity that we couldn't come to an agreement. As your current contract can be moved 1:1 to the new address and your friend's contract is with a different provider, there is unfortunately no special right of termination.The only option is for you to move the contract to the new address or to cancel the connection at the end of the contract term. Unfo'"", ""page_content='Source URL: https://www.telekom.de/hilfe/technician-appointment-video\n\nQuestion: How can I prepare for the technician’s appointment?\nAnswer: You have an appointment with a Telekom technician on behalf of your telephone company and you don’t know where your telephone service box is? Here we will show you how you can support the technician and arrange the appointment.'"", ""page_content='did the process online and receive an email telling that my contract can't terminate before the july 2026 !I went to a telekom store to ask for help and they did the process again telling me it was possible to termniate the contract within one month .... I received again a confirmation email after my visit telling me my contract will terminate only on july 2026.I am not living in my flat since 3 weeks now; the internet box is packed ready to be sent back. Please help me in terminating my contra'""]",The answer to given question is not present in context,783,0.00013769999999999999,45,5,49.76376008987427,0.9703203785048532,0.9999999999,0.0,0.6666666666666666,0.005959978627465526,0.0851063829787234
Wie können Sie Ihre Firmendaten in der Trassen Defender App ändern?,"Ihre Firmendaten (Firma, Anschrift, Zuständigkeit etc.) können Sie jederzeit in der Trassen Defender App über den Menüpunkt ""Einstellungen"" ändern. Ihre Kontaktdaten (E-Mail-Adresse, Telefonnummer) hingegen können Sie nur durch eine Neuregistrierung ändern.","[""page_content='Source URL: https://telekomhilft.telekom.de/t5/TV/Magenta-tv-app/td-p/6948572/jump-to/first-unread-message\nSubject: Magenta tv app\nContent: Hallo Zusammen,habe seit Jahren einen Vetrag mit Magenta TV . Irrtümlicherweise hat eine Shop-Mitarbeiterin meinen Vetrag umgestellt. Alles wieder zurück gebucht.Jetzt kann ich mich seither aber nicht mehr bei Magenta TV einloggen. (Um z.B. zu Programmieren) \xa0Fehlermeldung in der jeweiligen App (Magenta TV und Magenta TV 1. Gen) die andere für meinen Traif zu nutzen. La'"", 'page_content=\'Source URL: https://www.telekom.de/hilfe/apps-dienste/apps/trassen-defender-app/trassen-defender-app-funktionen/aenderung-daten\n\nQuestion: Wie kann ich meine Kontakt- bzw. Accountdaten in der Trassen Defender App ändern?\nAnswer: Ihre Firmendaten(Firma, Anschrift, Zuständigkeit etc.) ändern Sie jederzeit in der App über den Menüpunkt ""Einstellungen"".\nIhre Kontaktdaten(E-Mail-Adresse, Telefonnummer) hingegen können Sie leider nur über eine Neuregistrierung ändern. In diesem Fall löschen Sie über d\'', 'page_content=\'choptionen hinzufügen"" gelangen Sie zur Übersicht der Zubuchoptionen. Wählen Sie dort Ihre Option aus und folgen Sie den weiteren Schritten.Hinweis: ""Travel Mobil World"" wählen Sie durch Klick auf ""Travel Mobil"".\nMeinMagenta AppKlicken Sie in derMeinMagenta Appauf den Mobilfunk-Vertrag, dann auf ""Optionen"" und auf ""Optionen buchen"". Wählen Sie die Option aus und folgen Sie den weiteren Schritten.\'', ""page_content='n imKundencenteran und folgen Sie den weiteren Schritten:\nMeinMagenta AppMelden Sie sich per Telekom Login in derMeinMagenta Appan und folgen Sie den weiteren Schritten:\nKontaktformularMöchten Sie die Änderung nicht selbst durchführen, melden Sie sich perKontaktformularbei uns.\nHinweis: Um Ihre Daten zu schützen, muss die neue E-Mail-Adresse verifiziert werden. In unserem Ratgeber zeigen wir Ihnen, wie dieVerifikation Ihrer E-Mail-Adressefunktioniert.\n• Zur KontaktaufnahmeMein Profil > Kontaktda'"", ""page_content='Source URL: https://www.telekom.de/hilfe/apps-dienste/apps/trassen-defender-app/trassen-defender-app-allgemeines/welche-art-von-stoerungen-kann-ich-melden\n\nQuestion: Welche Art von Störungen bzw. Beschädigungen kann ich über die Trassen Defender App melden?\nAnswer: Die App ist ausschließlich für die Meldung von unter- und oberirdischen Kabelbeschädigungen geeignet.\nDie Meldung von Beschädigungen an Endverteilern oder Multifunktionsgehäusen ist nicht möglich.'""]","Ihre Firmendaten (Firma, Anschrift, Zuständigkeit etc.) ändern Sie jederzeit in der App über den Menüpunkt ""Einstellungen"".",828,0.0001503,58,5,52.01655292510986,0.9171422034137615,0.499999999975,1.0,1.0,0.3005283407585901,0.6181818181818182
What sind die Schritte im Anmeldevorgang für schnurlose Geräte am Speedport?,"Um schnurlose (DECT) Geräte am Speedport anzumelden, gehen Sie bitte wie folgt vor:

1. Schauen Sie in der Bedienungsanleitung Ihres DECT-Telefons nach, um den Anmeldevorgang zu starten.
2. Sobald Sie den Anmeldevorgang Ihres Telefons aktiviert haben, drücken Sie die Taste „Anmelden“ auf Ihrem Speedport-Router.

Falls Ihr Speedport-Router keine Anmelden-Taste hat, können Sie alternativ Ihr DECT-Gerät folgendermaßen anmelden:
- Wählen Sie im Menü des Speedphones „Einstellungen > Einstellungen Router > Anmeldung“.

Nach der Anmeldung können Sie im Konfigurationsmenü Ihres Speedport im Bereich „Telefone“ dem angemeldeten Gerät Rufnummern zuordnen. 

Für weitere Informationen können Sie auch die Webseite www.telekom.de/hilfe besuchen.","['page_content=\'Source URL: https://www.telekom.de/hilfe/werksreset-speedport/werksreset-faq/schnurlose-geraete-anmelden\n\nQuestion: Wie melde ich schnurlose (DECT) Geräte am Speedport an? Answer: Um ein DECT-Telefon an Ihrem Speedport anzumelden, schauen Sie bitte in der Bedienungsanleitung des Telefons nach. Nachdem Sie den Anmeldevorgang Ihres Telefons gestartet haben, drücken Sie die Taste „Anmelden“ auf Ihrem Speedport-Router.Ihr Speedport-Router hat keine Anmelden-Taste?Zur alternativen Anmeldung Ihres DECT-Geräts. Anmeldung eines SpeedphonesWählen Sie im Menü des Speedphones bitte ""Einstellungen > Einstellungen Router > Anmeldung"". Hinweis:\xa0Im Konfigurationsmenü Ihres Speedport können Sie im Bereich ""Telefone"" dem angemeldeten Gerät anschließend Rufnummern zuordnen.\'', 'page_content=\'Source URL: https://www.telekom.de/hilfe/werksreset-speedport/werksreset-faq/geraete-per-wlan-verbinden\n\nQuestion: Wie verbinde ich meine Geräte nach dem Werksreset über WLAN neu?\nAnswer: Nach dem Zurücksetzen können Sie Ihre Smartphones, Tablets und Computer verbinden.\nPer WLAN: Den WLAN-Namen und das -Passwort bzw. -Schlüssel finden Sie im Routerpass auf der Unterseite des Speedport Routers.\nSo überprüfen Sie, ob WLAN am Router eingeschaltet ist: Falls nur Status “grün"" leuchtet, wecken Sie zu\'', ""page_content='ist.\n• ErreichbarkeitUnsere technische Fachkraft kontaktiert Sie unter der von Ihnen angegebenen Rückrufnummer. Halten Sie daher Ihr Telefon/Smartphone griffbereit, damit wir Sie erreichen können.\n• Klingelschild und HausnummerAchten Sie darauf, dass das Klingelschild mit Ihrem Namen beschriftet und die Hausnummer gut sichtbar ist, damit unsere technische Fachkraft Sie finden kann.\n• Zugang zu Ihren Räumen und dem HausanschlussraumUnsere technische Fachkraft benötigt den Zugang zu Ihrer Telefon'"", ""page_content='and.\n\nQuestion: Welche Netze kann ich mit der Samsung Galaxy Watch nutzen?\nAnswer: Die Samsung Galaxy Watch können Sie im LTE- und UMTS-Netz nutzen. Die Uhr verbindet sich immer automatisch mit dem Mobilfunknetz, wenn keine Bluetooth- oder WLAN Verbindung mit dem Smartphone möglich ist.\n\nQuestion: Kann ich die Samsung Galaxy Watch genauso nutzen wie mein Smartphone?\nAnswer: Die Funktionen der Samsung Galaxy Watch sind abhängig von den für die Smartwatch verfügbaren und installierten Apps und der'"", ""page_content='Übersicht sehen Sie, ob und welche Option bei Ihrem Vertrag inklusive oder gebucht ist.'""]","Um ein DECT-Telefon an Ihrem Speedport anzumelden, schauen Sie bitte in der Bedienungsanleitung des Telefons nach. Nachdem Sie den Anmeldevorgang Ihres Telefons gestartet haben, drücken Sie die Taste „Anmelden“ auf Ihrem Speedport-Router.",901,0.00021434999999999998,176,5,61.24068784713745,0.8558283624195976,0.9999999999,1.0,0.8,0.14047822663335,0.3673469387755102
Which option avoids extra data fees for Prepaid-SIMs outside the EU?,"Um außerhalb der EU keine zusätzlichen Datengebühren für Prepaid-SIM-Karten zu vermeiden, können Sie die Travel & Surf-Pässe von Telekom nutzen. Diese Option ermöglicht es Ihnen, ungewollte Kosten durch Datenaustausch zu vermeiden und kann einfach per SMS oder über den Browser aktiviert werden. Weitere Informationen finden Sie auf der Website von Telekom.","[""page_content='id-SIM-Karte im Ausland telefonieren möchte?\nAnswer: Innerhalb der EU fallen in der Regel keine Extrakosten für das Roaming an. Das gilt auch für Prepaid-SIM-Karten. Sie müssen diese Funktion dann auch nicht aktivieren, sondern telefonieren und surfen zu den gleichen Konditionen wie im Inland. Damit Ihnen außerhalb der EU keine Kosten durch ungewollten Datenaustausch entstehen, gibt es bei uns dieTravel & SurfPässe. Diese Option können Sie jederzeit ganz einfach per SMS oder den Browser überpass.telekomhinz'"", ""page_content='sent back. Please help me in terminating my contract the earliest possible.\n\nAccepted Solutions:\n- @cilouThank you for the conversation earlier.It's a pity that we couldn't come to an agreement. As your current contract can be moved 1:1 to the new address and your friend's contract is with a different provider, there is unfortunately no special right of termination.The only option is for you to move the contract to the new address or to cancel the connection at the end of the contract term. Unfo'"", ""page_content='e connection at the end of the contract term. Unfortunately, we have no other option.Best regardsTimur\n- @cilouThank you for the conversation earlier.It's a pity that we couldn't come to an agreement. As your current contract can be moved 1:1 to the new address and your friend's contract is with a different provider, there is unfortunately no special right of termination.The only option is for you to move the contract to the new address or to cancel the connection at the end of the contract term'"", ""page_content='Source URL: https://www.telekom.de/hilfe/technician-appointment-video\n\nQuestion: How can I prepare for the technician’s appointment?\nAnswer: You have an appointment with a Telekom technician on behalf of your telephone company and you don’t know where your telephone service box is? Here we will show you how you can support the technician and arrange the appointment.'"", ""page_content='inutes:** Flat rate for calls and SMS to all networks in Germany, including landline.\n\n**Additional Product Information:**\n- **Contract Terms:** No contractual obligation; customers can cancel daily.\n- **Costs:**\n  - **Recurring Fee:** €99.95 every four weeks.\n  - **One-Time Card Price:** €99.95 (standard retail price).\n  - **Activation Bonus:** €100.00 bonus credit upon activation.\n\nThis product is designed for customers seeking flexibility without long-term commitments, with substantial data a'""]",The Travel & Surf Pässe option avoids extra data fees for Prepaid-SIMs outside the EU.,765,0.00014714999999999997,72,5,57.184794664382935,0.9034679557636712,0.9999999999,1.0,0.75,0.007599116882217506,0.13157894736842105
"What are the perks of offline downloads on MagentaTV, especially for multi-device use and exclusive streams?","Mit MagentaTV kannst du auf Smartphones und Tablets Inhalte herunterladen und offline anschauen. Die Vorteile der Offline-Downloads, insbesondere für die Nutzung auf mehreren Geräten und exklusive Streams, umfassen:

1. **Flexibilität**: Du kannst deine Lieblingssendungen und Filme überall und jederzeit anschauen, ohne auf eine Internetverbindung angewiesen zu sein.
2. **Multi-Geräte-Nutzung**: Du kannst die heruntergeladenen Inhalte auf verschiedenen Geräten nutzen, was dir die Freiheit gibt, auf dem Gerät zu schauen, das dir am besten gefällt.
3. **Exklusive Inhalte**: Du hast Zugriff auf exklusive Serien und Filme, die du offline genießen kannst, was das Erlebnis noch angenehmer macht.

Falls du weitere Informationen benötigst, kannst du die Seite www.telekom.de/hilfe besuchen.","[""page_content='Source URL: https://www.telekom.de/magenta-tv/tarife-und-optionen/magenta-tv-mit-app/zubuchoptionen\n\nQuestion: Du hast Magenta TV noch nicht? Answer: Über 150 TV-Sender in HD, exklusive Serien und Filme bei MagentaTV+. Zeitversetztes Fernsehen durch Timeshift, Restart und Aufnahmefunktion. Auf dem Fernseher, Laptop, Tablet, Smartphone. Auf Smartphone und Tablet downloaden und offline schauen. Unabhängig vom Internetanbieter. Monatlich online kündbar. • Über 150 TV-Sender in HD, exklusive Serien und Filme bei MagentaTV+. • Zeitversetztes Fernsehen durch Timeshift, Restart und Aufnahmefunktion. • Auf dem Fernseher, Laptop, Tablet, Smartphone. • Auf Smartphone und Tablet downloaden und offline schauen. • Unabhängig vom Internetanbieter.'"", ""page_content='Source URL: https://www.telekom.de/hilfe/technician-appointment-video\n\nQuestion: How can I prepare for the technician’s appointment?\nAnswer: You have an appointment with a Telekom technician on behalf of your telephone company and you don’t know where your telephone service box is? Here we will show you how you can support the technician and arrange the appointment.'"", ""page_content='e connection at the end of the contract term. Unfortunately, we have no other option.Best regardsTimur\n- @cilouThank you for the conversation earlier.It's a pity that we couldn't come to an agreement. As your current contract can be moved 1:1 to the new address and your friend's contract is with a different provider, there is unfortunately no special right of termination.The only option is for you to move the contract to the new address or to cancel the connection at the end of the contract term'"", ""page_content='sent back. Please help me in terminating my contract the earliest possible.\n\nAccepted Solutions:\n- @cilouThank you for the conversation earlier.It's a pity that we couldn't come to an agreement. As your current contract can be moved 1:1 to the new address and your friend's contract is with a different provider, there is unfortunately no special right of termination.The only option is for you to move the contract to the new address or to cancel the connection at the end of the contract term. Unfo'"", ""page_content='did the process online and receive an email telling that my contract can't terminate before the july 2026 !I went to a telekom store to ask for help and they did the process again telling me it was possible to termniate the contract within one month .... I received again a confirmation email after my visit telling me my contract will terminate only on july 2026.I am not living in my flat since 3 weeks now; the internet box is packed ready to be sent back. Please help me in terminating my contra'""]",The answer to given question is not present in context,908,0.00020864999999999998,161,5,67.36183094978333,0.938809612415905,0.0,0.0,0.3333333333333333,0,0.0
What alerts do door/window contacts trigger in Magenta SmartHome?,"Die Tür-/Fensterkontakte im Magenta SmartHome-System lösen Alarme aus, wenn sie feststellen, dass eine Tür oder ein Fenster geöffnet oder geschlossen wird. Es gibt zwei Haupttypen von Alarmen: Einbruch- und Gefahren-Alarm (wie Rauch oder Wasser). Diese Alarme können individuell konfiguriert werden, sodass Nutzer benachrichtigt werden, wenn ungewöhnliche Aktivitäten festgestellt werden. Für weitere Details und Informationen besuchen Sie bitte www.telekom.de/hilfe.","[""page_content='Source URL: https://www.telekom.de/hilfe/geraete-zubehoer/smart-home/nutzung-und-funktionen-von-smart-home/das-alarmsytem-von-smart-home/anwendung\n\nQuestion: Wie funktioniert das Alarmsystem bei Magenta SmartHome?\nAnswer: Was ist ein Alarm und wie wird er ausgelöst?Alarme sind alle Ereignisse, die an Rauch- und Wassermeldern, Tür-, Fensterkontakten und Bewegungsmeldern festgestellt werden.Die App unterscheidet dabei zwischen Einbruch- und Gefahren-Alarmen (Rauch, Wasser), die individuell eingeri'"", ""page_content='e connection at the end of the contract term. Unfortunately, we have no other option.Best regardsTimur\n- @cilouThank you for the conversation earlier.It's a pity that we couldn't come to an agreement. As your current contract can be moved 1:1 to the new address and your friend's contract is with a different provider, there is unfortunately no special right of termination.The only option is for you to move the contract to the new address or to cancel the connection at the end of the contract term'"", ""page_content='sent back. Please help me in terminating my contract the earliest possible.\n\nAccepted Solutions:\n- @cilouThank you for the conversation earlier.It's a pity that we couldn't come to an agreement. As your current contract can be moved 1:1 to the new address and your friend's contract is with a different provider, there is unfortunately no special right of termination.The only option is for you to move the contract to the new address or to cancel the connection at the end of the contract term. Unfo'"", ""page_content='Source URL: https://www.telekom.de/hilfe/technician-appointment-video\n\nQuestion: How can I prepare for the technician’s appointment?\nAnswer: You have an appointment with a Telekom technician on behalf of your telephone company and you don’t know where your telephone service box is? Here we will show you how you can support the technician and arrange the appointment.'"", ""page_content='did the process online and receive an email telling that my contract can't terminate before the july 2026 !I went to a telekom store to ask for help and they did the process again telling me it was possible to termniate the contract within one month .... I received again a confirmation email after my visit telling me my contract will terminate only on july 2026.I am not living in my flat since 3 weeks now; the internet box is packed ready to be sent back. Please help me in terminating my contra'""]",The answer to given question is not present in context,788,0.0001614,96,5,59.9725980758667,0.8793225380402981,0.0,1.0,0.2,0,0.0
How do mobile devices receive cell broadcast messages without personal data?,"Mobile devices receive cell broadcast messages without personal data because these messages are sent to all compatible devices in a specific area without needing any individual identification. The system does not collect or process any personal data, such as location information, from the recipients. Instead, the warning messages are broadcasted as text notifications directly to the devices, ensuring that the sender does not have access to the mobile phone numbers or any other personal information of the recipients.","[""page_content='mit dem Handy? Answer: Cell Broadcast warnt die Bevölkerung vor Katastrophen und Notfällen. Das geschieht mittels einer Textnachricht mit Warnsignal auf dem Mobilfunk-Gerät (Smartphone oder Handy). Diese Nachricht wird direkt auf dem Bildschirm des Geräts angezeigt und kann nicht stummgeschaltet werden. Question: Kann man einen laufenden Alarm aus- bzw. stummschalten? Answer: Ja. Ein laufender Alarm kann durch Bestätigen der Warnmeldung ausgeschaltet werden. Question: Wie unterscheiden sich Probewarnungen von echten Warnmeldungen? Answer: Probewarnungen enthalten im Text den Hinweis, dass es sich um eine Probewarnung handelt. Diese finden in der Regel an Landes- oder Bundeswarntagen statt und werden auch in der Presse einige Tage/Wochen vorher angekündigt. Question: Kann ich Probewarnungen bzw. Testwarnungen deaktivieren? Und was ist der Unterschied? Answer: Warnungen, die im Rahmen eines Probewarntags von Bund und Ländern durchgeführt werden, können Sie nicht deaktivieren. Grund ist, dass diese in der Regel die höchste Warnstufe nutzen. Testwarnungen hingegen können Sie deaktivieren, weil das Funktionstests der Netzbetreiber sind. In den Cell-Broadcast-Einstellungen Ihres Geräts können Sie diese wie folgt deaktivieren:\niOS: Einstellungen > Mitteilungen > Cell Broadcast-Warnungen > Testwarnungen\nAndroid: Einstellungen > Sicherheit und Notfälle > Notfallbenachrichtigung für Mobilgeräte\n\nQuestion: Warum gibt es einen bundesweiten Warntag? Answer: Der bundesweite Warntag dient weiterhin dem Ziel, die Menschen in Deutschland über\xa0Warnungen zu informieren und sie damit\xa0zu sensibilisieren. Nähere Informationen erhalten Sie auf folgender Seitewww.warnung-der-bevoelkerung.de(Sie werden weitergeleitet). Question: Was hat die Telekom mit Cell Broadcast zu tun? Answer: Das Bundesamt für Bevölkerungsschutz und Katastrophenhilfe (BBK) setzt auf unterschiedliche Warnmittel/-kanäle. Eines dieser Warnmittel ist Cell Broadcast, bei dem die Warnmeldung als Textnachricht über die Mobilfunk-Netze versendet wird. Question: In welchen Sprachen werden Warnmeldungen unterstützt? Answer: Die Aussendung der Cell Broadcast-Warnmeldungen erfolgt in Deutsch und Englisch. In der Regel werden\xa0auf Mobilfunk-Geräten mit deutschen Spracheinstellungen nur Warnmeldungen auf\xa0Deutsch angezeigt. Question: Werden meine Daten (insbesondere Standortdaten) übermittelt? Answer: Nein, für die Aussendung von Cell Broadcast-Nachrichten werden keine personenbezogenen Daten wie Standortdaten erhoben oder verarbeitet. Das Warnsignal wird an alle empfangsbereiten Mobilfunk-Geräte ausgesendet, ohne dass der Absendende\xa0der Warnmeldung die Mobilfunk-Rufnummer oder andere Daten der Empfänger*innen kennt oder erfassen kann. '"", ""page_content='sent back. Please help me in terminating my contract the earliest possible.\n\nAccepted Solutions:\n- @cilouThank you for the conversation earlier.It's a pity that we couldn't come to an agreement. As your current contract can be moved 1:1 to the new address and your friend's contract is with a different provider, there is unfortunately no special right of termination.The only option is for you to move the contract to the new address or to cancel the connection at the end of the contract term. Unfo'"", ""page_content='e connection at the end of the contract term. Unfortunately, we have no other option.Best regardsTimur\n- @cilouThank you for the conversation earlier.It's a pity that we couldn't come to an agreement. As your current contract can be moved 1:1 to the new address and your friend's contract is with a different provider, there is unfortunately no special right of termination.The only option is for you to move the contract to the new address or to cancel the connection at the end of the contract term'"", ""page_content='did the process online and receive an email telling that my contract can't terminate before the july 2026 !I went to a telekom store to ask for help and they did the process again telling me it was possible to termniate the contract within one month .... I received again a confirmation email after my visit telling me my contract will terminate only on july 2026.I am not living in my flat since 3 weeks now; the internet box is packed ready to be sent back. Please help me in terminating my contra'"", ""page_content='Source URL: https://www.telekom.de/hilfe/technician-appointment-video\n\nQuestion: How can I prepare for the technician’s appointment?\nAnswer: You have an appointment with a Telekom technician on behalf of your telephone company and you don’t know where your telephone service box is? Here we will show you how you can support the technician and arrange the appointment.'""]",Mobile devices receive cell broadcast messages without personal data because the warning signal is sent to all ready mobile devices without the sender knowing or being able to capture the mobile phone numbers or other data of the recipients.,1241,0.00022484999999999996,86,5,73.00372290611267,0.9972201148086923,0.9999999999,1.0,1.0,0.21008746148982207,0.46153846153846156
