Question,Response,Contexts,Ground Truth,Token Count,Total Cost (USD),Completion Tokens,Number of Retrieved documents,Response time,answer_relevancy,context_precision,context_recall,faithfulness,BleuScore,RougeScore
Welche Geräte können an den Airties-Produkten betrieben werden?,"An den Airties-Produkten können sowohl WLAN-Geräte als auch Geräte über LAN-Kabel betrieben werden. Jede Airties-Box verfügt über zwei LAN-Ports, die Geschwindigkeiten von bis zu 1 GBit/s unterstützen. Sie können also eine Vielzahl von Geräten über ein LAN-Kabel einbinden, beispielsweise eine Funkbrücke zwischen Ihrem Speedport und Media Receiver.","[""page_content='Source URL: https://www.telekom.de/hilfe/geraete-zubehoer/heimnetzwerk-powerline-wlan/airties/wlan-geraete-an-airties-betreiben\n\nQuestion: Kann ich nur WLAN-Geräte an den Airties-Produkten betreiben?\nAnswer: Nein. Jede Airties-Box hat zwei LAN-Ports, die eine Geschwindigkeit bis 1 GBit/s unterstützen.\nÜber diese Ports können Sie alle möglichen Geräte auch über ein LAN-Kabel einbinden.\nRichten Sie z. B. eine Funkbrücke zwischen Ihrem Speedport und Media Receiver ein – und versorgen Sie gleichzeit'"", ""page_content='Source URL: https://www.telekom.de/hilfe/geraete-zubehoer/heimnetzwerk-powerline-wlan/airties/wlan-geraete-an-airties-betreiben\n\nQuestion: Kann ich nur WLAN-Geräte an den Airties-Produkten betreiben?\nAnswer: Nein. Jede Airties-Box hat zwei LAN-Ports, die eine Geschwindigkeit bis 1 GBit/s unterstützen.\nÜber diese Ports können Sie alle möglichen Geräte auch über ein LAN-Kabel einbinden.\nRichten Sie z. B. eine Funkbrücke zwischen Ihrem Speedport und Media Receiver ein – und versorgen Sie gleichzeit'"", ""page_content='Source URL: https://www.telekom.de/hilfe/geraete-zubehoer/heimnetzwerk-powerline-wlan/airties/wlan-geraete-an-airties-betreiben\n\nQuestion: Kann ich nur WLAN-Geräte an den Airties-Produkten betreiben?\nAnswer: Nein. Jede Airties-Box hat zwei LAN-Ports, die eine Geschwindigkeit bis 1 GBit/s unterstützen.\nÜber diese Ports können Sie alle möglichen Geräte auch über ein LAN-Kabel einbinden.\nRichten Sie z. B. eine Funkbrücke zwischen Ihrem Speedport und Media Receiver ein – und versorgen Sie gleichzeit'"", ""page_content='Source URL: https://www.telekom.de/hilfe/geraete-zubehoer/heimnetzwerk-powerline-wlan/airties/wlan-geraete-an-airties-betreiben\n\nQuestion: Kann ich nur WLAN-Geräte an den Airties-Produkten betreiben?\nAnswer: Nein. Jede Airties-Box hat zwei LAN-Ports, die eine Geschwindigkeit bis 1 GBit/s unterstützen.\nÜber diese Ports können Sie alle möglichen Geräte auch über ein LAN-Kabel einbinden.\nRichten Sie z. B. eine Funkbrücke zwischen Ihrem Speedport und Media Receiver ein – und versorgen Sie gleichzeit'""]",Die Antwort auf die gegebene Frage ist nicht im Kontext vorhanden,770,0.00014969999999999998,76,4,23.020251035690308,0.9137826775089509,0.5833333333041666,1.0,1.0,0.0039094870602888725,0.0273972602739726
Wie beeinflusst der Leitungsausbau die Verfügbarkeit von DSL-/VDSL-Tarifen an meinem Wohnort?,"Der Leitungsausbau hat einen direkten Einfluss auf die Verfügbarkeit von DSL-/VDSL-Tarifen an Ihrem Wohnort. Die Tarife, die Ihnen angeboten werden, hängen von der Infrastruktur in Ihrer Region ab. In einigen Gebieten sind möglicherweise keine Glasfaserleitungen verlegt, was die verfügbaren Geschwindigkeiten einschränkt. Weitere Faktoren, die die Verfügbarkeit beeinflussen können, sind die Leitungslänge und die Entfernung Ihrer Wohnung oder Ihres Hauses zur Vermittlungsstelle. Wenn Sie genauere Informationen zu Ihrem Wohnort benötigen, empfehle ich Ihnen, die Verfügbarkeitsprüfung auf der Telekom-Website durchzuführen oder direkt Kontakt mit dem Kundenservice aufzunehmen.","[""page_content='en, welche Down- und Uploadraten bei Ihnen zu Hause möglich sind. Dementsprechend wählen Sie anschließend Ihren Wunsch-Tarif.\n\nQuestion: Warum sind bestimmte DSL-/VDSL-Tarife an meinem Wohnort nicht verfügbar?\nAnswer: Welche Tarife für Sie infrage kommen, hängt immer mit dem Leitungsausbau in Ihrem Wohnort zusammen. Nicht überall sind zum Beispiel Glasfaserleitungen verlegt. Hinzu kommen weitere Faktoren wie die Leitungslänge und die Entfernung Ihrer Wohnung oder Ihres Hauses zur Vermittlungsste'"", ""page_content='en, welche Down- und Uploadraten bei Ihnen zu Hause möglich sind. Dementsprechend wählen Sie anschließend Ihren Wunsch-Tarif.\n\nQuestion: Warum sind bestimmte DSL-/VDSL-Tarife an meinem Wohnort nicht verfügbar?\nAnswer: Welche Tarife für Sie infrage kommen, hängt immer mit dem Leitungsausbau in Ihrem Wohnort zusammen. Nicht überall sind zum Beispiel Glasfaserleitungen verlegt. Hinzu kommen weitere Faktoren wie die Leitungslänge und die Entfernung Ihrer Wohnung oder Ihres Hauses zur Vermittlungsste'"", ""page_content='en, welche Down- und Uploadraten bei Ihnen zu Hause möglich sind. Dementsprechend wählen Sie anschließend Ihren Wunsch-Tarif.\n\nQuestion: Warum sind bestimmte DSL-/VDSL-Tarife an meinem Wohnort nicht verfügbar?\nAnswer: Welche Tarife für Sie infrage kommen, hängt immer mit dem Leitungsausbau in Ihrem Wohnort zusammen. Nicht überall sind zum Beispiel Glasfaserleitungen verlegt. Hinzu kommen weitere Faktoren wie die Leitungslänge und die Entfernung Ihrer Wohnung oder Ihres Hauses zur Vermittlungsste'"", ""page_content='en, welche Down- und Uploadraten bei Ihnen zu Hause möglich sind. Dementsprechend wählen Sie anschließend Ihren Wunsch-Tarif.\n\nQuestion: Warum sind bestimmte DSL-/VDSL-Tarife an meinem Wohnort nicht verfügbar?\nAnswer: Welche Tarife für Sie infrage kommen, hängt immer mit dem Leitungsausbau in Ihrem Wohnort zusammen. Nicht überall sind zum Beispiel Glasfaserleitungen verlegt. Hinzu kommen weitere Faktoren wie die Leitungslänge und die Entfernung Ihrer Wohnung oder Ihres Hauses zur Vermittlungsste'""]","Der Leitungsausbau beeinflusst die Verfügbarkeit von DSL-/VDSL-Tarifen an Ihrem Wohnort, da die Tarife, die für Sie infrage kommen, immer mit dem Leitungsausbau in Ihrem Wohnort zusammenhängen. Nicht überall sind zum Beispiel Glasfaserleitungen verlegt.",742,0.00017295,137,4,29.68309783935547,0.9720377503931473,0.999999999975,1.0,0.625,0.08061146241253206,0.2753623188405797
What is the function of Timeshift in MagentaTV?,"Die Funktion von Timeshift in MagentaTV ermöglicht zeitversetztes Fernsehen. Das bedeutet, dass du eine laufende Sendung pausieren, zurückspulen oder später ansehen kannst. Dies gibt dir die Flexibilität, deine Fernseherlebnisse nach deinem Zeitplan zu gestalten.","['page_content=\'in HD, exklusive Serien und Filme bei MagentaTV+.\n• Zeitversetztes Fernsehen durch Timeshift, Restart und Aufnahmefunktion.\n• Auf dem Fernseher, Laptop, Tablet, Smartphone.\n• Auf Smartphone und Tablet downloaden und offline schauen.\n• Unabhängig vom Internetanbieter. Monatlich online kündbar.\n\nQuestion: Wie kannst du zusätzliche TV-Pakete zu deinem bestehenden MagentaTV Vertrag dazu buchen?\nAnswer: Du loggst dich zuerst in dasKundencenterein. Hier findest du unter dem Reiter ""Ihre Zusatzprodukt\'', 'page_content=\'in HD, exklusive Serien und Filme bei MagentaTV+.\n• Zeitversetztes Fernsehen durch Timeshift, Restart und Aufnahmefunktion.\n• Auf dem Fernseher, Laptop, Tablet, Smartphone.\n• Auf Smartphone und Tablet downloaden und offline schauen.\n• Unabhängig vom Internetanbieter. Monatlich online kündbar.\n\nQuestion: Wie kannst du zusätzliche TV-Pakete zu deinem bestehenden MagentaTV Vertrag dazu buchen?\nAnswer: Du loggst dich zuerst in dasKundencenterein. Hier findest du unter dem Reiter ""Ihre Zusatzprodukt\'', 'page_content=\'in HD, exklusive Serien und Filme bei MagentaTV+.\n• Zeitversetztes Fernsehen durch Timeshift, Restart und Aufnahmefunktion.\n• Auf dem Fernseher, Laptop, Tablet, Smartphone.\n• Auf Smartphone und Tablet downloaden und offline schauen.\n• Unabhängig vom Internetanbieter. Monatlich online kündbar.\n\nQuestion: Wie kannst du zusätzliche TV-Pakete zu deinem bestehenden MagentaTV Vertrag dazu buchen?\nAnswer: Du loggst dich zuerst in dasKundencenterein. Hier findest du unter dem Reiter ""Ihre Zusatzprodukt\'', 'page_content=\'in HD, exklusive Serien und Filme bei MagentaTV+.\n• Zeitversetztes Fernsehen durch Timeshift, Restart und Aufnahmefunktion.\n• Auf dem Fernseher, Laptop, Tablet, Smartphone.\n• Auf Smartphone und Tablet downloaden und offline schauen.\n• Unabhängig vom Internetanbieter. Monatlich online kündbar.\n\nQuestion: Wie kannst du zusätzliche TV-Pakete zu deinem bestehenden MagentaTV Vertrag dazu buchen?\nAnswer: Du loggst dich zuerst in dasKundencenterein. Hier findest du unter dem Reiter ""Ihre Zusatzprodukt\'']",The answer to given question is not present in context,690,0.00012869999999999998,56,4,29.10270595550537,0.9238010860197571,0.999999999975,0.0,0.3333333333333333,0.005474870710453651,0.041666666666666664
Wie können Sie Ihre Firmendaten in der Trassen Defender App ändern?,"Sie können Ihre Firmendaten (Firma, Anschrift, Zuständigkeit etc.) jederzeit in der Trassen Defender App über den Menüpunkt ""Einstellungen"" ändern. Ihre Kontaktdaten (E-Mail-Adresse, Telefonnummer) können Sie jedoch nur durch eine Neuregistrierung ändern. In diesem Fall müssen Sie Ihr aktuelles Konto löschen und sich erneut registrieren.","['page_content=\'Source URL: https://www.telekom.de/hilfe/apps-dienste/apps/trassen-defender-app/trassen-defender-app-funktionen/aenderung-daten\n\nQuestion: Wie kann ich meine Kontakt- bzw. Accountdaten in der Trassen Defender App ändern?\nAnswer: Ihre Firmendaten(Firma, Anschrift, Zuständigkeit etc.) ändern Sie jederzeit in der App über den Menüpunkt ""Einstellungen"".\nIhre Kontaktdaten(E-Mail-Adresse, Telefonnummer) hingegen können Sie leider nur über eine Neuregistrierung ändern. In diesem Fall löschen Sie über d\'', 'page_content=\'Source URL: https://www.telekom.de/hilfe/apps-dienste/apps/trassen-defender-app/trassen-defender-app-funktionen/aenderung-daten\n\nQuestion: Wie kann ich meine Kontakt- bzw. Accountdaten in der Trassen Defender App ändern?\nAnswer: Ihre Firmendaten(Firma, Anschrift, Zuständigkeit etc.) ändern Sie jederzeit in der App über den Menüpunkt ""Einstellungen"".\nIhre Kontaktdaten(E-Mail-Adresse, Telefonnummer) hingegen können Sie leider nur über eine Neuregistrierung ändern. In diesem Fall löschen Sie über d\'', 'page_content=\'Source URL: https://www.telekom.de/hilfe/apps-dienste/apps/trassen-defender-app/trassen-defender-app-funktionen/aenderung-daten\n\nQuestion: Wie kann ich meine Kontakt- bzw. Accountdaten in der Trassen Defender App ändern?\nAnswer: Ihre Firmendaten(Firma, Anschrift, Zuständigkeit etc.) ändern Sie jederzeit in der App über den Menüpunkt ""Einstellungen"".\nIhre Kontaktdaten(E-Mail-Adresse, Telefonnummer) hingegen können Sie leider nur über eine Neuregistrierung ändern. In diesem Fall löschen Sie über d\'', 'page_content=\'Source URL: https://www.telekom.de/hilfe/apps-dienste/apps/trassen-defender-app/trassen-defender-app-funktionen/aenderung-daten\n\nQuestion: Wie kann ich meine Kontakt- bzw. Accountdaten in der Trassen Defender App ändern?\nAnswer: Ihre Firmendaten(Firma, Anschrift, Zuständigkeit etc.) ändern Sie jederzeit in der App über den Menüpunkt ""Einstellungen"".\nIhre Kontaktdaten(E-Mail-Adresse, Telefonnummer) hingegen können Sie leider nur über eine Neuregistrierung ändern. In diesem Fall löschen Sie über d\'']","Ihre Firmendaten (Firma, Anschrift, Zuständigkeit etc.) ändern Sie jederzeit in der App über den Menüpunkt ""Einstellungen"".",727,0.00014235,74,4,28.105724811553955,0.9999999999999996,0.999999999975,1.0,1.0,0.18624428151783898,0.4571428571428572
What sind die Schritte im Anmeldevorgang für schnurlose Geräte am Speedport?,"Um ein schnurloses (DECT) Gerät an Ihrem Speedport anzumelden, befolgen Sie bitte diese Schritte:

1. Schauen Sie in der Bedienungsanleitung Ihres DECT-Telefons nach, um den Anmeldevorgang zu starten.
2. Nachdem Sie den Anmeldevorgang Ihres Telefons gestartet haben, drücken Sie die Taste „Anmelden“ auf Ihrem Speedport-Router.

Falls Ihr Speedport-Router keine Anmelden-Taste hat, finden Sie in der Bedienungsanleitung weitere Informationen zur alternativen Anmeldung.

Für detaillierte Hilfe besuchen Sie bitte [www.telekom.de/hilfe](http://www.telekom.de/hilfe).","[""page_content='Source URL: https://www.telekom.de/hilfe/werksreset-speedport/werksreset-faq/schnurlose-geraete-anmelden\n\nQuestion: Wie melde ich schnurlose (DECT) Geräte am Speedport an?\nAnswer: Um ein DECT-Telefon an Ihrem Speedport anzumelden, schauen Sie bitte in der Bedienungsanleitung des Telefons nach.\nNachdem Sie den Anmeldevorgang Ihres Telefons gestartet haben, drücken Sie die Taste „Anmelden“ auf Ihrem Speedport-Router.Ihr Speedport-Router hat keine Anmelden-Taste?Zur alternativen Anmeldung Ihres DEC'"", ""page_content='Source URL: https://www.telekom.de/hilfe/werksreset-speedport/werksreset-faq/schnurlose-geraete-anmelden\n\nQuestion: Wie melde ich schnurlose (DECT) Geräte am Speedport an?\nAnswer: Um ein DECT-Telefon an Ihrem Speedport anzumelden, schauen Sie bitte in der Bedienungsanleitung des Telefons nach.\nNachdem Sie den Anmeldevorgang Ihres Telefons gestartet haben, drücken Sie die Taste „Anmelden“ auf Ihrem Speedport-Router.Ihr Speedport-Router hat keine Anmelden-Taste?Zur alternativen Anmeldung Ihres DEC'"", ""page_content='Source URL: https://www.telekom.de/hilfe/werksreset-speedport/werksreset-faq/schnurlose-geraete-anmelden\n\nQuestion: Wie melde ich schnurlose (DECT) Geräte am Speedport an?\nAnswer: Um ein DECT-Telefon an Ihrem Speedport anzumelden, schauen Sie bitte in der Bedienungsanleitung des Telefons nach.\nNachdem Sie den Anmeldevorgang Ihres Telefons gestartet haben, drücken Sie die Taste „Anmelden“ auf Ihrem Speedport-Router.Ihr Speedport-Router hat keine Anmelden-Taste?Zur alternativen Anmeldung Ihres DEC'"", ""page_content='Source URL: https://www.telekom.de/hilfe/werksreset-speedport/werksreset-faq/schnurlose-geraete-anmelden\n\nQuestion: Wie melde ich schnurlose (DECT) Geräte am Speedport an?\nAnswer: Um ein DECT-Telefon an Ihrem Speedport anzumelden, schauen Sie bitte in der Bedienungsanleitung des Telefons nach.\nNachdem Sie den Anmeldevorgang Ihres Telefons gestartet haben, drücken Sie die Taste „Anmelden“ auf Ihrem Speedport-Router.Ihr Speedport-Router hat keine Anmelden-Taste?Zur alternativen Anmeldung Ihres DEC'""]","Um ein DECT-Telefon an Ihrem Speedport anzumelden, schauen Sie bitte in der Bedienungsanleitung des Telefons nach. Nachdem Sie den Anmeldevorgang Ihres Telefons gestartet haben, drücken Sie die Taste „Anmelden“ auf Ihrem Speedport-Router.",836,0.00018795,139,4,29.163092136383057,0.8475094311424577,0.999999999975,1.0,0.75,0.2916289261087092,0.5423728813559322
Which option avoids extra data fees for Prepaid-SIMs outside the EU?,"Um außerhalb der EU zusätzliche Datengebühren zu vermeiden, können Sie die Travel & Surf-Pässe von Telekom nutzen. Diese Option ermöglicht es Ihnen, ungewollte Kosten durch Datenaustausch zu vermeiden. Sie können die Pässe jederzeit ganz einfach per SMS oder über den Browser unter pass.telekom hinzubuchen. Achten Sie darauf, die Pässe vor Reisen außerhalb der EU zu aktivieren.","[""page_content='chte?\nAnswer: Innerhalb der EU fallen in der Regel keine Extrakosten für das Roaming an. Das gilt auch für Prepaid-SIM-Karten. Sie müssen diese Funktion dann auch nicht aktivieren, sondern telefonieren und surfen zu den gleichen Konditionen wie im Inland. Damit Ihnen außerhalb der EU keine Kosten durch ungewollten Datenaustausch entstehen, gibt es bei uns dieTravel & SurfPässe. Diese Option können Sie jederzeit ganz einfach per SMS oder den Browser überpass.telekomhinzubuchen. Achten Sie darauf,'"", ""page_content='chte?\nAnswer: Innerhalb der EU fallen in der Regel keine Extrakosten für das Roaming an. Das gilt auch für Prepaid-SIM-Karten. Sie müssen diese Funktion dann auch nicht aktivieren, sondern telefonieren und surfen zu den gleichen Konditionen wie im Inland. Damit Ihnen außerhalb der EU keine Kosten durch ungewollten Datenaustausch entstehen, gibt es bei uns dieTravel & SurfPässe. Diese Option können Sie jederzeit ganz einfach per SMS oder den Browser überpass.telekomhinzubuchen. Achten Sie darauf,'"", ""page_content='chte?\nAnswer: Innerhalb der EU fallen in der Regel keine Extrakosten für das Roaming an. Das gilt auch für Prepaid-SIM-Karten. Sie müssen diese Funktion dann auch nicht aktivieren, sondern telefonieren und surfen zu den gleichen Konditionen wie im Inland. Damit Ihnen außerhalb der EU keine Kosten durch ungewollten Datenaustausch entstehen, gibt es bei uns dieTravel & SurfPässe. Diese Option können Sie jederzeit ganz einfach per SMS oder den Browser überpass.telekomhinzubuchen. Achten Sie darauf,'"", ""page_content='chte?\nAnswer: Innerhalb der EU fallen in der Regel keine Extrakosten für das Roaming an. Das gilt auch für Prepaid-SIM-Karten. Sie müssen diese Funktion dann auch nicht aktivieren, sondern telefonieren und surfen zu den gleichen Konditionen wie im Inland. Damit Ihnen außerhalb der EU keine Kosten durch ungewollten Datenaustausch entstehen, gibt es bei uns dieTravel & SurfPässe. Diese Option können Sie jederzeit ganz einfach per SMS oder den Browser überpass.telekomhinzubuchen. Achten Sie darauf,'""]",The Travel & Surf Pässe option avoids extra data fees for Prepaid-SIMs outside the EU.,710,0.00014429999999999998,84,4,31.59026312828064,0.8765515453403013,0.999999999975,1.0,0.75,0.007637922144947632,0.14457831325301204
"What are the perks of offline downloads on MagentaTV, especially for multi-device use and exclusive streams?","Die Offline-Downloads bei MagentaTV bieten einige Vorteile, insbesondere für die Nutzung auf mehreren Geräten und exklusive Streams:

1. **Flexibilität**: Du kannst Inhalte auf deinem Smartphone oder Tablet herunterladen und sie später offline anschauen, was ideal für Reisen oder Orte ohne Internetverbindung ist.

2. **Multigeräte-Nutzung**: Die Möglichkeit, auf verschiedenen Geräten zu streamen und heruntergeladene Inhalte zu nutzen, ermöglicht dir, deine Lieblingsserien und -filme überall und jederzeit zu genießen.

3. **Exklusive Inhalte**: Du hast Zugriff auf exklusive Serien und Filme, die du auch offline ansehen kannst, was dir mehr Freiheit bei der Auswahl deiner Unterhaltung gibt.

4. **Unabhängigkeit vom Internetanbieter**: Die Offline-Nutzung ist unabhängig von deinem Internetanbieter, was zusätzliche Flexibilität bietet.

Insgesamt machen diese Funktionen das Erlebnis von MagentaTV vielseitiger und benutzerfreundlicher.","['page_content=\'in HD, exklusive Serien und Filme bei MagentaTV+.\n• Zeitversetztes Fernsehen durch Timeshift, Restart und Aufnahmefunktion.\n• Auf dem Fernseher, Laptop, Tablet, Smartphone.\n• Auf Smartphone und Tablet downloaden und offline schauen.\n• Unabhängig vom Internetanbieter. Monatlich online kündbar.\n\nQuestion: Wie kannst du zusätzliche TV-Pakete zu deinem bestehenden MagentaTV Vertrag dazu buchen?\nAnswer: Du loggst dich zuerst in dasKundencenterein. Hier findest du unter dem Reiter ""Ihre Zusatzprodukt\'', 'page_content=\'in HD, exklusive Serien und Filme bei MagentaTV+.\n• Zeitversetztes Fernsehen durch Timeshift, Restart und Aufnahmefunktion.\n• Auf dem Fernseher, Laptop, Tablet, Smartphone.\n• Auf Smartphone und Tablet downloaden und offline schauen.\n• Unabhängig vom Internetanbieter. Monatlich online kündbar.\n\nQuestion: Wie kannst du zusätzliche TV-Pakete zu deinem bestehenden MagentaTV Vertrag dazu buchen?\nAnswer: Du loggst dich zuerst in dasKundencenterein. Hier findest du unter dem Reiter ""Ihre Zusatzprodukt\'', 'page_content=\'in HD, exklusive Serien und Filme bei MagentaTV+.\n• Zeitversetztes Fernsehen durch Timeshift, Restart und Aufnahmefunktion.\n• Auf dem Fernseher, Laptop, Tablet, Smartphone.\n• Auf Smartphone und Tablet downloaden und offline schauen.\n• Unabhängig vom Internetanbieter. Monatlich online kündbar.\n\nQuestion: Wie kannst du zusätzliche TV-Pakete zu deinem bestehenden MagentaTV Vertrag dazu buchen?\nAnswer: Du loggst dich zuerst in dasKundencenterein. Hier findest du unter dem Reiter ""Ihre Zusatzprodukt\'', 'page_content=\'in HD, exklusive Serien und Filme bei MagentaTV+.\n• Zeitversetztes Fernsehen durch Timeshift, Restart und Aufnahmefunktion.\n• Auf dem Fernseher, Laptop, Tablet, Smartphone.\n• Auf Smartphone und Tablet downloaden und offline schauen.\n• Unabhängig vom Internetanbieter. Monatlich online kündbar.\n\nQuestion: Wie kannst du zusätzliche TV-Pakete zu deinem bestehenden MagentaTV Vertrag dazu buchen?\nAnswer: Du loggst dich zuerst in dasKundencenterein. Hier findest du unter dem Reiter ""Ihre Zusatzprodukt\'']",The answer to given question is not present in context,830,0.00020865,187,4,35.19770908355713,0.9463982555831482,0.0,1.0,0.45454545454545453,0,0.0
What alerts do door/window contacts trigger in Magenta SmartHome?,"Die Tür-/Fensterkontakte in der Magenta SmartHome App können verschiedene Alarme auslösen. Wenn ein Kontakt geöffnet oder geschlossen wird, erhalten Sie eine Benachrichtigung auf Ihrem Smartphone oder Tablet. Bei einer Alarmmeldung ändert sich die Hintergrundfarbe des Bildschirms ""Mein Zuhause"" auf Rot. Alle Benachrichtigungen werden zudem im Menüpunkt ""Nachrichten"" abgelegt, sodass Sie sie jederzeit einsehen können. 

Wenn Sie weitere Informationen benötigen, besuchen Sie bitte www.telekom.de/hilfe.","['page_content=\'Ihres Smartphones oder Tablets. Den entsprechenden Ton hierzu können Sie in den Einstellungen Ihres Geräts selbst auswählen.\nHaben Sie Ihre Magenta SmartHome App dagegen geöffnet, sehen Sie die eingetroffene Nachricht direkt auf dem Bildschirm der App. Bei einer Alarmmeldung ändert sich zudem die Hintergrundfarbe des Bildschirms ""Mein Zuhause"" auf Rot.\nÜbrigens: Alle Benachrichtigungen\xa0werden immer im Menüpunkt ""Nachrichten"" abgelegt.\'', 'page_content=\'Ihres Smartphones oder Tablets. Den entsprechenden Ton hierzu können Sie in den Einstellungen Ihres Geräts selbst auswählen.\nHaben Sie Ihre Magenta SmartHome App dagegen geöffnet, sehen Sie die eingetroffene Nachricht direkt auf dem Bildschirm der App. Bei einer Alarmmeldung ändert sich zudem die Hintergrundfarbe des Bildschirms ""Mein Zuhause"" auf Rot.\nÜbrigens: Alle Benachrichtigungen\xa0werden immer im Menüpunkt ""Nachrichten"" abgelegt.\'', 'page_content=\'Ihres Smartphones oder Tablets. Den entsprechenden Ton hierzu können Sie in den Einstellungen Ihres Geräts selbst auswählen.\nHaben Sie Ihre Magenta SmartHome App dagegen geöffnet, sehen Sie die eingetroffene Nachricht direkt auf dem Bildschirm der App. Bei einer Alarmmeldung ändert sich zudem die Hintergrundfarbe des Bildschirms ""Mein Zuhause"" auf Rot.\nÜbrigens: Alle Benachrichtigungen\xa0werden immer im Menüpunkt ""Nachrichten"" abgelegt.\'', 'page_content=\'Ihres Smartphones oder Tablets. Den entsprechenden Ton hierzu können Sie in den Einstellungen Ihres Geräts selbst auswählen.\nHaben Sie Ihre Magenta SmartHome App dagegen geöffnet, sehen Sie die eingetroffene Nachricht direkt auf dem Bildschirm der App. Bei einer Alarmmeldung ändert sich zudem die Hintergrundfarbe des Bildschirms ""Mein Zuhause"" auf Rot.\nÜbrigens: Alle Benachrichtigungen\xa0werden immer im Menüpunkt ""Nachrichten"" abgelegt.\'']",The answer to given question is not present in context,660,0.00014625,105,4,35.27422881126404,0.9414450133304405,0.0,1.0,0.3333333333333333,0.0028919892142542742,0.023809523809523808
How do mobile devices receive cell broadcast messages without personal data?,"Mobile devices receive cell broadcast messages without personal data because the transmission process does not involve the collection or processing of any personal information, such as location data. The alert signal is sent to all compatible mobile devices in the area, and the sender of the warning message does not have access to the mobile numbers or any other data of the recipients. This ensures that the communication remains anonymous and secure.","[""page_content='endung von Cell Broadcast-Nachrichten werden keine personenbezogenen Daten wie Standortdaten erhoben oder verarbeitet. Das Warnsignal wird an alle empfangsbereiten Mobilfunk-Geräte ausgesendet, ohne dass der Absendende\xa0der Warnmeldung die Mobilfunk-Rufnummer oder andere Daten der Empfänger*innen kennt oder erfassen kann.'"", ""page_content='endung von Cell Broadcast-Nachrichten werden keine personenbezogenen Daten wie Standortdaten erhoben oder verarbeitet. Das Warnsignal wird an alle empfangsbereiten Mobilfunk-Geräte ausgesendet, ohne dass der Absendende\xa0der Warnmeldung die Mobilfunk-Rufnummer oder andere Daten der Empfänger*innen kennt oder erfassen kann.'"", ""page_content='endung von Cell Broadcast-Nachrichten werden keine personenbezogenen Daten wie Standortdaten erhoben oder verarbeitet. Das Warnsignal wird an alle empfangsbereiten Mobilfunk-Geräte ausgesendet, ohne dass der Absendende\xa0der Warnmeldung die Mobilfunk-Rufnummer oder andere Daten der Empfänger*innen kennt oder erfassen kann.'"", ""page_content='endung von Cell Broadcast-Nachrichten werden keine personenbezogenen Daten wie Standortdaten erhoben oder verarbeitet. Das Warnsignal wird an alle empfangsbereiten Mobilfunk-Geräte ausgesendet, ohne dass der Absendende\xa0der Warnmeldung die Mobilfunk-Rufnummer oder andere Daten der Empfänger*innen kennt oder erfassen kann.'""]",Mobile devices receive cell broadcast messages without personal data because the warning signal is sent to all ready mobile devices without the sender knowing or being able to capture the mobile phone numbers or other data of the recipients.,515,0.0001119,77,4,38.332945823669434,0.9972201148086923,0.999999999975,1.0,0.8888888888888888,0.2706469179819921,0.5405405405405406
