Question,Response,Contexts,Ground Truth,Token Count,Total Cost (USD),Completion Tokens,Number of Retrieved documents,Response time,answer_relevancy,context_precision,context_recall,faithfulness,BleuScore,RougeScore
Wie kann ich die HotSpot Zugangsdaten für meine Telekom Mobilfunk-Rufnummer erhalten?,"Um die zu Ihrer Telekom Mobilfunk-Rufnummer gehörenden HotSpot Zugangsdaten zu erhalten, senden Sie eine SMS mit dem Inhalt ""OPEN"" an die 9526. Je nach Tarif können Ihnen für diese SMS Kosten entstehen.","['page_content=\'Source URL: https://www.telekom.de/hilfe/mobilfunk/mobiles-internet/hotspot/zugangsdaten\n\nQuestion: Wie erhalte ich die zu meiner Telekom Mobilfunk-Rufnummer gehörenden HotSpot Zugangsdaten?\nAnswer: Um die zu Ihrer Telekom Mobilfunk-Rufnummer gehörenden HotSpot Zugangsdaten zu erhalten, senden Sie eine SMS mit dem Inhalt ""OPEN"" an die 9526. Je nach Tarif können Ihnen für diese SMS Kosten entstehen.\'', 'page_content=\'Source URL: https://www.telekom.de/hilfe/mobilfunk/mobiles-internet/hotspot/zugangsdaten\n\nQuestion: Wie erhalte ich die zu meiner Telekom Mobilfunk-Rufnummer gehörenden HotSpot Zugangsdaten?\nAnswer: Um die zu Ihrer Telekom Mobilfunk-Rufnummer gehörenden HotSpot Zugangsdaten zu erhalten, senden Sie eine SMS mit dem Inhalt ""OPEN"" an die 9526. Je nach Tarif können Ihnen für diese SMS Kosten entstehen.\'', 'page_content=\'Source URL: https://www.telekom.de/hilfe/mobilfunk/mobiles-internet/hotspot/zugangsdaten\n\nQuestion: Wie erhalte ich die zu meiner Telekom Mobilfunk-Rufnummer gehörenden HotSpot Zugangsdaten?\nAnswer: Um die zu Ihrer Telekom Mobilfunk-Rufnummer gehörenden HotSpot Zugangsdaten zu erhalten, senden Sie eine SMS mit dem Inhalt ""OPEN"" an die 9526. Je nach Tarif können Ihnen für diese SMS Kosten entstehen.\'', 'page_content=\'Source URL: https://www.telekom.de/hilfe/mobilfunk/mobiles-internet/hotspot/zugangsdaten\n\nQuestion: Wie erhalte ich die zu meiner Telekom Mobilfunk-Rufnummer gehörenden HotSpot Zugangsdaten?\nAnswer: Um die zu Ihrer Telekom Mobilfunk-Rufnummer gehörenden HotSpot Zugangsdaten zu erhalten, senden Sie eine SMS mit dem Inhalt ""OPEN"" an die 9526. Je nach Tarif können Ihnen für diese SMS Kosten entstehen.\'']","Um die zu Ihrer Telekom Mobilfunk-Rufnummer gehörenden HotSpot Zugangsdaten zu erhalten, senden Sie eine SMS mit dem Inhalt ""OPEN"" an die 9526. Je nach Tarif können Ihnen für diese SMS Kosten entstehen.",624,0.00011474999999999998,47,4,37.446836948394775,0.9314503882360291,0.999999999975,1.0,1.0,1.0,1.0
Wie kann ich meine Gutschrift einsehen?,"Die Gutschrift ist in Ihrer Rechnung zu finden und wird durch das Minuszeichen vor dem Gutschriftsbetrag angezeigt. Gutschriften und Rechnungen für Mobilfunk-Geräte erhalten Sie ausschließlich per Post. Die Bestätigung der Gutschrift erhalten Sie auf dem gleichen Weg, wie Sie Ihre Rechnung bekommen, z.B. per E-Mail. Wenn Sie weitere Informationen benötigen, besuchen Sie bitte www.telekom.de/hilfe.","[""page_content='Source URL: https://www.telekom.de/hilfe/vertrag-rechnung/rechnung/gutschrift-einsehen\n\nQuestion: Wo kann ich meine Gutschrift sehen?\nAnswer: Die Gutschrift ist in der Rechnung zu finden und am Minuszeichen vor dem Gutschriftsbetrag erkennbar. Gutschriften und Rechnungen für Mobilfunk-Geräte kommen ausschließlich per Post.\nDie Bestätigung der Gutschrift erhalten Sie auf dem gleichen Weg, auf dem Sie Ihre Rechnung bekommen z. B. per E-Mail.'"", ""page_content='Source URL: https://www.telekom.de/hilfe/vertrag-rechnung/rechnung/gutschrift-einsehen\n\nQuestion: Wo kann ich meine Gutschrift sehen?\nAnswer: Die Gutschrift ist in der Rechnung zu finden und am Minuszeichen vor dem Gutschriftsbetrag erkennbar. Gutschriften und Rechnungen für Mobilfunk-Geräte kommen ausschließlich per Post.\nDie Bestätigung der Gutschrift erhalten Sie auf dem gleichen Weg, auf dem Sie Ihre Rechnung bekommen z. B. per E-Mail.'"", ""page_content='Source URL: https://www.telekom.de/hilfe/vertrag-rechnung/rechnung/gutschrift-einsehen\n\nQuestion: Wo kann ich meine Gutschrift sehen?\nAnswer: Die Gutschrift ist in der Rechnung zu finden und am Minuszeichen vor dem Gutschriftsbetrag erkennbar. Gutschriften und Rechnungen für Mobilfunk-Geräte kommen ausschließlich per Post.\nDie Bestätigung der Gutschrift erhalten Sie auf dem gleichen Weg, auf dem Sie Ihre Rechnung bekommen z. B. per E-Mail.'"", ""page_content='Source URL: https://www.telekom.de/hilfe/vertrag-rechnung/rechnung/gutschrift-einsehen\n\nQuestion: Wo kann ich meine Gutschrift sehen?\nAnswer: Die Gutschrift ist in der Rechnung zu finden und am Minuszeichen vor dem Gutschriftsbetrag erkennbar. Gutschriften und Rechnungen für Mobilfunk-Geräte kommen ausschließlich per Post.\nDie Bestätigung der Gutschrift erhalten Sie auf dem gleichen Weg, auf dem Sie Ihre Rechnung bekommen z. B. per E-Mail.'""]",Die Gutschrift ist in der Rechnung zu finden und am Minuszeichen vor dem Gutschriftsbetrag erkennbar. Gutschriften und Rechnungen für Mobilfunk-Geräte kommen ausschließlich per Post.,685,0.00014099999999999998,85,4,40.9357533454895,0.8333364393464914,0.999999999975,1.0,0.8571428571428571,0.21343191066263306,0.5161290322580645
What information can be found in the Mobilfunkrechnung regarding the Wechsel der Rufnummer?,"Es tut mir leid, aber ich kann Ihnen keine spezifischen Informationen zur Mobilfunkrechnung und dem Wechsel der Rufnummer geben. Ich empfehle Ihnen, die Website www.telekom.de/hilfe zu besuchen, um weitere Unterstützung zu erhalten. Dort finden Sie möglicherweise die Informationen, die Sie benötigen.","[""page_content='Source URL: https://telekomhilft.telekom.de/t5/Mobilfunk/Mobilbox-Anrufernummer-ansagen-lassen-moeglich/td-p/6973423/jump-to/first-unread-message\nSubject: Mobilbox - Anrufernummer ansagen lassen möglich?\nContent: Hallo,wie kann ich mir in der Mobilbox (Prepaid Jahrestarif 96GB) beim Abhören der Nachrichten die Nummer des Anrufers ansagen lassen?Hier:https://www.telekom.de/hilfe/downloads/klassische-mobilbox-menueuebersicht.pdfbin ich leider nicht fündig geworden. Auch sonst leider keine passende'"", ""page_content='Source URL: https://telekomhilft.telekom.de/t5/Mobilfunk/Mobilbox-Anrufernummer-ansagen-lassen-moeglich/td-p/6973423/jump-to/first-unread-message\nSubject: Mobilbox - Anrufernummer ansagen lassen möglich?\nContent: Hallo,wie kann ich mir in der Mobilbox (Prepaid Jahrestarif 96GB) beim Abhören der Nachrichten die Nummer des Anrufers ansagen lassen?Hier:https://www.telekom.de/hilfe/downloads/klassische-mobilbox-menueuebersicht.pdfbin ich leider nicht fündig geworden. Auch sonst leider keine passende'"", ""page_content='Source URL: https://telekomhilft.telekom.de/t5/Mobilfunk/Mobilbox-Anrufernummer-ansagen-lassen-moeglich/td-p/6973423/jump-to/first-unread-message\nSubject: Mobilbox - Anrufernummer ansagen lassen möglich?\nContent: Hallo,wie kann ich mir in der Mobilbox (Prepaid Jahrestarif 96GB) beim Abhören der Nachrichten die Nummer des Anrufers ansagen lassen?Hier:https://www.telekom.de/hilfe/downloads/klassische-mobilbox-menueuebersicht.pdfbin ich leider nicht fündig geworden. Auch sonst leider keine passende'"", ""page_content='Source URL: https://telekomhilft.telekom.de/t5/Mobilfunk/Mobilbox-Anrufernummer-ansagen-lassen-moeglich/td-p/6973423/jump-to/first-unread-message\nSubject: Mobilbox - Anrufernummer ansagen lassen möglich?\nContent: Hallo,wie kann ich mir in der Mobilbox (Prepaid Jahrestarif 96GB) beim Abhören der Nachrichten die Nummer des Anrufers ansagen lassen?Hier:https://www.telekom.de/hilfe/downloads/klassische-mobilbox-menueuebersicht.pdfbin ich leider nicht fündig geworden. Auch sonst leider keine passende'""]","Die Mobilfunkrechnung enthält klare Informationen über den Wechsel der Rufnummer, da der Vorgang ganz klar aus der ersten Mobilfunkrechnung hervorgeht.",785,0.00014384999999999997,58,4,35.430078983306885,0.0,0.0,0.0,0.0,0.011326402345230238,0.1176470588235294
What features does the Mobilbox offer for identifying callers when listening to messages?,"Die Mobilbox bietet die Möglichkeit, die Nummer des Anrufers beim Abhören der Nachrichten ansagen zu lassen. Diese Funktion könnte jedoch je nach Tarif und Einstellungen variieren. Um genaue Anweisungen zu erhalten, empfehle ich, die offizielle Telekom-Hilfe-Seite zu besuchen oder die Menüübersicht für die klassische Mobilbox zu konsultieren. Hier ist der Link, den du nutzen kannst: [Menüübersicht Mobilbox](https://www.telekom.de/hilfe/downloads/klassische-mobilbox-menueuebersicht.pdf). Wenn du weitere Fragen hast, lass es mich wissen!","[""page_content='Source URL: https://telekomhilft.telekom.de/t5/Mobilfunk/Mobilbox-Anrufernummer-ansagen-lassen-moeglich/td-p/6973423/jump-to/first-unread-message\nSubject: Mobilbox - Anrufernummer ansagen lassen möglich?\nContent: Hallo,wie kann ich mir in der Mobilbox (Prepaid Jahrestarif 96GB) beim Abhören der Nachrichten die Nummer des Anrufers ansagen lassen?Hier:https://www.telekom.de/hilfe/downloads/klassische-mobilbox-menueuebersicht.pdfbin ich leider nicht fündig geworden. Auch sonst leider keine passende'"", ""page_content='Source URL: https://telekomhilft.telekom.de/t5/Mobilfunk/Mobilbox-Anrufernummer-ansagen-lassen-moeglich/td-p/6973423/jump-to/first-unread-message\nSubject: Mobilbox - Anrufernummer ansagen lassen möglich?\nContent: Hallo,wie kann ich mir in der Mobilbox (Prepaid Jahrestarif 96GB) beim Abhören der Nachrichten die Nummer des Anrufers ansagen lassen?Hier:https://www.telekom.de/hilfe/downloads/klassische-mobilbox-menueuebersicht.pdfbin ich leider nicht fündig geworden. Auch sonst leider keine passende'"", ""page_content='Source URL: https://telekomhilft.telekom.de/t5/Mobilfunk/Mobilbox-Anrufernummer-ansagen-lassen-moeglich/td-p/6973423/jump-to/first-unread-message\nSubject: Mobilbox - Anrufernummer ansagen lassen möglich?\nContent: Hallo,wie kann ich mir in der Mobilbox (Prepaid Jahrestarif 96GB) beim Abhören der Nachrichten die Nummer des Anrufers ansagen lassen?Hier:https://www.telekom.de/hilfe/downloads/klassische-mobilbox-menueuebersicht.pdfbin ich leider nicht fündig geworden. Auch sonst leider keine passende'"", ""page_content='Source URL: https://telekomhilft.telekom.de/t5/Mobilfunk/Mobilbox-Anrufernummer-ansagen-lassen-moeglich/td-p/6973423/jump-to/first-unread-message\nSubject: Mobilbox - Anrufernummer ansagen lassen möglich?\nContent: Hallo,wie kann ich mir in der Mobilbox (Prepaid Jahrestarif 96GB) beim Abhören der Nachrichten die Nummer des Anrufers ansagen lassen?Hier:https://www.telekom.de/hilfe/downloads/klassische-mobilbox-menueuebersicht.pdfbin ich leider nicht fündig geworden. Auch sonst leider keine passende'""]",The answer to given question is not present in context,850,0.00018375,125,4,42.26573729515076,0.0,0.0,0.0,0.8333333333333334,0,0.0
What Arten von Störungen können nicht über die Trassen Defender App gemeldet werden?,"Ich kann Ihnen dabei nicht helfen. Ich empfehle Ihnen, die Webseite www.telekom.de/hilfe zu besuchen, um weitere Unterstützung zu erhalten.","[""page_content='ftig die Nachrichten in der App nicht mehr angezeigt, erscheinen aber wieder auf dem Smartphone oder es werden gar keine Sprachnachrichten angezeigt.'"", ""page_content='ftig die Nachrichten in der App nicht mehr angezeigt, erscheinen aber wieder auf dem Smartphone oder es werden gar keine Sprachnachrichten angezeigt.'"", ""page_content='ftig die Nachrichten in der App nicht mehr angezeigt, erscheinen aber wieder auf dem Smartphone oder es werden gar keine Sprachnachrichten angezeigt.'"", ""page_content='ftig die Nachrichten in der App nicht mehr angezeigt, erscheinen aber wieder auf dem Smartphone oder es werden gar keine Sprachnachrichten angezeigt.'""]",Die Meldung von Beschädigungen an Endverteilern oder Multifunktionsgehäusen ist nicht möglich.,312,5.984999999999999e-05,29,4,37.1428906917572,0.0,0.0,0.0,0.0,0.010182425646195498,0.05405405405405405
Can the camera work with both Alexa and mydlink?,"Ja, die Kamera kann sowohl mit Alexa als auch mit mydlink arbeiten. Du musst zunächst einen mydlink-Account erstellen und die Kamera über die MZA-App einrichten. Danach kannst du den Alexa Skill aktivieren, indem du dich mit deinen mydlink Account-Daten verbindest. Stelle sicher, dass Bluetooth auf deinem Smartphone aktiviert ist, während du die Einrichtung durchführst.","[""page_content='her noch einen mydlink-Account an, bindest die Kamera aber dort nicht direkt ein.Danach folgst Du den Anweisungen in der MZA-App. Zwischendurch wirst Du nach dem mydlink Account gefragt. Die Kamera wird dann dem mydlink-Account zugefügt. Wichtig ist, Bluetooth muss auf dem Smartphone aktiviert sein.Wenn das erledigt ist, kannst Du den Alexa Skill einrichten. Dazu verbindest Du Dich mit den mydlink Account-Daten.\n- Die Kamera lässt sich in beiden Apps einrichten.\n- Die Kamera lässt sich in beiden'"", ""page_content='her noch einen mydlink-Account an, bindest die Kamera aber dort nicht direkt ein.Danach folgst Du den Anweisungen in der MZA-App. Zwischendurch wirst Du nach dem mydlink Account gefragt. Die Kamera wird dann dem mydlink-Account zugefügt. Wichtig ist, Bluetooth muss auf dem Smartphone aktiviert sein.Wenn das erledigt ist, kannst Du den Alexa Skill einrichten. Dazu verbindest Du Dich mit den mydlink Account-Daten.\n- Die Kamera lässt sich in beiden Apps einrichten.\n- Die Kamera lässt sich in beiden'"", ""page_content='her noch einen mydlink-Account an, bindest die Kamera aber dort nicht direkt ein.Danach folgst Du den Anweisungen in der MZA-App. Zwischendurch wirst Du nach dem mydlink Account gefragt. Die Kamera wird dann dem mydlink-Account zugefügt. Wichtig ist, Bluetooth muss auf dem Smartphone aktiviert sein.Wenn das erledigt ist, kannst Du den Alexa Skill einrichten. Dazu verbindest Du Dich mit den mydlink Account-Daten.\n- Die Kamera lässt sich in beiden Apps einrichten.\n- Die Kamera lässt sich in beiden'"", ""page_content='her noch einen mydlink-Account an, bindest die Kamera aber dort nicht direkt ein.Danach folgst Du den Anweisungen in der MZA-App. Zwischendurch wirst Du nach dem mydlink Account gefragt. Die Kamera wird dann dem mydlink-Account zugefügt. Wichtig ist, Bluetooth muss auf dem Smartphone aktiviert sein.Wenn das erledigt ist, kannst Du den Alexa Skill einrichten. Dazu verbindest Du Dich mit den mydlink Account-Daten.\n- Die Kamera lässt sich in beiden Apps einrichten.\n- Die Kamera lässt sich in beiden'""]","Yes, the camera can be set up in both the Alexa app and the mydlink app.",725,0.00014429999999999998,79,4,38.05793571472168,0.9069664571088695,0.999999999975,1.0,1.0,0.00402899484413971,0.07894736842105264
What enables daily cancellation in MagentaMobil Prepaid Max?,"Es tut mir leid, aber ich kann Ihnen nicht direkt sagen, was die tägliche Kündigung im MagentaMobil Prepaid Max ermöglicht. Für ausführliche Informationen zu diesem Thema empfehle ich Ihnen, die Webseite www.telekom.de/hilfe zu besuchen. Dort finden Sie weitere Unterstützung und hilfreiche Informationen.","[""page_content='Source URL: https://www.telekom.de/hilfe/mobilfunk/tarife-optionen/prepaid-tarife/wechsel-laufzeitvertrag\n\nQuestion: Wie kann ich meinen Prepaid-Vertrag in einen Laufzeitvertrag ändern?\nAnswer: Um Ihren Prepaid-Vertrag in einen MagentaMobil Laufzeitvertrag ändern zu können, benötigen wir detaillierte Angaben von Ihnen. Dazu laden Sie sich bitte das Auftragsdokument herunter und schicken es ausgefüllt als Anlage über unser Kontaktformular an uns.'"", ""page_content='Source URL: https://www.telekom.de/hilfe/mobilfunk/tarife-optionen/prepaid-tarife/wechsel-laufzeitvertrag\n\nQuestion: Wie kann ich meinen Prepaid-Vertrag in einen Laufzeitvertrag ändern?\nAnswer: Um Ihren Prepaid-Vertrag in einen MagentaMobil Laufzeitvertrag ändern zu können, benötigen wir detaillierte Angaben von Ihnen. Dazu laden Sie sich bitte das Auftragsdokument herunter und schicken es ausgefüllt als Anlage über unser Kontaktformular an uns.'"", ""page_content='Source URL: https://www.telekom.de/hilfe/mobilfunk/tarife-optionen/prepaid-tarife/wechsel-laufzeitvertrag\n\nQuestion: Wie kann ich meinen Prepaid-Vertrag in einen Laufzeitvertrag ändern?\nAnswer: Um Ihren Prepaid-Vertrag in einen MagentaMobil Laufzeitvertrag ändern zu können, benötigen wir detaillierte Angaben von Ihnen. Dazu laden Sie sich bitte das Auftragsdokument herunter und schicken es ausgefüllt als Anlage über unser Kontaktformular an uns.'"", ""page_content='Source URL: https://www.telekom.de/hilfe/mobilfunk/tarife-optionen/prepaid-tarife/wechsel-laufzeitvertrag\n\nQuestion: Wie kann ich meinen Prepaid-Vertrag in einen Laufzeitvertrag ändern?\nAnswer: Um Ihren Prepaid-Vertrag in einen MagentaMobil Laufzeitvertrag ändern zu können, benötigen wir detaillierte Angaben von Ihnen. Dazu laden Sie sich bitte das Auftragsdokument herunter und schicken es ausgefüllt als Anlage über unser Kontaktformular an uns.'""]","The ability to cancel daily in MagentaMobil Prepaid Max is enabled by the absence of a contractual obligation, allowing customers the flexibility to cancel at any time.",643,0.00012389999999999998,61,4,38.51734495162964,0.0,0.0,0.0,0.0,0.021739441181346644,0.07692307692307691
Welche Laufzeiten gibt's für MagentaTV WOW und wie variieren die Inhalte?,"Bei MagentaTV WOW gibt es verschiedene Laufzeiten und Inhalte, die sich unterscheiden. Die Vertragslaufzeiten sind in der Regel als Monatsabo verfügbar. 

Die Inhalte variieren in den verschiedenen WOW Paketen, die Folgendes umfassen:
- Filme & Serien (Standard/Premium)
- Live-Sport (inkl. Premium)
- Sport, Filme & Serien (inkl. Premium)

Bitte beachte, dass WOW by Telekom nur in Verbindung mit einem MagentaTV Tarif verfügbar ist. Wenn du weitere Informationen benötigst, besuche bitte www.telekom.de/hilfe.","[""page_content='Source URL: https://www.telekom.de/hilfe/tv/inhalte/wow/abos\n\nQuestion: Welche Unterschiede gibt es bei den MagentaTV WOW Optionen?\nAnswer: Es gibt verschiedeneWOW Paketebei MagentaTV, die sich im Inhalt (z.\xa0B. Serien oder Live-Sport) und in der Vertragslaufzeit unterscheiden:\nHinweis:WOW by Telekom gibt es nur in Verbindung mit einem MagentaTV Tarif.\n• Pakete: Filme & Serien Standard/Premium, Live-Sport (inkl. Premium) und Sport, Filme & Serien (inkl. Premium)\n• Vertragslaufzeit: Monatsabo und/'"", ""page_content='Source URL: https://www.telekom.de/hilfe/tv/inhalte/wow/abos\n\nQuestion: Welche Unterschiede gibt es bei den MagentaTV WOW Optionen?\nAnswer: Es gibt verschiedeneWOW Paketebei MagentaTV, die sich im Inhalt (z.\xa0B. Serien oder Live-Sport) und in der Vertragslaufzeit unterscheiden:\nHinweis:WOW by Telekom gibt es nur in Verbindung mit einem MagentaTV Tarif.\n• Pakete: Filme & Serien Standard/Premium, Live-Sport (inkl. Premium) und Sport, Filme & Serien (inkl. Premium)\n• Vertragslaufzeit: Monatsabo und/'"", ""page_content='Source URL: https://www.telekom.de/hilfe/tv/inhalte/wow/abos\n\nQuestion: Welche Unterschiede gibt es bei den MagentaTV WOW Optionen?\nAnswer: Es gibt verschiedeneWOW Paketebei MagentaTV, die sich im Inhalt (z.\xa0B. Serien oder Live-Sport) und in der Vertragslaufzeit unterscheiden:\nHinweis:WOW by Telekom gibt es nur in Verbindung mit einem MagentaTV Tarif.\n• Pakete: Filme & Serien Standard/Premium, Live-Sport (inkl. Premium) und Sport, Filme & Serien (inkl. Premium)\n• Vertragslaufzeit: Monatsabo und/'"", ""page_content='Source URL: https://www.telekom.de/hilfe/tv/inhalte/wow/abos\n\nQuestion: Welche Unterschiede gibt es bei den MagentaTV WOW Optionen?\nAnswer: Es gibt verschiedeneWOW Paketebei MagentaTV, die sich im Inhalt (z.\xa0B. Serien oder Live-Sport) und in der Vertragslaufzeit unterscheiden:\nHinweis:WOW by Telekom gibt es nur in Verbindung mit einem MagentaTV Tarif.\n• Pakete: Filme & Serien Standard/Premium, Live-Sport (inkl. Premium) und Sport, Filme & Serien (inkl. Premium)\n• Vertragslaufzeit: Monatsabo und/'""]","Die Laufzeiten für MagentaTV WOW variieren zwischen Monatsabo und Jahresabo. Die Inhalte unterscheiden sich je nach Paket, das Filme & Serien Standard/Premium, Live-Sport (inkl. Premium) und Sport, Filme & Serien (inkl. Premium) umfasst.",826,0.00017565,115,4,40.88932991027832,0.8964513857221609,0.999999999975,0.5,0.8,0.11690776818141621,0.33333333333333337
"What challenges does Telekom face with FTTH, given its infrastructure and market competition?","Die Telekom steht bei der Einführung von FTTH (Fiber to the Home) vor mehreren Herausforderungen, insbesondere in Bezug auf ihre Infrastruktur und den Wettbewerb auf dem Markt. Die zunehmende Zahl von FTTH-Netzbetreibern erfordert, dass die Telekom Kooperationen eingeht, um wettbewerbsfähig zu bleiben. Aktuell existieren bereits einige Kooperationen, jedoch sind weitere Partnerschaften und Strategien notwendig, um in einem sich schnell verändernden Markt erfolgreich zu sein. 

Die bestehenden Kooperationen sind möglicherweise nicht ausreichend, um die benötigte Reichweite und Kapazität zu gewährleisten, und es könnte auch erforderlich sein, neue Technologien zu integrieren, um mit den Mitbewerbern Schritt zu halten. Die Herausforderungen sind also sowohl technischer als auch strategischer Natur, da die Telekom sich anpassen muss, um in diesem Bereich weiterhin eine relevante Rolle zu spielen.","[""page_content='die Telekom mit immer mehr FTTH-Netzbetreibern entspr. Kooperationen eingehen wird und dann auch vermehrt als Anbieter i.V.m.FTTHder versch. Netzbetreiber möglich sein könnte. Aber das ist, von den aktuellbereits bestehenden Kooperationenabgesehen (die SVO ist nicht dabei), noch Zukunftsmusik.'"", ""page_content='die Telekom mit immer mehr FTTH-Netzbetreibern entspr. Kooperationen eingehen wird und dann auch vermehrt als Anbieter i.V.m.FTTHder versch. Netzbetreiber möglich sein könnte. Aber das ist, von den aktuellbereits bestehenden Kooperationenabgesehen (die SVO ist nicht dabei), noch Zukunftsmusik.'"", ""page_content='die Telekom mit immer mehr FTTH-Netzbetreibern entspr. Kooperationen eingehen wird und dann auch vermehrt als Anbieter i.V.m.FTTHder versch. Netzbetreiber möglich sein könnte. Aber das ist, von den aktuellbereits bestehenden Kooperationenabgesehen (die SVO ist nicht dabei), noch Zukunftsmusik.'"", ""page_content='die Telekom mit immer mehr FTTH-Netzbetreibern entspr. Kooperationen eingehen wird und dann auch vermehrt als Anbieter i.V.m.FTTHder versch. Netzbetreiber möglich sein könnte. Aber das ist, von den aktuellbereits bestehenden Kooperationenabgesehen (die SVO ist nicht dabei), noch Zukunftsmusik.'""]","Telekom faces challenges with FTTH as it cannot provide connections everywhere due to its existing infrastructure, which is primarily based on copper lines and xDSL. The company may need to rely on partnerships with FTTH network operators, but currently, there are no existing collaborations with the SVO, which limits its ability to offer FTTH services. Additionally, the traditional basic service obligations of Telekom are changing with the introduction of FTTH, indicating a shift in market dynamics and competition.",631,0.0001725,173,4,56.3865020275116,0.9587870569121312,0.999999999975,0.3333333333333333,0.13333333333333333,0.00230977385156945,0.06698564593301436
Welche IP-Telefonie-Funktionen bietet EasySupport für Telekom-Kunden und wie wird der Speedport W 724V konfiguriert?,"Die IP-Telefonie-Funktionen, die EasySupport für Telekom-Kunden bietet, beinhalten die automatische Einrichtung aller für Sie reservierten Rufnummern auf Ihrem Speedport-Router. Dabei werden bereits eingerichtete Rufnummern überschrieben, und der Router wird auf den Betrieb mit IP-basierter Telefonie eingestellt. Die Verbindung ins Internet wird dauerhaft aktiviert, während alle anderen Einstellungen auf Ihrem Speedport unverändert bleiben.

Die automatische Einrichtung der IP-basierten Telefonie können Sie direkt über [www.telekom.de/einrichten](https://www.telekom.de/einrichten) aufrufen. Diese Möglichkeit steht Ihnen außerdem im Speedport-Service des Telekom Kundencenters zur Verfügung.","[""page_content='Source URL: https://www.telekom.de/hilfe/geraete-zubehoer/einrichtung-support/easysupport/automatische-einrichtung/automatische-einrichtung-telefonie\n\nQuestion: Was ist die automatische Einrichtung der Telefonie?\nAnswer: Die automatische Einrichtung der\xa0Telefonie ist ein EasySupport Service für Telekom Kunden. Durch diesen werden alle für Sie reservierten Rufnummern automatisch auf Ihrem Speedport eingerichtet.\nBereits eingerichtete Rufnummern können dabei überschrieben werden. Außerdem wird der Router auf den Betrieb mit IP-basierter Telefonie eingestellt und die Verbindung ins Internet dauerhaft aktiviert. Alle anderen Einstellungen auf Ihrem Speedport bleiben unverändert.\nDie automatische Einrichtung der IP-basierten Telefonie können Sie direkt überwww.telekom.de/einrichtenaufrufen.\nDiese\xa0Möglichkeit\xa0steht Ihnen außerdem im Speedport-Service\xa0des Telekom Kundencenters Verfügung.'"", ""page_content='Source URL: https://www.telekom.de/hilfe/geraete-zubehoer/einrichtung-support/easysupport/automatische-einrichtung/automatische-einrichtung-telefonie\n\nQuestion: Was ist die automatische Einrichtung der Telefonie?\nAnswer: Die automatische Einrichtung der\xa0Telefonie ist ein EasySupport Service für Telekom Kunden. Durch diesen werden alle für Sie reservierten Rufnummern automatisch auf Ihrem Speedport eingerichtet.\nBereits eingerichtete Rufnummern können dabei überschrieben werden. Außerdem wird der Router auf den Betrieb mit IP-basierter Telefonie eingestellt und die Verbindung ins Internet dauerhaft aktiviert. Alle anderen Einstellungen auf Ihrem Speedport bleiben unverändert.\nDie automatische Einrichtung der IP-basierten Telefonie können Sie direkt überwww.telekom.de/einrichtenaufrufen.\nDiese\xa0Möglichkeit\xa0steht Ihnen außerdem im Speedport-Service\xa0des Telekom Kundencenters Verfügung.'"", ""page_content='Source URL: https://www.telekom.de/hilfe/geraete-zubehoer/einrichtung-support/easysupport/automatische-einrichtung/automatische-einrichtung-telefonie\n\nQuestion: Was ist die automatische Einrichtung der Telefonie?\nAnswer: Die automatische Einrichtung der\xa0Telefonie ist ein EasySupport Service für Telekom Kunden. Durch diesen werden alle für Sie reservierten Rufnummern automatisch auf Ihrem Speedport eingerichtet.\nBereits eingerichtete Rufnummern können dabei überschrieben werden. Außerdem wird der Router auf den Betrieb mit IP-basierter Telefonie eingestellt und die Verbindung ins Internet dauerhaft aktiviert. Alle anderen Einstellungen auf Ihrem Speedport bleiben unverändert.\nDie automatische Einrichtung der IP-basierten Telefonie können Sie direkt überwww.telekom.de/einrichtenaufrufen.\nDiese\xa0Möglichkeit\xa0steht Ihnen außerdem im Speedport-Service\xa0des Telekom Kundencenters Verfügung.'"", ""page_content='Source URL: https://www.telekom.de/hilfe/geraete-zubehoer/einrichtung-support/easysupport/automatische-einrichtung/automatische-einrichtung-telefonie\n\nQuestion: Was ist die automatische Einrichtung der Telefonie?\nAnswer: Die automatische Einrichtung der\xa0Telefonie ist ein EasySupport Service für Telekom Kunden. Durch diesen werden alle für Sie reservierten Rufnummern automatisch auf Ihrem Speedport eingerichtet.\nBereits eingerichtete Rufnummern können dabei überschrieben werden. Außerdem wird der Router auf den Betrieb mit IP-basierter Telefonie eingestellt und die Verbindung ins Internet dauerhaft aktiviert. Alle anderen Einstellungen auf Ihrem Speedport bleiben unverändert.\nDie automatische Einrichtung der IP-basierten Telefonie können Sie direkt überwww.telekom.de/einrichtenaufrufen.\nDiese\xa0Möglichkeit\xa0steht Ihnen außerdem im Speedport-Service\xa0des Telekom Kundencenters Verfügung.'""]","Die automatische Einrichtung der Telefonie ist ein EasySupport Service für Telekom Kunden, der alle für Sie reservierten Rufnummern automatisch auf Ihrem Speedport einrichtet. Um den Speedport W 724V zu konfigurieren, wählen Sie sich über speedport.ip in die Einrichtung Ihres Routers ein, wechseln in den Bereich ""Internet"" für die Zugangsdaten und in den Bereich ""Telefonie"" zur Einrichtung der Rufnummern.",1088,0.00022574999999999998,139,4,47.49177384376526,0.8925761867436995,0.999999999975,0.5,1.0,0.08977390984291289,0.2716049382716049
