Question,Response,Contexts,Ground Truth,Token Count,Total Cost (USD),Completion Tokens,Number of Retrieved documents,Response time,answer_relevancy,context_precision,context_recall,faithfulness,BleuScore,RougeScore
What benefits can users expect from the GÖNN-Tarif?,"Der GÖNN-Tarif bietet seinen Nutzern einige Vorteile, darunter:

1. **9 Dayflats pro Monat**: Jeder GÖNN-Kunde erhält automatisch 9 Dayflats, unabhängig von vorher geworbenen Freunden. 
2. **Einfache Nutzung**: Der Tarif kann normal genutzt werden, sobald er aktiv ist, ohne dass Anpassungen erforderlich sind. Nutzer können ihren Tarif direkt in der MeinMagenta App verwalten.

Bitte beachten Sie, dass es keine neuen GÖNN-Tarife mehr gibt, aber es gibt viele Angebote für junge Leute bei Telekom Young.","[""page_content='Question: Kann ich gönn weiterhin buchen?\nAnswer: Einen neuen GÖNN-Tarif kannst du leider nicht mehr abschließen. Jedoch gibt es viele Angebote für junge Leute für dich bei Telekom Young.\n\nQuestion: Mein gönn tarif wird erst in der zukunft aktiv, was passiert jetzt?\nAnswer: Keine Sorge du kannst deinen Tarif ganz normal nutzen und musst nichts anpassen. Dein Tarif wird aktiv und du nutzt ihn direkt in der MeinMagenta App.\n\nQuestion: Wird es weiterhin friends with gönnefits geben?\nAnswer: Friends with Gönnefits wird es so nicht mehr geben. Es wird sogar besser, jeder GÖNN Kunde bekommt automatisch 9 Dayflats pro Monat, unabhängig von vorher geworbenen Freunden.'"", ""page_content='Question: Kann ich gönn weiterhin buchen?\nAnswer: Einen neuen GÖNN-Tarif kannst du leider nicht mehr abschließen. Jedoch gibt es viele Angebote für junge Leute für dich bei Telekom Young.\n\nQuestion: Mein gönn tarif wird erst in der zukunft aktiv, was passiert jetzt?\nAnswer: Keine Sorge du kannst deinen Tarif ganz normal nutzen und musst nichts anpassen. Dein Tarif wird aktiv und du nutzt ihn direkt in der MeinMagenta App.\n\nQuestion: Wird es weiterhin friends with gönnefits geben?\nAnswer: Friends with Gönnefits wird es so nicht mehr geben. Es wird sogar besser, jeder GÖNN Kunde bekommt automatisch 9 Dayflats pro Monat, unabhängig von vorher geworbenen Freunden.'"", ""page_content='Question: Kann ich gönn weiterhin buchen?\nAnswer: Einen neuen GÖNN-Tarif kannst du leider nicht mehr abschließen. Jedoch gibt es viele Angebote für junge Leute für dich bei Telekom Young.\n\nQuestion: Mein gönn tarif wird erst in der zukunft aktiv, was passiert jetzt?\nAnswer: Keine Sorge du kannst deinen Tarif ganz normal nutzen und musst nichts anpassen. Dein Tarif wird aktiv und du nutzt ihn direkt in der MeinMagenta App.\n\nQuestion: Wird es weiterhin friends with gönnefits geben?\nAnswer: Friends with Gönnefits wird es so nicht mehr geben. Es wird sogar besser, jeder GÖNN Kunde bekommt automatisch 9 Dayflats pro Monat, unabhängig von vorher geworbenen Freunden.'"", ""page_content='Question: Kann ich gönn weiterhin buchen?\nAnswer: Einen neuen GÖNN-Tarif kannst du leider nicht mehr abschließen. Jedoch gibt es viele Angebote für junge Leute für dich bei Telekom Young.\n\nQuestion: Mein gönn tarif wird erst in der zukunft aktiv, was passiert jetzt?\nAnswer: Keine Sorge du kannst deinen Tarif ganz normal nutzen und musst nichts anpassen. Dein Tarif wird aktiv und du nutzt ihn direkt in der MeinMagenta App.\n\nQuestion: Wird es weiterhin friends with gönnefits geben?\nAnswer: Friends with Gönnefits wird es so nicht mehr geben. Es wird sogar besser, jeder GÖNN Kunde bekommt automatisch 9 Dayflats pro Monat, unabhängig von vorher geworbenen Freunden.'""]",The answer to given question is not present in context,909,0.00019079999999999998,121,4,55.78822922706604,0.9763779548490091,0.0,1.0,1.0,0.0024874082113819154,0.021505376344086023
"What bedeutet es, dass das System in einem alarmfähigen Zustand verbleibt?","Das bedeutet, dass das System in der Lage ist, neue Alarmereignisse zu erkennen und zu signalisieren. Es bleibt also bereit, um auf mögliche Alarme zu reagieren, auch wenn es bereits aktiviert wurde.","['page_content=\'en bleiben für eine Minute eingeschaltet, die Dimmer und Lampen leuchten 60 Minuten weiter. Das System verbleibt in einem alarmfähigen Zustand, d. h. es ist in der Lage, neue Alarmereignisse zu erkennen und zu signalisieren.\nDas Alarmsystem aktivieren und deaktivierenDas Alarmsystem wird automatisch aktiviert, wenn Sie Ihren Anwesenheitsstatus auf ""Abwesend"" wechseln. Daneben können Sie es auch über eine zugeordnete Funk-Fernbedienung, einen Wandtaster oder über das Menü ""Alarmsystem"" aktivieren\'', 'page_content=\'en bleiben für eine Minute eingeschaltet, die Dimmer und Lampen leuchten 60 Minuten weiter. Das System verbleibt in einem alarmfähigen Zustand, d. h. es ist in der Lage, neue Alarmereignisse zu erkennen und zu signalisieren.\nDas Alarmsystem aktivieren und deaktivierenDas Alarmsystem wird automatisch aktiviert, wenn Sie Ihren Anwesenheitsstatus auf ""Abwesend"" wechseln. Daneben können Sie es auch über eine zugeordnete Funk-Fernbedienung, einen Wandtaster oder über das Menü ""Alarmsystem"" aktivieren\'', 'page_content=\'en bleiben für eine Minute eingeschaltet, die Dimmer und Lampen leuchten 60 Minuten weiter. Das System verbleibt in einem alarmfähigen Zustand, d. h. es ist in der Lage, neue Alarmereignisse zu erkennen und zu signalisieren.\nDas Alarmsystem aktivieren und deaktivierenDas Alarmsystem wird automatisch aktiviert, wenn Sie Ihren Anwesenheitsstatus auf ""Abwesend"" wechseln. Daneben können Sie es auch über eine zugeordnete Funk-Fernbedienung, einen Wandtaster oder über das Menü ""Alarmsystem"" aktivieren\'', 'page_content=\'en bleiben für eine Minute eingeschaltet, die Dimmer und Lampen leuchten 60 Minuten weiter. Das System verbleibt in einem alarmfähigen Zustand, d. h. es ist in der Lage, neue Alarmereignisse zu erkennen und zu signalisieren.\nDas Alarmsystem aktivieren und deaktivierenDas Alarmsystem wird automatisch aktiviert, wenn Sie Ihren Anwesenheitsstatus auf ""Abwesend"" wechseln. Daneben können Sie es auch über eine zugeordnete Funk-Fernbedienung, einen Wandtaster oder über das Menü ""Alarmsystem"" aktivieren\'']","Das System in einem alarmfähigen Zustand zu verbleiben bedeutet, dass es in der Lage ist, neue Alarmereignisse zu erkennen und zu signalisieren.",702,0.0001251,44,4,48.418885231018066,0.9197835553966724,0.999999999975,1.0,0.75,0.36118768542859303,0.5
Wo befindet sich die Glasfaser-Dose in Einfamilienhäusern?,"In Einfamilienhäusern befindet sich die Glasfaser-Dose in der Regel im Keller, wo die Glasfaserleitung in das Haus geführt wird. Von dort aus können Kabel in die verschiedenen Wohnungen oder Räume verteilt werden. Es ist möglich, das Modem im Keller anzuschließen und die Verbindung von dort zu verteilen. Der Techniker kann die notwendigen Anpassungen vornehmen, um die Glasfaser-Dose entsprechend zu installieren. Wenn Sie weitere Informationen benötigen oder spezifische Fragen haben, empfehle ich Ihnen, die Unterstützung auf www.telekom.de/hilfe zu besuchen.","['page_content=\'Source URL: https://telekomhilft.telekom.de/t5/Festnetz-Internet/Glasfaser-im-Keller-anschliessen-anstatt-in-den-Wohnungen/td-p/6959774/jump-to/first-unread-message\nSubject: Glasfaser im Keller anschließen anstatt in den Wohnungen\nContent: Hi!Wir haben uns ein Haus gekauft, in dem Glasfaser möglich ist.Vom Keller gehen Kabel in beide Wohnungen.Wir würden aber das Modem gerne im Keller anschließen und von dort in die Wohnungen verteilen. Ist das grundsätzlich möglich? Kann der Techniker dann einfach das Kabel ""abknipsen""?\'', 'page_content=\'Source URL: https://telekomhilft.telekom.de/t5/Festnetz-Internet/Glasfaser-im-Keller-anschliessen-anstatt-in-den-Wohnungen/td-p/6959774/jump-to/first-unread-message\nSubject: Glasfaser im Keller anschließen anstatt in den Wohnungen\nContent: Hi!Wir haben uns ein Haus gekauft, in dem Glasfaser möglich ist.Vom Keller gehen Kabel in beide Wohnungen.Wir würden aber das Modem gerne im Keller anschließen und von dort in die Wohnungen verteilen. Ist das grundsätzlich möglich? Kann der Techniker dann einfach das Kabel ""abknipsen""?\'', 'page_content=\'Source URL: https://telekomhilft.telekom.de/t5/Festnetz-Internet/Glasfaser-im-Keller-anschliessen-anstatt-in-den-Wohnungen/td-p/6959774/jump-to/first-unread-message\nSubject: Glasfaser im Keller anschließen anstatt in den Wohnungen\nContent: Hi!Wir haben uns ein Haus gekauft, in dem Glasfaser möglich ist.Vom Keller gehen Kabel in beide Wohnungen.Wir würden aber das Modem gerne im Keller anschließen und von dort in die Wohnungen verteilen. Ist das grundsätzlich möglich? Kann der Techniker dann einfach das Kabel ""abknipsen""?\'', 'page_content=\'Source URL: https://telekomhilft.telekom.de/t5/Festnetz-Internet/Glasfaser-im-Keller-anschliessen-anstatt-in-den-Wohnungen/td-p/6959774/jump-to/first-unread-message\nSubject: Glasfaser im Keller anschließen anstatt in den Wohnungen\nContent: Hi!Wir haben uns ein Haus gekauft, in dem Glasfaser möglich ist.Vom Keller gehen Kabel in beide Wohnungen.Wir würden aber das Modem gerne im Keller anschließen und von dort in die Wohnungen verteilen. Ist das grundsätzlich möglich? Kann der Techniker dann einfach das Kabel ""abknipsen""?\'']",In Einfamilienhäusern befindet sich die Glasfaser-Dose in der Regel im Keller in einem Umkreis von bis zu 3 Metern um den Hausanschluss bzw. Eintrittspunkt.,831,0.00017729999999999997,117,4,56.63863778114319,0.8640592480941804,0.999999999975,1.0,0.3,0.1251568936672046,0.29059829059829057
What steps should you follow to buchen Optionen in der MeinMagenta App?,"Um Optionen in der MeinMagenta App zu buchen, folgen Sie bitte diesen Schritten:

1. Öffnen Sie die MeinMagenta App.
2. Klicken Sie auf Ihren Mobilfunk-Vertrag.
3. Wählen Sie den Bereich ""Optionen"".
4. Klicken Sie auf ""Optionen buchen"".
5. Wählen Sie die gewünschte Option aus.
6. Folgen Sie den weiteren Schritten zur Bestätigung.

Falls Sie die Option ""Travel Mobil World"" buchen möchten, klicken Sie bitte auf ""Travel Mobil"". Viel Erfolg!","['page_content=\'langen Sie zur Übersicht der Zubuchoptionen. Wählen Sie dort Ihre Option aus und folgen Sie den weiteren Schritten.Hinweis: ""Travel Mobil World"" wählen Sie durch Klick auf ""Travel Mobil"".\nMeinMagenta AppKlicken Sie in derMeinMagenta Appauf den Mobilfunk-Vertrag, dann auf ""Optionen"" und auf ""Optionen buchen"". Wählen Sie die Option aus und folgen Sie den weiteren Schritten.\'', 'page_content=\'langen Sie zur Übersicht der Zubuchoptionen. Wählen Sie dort Ihre Option aus und folgen Sie den weiteren Schritten.Hinweis: ""Travel Mobil World"" wählen Sie durch Klick auf ""Travel Mobil"".\nMeinMagenta AppKlicken Sie in derMeinMagenta Appauf den Mobilfunk-Vertrag, dann auf ""Optionen"" und auf ""Optionen buchen"". Wählen Sie die Option aus und folgen Sie den weiteren Schritten.\'', 'page_content=\'langen Sie zur Übersicht der Zubuchoptionen. Wählen Sie dort Ihre Option aus und folgen Sie den weiteren Schritten.Hinweis: ""Travel Mobil World"" wählen Sie durch Klick auf ""Travel Mobil"".\nMeinMagenta AppKlicken Sie in derMeinMagenta Appauf den Mobilfunk-Vertrag, dann auf ""Optionen"" und auf ""Optionen buchen"". Wählen Sie die Option aus und folgen Sie den weiteren Schritten.\'', 'page_content=\'langen Sie zur Übersicht der Zubuchoptionen. Wählen Sie dort Ihre Option aus und folgen Sie den weiteren Schritten.Hinweis: ""Travel Mobil World"" wählen Sie durch Klick auf ""Travel Mobil"".\nMeinMagenta AppKlicken Sie in derMeinMagenta Appauf den Mobilfunk-Vertrag, dann auf ""Optionen"" und auf ""Optionen buchen"". Wählen Sie die Option aus und folgen Sie den weiteren Schritten.\'']","Um Optionen in der MeinMagenta App zu buchen, klicke auf dem Home Screen auf deinen GÖNN Vertrag, dann in der Mitte auf ""Optionen buchen"" und schließlich auf ""Datenpass"".",646,0.00014595,109,4,54.87351393699646,0.9431768749561105,0.6388888888675925,0.0,0.875,0.10854352878303279,0.26666666666666666
Wie können Sie Apps auf Ihrem Android-Smartphone vollständig schließen?,"Um Apps auf Ihrem Android-Smartphone vollständig zu schließen, können Sie die folgenden Schritte befolgen:

1. **Öffnen Sie die Übersicht der laufenden Apps**: Tippen Sie auf die Schaltfläche „Übersicht“ oder „Letzte Apps“ (dies ist oft ein Quadrat oder eine vertikale Linie), die sich normalerweise unten auf dem Bildschirm befindet.

2. **Wischen Sie die App nach oben oder zur Seite**: Suchen Sie die App, die Sie schließen möchten, und wischen Sie sie einfach nach oben oder zur Seite, um sie zu schließen.

3. **Alle Apps schließen**: In einigen Android-Versionen gibt es auch die Option „Alle schließen“. Tippen Sie darauf, um alle geöffneten Apps gleichzeitig zu schließen.

Bitte beachten Sie, dass das Schließen von Apps nicht immer notwendig ist, da Android die Ressourcen effizient verwaltet. Wenn Sie weitere Hilfe benötigen, besuchen Sie bitte www.telekom.de/hilfe.","[""page_content='Question:\nWissen Sie, wie Sie Apps auf Ihrem Android-Smartphone vollständig schließen können?'"", ""page_content='Question:\nWissen Sie, wie Sie Apps auf Ihrem Android-Smartphone vollständig schließen können?'"", ""page_content='Question:\nWissen Sie, wie Sie Apps auf Ihrem Android-Smartphone vollständig schließen können?'"", ""page_content='Question:\nWissen Sie, wie Sie Apps auf Ihrem Android-Smartphone vollständig schließen können?'""]","Auf unserer Webseite informieren wir darüber, wie auf einem Android-Smartphone Apps vollständig beendet werden können.",441,0.00015345,194,4,61.14076113700867,0.9834087405156501,0.0,1.0,0.6363636363636364,0.0019420545110794586,0.08333333333333334
What to do for managing camera recordings in Magenta SmartHome?,"Es tut mir leid, aber ich kann Ihnen bei der Verwaltung von Kameraaufnahmen in Magenta SmartHome nicht direkt helfen. Ich empfehle Ihnen, die offizielle Webseite von Telekom unter www.telekom.de/hilfe zu besuchen, um weitere Unterstützung zu erhalten.","['page_content=\'Question: Wie schalte ich Benachrichtigungen für Magenta SmartHome ein oder aus?\nAnswer: Sie können während der Installation von Magenta SmartHome oder auch nachträglich festlegen, ob\xa0Sie Benachrichtigungen auf Ihrem Smartphone oder Tablet erhalten möchten.\nEinrichtung während\xa0der InstallationWährend der Installation der Magenta SmartHome App werden Sie gefragt, ob Sie Benachrichtigungen erhalten möchten. Bestätigen Sie dies, damit Sie über die App zu Alarmen, Informationen Ihres Wasser- oder Rauchmelders, Unwetterwarnungen und zum Batterieladestand Nachrichten erhalten.\nNachträgliche EinrichtungUm die Benachrichtigungen nachträglich zu aktivieren bzw. deaktivieren, öffnen Sie die Magenta SmartHome App und wählen Sie ""Mehr > Einstellungen > Nachrichten""\xa0aus. Jetzt können Sie die Benachrichtigungen wie gewünscht ein- oder ausschalten.\'', 'page_content=\'Question: Wie schalte ich Benachrichtigungen für Magenta SmartHome ein oder aus?\nAnswer: Sie können während der Installation von Magenta SmartHome oder auch nachträglich festlegen, ob\xa0Sie Benachrichtigungen auf Ihrem Smartphone oder Tablet erhalten möchten.\nEinrichtung während\xa0der InstallationWährend der Installation der Magenta SmartHome App werden Sie gefragt, ob Sie Benachrichtigungen erhalten möchten. Bestätigen Sie dies, damit Sie über die App zu Alarmen, Informationen Ihres Wasser- oder Rauchmelders, Unwetterwarnungen und zum Batterieladestand Nachrichten erhalten.\nNachträgliche EinrichtungUm die Benachrichtigungen nachträglich zu aktivieren bzw. deaktivieren, öffnen Sie die Magenta SmartHome App und wählen Sie ""Mehr > Einstellungen > Nachrichten""\xa0aus. Jetzt können Sie die Benachrichtigungen wie gewünscht ein- oder ausschalten.\'', 'page_content=\'Question: Wie schalte ich Benachrichtigungen für Magenta SmartHome ein oder aus?\nAnswer: Sie können während der Installation von Magenta SmartHome oder auch nachträglich festlegen, ob\xa0Sie Benachrichtigungen auf Ihrem Smartphone oder Tablet erhalten möchten.\nEinrichtung während\xa0der InstallationWährend der Installation der Magenta SmartHome App werden Sie gefragt, ob Sie Benachrichtigungen erhalten möchten. Bestätigen Sie dies, damit Sie über die App zu Alarmen, Informationen Ihres Wasser- oder Rauchmelders, Unwetterwarnungen und zum Batterieladestand Nachrichten erhalten.\nNachträgliche EinrichtungUm die Benachrichtigungen nachträglich zu aktivieren bzw. deaktivieren, öffnen Sie die Magenta SmartHome App und wählen Sie ""Mehr > Einstellungen > Nachrichten""\xa0aus. Jetzt können Sie die Benachrichtigungen wie gewünscht ein- oder ausschalten.\'', 'page_content=\'Question: Wie schalte ich Benachrichtigungen für Magenta SmartHome ein oder aus?\nAnswer: Sie können während der Installation von Magenta SmartHome oder auch nachträglich festlegen, ob\xa0Sie Benachrichtigungen auf Ihrem Smartphone oder Tablet erhalten möchten.\nEinrichtung während\xa0der InstallationWährend der Installation der Magenta SmartHome App werden Sie gefragt, ob Sie Benachrichtigungen erhalten möchten. Bestätigen Sie dies, damit Sie über die App zu Alarmen, Informationen Ihres Wasser- oder Rauchmelders, Unwetterwarnungen und zum Batterieladestand Nachrichten erhalten.\nNachträgliche EinrichtungUm die Benachrichtigungen nachträglich zu aktivieren bzw. deaktivieren, öffnen Sie die Magenta SmartHome App und wählen Sie ""Mehr > Einstellungen > Nachrichten""\xa0aus. Jetzt können Sie die Benachrichtigungen wie gewünscht ein- oder ausschalten.\'']",The answer to given question is not present in context,983,0.00017085,52,4,55.17015504837036,0.0,0.0,0.0,0.0,0.005157142709886005,0.04000000000000001
Wie aktiviere ich eine zufällige PIN auf pass.telekom.de?,"Um eine zufällige PIN auf pass.telekom.de zu aktivieren, gehen Sie bitte auf die Seite ""pass.telekom.de"". Scrollen Sie nach unten zu ""Nützliche Übersichten"" und wählen Sie den Menüpunkt ""PIN-Schutz"". Dort können Sie die Aktivierung und Deaktivierung vornehmen. Bei der Aktivierung erhalten Sie eine zufällig erstellte PIN, die Ihnen direkt angezeigt und zusätzlich per SMS an Ihr Handy gesendet wird.","['page_content=\'Question: Wie bekomme ich eine PIN für pass.telekom.de?\nAnswer: Die Aktivierung und Deaktivierung ist unten\xa0auf der Seite ""pass.telekom.de"" unter ""Nützliche Übersichten"" im Menüpunkt ""PIN-Schutz"" möglich.\nHinweis: Bei der Aktivierung wird eine zufällig erstellte PIN vergeben, die Sie direkt angezeigt und zusätzlich noch per SMS ans Handy gesendet bekommen.\'', 'page_content=\'Question: Wie bekomme ich eine PIN für pass.telekom.de?\nAnswer: Die Aktivierung und Deaktivierung ist unten\xa0auf der Seite ""pass.telekom.de"" unter ""Nützliche Übersichten"" im Menüpunkt ""PIN-Schutz"" möglich.\nHinweis: Bei der Aktivierung wird eine zufällig erstellte PIN vergeben, die Sie direkt angezeigt und zusätzlich noch per SMS ans Handy gesendet bekommen.\'', 'page_content=\'Question: Wie bekomme ich eine PIN für pass.telekom.de?\nAnswer: Die Aktivierung und Deaktivierung ist unten\xa0auf der Seite ""pass.telekom.de"" unter ""Nützliche Übersichten"" im Menüpunkt ""PIN-Schutz"" möglich.\nHinweis: Bei der Aktivierung wird eine zufällig erstellte PIN vergeben, die Sie direkt angezeigt und zusätzlich noch per SMS ans Handy gesendet bekommen.\'', 'page_content=\'Question: Wie bekomme ich eine PIN für pass.telekom.de?\nAnswer: Die Aktivierung und Deaktivierung ist unten\xa0auf der Seite ""pass.telekom.de"" unter ""Nützliche Übersichten"" im Menüpunkt ""PIN-Schutz"" möglich.\nHinweis: Bei der Aktivierung wird eine zufällig erstellte PIN vergeben, die Sie direkt angezeigt und zusätzlich noch per SMS ans Handy gesendet bekommen.\'']","Die Aktivierung einer zufällig erstellten PIN auf pass.telekom.de erfolgt unter ""Nützliche Übersichten"" im Menüpunkt ""PIN-Schutz"". Bei der Aktivierung wird eine zufällig erstellte PIN vergeben, die direkt angezeigt und zusätzlich per SMS ans Handy gesendet wird.",611,0.0001335,93,4,64.21005988121033,0.9999999999999996,0.999999999975,1.0,0.625,0.17067308717751264,0.5663716814159292
What connections can the Media Receiver make with Airties devices as a WLAN-Client?,"Ja, die Media Receiver der Telekom lassen sich als WLAN-Client mit Airties Geräten verbinden. Wenn Sie weitere Fragen haben, lassen Sie es mich wissen!","[""page_content='Question: Ist der TV-Receiver mit Airties Geräten kompatibel?\nAnswer: Ja, die Media Receiver der Telekom lassen sich als WLAN-Client mit Airties Geräten verbinden.'"", ""page_content='Question: Ist der TV-Receiver mit Airties Geräten kompatibel?\nAnswer: Ja, die Media Receiver der Telekom lassen sich als WLAN-Client mit Airties Geräten verbinden.'"", ""page_content='Question: Ist der TV-Receiver mit Airties Geräten kompatibel?\nAnswer: Ja, die Media Receiver der Telekom lassen sich als WLAN-Client mit Airties Geräten verbinden.'"", ""page_content='Question: Ist der TV-Receiver mit Airties Geräten kompatibel?\nAnswer: Ja, die Media Receiver der Telekom lassen sich als WLAN-Client mit Airties Geräten verbinden.'""]",The answer to given question is not present in context,346,6.585e-05,31,4,60.6793258190155,0.9531590274357603,0.0,0.0,0.5,0,0.0
Wie können wir telefonisch einen Vertragswechsel zum Umzugstermin besprechen?,"Um telefonisch einen Vertragswechsel zum Umzugstermin zu besprechen, empfehle ich Ihnen, den Kundenservice von Telekom direkt zu kontaktieren. Sie können die Hotline unter 0800 330 1000 erreichen. Dort stehen Ihnen freundliche Mitarbeiter zur Verfügung, die Ihnen bei Ihrem Anliegen helfen können. Alternativ können Sie auch die Webseite www.telekom.de/hilfe besuchen, um weitere Informationen und Unterstützung zu erhalten.","[""page_content='Question: Wie kann ich beim Umzug mit meinem Festnetz-Anschluss gleichzeitig zur Telekom wechseln?\nAnswer: Sie können während Ihres Umzugs zum neuen Wohnsitz zur Telekom wechseln und Ihre Rufnummern mitnehmen. Dafür gibt es 2 Szenarien:\n• Wenn Ihr aktueller Telefonanbieter an Ihrer neuen Adresse die bisherigen Leistungen nicht anbieten kann, haben Sie nach § 45 Telekommunikationsgesetz (TKG) ein Sonderkündigungsrecht.\n• Weiterhin haben Sie auch die Möglichkeit zum Ende der Vertragslaufzeit zur Telekom zu wechseln, wenn Ihr Umzugstermin mit dem Zeitpunkt übereinstimmt.'"", ""page_content='Question: Wie kann ich beim Umzug mit meinem Festnetz-Anschluss gleichzeitig zur Telekom wechseln?\nAnswer: Sie können während Ihres Umzugs zum neuen Wohnsitz zur Telekom wechseln und Ihre Rufnummern mitnehmen. Dafür gibt es 2 Szenarien:\n• Wenn Ihr aktueller Telefonanbieter an Ihrer neuen Adresse die bisherigen Leistungen nicht anbieten kann, haben Sie nach § 45 Telekommunikationsgesetz (TKG) ein Sonderkündigungsrecht.\n• Weiterhin haben Sie auch die Möglichkeit zum Ende der Vertragslaufzeit zur Telekom zu wechseln, wenn Ihr Umzugstermin mit dem Zeitpunkt übereinstimmt.'"", ""page_content='Question: Wie kann ich beim Umzug mit meinem Festnetz-Anschluss gleichzeitig zur Telekom wechseln?\nAnswer: Sie können während Ihres Umzugs zum neuen Wohnsitz zur Telekom wechseln und Ihre Rufnummern mitnehmen. Dafür gibt es 2 Szenarien:\n• Wenn Ihr aktueller Telefonanbieter an Ihrer neuen Adresse die bisherigen Leistungen nicht anbieten kann, haben Sie nach § 45 Telekommunikationsgesetz (TKG) ein Sonderkündigungsrecht.\n• Weiterhin haben Sie auch die Möglichkeit zum Ende der Vertragslaufzeit zur Telekom zu wechseln, wenn Ihr Umzugstermin mit dem Zeitpunkt übereinstimmt.'"", ""page_content='Question: Wie kann ich beim Umzug mit meinem Festnetz-Anschluss gleichzeitig zur Telekom wechseln?\nAnswer: Sie können während Ihres Umzugs zum neuen Wohnsitz zur Telekom wechseln und Ihre Rufnummern mitnehmen. Dafür gibt es 2 Szenarien:\n• Wenn Ihr aktueller Telefonanbieter an Ihrer neuen Adresse die bisherigen Leistungen nicht anbieten kann, haben Sie nach § 45 Telekommunikationsgesetz (TKG) ein Sonderkündigungsrecht.\n• Weiterhin haben Sie auch die Möglichkeit zum Ende der Vertragslaufzeit zur Telekom zu wechseln, wenn Ihr Umzugstermin mit dem Zeitpunkt übereinstimmt.'""]",Die Antwort auf die gegebene Frage ist im Kontext nicht vorhanden,760,0.00015135,83,4,62.62663197517395,0.8966903049693143,0.0,1.0,0.0,0.003263584888402175,0.05333333333333334
What are the pairing options for PlusKarte Kids & Teens and their monthly costs?,"Die PlusKarte Kids & Teens kann mit verschiedenen Geräten gebucht werden, wobei Sie individuell für jedes Gerät eine monatliche Zuzahlung festlegen können. Die PlusKarte hat eine Mindestvertragslaufzeit von 24 Monaten. Leider habe ich keine spezifischen Informationen zu den monatlichen Kosten für die Geräte. Für detaillierte Informationen empfehle ich, die Webseite www.telekom.de/hilfe zu besuchen oder sich direkt an den Kundenservice zu wenden.","[""page_content='Question: Kann ich eine PlusKarte mit Gerät buchen?\nAnswer: Ja, Sie können bei jeder MagentaMobil PlusKarte (Data Karte, PlusKarte+, PlusKarte Kids & Teens) ein Gerät dazu auswählen.\nDabei können Sie individuell für jede PlusKarte entscheiden, welches Gerät Sie mit welcher monatlichen Zuzahlung möchten. Die PlusKarte hat dann eine Mindestvertragslaufzeit von 24 Monaten.'"", ""page_content='Question: Kann ich eine PlusKarte mit Gerät buchen?\nAnswer: Ja, Sie können bei jeder MagentaMobil PlusKarte (Data Karte, PlusKarte+, PlusKarte Kids & Teens) ein Gerät dazu auswählen.\nDabei können Sie individuell für jede PlusKarte entscheiden, welches Gerät Sie mit welcher monatlichen Zuzahlung möchten. Die PlusKarte hat dann eine Mindestvertragslaufzeit von 24 Monaten.'"", ""page_content='Question: Kann ich eine PlusKarte mit Gerät buchen?\nAnswer: Ja, Sie können bei jeder MagentaMobil PlusKarte (Data Karte, PlusKarte+, PlusKarte Kids & Teens) ein Gerät dazu auswählen.\nDabei können Sie individuell für jede PlusKarte entscheiden, welches Gerät Sie mit welcher monatlichen Zuzahlung möchten. Die PlusKarte hat dann eine Mindestvertragslaufzeit von 24 Monaten.'"", ""page_content='Question: Kann ich eine PlusKarte mit Gerät buchen?\nAnswer: Ja, Sie können bei jeder MagentaMobil PlusKarte (Data Karte, PlusKarte+, PlusKarte Kids & Teens) ein Gerät dazu auswählen.\nDabei können Sie individuell für jede PlusKarte entscheiden, welches Gerät Sie mit welcher monatlichen Zuzahlung möchten. Die PlusKarte hat dann eine Mindestvertragslaufzeit von 24 Monaten.'""]",The answer to given question is not present in context,619,0.00013424999999999998,92,4,68.77996683120728,0.0,0.0,0.0,0.5,0,0.0
