Question,Response,Contexts,Ground Truth,Token Count,Total Cost (USD),Completion Tokens,Number of Retrieved documents,Response time,answer_relevancy,context_precision,context_recall,faithfulness,BleuScore,RougeScore
What ist die Bedeutung der eSIM für die Verbindung der Samsung Galaxy Watch mit dem Mobilfunknetz?,"Die eSIM ermöglicht es der Samsung Galaxy Watch, eine Verbindung zum Mobilfunknetz aufzubauen, ohne dass ein Smartphone oder WLAN in der Nähe sein muss. Im Gegensatz zu herkömmlichen Smartwatches, die auf Bluetooth oder WLAN angewiesen sind, kann die Galaxy Watch mit eSIM eigenständig online gehen und ist über Ihre Rufnummer erreichbar, auch wenn Ihr Smartphone zu Hause bleibt. Dies bietet Ihnen mehr Flexibilität und Unabhängigkeit in der Nutzung Ihrer Smartwatch.","[""page_content='Source URL: https://www.telekom.de/hilfe/geraete-zubehoer/handy-smartphone-tablet/samsung/samsung-galaxy-watch/vorteile-samsung-galaxy-watch\n\nQuestion: Was sind die Vorteile der Samsung Galaxy Watch mit eSIM? Answer: Durch die eSIM kann die Samsung Galaxy Watch eine Verbindung ins Mobilfunknetz aufbauen, auch wenn kein Smartphone oder WLAN in der Nähe ist. Bei herkömmlichen Smartwatches war eine Verbindung ins Mobilfunknetz nur möglich, wenn die Smartwatch mit Hilfe eines Smartphones über Bluetooth oder WLAN mit dem Mobilfunknetz verbunden war. Die Samsung Galaxy Watch mit eSIM kann selbständig eine Verbindung ins Mobilfunknetz aufbauen. Sie können also Ihr Smartphone zu Hause lassen und sind über die Smartwatch über das Mobilfunknetz online und auf Ihrer Rufnummer erreichbar.'"", ""page_content='Source URL: https://www.telekom.de/unterwegs/esim\n\nQuestion: Welche Geräte unterstützen\xa0eSIM? Answer: Der fest verbaute SIM-Chip ist eine innovative Lösung für die mobile Kommunikation und wird die klassische Variante bald komplett ersetzen. Aktuelle Mobilfunk-Geräte sind bereits mit der embedded SIM ausgestattet und bieten Ihnen damit Flexibilität und Unabhängigkeit. Bei den Mobilfunk-Geräten von Apple finden Sie die moderne SIM-Lösung beispielsweise bereits seit 2018. Viele Smartphones besitzen eine sogenannte Dual-SIM-Funktion. Mit dieser nutzen Sie zwei SIM-Karten parallel in einem Gerät, zum einen die herkömmliche SIM-Karte, zum anderen eine eSIM. Das ist besonders praktisch, wenn Sie auf Ihrem Gerät sowohl privat als auch dienstlich erreichbar sein möchten. Buchen Sie dazu beispielsweise einfach Ihren privaten Mobilfunkvertrag mit einer eSIM und lassen sich das eSIM-Profil via eSIM direct sofort auf Ihrem Dienstgerät bereitstellen oder nutzen Sie für die Bereitstellung einen QR-Code, den Sie einfach mit der Kamera Ihres Smartphones erfassen. Ob dienstlich oder privat - jetzt geht kein Anruf mehr verloren. Sie möchten auch mal ohne Smartphone unterwegs telefonieren, Nachrichten schreiben, Musik streamen und vieles mehr? Das ermöglicht Ihnen eine Smartwatch mit eSIM. Buchen Sie dazu idealerweise auf Ihrem Mobilfunkvertrag eine MultiSIM und wählen Sie als SIM-Typ eSIM aus. Nach der Bereitstellung des eSIM-Profils auf Ihrer Watch können Sie mit Ihrer Smartwatch Funktionen wie Telefonie und Internet entsprechend Ihres Mobilfunktarifs nutzen und sind sowohl auf Ihrem Smartphone und Ihrer Smartwatch unter der gleichen Rufnummer erreichbar. Question: Welche Vorteile hat eine eSIM? Answer: Die eSIM hat gegenüber den klassischen SIM-Karten-Formaten viele Vorteile:\nSchnell und sofort einsatzbereit\nDas sogenannte eSIM-Profil, welches Ihrem Mobilfunk-Vertrag zugeordnet ist, wird digital auf Ihr Mobilfunk-Gerät übertragen. Anders als bisher ist eine gewöhnliche SIM-Karte nicht mehr notwendig.'"", ""page_content='Das umständliche manuelle Einsetzen der SIM-Karte in den Kartenschlitz entfällt. Stattdessen erhalten Sie einen QR-Code, den Sie mit Ihrem Gerät zur Installation der eSIM einscannen. Sie erhalten die eSIM auf dem Postweg. Weitere Informationen zur eSIM finden Sie unterhttps://www.telekom.de/hilfe/mobilfunk/esim\n\n'"", ""page_content='Das umständliche manuelle Einsetzen der SIM-Karte in den Kartenschlitz entfällt. Stattdessen erhalten Sie einen QR-Code, den Sie mit Ihrem Gerät zur Installation der eSIM einscannen. Sie erhalten die eSIM auf dem Postweg. Weitere Informationen zur eSIM finden Sie unterhttps://www.telekom.de/hilfe/mobilfunk/esim\n\n'""]","Die eSIM ermöglicht es der Samsung Galaxy Watch, eine Verbindung ins Mobilfunknetz aufzubauen, auch wenn kein Smartphone oder WLAN in der Nähe ist. Dies bedeutet, dass die Smartwatch selbstständig online und erreichbar ist, ohne dass ein Smartphone benötigt wird.",3079,0.0005050499999999999,96,4,62.95541501045227,0.9348684240306048,0.999999999975,1.0,1.0,0.2470161660589284,0.453781512605042
Kann ich eine PlusKarte ohne Mindestvertragslaufzeit buchen?,"Ja, Sie können eine PlusKarte ohne Mindestvertragslaufzeit buchen, wenn Sie kein Gerät dazu nehmen. In diesem Fall ist der Vertrag monatlich kündbar.","[""page_content='Source URL: https://www.telekom.de/hilfe/mobilfunk/tarife-optionen/zusatzkarten/plus-karte-vertragslaufzeit\n\nQuestion: Kann ich eine PlusKarte ohne Vertragslaufzeit buchen? Answer: Ja, wenn Sie kein Gerät dazu nehmen, können Sie eine MagentaMobil PlusKarte auch ohne Mindestvertragslaufzeit wählen. Der Vertrag ist dann monatlich kündbar.'"", ""page_content='Question:\nWie kann ich die neuen Magenta-Mobil-Plus-Karten der deutschen Telekom buchen? Answer:\nBaue mit unserem Magenta-Mobil-Plan deine eigene Mobilfamilie und spare Geld beim deutschen 5G-Netz der Telekom. Die neuen Magenta-Mobil-Plus-Karten sind für jeden verwendbar, unabhängig von Name, Wohnort oder Alter. Je mehr Nutzer, desto günstiger wird es für jeden. Es gibt eine Hauptkarte, welche das Datenvolumen für alle weiteren Karten bestimmt. Der erste Magenta-Mobil-Plus-Plan kostet monatlich 1995, wobei jeder weitere nur 95 kostet. Es gibt auch spezielle Karten für Kinder, Jugendliche und Geräte wie Laptops oder Tablets.'"", ""page_content='Konditionen sind Stand per heute.Gruß Timo\n- Hey@5c41a,bei einer PlusKarte ist die Buchung der Option durchaus erforderlich. Diese Tarifoption überträgt sich nicht automatisch auf die PlusKarte.Bei einer PlusKarte ist eine Buchung einer MutliSIM für eine Smartwatch daher für 4,95 Euro möglich. Konditionen sind Stand per heute.Gruß Timo\n'"", ""page_content='Source URL: https://www.telekom.de/hilfe/mobilfunk/tarife-optionen/zusatzkarten/plus-karte-nicht-buchbar\n\nQuestion: Warum kann ich bei meinem MagentaMobil Tarif keine PlusKarte dazu buchen? Answer: Der Grund ist ein veralteter Tarif.'""]","Ja, wenn Sie kein Gerät dazu nehmen, können Sie eine MagentaMobil PlusKarte auch ohne Mindestvertragslaufzeit wählen. Der Vertrag ist dann monatlich kündbar.",1125,0.00018405,34,4,44.73500418663025,0.9999999999999994,0.9999999999666667,1.0,0.6666666666666666,0.23933115010284958,0.5098039215686274
What advantages does the A15 Bionic Prozessor offer in the iPhone 13 series compared to its predecessor?,"Der A15 Bionic Prozessor im iPhone 13 bietet im Vergleich zum A14 Bionic eine verbesserte Leistung und Energieeffizienz. Er ermöglicht schnellere Verarbeitungszeiten, was sich in einer flüssigeren Benutzererfahrung und besseren Multitasking-Fähigkeiten äußert. Zudem unterstützt er fortschrittliche Funktionen wie verbesserte Grafikleistung für Spiele und Anwendungen sowie optimierte Bildverarbeitung für die Kamera, was zu besseren Fotos und Videos führt.","[""page_content='Source URL: https://www.telekom.de/hilfe/geraete-zubehoer/handy-smartphone-tablet/apple/iphone/iphone-13-und-iphone-13-pro-und-iphone-13-pro-max-und-iphone-13-mini/kamera\n\nQuestion: Was für Eigenschaften hat die Kamera in den iPhone 13, iPhone 13 Pro und iPhone 13 Pro Max oder iPhone 13 mini? Answer: Das iPhone 13 und iPhone 13 mini\xa0bieten:\nDas iPhone 13 Pro\xa0 und iPhone 13 Pro Max bieten\xa0zusätzlich:\n• Fortschrittliches Zwei-Kamera-System mit 12 MP Weitwinkel‑ und Ultraweitwinkel-Objektiven\n• Fotografische Stile\n• Smart HDR 4\n• Nachtmodus\n• 4K HDR Aufnahme mit Dolby Vision\n• 12 MP TrueDepth Frontkamera mit Nachtmodus\n• 4K HDR Aufnahme mit Dolby Vision\n• LiDAR Scanner\n• 6x optischer Zoombereich\n• Makrofotografie\n\n'"", 'page_content=\'DasiPhone 15und dasiPhone 15 Plusermöglichen professionelle Bildaufnahmen mit einer 48-Megapixel-Kamera und einem 2-fachen Tele-Zoom. BeimiPhone 15 Pround beimiPhone 15 Pro Maxgeht Apple sogar noch einen Schritt weiter: Beide Modelle sind mit einem 3-fachen Tele-Zoom ausgestattet. Dadurch sind selbst aus größerer Entfernung gestochen scharfe, detailreiche Aufnahmen möglich. Zusätzlich punkten die Pro-Modelle durch den A17 Pro Chip. Dieser sorgt für mehr Leistung und gleichzeitig für eine längere Akkulaufzeit.Folgende weitere Highlights erwarten Sie bei der iPhone 15-Generation:6,1 Zoll oder 6,7 Zoll DisplayDynamic Island für eine leichtere BedienbarkeitiPhone 15 Pro und iPhone 15 Pro Max mit individualisierbarem Action ButtonUSB-C-Anschluss für mehr KonnektivitätAppleCare Garantie bei allen Modellen inklusiveA16 Bionic Chip oder A17 Pro ChipPro-Modelle aus robustem und leichtem TitanDas iPhone 16: Die nächste Generation von Innovation und StilMit demiPhone 16hebt Apple seine Technologie auf ein neues Level. Die bedeutendste Neuerung der iPhone 16-Serie ist die Einführung des fortschrittlichen A18 Bionic Chips, der für außergewöhnliche Leistung sorgt. Das iPhone 16 und dasiPhone 16 Plusbieten eine beeindruckende 48-Megapixel-Hauptkamera, ergänzt durch einen neuen 4-fachen Tele-Zoom für detailreiche Aufnahmen aus der Ferne. Die ModelleiPhone 16 ProundiPhone Pro Maxgehen noch einen Schritt weiter: Mit der neuen Pro-Optik und verbesserten LiDAR-Technologie ermöglichen sie atemberaubende Fotos und Videos mit beispielloser Präzision.Folgende weitere Highlights erwarten Sie bei der iPhone 16-Generation:6,2 Zoll oder 6,9 Zoll Super Retina XDR DisplayLängere AkkulaufzeitErweiterte Dynamic Island für eine noch intuitivere BedienungIndividuell anpassbarer Action Button bei den Pro-ModellenUSB-C-Anschluss für vielseitige KonnektivitätInklusive AppleCare Garantie für alle ModelleA18 Bionic Chip für maximale Leistung und EffizienzPro-Modelle aus widerstandsfähigem und elegantem Titan\nMit der iPhone 13-Serie hat Apple weitere Smartphones auf den Markt gebracht, die ihre Vorgängermodelle erneut mit modernen Technologien übertreffen. Die 5G-fähigen Modelle verfügen über einen neuen A15 Bionic Prozessor, der noch mehr Leistung bietet als der A14 Bionic. DasiPhone 13begeistert mit einem 12 Megapixel Kamera-System sowie einem 6,1"" Super Retina XDR Display für leuchtende Farben. Im Vergleich zu den Vorgängermodellen bietet die iPhone 13-Serie viele Neuerungen hinsichtlich der Ausstattung:\nBei den Modellen desiPhone 14setzt Apple bei der Kamera wieder neue Maßstäbe. Bereits das Basismodell und dasiPhone 14 Plussind mit einem starken 6-Linsen-Objektiv ausgestattet, mit dem auch bei wenig Licht klare und kontraststarke Bilder gelingen. Das garantiert hervorragende Fotos. Beide iPhone-Modelle sind zudem 5G-fähig. Damit Sie Fotos und Videos ebenso im Freien bei Sonnenlicht genießen können, besitzen das iPhone 14 und das iPhone 14 Plus ein Super Retina XDR Display mit einer hohen maximalen Helligkeit von bis zu 1.200 Nits.Auch der Akku wurde weiter verbessert und hält jetzt, je nach Verwendung, bis zu einem Tag.Weitere Highlights der neuen iPhone 14 Generation umfassen, je nach Modell:\nMit der iPhone 15-Serie geht Apple in puncto Technik noch einen Schritt weiter. Die wohl größte Neuerung der iPhone 15 Generation ist, dass alle Modelle über einen USB-C-Anschluss verfügen, der mit vielen anderen Geräten kompatibel ist. DasiPhone 15und dasiPhone 15 Plusermöglichen professionelle Bildaufnahmen mit einer 48-Megapixel-Kamera und einem 2-fachen Tele-Zoom. BeimiPhone 15 Pround beimiPhone 15 Pro Maxgeht Apple sogar noch einen Schritt weiter: Beide Modelle sind mit einem 3-fachen Tele-Zoom ausgestattet. Dadurch sind selbst aus größerer Entfernung gestochen scharfe, detailreiche Aufnahmen möglich. Zusätzlich punkten die Pro-Modelle durch den A17 Pro Chip. Dieser sorgt für mehr Leistung und gleichzeitig für eine längere Akkulaufzeit.Folgende weitere Highlights erwarten Sie bei der iPhone 15-Generation:\nMit demiPhone 16hebt Apple seine Technologie auf ein neues Level. Die bedeutendste Neuerung der iPhone 16-Serie ist die Einführung des fortschrittlichen A18 Bionic Chips, der für außergewöhnliche Leistung sorgt. Das iPhone 16 und dasiPhone 16 Plusbieten eine beeindruckende 48-Megapixel-Hauptkamera, ergänzt durch einen neuen 4-fachen Tele-Zoom für detailreiche Aufnahmen aus der Ferne. Die ModelleiPhone 16 ProundiPhone Pro Maxgehen noch einen Schritt weiter: Mit der neuen Pro-Optik und verbesserten LiDAR-Technologie ermöglichen sie atemberaubende Fotos und Videos mit beispielloser Präzision.Folgende weitere Highlights erwarten Sie bei der iPhone 16-Generation:\n• Längere Akkulaufzeit\n• Verbesserter Wasserschutz\n• Liquid Retina HD Display\n• Ceramic Shield auf der Vorderseite für eine bessere Sturzfestigkeit\n• Einen Akku für bis zu 17 Stunden Videowiedergabe\n• Ein 6,1"" Super Retina XDR Display\n• 12 MP TrueDepth Frontkamera mit Nachtmodus\n• Verbesserte Akkulaufzeit\n• Starke Performance durch A15 Bionic Prozessor\n• 6,1 Zoll oder 6,7 Zoll Display\n• 128 oder 256 GB Speicherkapazität\n• A15 Bionic Chip\n• Action- und Kinomodus für ruckelfreie Videos\n• Unfallerkennung, die im Notfall selbstständig Hilfe ruft\n• Viele Möglichkeiten zur Personalisierung, Kommunikation und zum Teilen\n• 6,1 Zoll oder 6,7 Zoll Display\n• Dynamic Island für eine leichtere Bedienbarkeit\n• iPhone 15 Pro und iPhone 15 Pro Max mit individualisierbarem Action Button\n• USB-C-Anschluss für mehr Konnektivität\n• AppleCare Garantie bei allen Modellen inklusive\n• A16 Bionic Chip oder A17 Pro Chip\n• Pro-Modelle aus robustem und leichtem Titan\n• 6,2 Zoll oder 6,9 Zoll Super Retina XDR Display\n• Längere Akkulaufzeit\n• Erweiterte Dynamic Island für eine noch intuitivere Bedienung\n• Individuell anpassbarer Action Button bei den Pro-Modellen\n• USB-C-Anschluss für vielseitige Konnektivität\n• Inklusive AppleCare Garantie für alle Modelle\n• A18 Bionic Chip für maximale Leistung und Effizienz\n• Pro-Modelle aus widerstandsfähigem und elegantem Titan\n\nQuestion: Welches iPhone hat die beste Kamera? Answer: Apple setzt bei allen iPhones auf qualitativ hochwertige Kameratechnologie, doch die Pro-Modelle der iPhone 16-Serie stehen an der Spitze. Mit der neuesten Generation von Kameras bieten diese Modelle eine beispiellose Bildqualität. Die Modelle iPhone 16 und iPhone 16 Plus verfügen über eine 48-Megapixel-Hauptkamera mit einem 4-fachen Tele-Zoom, der atemberaubende Detailgenauigkeit auch aus großer Entfernung ermöglicht. Die iPhone 16 Pro-Modelle bieten zusätzlich eine innovative Pro-Optik und eine verbesserte LiDAR-Technologie für noch präzisere und lebendigere Aufnahmen.\'', ""page_content='Source URL: https://www.telekom.de/unterwegs/hersteller/apple/iphone-vergleich\n\nQuestion: iPhones vergleichen: Älteres Modell oder High End-Smartphone? Answer: Legen Sie Wert auf ein ausgewogenes Verhältnis zwischen guter Leistung und einem ansprechenden Design, kommen Sie amApple iPhone 11nicht vorbei. Der A13 Bionic Prozessor verleiht Ihrem Smartphone noch mehr Power als der Vorgängerchip. Das große Display mit 6,1 Zoll ermöglicht Ihnen nicht nur eine einfache Handhabung, sondern auch zuverlässiges Arbeiten. Im Vergleich mit älteren iPhone-Modellen wird außerdem deutlich: Apple hat mit dem Smartphone iPhone 11 die Kameratechnik auf das nächste Level gehoben. Das Modell wartet mit zwei Kameras mit je 12 Megapixel (Wide und Ultra Wide) auf. Der integrierte Nachtmodus sorgt auch bei dunklen Lichtbedingungen für eindrucksvolle Bilder mit hoher Auflösung. Beim iPhone 11 dürfen Sie sich im Vergleich zu den Vorgängermodellen über viele Extra-Features freuen:\nSie sind auf der Suche nach einem iPhone, das5G Mobilfunkunterstützt? Dann ist ein Modell aus der iPhone 12-Serie die richtige Wahl. Diese Geräte überzeugen mit moderner Technik und hoher Leistung: Der A14 Bionic Prozessor bringt die Power der iPhones auf ein neues Level. Mit exzellentem Kontrast und hoher Auflösung punktet das Super Retina XDR Display mit OLED-Technologie. Es reicht bis zum Rand und ermöglicht somit eine noch bessere Handhabung.'"", 'page_content=\'Auch die Kamera-Technik hat Apple optimiert. DasiPhone 12ist mit einem 12 Megapixel Zwei-Kamera-System mit Ultraweitwinkel- und Weitwinkelobjektiv versehen. Erhältlich ist das Apple iPhone 12 mit 64 oder 128 GB Speichergröße. Zudem verfügt es über:Ceramic Shield auf der Vorderseite für eine bessere SturzfestigkeitEinen Akku für bis zu 17 Stunden VideowiedergabeEin 6,1"" Super Retina XDR DisplayDieiPhone 13-Serie – einfach großartigMit der iPhone 13-Serie hat Apple weitere Smartphones auf den Markt gebracht, die ihre Vorgängermodelle erneut mit modernen Technologien übertreffen. Die 5G-fähigen Modelle verfügen über einen neuen A15 Bionic Prozessor, der noch mehr Leistung bietet als der A14 Bionic. DasiPhone 13begeistert mit einem 12 Megapixel Kamera-System sowie einem 6,1"" Super Retina XDR Display für leuchtende Farben. Im Vergleich zu den Vorgängermodellen bietet die iPhone 13-Serie viele Neuerungen hinsichtlich der Ausstattung:12 MP TrueDepth Frontkamera mit NachtmodusVerbesserte AkkulaufzeitStarke Performance durch A15 Bionic ProzessorDas iPhone 14: leistungsstark und kompaktBei den Modellen desiPhone 14setzt Apple bei der Kamera wieder neue Maßstäbe. Bereits das Basismodell und dasiPhone 14 Plussind mit einem starken 6-Linsen-Objektiv ausgestattet, mit dem auch bei wenig Licht klare und kontraststarke Bilder gelingen. Das garantiert hervorragende Fotos. Beide iPhone-Modelle sind zudem 5G-fähig. Damit Sie Fotos und Videos ebenso im Freien bei Sonnenlicht genießen können, besitzen das iPhone 14 und das iPhone 14 Plus ein Super Retina XDR Display mit einer hohen maximalen Helligkeit von bis zu 1.200 Nits.Auch der Akku wurde weiter verbessert und hält jetzt, je nach Verwendung, bis zu einem Tag.Weitere Highlights der neuen iPhone 14 Generation umfassen, je nach Modell:6,1 Zoll oder 6,7 Zoll Display128 oder 256 GB SpeicherkapazitätA15 Bionic ChipAction- und Kinomodus für ruckelfreie VideosUnfallerkennung, die im Notfall selbstständig Hilfe ruftViele Möglichkeiten zur Personalisierung, Kommunikation und zum TeilenDie iPhone 15 - Serie: innovative Technik und elegantes DesignMit der iPhone 15-Serie geht Apple in puncto Technik noch einen Schritt weiter. Die wohl größte Neuerung der iPhone 15 Generation ist, dass alle Modelle über einen USB-C-Anschluss verfügen, der mit vielen anderen Geräten kompatibel ist.\'']","The A15 Bionic Prozessor in the iPhone 13 series offers more performance compared to the A14 Bionic, enhancing the overall capabilities of the device.",5784,0.00091125,97,4,51.7265841960907,0.9622077449327713,0.499999999975,1.0,0.125,0.021694517255228814,0.15555555555555556
What steps are involved in updating bank connections in the Kundencenter and MeinMagenta App?,"Um Ihre Bankverbindung im Kundencenter oder in der MeinMagenta App zu aktualisieren, folgen Sie diesen Schritten:

1. **Kundencenter**: Gehen Sie zu ""Mein Profil"" > ""Persönliche Daten"" > ""Bankverbindungen"". Klicken Sie auf das Stift-Symbol, geben Sie Ihre neuen Daten ein, kontrollieren Sie diese und klicken Sie auf ""Weiter"".
   
2. **MeinMagenta App**: Tippen Sie auf das Benutzer-Symbol rechts neben dem Startbildschirm > ""Persönliche Daten"" > ""Bankverbindungen"" > ""Bearbeiten"", geben Sie die neuen Daten ein, kontrollieren Sie diese und klicken Sie auf ""Weiter"".

Für weitere Informationen besuchen Sie bitte [telekom.de/hilfe](https://www.telekom.de/hilfe/vertrag-rechnung/rechnung/bankverbindung-einrichten-aendern).","[""page_content='• KundencenterMein Profil > Persönliche Daten > Bankverbindungen > Stift-Symbol klicken > Daten eingeben > Daten kontrollieren > Weiter\n• MeinMagenta AppBenutzer-Symbol rechts neben Start > Persönliche Daten > Bankverbindungen > Bearbeiten > Daten eingeben > Daten kontrollieren > Weiter\n\n'"", ""page_content='Source URL: https://www.telekom.de/hilfe/vertrag-rechnung/rechnung/bankverbindung-einrichten-aendern\n\nQuestion: Wie kann ich die Bankverbindung für die Abbuchung einrichten oder ändern? Answer: Sie können für Ihre Festnetz- oder Mobilfunk-Rechnung Ihre Bankdaten für die Teilnahme am SEPA-Lastschriftverfahren im Kundencenter, in der MeinMagentaApp oder per Kontaktformular anpassen. Alternativ können Sie dasKontaktformularnutzen, wenn Sie möchten, dass wir die Bankverbindung für Sie ändern.'"", ""page_content='Source URL: https://www.telekom.de/hilfe/vertrag-rechnung/vertrag/meine-daten/aendern\n\nQuestion: Wo kann ich meine Kundendaten ändern? Answer: So ändern Sie Ihre Vertragsdaten, Kontaktdaten oder die Bankverbindung für Ihren Festnetz- bzw.'"", 'page_content=\'Question:\nBasierend auf dem Transkript, könnte eine relevante Frage auf Deutsch sein: ""Haben Sie bereits die notwendige Ausrüstung und Informationen, um den Online-Prozess zum Aktualisieren Ihrer SIM-K\n\nAnswer:\nHallo, ich bin Erina von der Telekomfirma. Falls du eine gratis SIM-Karte nutzt und weiterhin diese Karte und deine aktuelle Mobiltelefonnummer verwenden möchtest, dann lass uns loslegen. Wenn du Fragen zur Aktualisierung dieser Karte hast, kann ich dir zeigen, wie man dies einfach online macht. Du erhältst eine SMS und mit deren Hilfe kannst du auf eine Seite gelangen, auf der du einen speziellen Rabatt für diese SIM-Karte erhältst. Dieses Angebot ist exklusiv online für dich erhältlich. Auf dieser Seite musst du deine Handynummer angeben. Wenn du deine Nummer nicht kennst, wähl auf deinem Handy *135#. Deine Telefonnummer erscheint dann auf dem Bildschirm. Gehe dann auf die Seite, gib deine Daten ein, wähle einen Tarif und akzeptiere die Allgemeinen Geschäftsbedingungen. Um deine Daten zu überprüfen, nutze die NEXT App und wähle deinen Dokumententyp. Jetzt ist ein Selfie von dir nötig. Akzeptiere die Allgemeinen Geschäftsbedingungen. Für die Identifikation musst du ein Foto von der Vorder- und Rückseite deines Ausweises machen. Die Aufnahme der Vorderseite beginnt automatisch, nachdem das Dokument in den Rahmen der App platziert wurde. Dann mach ein Foto der Rückseite. Falls du einen Pass für die Identifikation verwendest, ist ein Foto der Rückseite nicht nötig. Weiter geht es mit dem Selfie. Um deine Identität zu überprüfen, nimm ein kurzes Video auf und wiederhole zwei Wörter, die in der App angezeigt werden. Die Überprüfung der Informationen dauert eins bis fünf Minuten. Erfolgreich überprüft?\'']","To update bank connections in the Kundencenter, the steps are: 1. Go to Mein Profil > Persönliche Daten > Bankverbindungen > click on the Stift-Symbol > enter data > check data > click Weiter. In the MeinMagenta App, the steps are: 1. Click on the Benutzer-Symbol on the right next to Start > Persönliche Daten > Bankverbindungen > Bearbeiten > enter data > check data > click Weiter.",1840,0.00035789999999999997,182,4,53.750985860824585,0.938448455754051,0.99999999995,1.0,1.0,0.0037880804373367463,0.2625
What sind die Kosten für die Mitnahme meiner Mobilfunk-Rufnummer zu einem anderen Anbieter?,"Die Mitnahme Ihrer Mobilfunk-Rufnummer zu einem anderen Anbieter ist sowohl bei Laufzeitverträgen als auch bei Prepaid-Karten der Telekom kostenfrei. Sie können Ihre Rufnummer jederzeit während der Laufzeit, zum Vertragsende oder danach ohne Gebühren mitnehmen. Weitere Informationen finden Sie auf der Telekom-Website.","[""page_content='Source URL: https://www.telekom.de/hilfe/vertrag-rechnung/vertrag/kuendigung/kosten-rufnummernmitnahme\n\nQuestion: Was kostet mich die Mitnahme meiner Mobilfunk-Rufnummer? Answer: Die Rufnummernmitnahme zu einem anderen Anbieter ist sowohl bei Laufzeitverträgen als auch bei Prepaid-Karten der Telekom kostenfrei.'"", 'page_content=\'Source URL: https://www.telekom.de/hilfe/vertrag-rechnung/vertrag/kuendigung/mobilfunk-rufnummer-exportieren\n\nQuestion: Wie kann ich meine Mobilfunk-Rufnummer zu einem anderen Anbieter mitnehmen? Answer: Sie können Ihre Telekom Mobilfunk-Rufnummer bereits während der Laufzeit, zum Vertragsende oder auch danach zu einem anderen Anbieter kostenfrei mitnehmen. Beachten Sie die dafür geltendenPortierungsfristenund gehen Sie wie folgt vor:\nPortierung aus einem laufenden VertragFür den Export benötigen wir Ihre Zustimmung zur vorzeitigen Portierung (Mitnahme) der Rufnummer – das sogenannte Opt-In. Füllen Sie einfach unser Formular ""Mitnahme Rufnummer (Opt-In) – Mobilfunk"" aus oder nutzen Sie unserenRückrufservice. Anschließend können Sie bei Ihrem neuen Anbieter die Rufnummernmitnahme beauftragen. Ihr Vertrag bei der Telekom läuft nach dem Export mit einer neuen Mobilfunk-Rufnummer weiter. Portierung zum oder nach VertragsendeSobald Sie von uns die Kündigungsbestätigung erhalten haben, können Sie bei Ihrem neuen Anbieter die Rufnummernmitnahme beauftragen. Portierung PrepaidSie können Ihre Telekom Mobilfunk-Rufnummer zum Vertragsende oder danach zu einem anderen Anbieter kostenfrei mitnehmen. Damit die Portierung unterbrechungsfrei funktioniert, kündigen Sie idealerweise mit Wunschtermin und wählen ein Datum mindestens 14 Tage in der Zukunft aus. Sobald Sie von uns die Kündigungsbestätigung erhalten haben, können Sie bei Ihrem neuen Anbieter die Rufnummernmitnahme zum Vertragsende beauftragen. Ihre Telekom Rufnummer nutzen Sie bis dahin normal weiter.\'', ""page_content='Source URL: https://www.telekom.de/hilfe/vertrag-rechnung/vertrag/kuendigung/frist-rufnummernmitnahme\n\nQuestion: Wann kann ich eine Rufnummernmitnahme beauftragen? Answer: Für die Mitnahme Ihrer Mobilfunk-Rufnummer zu einem anderen Anbieter gelten folgende Fristen:\nBei Mitnahme aus einem laufenden VertragDie Rufnummer muss mindestens 5 Arbeitstage aktiv sein, bevor eine Portierung möglich ist. Bei Mitnahme zum VertragsendeDie Portierung der Rufnummer kann frühestens 123 Kalendertage vor und maximal 90 Tage nach dem Ende der Mindestvertragslaufzeit beauftragt werden.'"", 'page_content=\'Source URL: https://www.telekom.de/hilfe/vertrag-rechnung/vertrag/bestellung/rufnummer-mitnehmen\n\nQuestion: Wie kann ich meine Mobilfunk-Nummer beim Wechsel zur Telekom mitnehmen? Answer: Bei derOnline-BuchungIhres neuen Wunschtarifs bei der Telekom beantragen Sie die Rufnummernmitnahme, indem Sie im Warenkorb die Schaltfläche ""Rufnummer vom bisherigen Anbieter mitnehmen"" aktivieren und Ihre Mobilfunk-Nummer angeben. Nun können Sie auswählen, ob Sie die Rufnummer zum nächstmöglichen Zeitpunkt oder zum Vertragsende übertragen möchten. Hinweis: Sie können die Rufnummer auch dann zur Telekom portieren, wenn diese nicht auf Ihren Namen läuft. Geben Sie dazu bei der Buchung des neuen Tarifs die Daten des Vertragspartners ein.\'']","Die Mitnahme meiner Mobilfunk-Rufnummer zu einem anderen Anbieter ist kostenfrei, sowohl bei Laufzeitverträgen als auch bei Prepaid-Karten der Telekom.",1762,0.00029309999999999997,64,4,43.81808686256409,0.9533785009821768,0.99999999995,1.0,0.8333333333333334,0.28765062207200615,0.5714285714285715
"Wie aktiviere ich VoLTE, wenn LTE fehlt?","Um VoLTE (Voice over LTE) zu aktivieren, müssen Sie sicherstellen, dass Ihr Smartphone 4G/LTE-fähig ist und dass die LTE-Option in den Einstellungen aktiviert ist. Überprüfen Sie in den mobilen Daten- und Anruf-Einstellungen Ihres Geräts, ob VoLTE aktiviert ist. Falls LTE in der Statuszeile Ihres Smartphones nicht angezeigt wird, könnte es sein, dass Sie sich in einem Gebiet mit 2G-Abdeckung befinden oder dass die VoLTE-Funktion in Ihrem Vertrag deaktiviert ist. In diesem Fall sollten Sie sich an den Telekom-Support wenden, um weitere Unterstützung zu erhalten.","['page_content=\'hinter der Kartennummer aufgelasert (Beispiel Abbildung: P2). Wir informieren Sie rechtzeitig, wenn Sie eine neue SIM-Karte brauchen.Wenn Sie nicht warten möchten:\n\nQuestion: Wie stelle ich an meinem Smartphone das 4G/LTE- bzw. 5G-Netz und Voice over LTE (VoLTE) ein? Answer: Sie haben schon ein aktuelles Smartphone und sehen in der\xa0Statuszeile am oberen Rand des Displays die Bezeichnung ""LTE""\xa0oder ""4G""?Gratulation, alles in Ordnung, Sie müssen nichts weiter tun. Wir empfehlen Ihnen allerdings eine kurze Überprüfung, ob in Ihrem Telefon auch schon die Sprachübertragung über LTE (VoLTE, Voice over LTE) aktiviert ist. So erleben Sie auch die beste Sprachqualität. Wie kann ich\xa0VoLTE einschalten? Sie sehen kein 4G oder LTE in der Statusanzeige,nutzen jedoch ein 4G/LTE-fähiges Smartphone und bekommen nur ""2G"" oder ""E""\xa0oder ""Edge""\xa0in dessen Statuszeile angezeigt?Wenn die Anzeige von ""2G"", ""E""\xa0oder ""Edge"" nur an bestimmten Orten erfolgt, Sie aber an anderen Orten ""LTE""\xa0bzw. ""4G""\xa0in der Anzeige sehen,\xa0müssen Sie nichts weiter tun. In diesem Fall sind Sie in einer Gegend mit reiner ""2G""-AbdeckungSie sehen auch bei Ortswechsel z. B.\'', 'page_content=\'zwischen Wohnung, Arbeitsplatz und Innenstadtkernnie""LTE""\xa0bzw. ""4G""\xa0in der Statuszeile?Überprüfen Sie zunächst, ob Ihr Telefon so eingestellt ist, dass es das 4G/LTE Netz nutzen kann. Bei einigen Smartphones lassen sich manuelle Einstellungen der Sprach- und Datenübertragung vornehmen. Mit der gerätespezifischen Anleitung können Sie ganz einfach überprüfen, ob LTE und VoLTE eingeschaltet ist. Im Hilfecenter der Telekom finden Sie ebenfalls kurze Anleitungen zur Aktivierung für die gängigsten Smartphone-Modelle:Wie kann ich LTE einschalten?Wie kann ich\xa0VoLTE einschalten? \'', ""page_content='Das gleiche passiert, wenn ich von jemand anderem angerufen werde. Bei mir klingelt nichts, der Anrufer hört nichts. Hinterher kriege ich dann die SMS über den verpassten Anruf. Internet und SMS funktionieren währenddessen problemlos über Mobilfunk. Ich habe einen normalen MagentaMobil S Vertrag. Ich habe es über längere Zeit auch mit und ohne WLAN Calling probiert, immer das gleiche.Sobald ich den Lockdown Mode wieder deaktiviere klappt wieder alles wie gewont. Vor der Telekom war ich bei Vodafone, dort war das nie ein Problem.Bei aktiviertem Lockdown Mode konnte ich heute (beim neuen Handy) auch die eSIM nicht aktivieren, das ging wieder erst nach dem Deaktivieren.Ich habe zudem ein dienstliches iPhone 15, ebenfalls mit einem Telekom-Vertrag, allerdings aus einem größeren Rahmenvertrag. Dort kann ich auch mit Lockdown-Mode telefonieren.Ich war auch einige Zeit lang mit dem Apple Support in Kontakt. Dort wurde das Problem genauer untersucht, inklusive ausführlicher Logging/Analyse-Sitzung, und wurde als ein seit einem Jahr bekanntes Problem identifiziert, was wohl irgendwann gefixt werden soll, aber offenbar nicht in iOS 18.Hat sonst jemand schon mal so etwas beobachtet? Funktioniert das Telefonieren bei euch, wenn ihr den Lockdown-Mode aktiviert habt? Ich möchte aufgrund meiner dienstlichen Situation nur ungern auf die zusätzliche Sicherheit verzichten.Achja, die Telekom Hotline meinte auch nur zu mir „Da können wir nichts machen“Danke schonmal fürs lesen! Accepted Solutions:\n- Um das hier noch abzuschließen: Nach weiteren Diagnose-Sessions kam Apple zu dem Schluss, dass es doch an der Telekom liegen muss. Danach habe ich nochmal mit Nachdruck beim Support angerufen und man stellte fest, dass in meinem VertragVoLTEund VoWLAN deaktiviert war, obwohl es mir in den Tarifoptionen als aktiv angezeigt wurde. Als das dann aktiviert wurde hat endlich alles funktioniert\n- Um das hier noch abzuschließen: Nach weiteren Diagnose-Sessions kam Apple zu dem Schluss, dass es doch an der Telekom liegen muss. Danach habe ich nochmal mit Nachdruck beim Support angerufen und man stellte fest, dass in meinem VertragVoLTEund VoWLAN deaktiviert war, obwohl es mir in den Tarifoptionen als aktiv angezeigt wurde. Als das dann aktiviert wurde hat endlich alles funktioniert\n'"", ""page_content='Source URL: https://telekomhilft.telekom.de/t5/Mobilfunk/kein-4g/td-p/6971283/jump-to/first-unread-message\nSubject: kein 4g ??? Content: einen wunderschönen....seit einer kurzen zeit habe ich den Mobilfunk Anbieter gewechselt, vorher wurde mir immer4Goder 4G+ auf mein Smartphone angezeigt nun wird mir nur nochLTEoder LTE+ angezeigt. in den Einstellungen wird mir auch kein4Gmehr angeboten.ich habe das Huawei Mate 20 pro dual Sim.Das kuriose ist das bei der Einstellung VoLTE-AnrufeLTEund4Gangezeigt wird.Gibt es eine Möglichkeit das zu ändern. es kann ja nur eineAPNEinstellung sein oder???ich würde mich über jede Hilfe freuen. Accepted Solutions:\n- 4GundLTEsind das gleiche.'""]",Die Antwort auf die gegebene Frage ist nicht im Kontext vorhanden,2689,0.0004609499999999999,128,4,53.64280295372009,0.9469070149662544,0.49999999995,1.0,1.0,0.002837045175138427,0.05555555555555555
Wie kann die eSIM der Galaxy Watch online ohne Smartphone sein?,"Die Samsung Galaxy Watch mit eSIM kann eine Verbindung zum Mobilfunknetz aufbauen, ohne dass ein Smartphone oder WLAN in der Nähe ist. Dies ermöglicht Ihnen, Ihr Smartphone zu Hause zu lassen und dennoch über die Smartwatch online und unter Ihrer Rufnummer erreichbar zu sein. Die eSIM sorgt dafür, dass die Uhr selbstständig ins Mobilfunknetz einwählt, was bei traditionellen Smartwatches nicht möglich war. Weitere Informationen finden Sie auf der Telekom-Website.","[""page_content='Source URL: https://www.telekom.de/hilfe/geraete-zubehoer/handy-smartphone-tablet/samsung/samsung-galaxy-watch/vorteile-samsung-galaxy-watch\n\nQuestion: Was sind die Vorteile der Samsung Galaxy Watch mit eSIM? Answer: Durch die eSIM kann die Samsung Galaxy Watch eine Verbindung ins Mobilfunknetz aufbauen, auch wenn kein Smartphone oder WLAN in der Nähe ist. Bei herkömmlichen Smartwatches war eine Verbindung ins Mobilfunknetz nur möglich, wenn die Smartwatch mit Hilfe eines Smartphones über Bluetooth oder WLAN mit dem Mobilfunknetz verbunden war. Die Samsung Galaxy Watch mit eSIM kann selbständig eine Verbindung ins Mobilfunknetz aufbauen. Sie können also Ihr Smartphone zu Hause lassen und sind über die Smartwatch über das Mobilfunknetz online und auf Ihrer Rufnummer erreichbar.'"", ""page_content='Sobald das neue Smartphone eingerichtet ist und eine WLAN-Verbindung hergestellt ist, lädt sich das eSIM-Profil automatisch herunter. '"", ""page_content='Sie können die Mobilfunkfunktion einerseits\xa0direkt während des ersten Kopplungsprozesses zwischen der Watch und Ihrem Smartphone aktivieren. Wenn Sie die Mobilfunkfunktion erstspäteraktivieren möchten, können Sie das jederzeit mit der Samsung Galaxy Wearable App (Android) oder Samsung Galaxy Watch App (iOS) auf Ihrem Smartphone tun. '"", ""page_content='Das umständliche manuelle Einsetzen der SIM-Karte in den Kartenschlitz entfällt. Stattdessen erhalten Sie einen QR-Code, den Sie mit Ihrem Gerät zur Installation der eSIM einscannen. Sie erhalten die eSIM auf dem Postweg. Weitere Informationen zur eSIM finden Sie unterhttps://www.telekom.de/hilfe/mobilfunk/esim\n\n'""]","Die eSIM der Samsung Galaxy Watch ermöglicht es, eine Verbindung ins Mobilfunknetz aufzubauen, auch wenn kein Smartphone oder WLAN in der Nähe ist. Dadurch kann die Smartwatch selbstständig online sein und ist über die Rufnummer erreichbar, ohne dass ein Smartphone benötigt wird.",2776,0.00045824999999999994,93,4,33.18561315536499,0.9032075031866696,0.7499999999625,1.0,1.0,0.1758495379501902,0.360655737704918
Why was the 10th Sept meeting on the mobile plan canceled?,"Es scheint, dass der Termin am 10. September nicht wahrgenommen wurde, da sich niemand zur vereinbarten Zeit gemeldet hat. Der Kunde hatte extra seine Arbeitszeit angepasst, um für das Gespräch verfügbar zu sein, blieb jedoch enttäuscht, weil es keine Rückmeldung gab. Möglicherweise gab es Missverständnisse oder unvorhergesehene Umstände, die dazu führten, dass der Termin nicht stattfand. Für weitere Unterstützung empfehlen wir, sich an den Kundenservice zu wenden.","[""page_content='September. Kann mich aber auch irren.Weil ich durch die Arbeit ziemlich eingespannt bin, haben wir also einen Termin für den 10. September ausgemacht. Bei mir hätte es morgen am besten gepasst, da ich an diesem Tag Spätschicht hatte. Von Ihrer Seite ging es aber laut Ihrer Aussage erst ab 13 Uhr, da Sie auch Spätdienst hätte. Also haben wir den Termin für 13 Uhr vereinbart. Ich habe mir dann extra Zeit auf der Arbeit gemacht und habe erst eine Stunde später angefangen zu arbeiten. Sowas mache ich nämlich nicht gerne zwischen Tür und Angel.Aber, und darüber war ich an dem Tag echt enttäuscht, es hat sich niemand bei mir gemeldet. Nicht zur vereinbarten Zeit und auch nicht später...Also um sonst eine Stunde später angefangen und selbst Kundentermine dadurch verschoben.Aber, ich dachte, vielleicht ist die gute Frau ja auch einfach krank geworden, hat mich vergessen oder hat den Vorbestelltag mit dem Release Tag vom iPhone verwechselt. Aber auch an dem Tag kam nichts. Ich habe dann mal selber versucht, die Telefonnummer von der Sie mich angerufen hat, anzurufen. Aber leider komme ich da nicht weiter.Find ich echt schade, aber vielleicht kann ja von Team hier jemand die Kollegin, deren Namen ich leider nicht mehr weiß nochmal an mich erinnern. Mein Vertrag läuft jetzt noch 2 Monate und langsam muss ich sonst nach alternative Ausschau halte.Liebe Grüße,Barry\n\nAccepted Solutions:\n- Hab heute Morgen mit einen sehr netten Mitarbeiter telefoniert und er hat mir ein super Angebot gemacht. - Hab heute Morgen mit einen sehr netten Mitarbeiter telefoniert und er hat mir ein super Angebot gemacht. '"", ""page_content='Source URL: https://telekomhilft.telekom.de/t5/Mobilfunk/Kunden-Rueckgewinnung-meldet-sich-bei-Vereinbarten-Termin-nicht/td-p/6970811/jump-to/first-unread-message\nSubject: Kunden-Rückgewinnung meldet sich bei Vereinbarten Termin nicht\nContent: Hallo,ich habe meinen Mobilfunktarif gekündigt und ungefähr vor 1 1/2 Monaten wurde ich von einer netten Frau angerufen, mit der Nachfrage warum ich gekündigt habe und ob Sie mir mal ein Angebot machen dürfe. Ihr Chef war wohl bei dem Gespräch auch dabei.Wir haben uns freundlich unterhalten und bei unserem Gespräch erwähnte ich das ich aktuell ein iPhone habe, und das neue ja (zu diesem Zeitpunkt) bald vorgestellt wird. Daraufhin meinte Sie, sie würde sich dann nochmal in ca. einem Monat bei mir melden.So kam es dann auch, 1-2 Tage vor der Apple Keynote rief Sie mich nochmal an, \xa0aber eigentlich nur um einen weiteren Termin mit mir zu Vereinbaren. Es ging um den Tag wo man das iPhone vorbestellen könne. Ich glaub es war der 10.'"", ""page_content='Source URL: https://telekomhilft.telekom.de/t5/Mobilfunk/Rufnummerportierung-abbrechen/td-p/6948072/jump-to/first-unread-message\nSubject: Rufnummerportierung abbrechen\nContent: Hallo,ich habe:-einen Mobilfunkvertrag mit Rufnummermitnahme beauftragt, der Auftrag ist bereits abgeschlossen und die Portierung war erfolgreich-eine 1. Zusatzkarte für obigen Vertrag mit Rufnummermitnahme beauftragt, Portierungstermin ist übermorgen-eine 2. Zusatzkarte für obigen Vertrag mit Rufnummermitnahme beauftragt, Portierungstermin ist der 30.9.-eine 3. Zusatzkarte mit neuer Rufnummer beauftragt, Auftrag wurde abgelehtDa die 3. Zusatzkarte abgelehnt wurde, einmal die nachfrage: Kann ich die Portierung der 2. Zusatzkarte mit Termin 30.9. noch abbrechen - falls ja: bis wann? Ich habe hier irgendwo gelesen, dass es bis 3 Tage vorher geht.Hintergrund: Der Nummerninhaber der 2.'"", ""page_content='Source URL: https://telekomhilft.telekom.de/t5/Mobilfunk/Liefertermin-iPhone-16-Pro-Max/td-p/6976075/jump-to/first-unread-message\nSubject: Liefertermin iPhone 16 Pro Max\nContent: Guten Morgen,ich habe am 25.09.2024 einen neuen Vertrag mit einem iPhone 16 Pro Max abgeschlossen. Der Vertrag wurde zum 04.10.2024 aktiviert.'""]","The meeting on the 10th September was effectively canceled because no one from the other party contacted me at the agreed time or later, despite having made arrangements to start work an hour later to accommodate the meeting.",2346,0.00039824999999999995,103,4,52.12092113494873,0.0,0.9999999999,1.0,0.8571428571428571,0.0032290850333869447,0.03448275862068966
Wie wird die eSIM zugestellt und was ist die Rolle des QR-Codes bei der Installation?,"Die eSIM wird Ihnen auf dem Postweg zugestellt. Anstelle einer physischen SIM-Karte erhalten Sie einen QR-Code, den Sie mit Ihrem Gerät einscannen, um die eSIM zu installieren. Dies vereinfacht den Prozess, da das manuelle Einsetzen der SIM-Karte entfällt. Weitere Informationen zur eSIM finden Sie unter [Telekom Hilfe](https://www.telekom.de/hilfe/mobilfunk/esim).","[""page_content='Das umständliche manuelle Einsetzen der SIM-Karte in den Kartenschlitz entfällt. Stattdessen erhalten Sie einen QR-Code, den Sie mit Ihrem Gerät zur Installation der eSIM einscannen. Sie erhalten die eSIM auf dem Postweg. Weitere Informationen zur eSIM finden Sie unterhttps://www.telekom.de/hilfe/mobilfunk/esim\n\n'"", ""page_content='Das umständliche manuelle Einsetzen der SIM-Karte in den Kartenschlitz entfällt. Stattdessen erhalten Sie einen QR-Code, den Sie mit Ihrem Gerät zur Installation der eSIM einscannen. Sie erhalten die eSIM auf dem Postweg. Weitere Informationen zur eSIM finden Sie unterhttps://www.telekom.de/hilfe/mobilfunk/esim\n\n'"", ""page_content='Das umständliche manuelle Einsetzen der SIM-Karte in den Kartenschlitz entfällt. Stattdessen erhalten Sie einen QR-Code, den Sie mit Ihrem Gerät zur Installation der eSIM einscannen. Sie erhalten die eSIM auf dem Postweg. Weitere Informationen zur eSIM finden Sie unterhttps://www.telekom.de/hilfe/mobilfunk/esim\n\n'"", ""page_content='Das umständliche manuelle Einsetzen der SIM-Karte in den Kartenschlitz entfällt. Stattdessen erhalten Sie einen QR-Code, den Sie mit Ihrem Gerät zur Installation der eSIM einscannen. Sie erhalten die eSIM auf dem Postweg. Weitere Informationen zur eSIM finden Sie unterhttps://www.telekom.de/hilfe/mobilfunk/esim\n\n'""]","Die eSIM wird auf dem Postweg zugestellt. Der QR-Code spielt eine Rolle bei der Installation der eSIM, da er mit dem Gerät eingescannt werden muss, um die eSIM zu installieren.",957,0.00018404999999999997,90,4,38.96273612976074,0.9664566489742631,0.999999999975,1.0,0.8333333333333334,0.15686589413993737,0.37362637362637363
What MagentaMobil plans are available for no-commitment users?,"Für Nutzer, die eine flexible, vertraglich unverbindliche Option suchen, bietet Telekom den MagentaMobil PlusKarte Flex Tarif an. Dieser Tarif hat keine Mindestvertragslaufzeit und ermöglicht es Ihnen, die Datenvolumen je nach Bedarf auszuwählen, mit Geschwindigkeiten von bis zu 300 Mbit/s. Sie können auch die MagentaMobil XS, S, M oder L Tarife wählen, die verschiedene Datenlimits und Geschwindigkeiten bieten. Weitere Informationen finden Sie auf der Telekom-Website.","[""page_content='Du bist hinsichtlich der Vertragslaufzeit flexibel und kannst dich für einen 24-Monats-Vertrag entscheiden oder überhaupt keinen Vertrag wählen. Für diejenigen, die sich für eine 24-monatige Laufzeit entscheiden, gibt es gegen Aufpreis ein Smartphone dazu. Die neuen Magenta-Mobil-Tarife können einfach über unseren Kundenservice, online, im Telekom-Shop oder im Verhandel gebucht werden. Erstelle deine Magenta-Mobil-Familie mit jedem, der dir wichtig ist und profitiere vom besten 5G-Netz der Telekom. '"", 'page_content=\'The document provides information about the ""MagentaMobil Basic Flex"" mobile plan from Telekom Deutschland GmbH. Here’s a summary of the relevant details:\n\n### Product Overview:\n- **Included Services**: Mobile connection for telephony, SMS, and internet access.\'', ""page_content='### Summary of the MagentaMobil PlusKarte Flex (Telekom Deutschland GmbH)\n\n#### Product Overview\n- **Product Name**: MagentaMobil PlusKarte Flex\n- **Service Types**: Mobile connection for telephony, SMS, and internet access. - **Launch Date**: Effective from August 1, 2024. #### Data Transfer Rates\n- **Download Speed**: Up to 300 Mbit/s\n- **Upload Speed**: Up to 50 Mbit/s\n\n#### Data Volume Details\n- The data volume is associated with the main contract (MagentaMobil). - **Data Limits**:\n  - **MagentaMobil XS**: 5 GB (after, reduced to 64 kbit/s)\n  - **MagentaMobil S**: 20 GB (after, reduced to 64 kbit/s)\n  - **MagentaMobil M**: 40 GB (after, reduced to 64 kbit/s)\n  - **MagentaMobil L**: 80 GB (after, reduced to 64 kbit/s)\n- **Note**: XL contract offers unlimited data. #### Contract Terms\n- **Contract Duration**: \n  - No minimum contract period.'"", ""page_content='- **Marketing Start Date**: 01.08.2024. ### Data Transfer Rates:\n- **Download Speed**: \n  - Max: 300 MBit/s\n  - Reduced after 5 GB usage: 64 kBit/s\n- **Upload Speed**:\n  - Max: 50 MBit/s\n  - Reduced after 5 GB usage: 16 kBit/s\n\n### Contract Information:\n- **Contract Duration**: \n  - No minimum contract term. - Cancellation period: One month. ### Pricing:\n- **Monthly Fee**: €24.95 (excluding one-time hardware costs). ### Additional Information:\n- Detailed terms and conditions are available on the Telekom website. This plan is designed for users looking for a flexible mobile contract without a long-term commitment and offers competitive data speeds.'""]","The available MagentaMobil plans for no-commitment users include the MagentaMobil Prepaid M, MagentaMobil Prepaid L, MagentaMobil Prepaid XL, and MagentaMobil Prepaid Max. These plans allow users to make calls and send SMS in all German networks without additional charges and without a contractual obligation.",1432,0.00026205,105,4,52.189563274383545,0.86676697781829,0.0,0.0,1.0,0.003384129602542209,0.06896551724137932
