Question,Response,Contexts,Ground Truth,Token Count,Total Cost (USD),Completion Tokens,Number of Retrieved documents,Response time,answer_relevancy,context_precision,context_recall,faithfulness,BleuScore,RougeScore
What ist die Bedeutung der eSIM für die Verbindung der Samsung Galaxy Watch mit dem Mobilfunknetz?,"Die eSIM ermöglicht es der Samsung Galaxy Watch, eine direkte Verbindung zum Mobilfunknetz herzustellen, auch wenn kein Smartphone oder WLAN in der Nähe ist. Im Gegensatz zu herkömmlichen Smartwatches, die eine Verbindung nur über Bluetooth oder WLAN in Verbindung mit einem Smartphone herstellen können, kann die Galaxy Watch mit eSIM eigenständig online gehen und ist somit auch ohne Smartphone erreichbar. Das bietet Ihnen mehr Flexibilität und Unabhängigkeit.","[""page_content='Source URL: https://www.telekom.de/hilfe/geraete-zubehoer/handy-smartphone-tablet/samsung/samsung-galaxy-watch/vorteile-samsung-galaxy-watch\n\nQuestion: Was sind die Vorteile der Samsung Galaxy Watch mit eSIM? Answer: Durch die eSIM kann die Samsung Galaxy Watch eine Verbindung ins Mobilfunknetz aufbauen, auch wenn kein Smartphone oder WLAN in der Nähe ist. Bei herkömmlichen Smartwatches war eine Verbindung ins Mobilfunknetz nur möglich, wenn die Smartwatch mit Hilfe eines Smartphones über Bluetooth oder WLAN mit dem Mobilfunknetz verbunden war. Die Samsung Galaxy Watch mit eSIM kann selbständig eine Verbindung ins Mobilfunknetz aufbauen. Sie können also Ihr Smartphone zu Hause lassen und sind über die Smartwatch über das Mobilfunknetz online und auf Ihrer Rufnummer erreichbar.'"", ""page_content='Source URL: https://www.telekom.de/hilfe/geraete-zubehoer/handy-smartphone-tablet/samsung/samsung-galaxy-watch/vorteile-samsung-galaxy-watch\n\nQuestion: Was sind die Vorteile der Samsung Galaxy Watch mit eSIM?\nAnswer: Durch die eSIM kann die Samsung Galaxy Watch eine Verbindung ins Mobilfunknetz aufbauen, auch wenn kein Smartphone oder WLAN in der Nähe ist. Bei herkömmlichen Smartwatches war eine Verbindung ins Mobilfunknetz nur möglich, wenn die Smartwatch mit Hilfe eines Smartphones über Blueto'"", ""page_content='Source URL: https://www.telekom.de/hilfe/geraete-zubehoer/handy-smartphone-tablet/samsung/samsung-galaxy-watch/vorteile-samsung-galaxy-watch\n\nQuestion: Was sind die Vorteile der Samsung Galaxy Watch mit eSIM?\nAnswer: Durch die eSIM kann die Samsung Galaxy Watch eine Verbindung ins Mobilfunknetz aufbauen, auch wenn kein Smartphone oder WLAN in der Nähe ist. Bei herkömmlichen Smartwatches war eine Verbindung ins Mobilfunknetz nur möglich, wenn die Smartwatch mit Hilfe eines Smartphones über Blueto'"", ""page_content='Source URL: https://www.telekom.de/hilfe/geraete-zubehoer/handy-smartphone-tablet/samsung/samsung-galaxy-watch/vorteile-samsung-galaxy-watch\n\nQuestion: Was sind die Vorteile der Samsung Galaxy Watch mit eSIM?\nAnswer: Durch die eSIM kann die Samsung Galaxy Watch eine Verbindung ins Mobilfunknetz aufbauen, auch wenn kein Smartphone oder WLAN in der Nähe ist. Bei herkömmlichen Smartwatches war eine Verbindung ins Mobilfunknetz nur möglich, wenn die Smartwatch mit Hilfe eines Smartphones über Blueto'""]","Die eSIM ermöglicht es der Samsung Galaxy Watch, eine Verbindung ins Mobilfunknetz aufzubauen, auch wenn kein Smartphone oder WLAN in der Nähe ist. Dies bedeutet, dass die Smartwatch selbstständig online und erreichbar ist, ohne dass ein Smartphone benötigt wird.",793,0.00015899999999999996,89,4,226.5259690284729,0.8911527362141191,0.999999999975,1.0,0.8571428571428571,0.2653946103211352,0.5299145299145299
Kann ich eine PlusKarte ohne Mindestvertragslaufzeit buchen?,"Ja, Sie können eine MagentaMobil PlusKarte ohne Mindestvertragslaufzeit buchen, wenn Sie kein Gerät dazu nehmen. Der Vertrag ist dann monatlich kündbar.","[""page_content='Source URL: https://www.telekom.de/hilfe/mobilfunk/tarife-optionen/zusatzkarten/plus-karte-vertragslaufzeit\n\nQuestion: Kann ich eine PlusKarte ohne Vertragslaufzeit buchen?\nAnswer: Ja, wenn Sie kein Gerät dazu nehmen, können Sie eine MagentaMobil PlusKarte auch ohne Mindestvertragslaufzeit wählen. Der Vertrag ist dann monatlich kündbar.'"", ""page_content='Source URL: https://www.telekom.de/hilfe/mobilfunk/tarife-optionen/zusatzkarten/plus-karte-vertragslaufzeit\n\nQuestion: Kann ich eine PlusKarte ohne Vertragslaufzeit buchen?\nAnswer: Ja, wenn Sie kein Gerät dazu nehmen, können Sie eine MagentaMobil PlusKarte auch ohne Mindestvertragslaufzeit wählen. Der Vertrag ist dann monatlich kündbar.'"", ""page_content='Source URL: https://www.telekom.de/hilfe/mobilfunk/tarife-optionen/zusatzkarten/plus-karte-vertragslaufzeit\n\nQuestion: Kann ich eine PlusKarte ohne Vertragslaufzeit buchen?\nAnswer: Ja, wenn Sie kein Gerät dazu nehmen, können Sie eine MagentaMobil PlusKarte auch ohne Mindestvertragslaufzeit wählen. Der Vertrag ist dann monatlich kündbar.'"", ""page_content='Source URL: https://www.telekom.de/hilfe/mobilfunk/tarife-optionen/zusatzkarten/plus-karte-vertragslaufzeit\n\nQuestion: Kann ich eine PlusKarte ohne Vertragslaufzeit buchen?\nAnswer: Ja, wenn Sie kein Gerät dazu nehmen, können Sie eine MagentaMobil PlusKarte auch ohne Mindestvertragslaufzeit wählen. Der Vertrag ist dann monatlich kündbar.'""]","Ja, wenn Sie kein Gerät dazu nehmen, können Sie eine MagentaMobil PlusKarte auch ohne Mindestvertragslaufzeit wählen. Der Vertrag ist dann monatlich kündbar.",547,9.779999999999999e-05,35,4,209.70873403549194,0.9759741981600264,0.999999999975,1.0,1.0,0.4786291785330549,0.64
What advantages does the A15 Bionic Prozessor offer in the iPhone 13 series compared to its predecessor?,"Der A15 Bionic Prozessor im iPhone 13 bietet mehrere Vorteile im Vergleich zum A14 Bionic. Er bietet eine höhere Leistung und Effizienz, was zu einer schnelleren Verarbeitung von Aufgaben und einer verbesserten Grafikleistung führt. Dies bedeutet, dass Spiele und grafikintensive Anwendungen flüssiger laufen. Zudem verbessert der A15 Bionic die Leistung bei maschinellem Lernen, was neue Möglichkeiten für Kamera- und Fotofunktionen eröffnet. Insgesamt sorgt der neue Prozessor für ein besseres Benutzererlebnis und eine längere Akkulaufzeit.","['page_content=\'ihre Vorgängermodelle erneut mit modernen Technologien übertreffen. Die 5G-fähigen Modelle verfügen über einen neuen A15 Bionic Prozessor, der noch mehr Leistung bietet als der A14 Bionic. DasiPhone 13begeistert mit einem 12 Megapixel Kamera-System sowie einem 6,1"" Super Retina XDR Display für leuchtende Farben. Im Vergleich zu den Vorgängermodellen bietet die iPhone 13-Serie viele Neuerungen hinsichtlich der Ausstattung:\nBei den Modellen desiPhone 14setzt Apple bei der Kamera wieder neue Maßstä\'', 'page_content=\'ihre Vorgängermodelle erneut mit modernen Technologien übertreffen. Die 5G-fähigen Modelle verfügen über einen neuen A15 Bionic Prozessor, der noch mehr Leistung bietet als der A14 Bionic. DasiPhone 13begeistert mit einem 12 Megapixel Kamera-System sowie einem 6,1"" Super Retina XDR Display für leuchtende Farben. Im Vergleich zu den Vorgängermodellen bietet die iPhone 13-Serie viele Neuerungen hinsichtlich der Ausstattung:\nBei den Modellen desiPhone 14setzt Apple bei der Kamera wieder neue Maßstä\'', 'page_content=\'ihre Vorgängermodelle erneut mit modernen Technologien übertreffen. Die 5G-fähigen Modelle verfügen über einen neuen A15 Bionic Prozessor, der noch mehr Leistung bietet als der A14 Bionic. DasiPhone 13begeistert mit einem 12 Megapixel Kamera-System sowie einem 6,1"" Super Retina XDR Display für leuchtende Farben. Im Vergleich zu den Vorgängermodellen bietet die iPhone 13-Serie viele Neuerungen hinsichtlich der Ausstattung:\nBei den Modellen desiPhone 14setzt Apple bei der Kamera wieder neue Maßstä\'', 'page_content=\'ihre Vorgängermodelle erneut mit modernen Technologien übertreffen. Die 5G-fähigen Modelle verfügen über einen neuen A15 Bionic Prozessor, der noch mehr Leistung bietet als der A14 Bionic. DasiPhone 13begeistert mit einem 12 Megapixel Kamera-System sowie einem 6,1"" Super Retina XDR Display für leuchtende Farben. Im Vergleich zu den Vorgängermodellen bietet die iPhone 13-Serie viele Neuerungen hinsichtlich der Ausstattung:\nBei den Modellen desiPhone 14setzt Apple bei der Kamera wieder neue Maßstä\'']","The A15 Bionic Prozessor in the iPhone 13 series offers more performance compared to the A14 Bionic, enhancing the overall capabilities of the device.",778,0.00016754999999999998,113,4,234.46668219566345,0.9680977357647184,0.999999999975,0.5,0.2222222222222222,0.01597834411462684,0.1320754716981132
What steps are involved in updating bank connections in the Kundencenter and MeinMagenta App?,"Um Ihre Bankverbindungen im Kundencenter und in der MeinMagenta App zu aktualisieren, folgen Sie bitte diesen Schritten:

**Kundencenter:**
1. Gehen Sie zu „Mein Profil“.
2. Klicken Sie auf „Persönliche Daten“.
3. Wählen Sie „Bankverbindungen“ und klicken Sie auf das Stift-Symbol.
4. Geben Sie die neuen Daten ein.
5. Kontrollieren Sie die eingegebenen Daten.
6. Klicken Sie auf „Weiter“.

**MeinMagenta App:**
1. Tippen Sie auf das Benutzer-Symbol rechts neben „Start“.
2. Wählen Sie „Persönliche Daten“.
3. Gehen Sie zu „Bankverbindungen“ und tippen Sie auf „Bearbeiten“.
4. Geben Sie die neuen Daten ein.
5. Kontrollieren Sie die eingegebenen Daten.
6. Klicken Sie auf „Weiter“.

Falls Sie weitere Fragen haben, stehe ich Ihnen gerne zur Verfügung!","[""page_content='• KundencenterMein Profil > Persönliche Daten > Bankverbindungen > Stift-Symbol klicken > Daten eingeben > Daten kontrollieren > Weiter\n• MeinMagenta AppBenutzer-Symbol rechts neben Start > Persönliche Daten > Bankverbindungen > Bearbeiten > Daten eingeben > Daten kontrollieren > Weiter\n\n'"", ""page_content='• KundencenterMein Profil > Persönliche Daten > Bankverbindungen > Stift-Symbol klicken > Daten eingeben > Daten kontrollieren > Weiter\n• MeinMagenta AppBenutzer-Symbol rechts neben Start > Persönliche Daten > Bankverbindungen > Bearbeiten > Daten eingeben > Daten kontrollieren > Weiter\n\n'"", ""page_content='• KundencenterMein Profil > Persönliche Daten > Bankverbindungen > Stift-Symbol klicken > Daten eingeben > Daten kontrollieren > Weiter\n• MeinMagenta AppBenutzer-Symbol rechts neben Start > Persönliche Daten > Bankverbindungen > Bearbeiten > Daten eingeben > Daten kontrollieren > Weiter\n\n'"", ""page_content='• KundencenterMein Profil > Persönliche Daten > Bankverbindungen > Stift-Symbol klicken > Daten eingeben > Daten kontrollieren > Weiter\n• MeinMagenta AppBenutzer-Symbol rechts neben Start > Persönliche Daten > Bankverbindungen > Bearbeiten > Daten eingeben > Daten kontrollieren > Weiter\n\n'""]","To update bank connections in the Kundencenter, the steps are: 1. Go to Mein Profil > Persönliche Daten > Bankverbindungen > click on the Stift-Symbol > enter data > check data > click Weiter. In the MeinMagenta App, the steps are: 1. Click on the Benutzer-Symbol on the right next to Start > Persönliche Daten > Bankverbindungen > Bearbeiten > enter data > check data > click Weiter.",645,0.00019034999999999996,208,4,236.7573220729828,0.9503457577688356,0.999999999975,1.0,0.9230769230769231,0.00268237482367139,0.26666666666666666
What sind die Kosten für die Mitnahme meiner Mobilfunk-Rufnummer zu einem anderen Anbieter?,"Die Mitnahme Ihrer Mobilfunk-Rufnummer zu einem anderen Anbieter ist sowohl bei Laufzeitverträgen als auch bei Prepaid-Karten der Telekom kostenfrei. Wenn Sie weitere Informationen benötigen, können Sie auch die Website www.telekom.de/hilfe besuchen.","[""page_content='Source URL: https://www.telekom.de/hilfe/vertrag-rechnung/vertrag/kuendigung/kosten-rufnummernmitnahme\n\nQuestion: Was kostet mich die Mitnahme meiner Mobilfunk-Rufnummer? Answer: Die Rufnummernmitnahme zu einem anderen Anbieter ist sowohl bei Laufzeitverträgen als auch bei Prepaid-Karten der Telekom kostenfrei.'"", ""page_content='Source URL: https://www.telekom.de/hilfe/vertrag-rechnung/vertrag/kuendigung/kosten-rufnummernmitnahme\n\nQuestion: Was kostet mich die Mitnahme meiner Mobilfunk-Rufnummer? Answer: Die Rufnummernmitnahme zu einem anderen Anbieter ist sowohl bei Laufzeitverträgen als auch bei Prepaid-Karten der Telekom kostenfrei.'"", ""page_content='Source URL: https://www.telekom.de/hilfe/vertrag-rechnung/vertrag/kuendigung/kosten-rufnummernmitnahme\n\nQuestion: Was kostet mich die Mitnahme meiner Mobilfunk-Rufnummer? Answer: Die Rufnummernmitnahme zu einem anderen Anbieter ist sowohl bei Laufzeitverträgen als auch bei Prepaid-Karten der Telekom kostenfrei.'"", ""page_content='Source URL: https://www.telekom.de/hilfe/vertrag-rechnung/vertrag/kuendigung/kosten-rufnummernmitnahme\n\nQuestion: Was kostet mich die Mitnahme meiner Mobilfunk-Rufnummer? Answer: Die Rufnummernmitnahme zu einem anderen Anbieter ist sowohl bei Laufzeitverträgen als auch bei Prepaid-Karten der Telekom kostenfrei.'""]","Die Mitnahme meiner Mobilfunk-Rufnummer zu einem anderen Anbieter ist kostenfrei, sowohl bei Laufzeitverträgen als auch bei Prepaid-Karten der Telekom.",537,0.00010394999999999998,52,4,235.81063389778137,0.9533785009821768,0.999999999975,1.0,0.6666666666666666,0.3852818814494648,0.6557377049180326
"Wie aktiviere ich VoLTE, wenn LTE fehlt?","Um VoLTE zu aktivieren, sollten Sie zunächst sicherstellen, dass Ihr Smartphone 4G/LTE-fähig ist. Wenn in der Statusanzeige kein 4G oder LTE angezeigt wird und nur ""2G"" oder ""E"" bzw. ""Edge"" sichtbar ist, könnte es an der Netzabdeckung an Ihrem Standort liegen. 

Hier sind einige Schritte, die Sie versuchen können:

1. **Netzwerk-Einstellungen überprüfen:** Gehen Sie in die Einstellungen Ihres Smartphones und suchen Sie nach den Mobilfunknetz-Einstellungen. Stellen Sie sicher, dass LTE aktiviert ist.

2. **Flugmodus ein-/ausschalten:** Manchmal kann das Aktivieren und anschließende Deaktivieren des Flugmodus helfen, die Verbindung wiederherzustellen.

3. **Standort wechseln:** Versuchen Sie, sich an einen Ort zu begeben, wo Sie wissen, dass LTE verfügbar ist, um zu prüfen, ob Ihr Gerät das LTE-Netz erkennt.

4. **Gerät neu starten:** Ein Neustart kann oft helfen, Verbindungsprobleme zu lösen.

Falls das Problem weiterhin besteht, empfehle ich Ihnen, direkt bei Telekom nachzufragen oder die Hilfe-Seite unter www.telekom.de/hilfe zu besuchen.","['page_content=\'rdings eine kurze Überprüfung, ob in Ihrem Telefon auch schon die Sprachübertragung über LTE (VoLTE, Voice over LTE) aktiviert ist. So erleben Sie auch die beste Sprachqualität.\nWie kann ich\xa0VoLTE einschalten?\nSie sehen kein 4G oder LTE in der Statusanzeige,nutzen jedoch ein 4G/LTE-fähiges Smartphone und bekommen nur ""2G"" oder ""E""\xa0oder ""Edge""\xa0in dessen Statuszeile angezeigt?Wenn die Anzeige von ""2G"", ""E""\xa0oder ""Edge"" nur an bestimmten Orten erfolgt, Sie aber an anderen Orten ""LTE""\xa0bzw. ""4G""\xa0in de\'', 'page_content=\'rdings eine kurze Überprüfung, ob in Ihrem Telefon auch schon die Sprachübertragung über LTE (VoLTE, Voice over LTE) aktiviert ist. So erleben Sie auch die beste Sprachqualität.\nWie kann ich\xa0VoLTE einschalten?\nSie sehen kein 4G oder LTE in der Statusanzeige,nutzen jedoch ein 4G/LTE-fähiges Smartphone und bekommen nur ""2G"" oder ""E""\xa0oder ""Edge""\xa0in dessen Statuszeile angezeigt?Wenn die Anzeige von ""2G"", ""E""\xa0oder ""Edge"" nur an bestimmten Orten erfolgt, Sie aber an anderen Orten ""LTE""\xa0bzw. ""4G""\xa0in de\'', 'page_content=\'rdings eine kurze Überprüfung, ob in Ihrem Telefon auch schon die Sprachübertragung über LTE (VoLTE, Voice over LTE) aktiviert ist. So erleben Sie auch die beste Sprachqualität.\nWie kann ich\xa0VoLTE einschalten?\nSie sehen kein 4G oder LTE in der Statusanzeige,nutzen jedoch ein 4G/LTE-fähiges Smartphone und bekommen nur ""2G"" oder ""E""\xa0oder ""Edge""\xa0in dessen Statuszeile angezeigt?Wenn die Anzeige von ""2G"", ""E""\xa0oder ""Edge"" nur an bestimmten Orten erfolgt, Sie aber an anderen Orten ""LTE""\xa0bzw. ""4G""\xa0in de\'', 'page_content=\'rdings eine kurze Überprüfung, ob in Ihrem Telefon auch schon die Sprachübertragung über LTE (VoLTE, Voice over LTE) aktiviert ist. So erleben Sie auch die beste Sprachqualität.\nWie kann ich\xa0VoLTE einschalten?\nSie sehen kein 4G oder LTE in der Statusanzeige,nutzen jedoch ein 4G/LTE-fähiges Smartphone und bekommen nur ""2G"" oder ""E""\xa0oder ""Edge""\xa0in dessen Statuszeile angezeigt?Wenn die Anzeige von ""2G"", ""E""\xa0oder ""Edge"" nur an bestimmten Orten erfolgt, Sie aber an anderen Orten ""LTE""\xa0bzw. ""4G""\xa0in de\'']",Die Antwort auf die gegebene Frage ist nicht im Kontext vorhanden,1009,0.0002643,251,4,240.73344206809998,0.9494814178282572,0.9999999999666667,1.0,0.21428571428571427,0.0012306800290383941,0.03370786516853933
Wie kann die eSIM der Galaxy Watch online ohne Smartphone sein?,"Die Samsung Galaxy Watch mit eSIM kann selbständig eine Verbindung zum Mobilfunknetz aufbauen. Das bedeutet, dass Sie Ihr Smartphone zu Hause lassen können und dennoch über die Smartwatch online sind und Ihre Rufnummer erreichen können. Sie ist somit in der Lage, ohne eine Bluetooth- oder WLAN-Verbindung zu einem Smartphone zu funktionieren.","[""page_content='Smartwatch mit Hilfe eines Smartphones über Bluetooth oder WLAN mit dem Mobilfunknetz verbunden war. Die Samsung Galaxy Watch mit eSIM kann selbständig eine Verbindung ins Mobilfunknetz aufbauen. Sie können also Ihr Smartphone zu Hause lassen und sind über die Smartwatch über das Mobilfunknetz online und auf Ihrer Rufnummer erreichbar.'"", ""page_content='Smartwatch mit Hilfe eines Smartphones über Bluetooth oder WLAN mit dem Mobilfunknetz verbunden war. Die Samsung Galaxy Watch mit eSIM kann selbständig eine Verbindung ins Mobilfunknetz aufbauen. Sie können also Ihr Smartphone zu Hause lassen und sind über die Smartwatch über das Mobilfunknetz online und auf Ihrer Rufnummer erreichbar.'"", ""page_content='Smartwatch mit Hilfe eines Smartphones über Bluetooth oder WLAN mit dem Mobilfunknetz verbunden war. Die Samsung Galaxy Watch mit eSIM kann selbständig eine Verbindung ins Mobilfunknetz aufbauen. Sie können also Ihr Smartphone zu Hause lassen und sind über die Smartwatch über das Mobilfunknetz online und auf Ihrer Rufnummer erreichbar.'"", ""page_content='Smartwatch mit Hilfe eines Smartphones über Bluetooth oder WLAN mit dem Mobilfunknetz verbunden war. Die Samsung Galaxy Watch mit eSIM kann selbständig eine Verbindung ins Mobilfunknetz aufbauen. Sie können also Ihr Smartphone zu Hause lassen und sind über die Smartwatch über das Mobilfunknetz online und auf Ihrer Rufnummer erreichbar.'""]","Die eSIM der Samsung Galaxy Watch ermöglicht es, eine Verbindung ins Mobilfunknetz aufzubauen, auch wenn kein Smartphone oder WLAN in der Nähe ist. Dadurch kann die Smartwatch selbstständig online sein und ist über die Rufnummer erreichbar, ohne dass ein Smartphone benötigt wird.",489,0.00010305,66,4,236.79773020744324,0.9125307513787216,0.999999999975,1.0,0.75,0.03894712434638685,0.31683168316831684
Why was the 10th Sept meeting on the mobile plan canceled?,"Es scheint, dass die Informationen zu dem Meeting am 10. September in den bereitgestellten Dokumenten nicht ausreichend sind, um den Grund für die Absage zu klären. Ich kann Ihnen dabei leider nicht weiterhelfen. Ich empfehle Ihnen, die Webseite www.telekom.de/hilfe zu besuchen, um weitere Unterstützung zu erhalten.","[""page_content='Es ging um den Tag wo man das iPhone vorbestellen könne. Ich glaub es war der 10. September. Kann mich aber auch irren.Weil ich durch die Arbeit ziemlich eingespannt bin, haben wir also einen Termin für den 10. September ausgemacht. Bei mir hätte es morgen am besten gepasst, da ich an diesem Tag Spätschicht hatte. Von Ihrer Seite ging es aber laut Ihrer Aussage erst ab 13 Uhr, da Sie auch Spätdienst hätte. Also haben wir den Termin für 13 Uhr vereinbart. Ich habe mir dann extra Zeit auf der Arbe'"", ""page_content='Es ging um den Tag wo man das iPhone vorbestellen könne. Ich glaub es war der 10. September. Kann mich aber auch irren.Weil ich durch die Arbeit ziemlich eingespannt bin, haben wir also einen Termin für den 10. September ausgemacht. Bei mir hätte es morgen am besten gepasst, da ich an diesem Tag Spätschicht hatte. Von Ihrer Seite ging es aber laut Ihrer Aussage erst ab 13 Uhr, da Sie auch Spätdienst hätte. Also haben wir den Termin für 13 Uhr vereinbart. Ich habe mir dann extra Zeit auf der Arbe'"", ""page_content='Es ging um den Tag wo man das iPhone vorbestellen könne. Ich glaub es war der 10. September. Kann mich aber auch irren.Weil ich durch die Arbeit ziemlich eingespannt bin, haben wir also einen Termin für den 10. September ausgemacht. Bei mir hätte es morgen am besten gepasst, da ich an diesem Tag Spätschicht hatte. Von Ihrer Seite ging es aber laut Ihrer Aussage erst ab 13 Uhr, da Sie auch Spätdienst hätte. Also haben wir den Termin für 13 Uhr vereinbart. Ich habe mir dann extra Zeit auf der Arbe'"", ""page_content='Es ging um den Tag wo man das iPhone vorbestellen könne. Ich glaub es war der 10. September. Kann mich aber auch irren.Weil ich durch die Arbeit ziemlich eingespannt bin, haben wir also einen Termin für den 10. September ausgemacht. Bei mir hätte es morgen am besten gepasst, da ich an diesem Tag Spätschicht hatte. Von Ihrer Seite ging es aber laut Ihrer Aussage erst ab 13 Uhr, da Sie auch Spätdienst hätte. Also haben wir den Termin für 13 Uhr vereinbart. Ich habe mir dann extra Zeit auf der Arbe'""]","The meeting on the 10th September was effectively canceled because no one from the other party contacted me at the agreed time or later, despite having made arrangements to start work an hour later to accommodate the meeting.",732,0.0001404,68,4,214.83949899673462,0.0,0.9166666666361111,0.0,0.0,0.003997395604823099,0.044444444444444446
Wie wird die eSIM zugestellt und was ist die Rolle des QR-Codes bei der Installation?,Die eSIM wird Ihnen auf dem Postweg zugestellt. Statt des umständlichen manuellen Einsetzens einer SIM-Karte in den Kartenschlitz erhalten Sie einen QR-Code. Dieser QR-Code muss mit Ihrem Gerät zur Installation der eSIM eingescannt werden. Weitere Informationen zur eSIM finden Sie auf der Telekom-Hilfeseite: [Telekom Hilfe zur eSIM](https://www.telekom.de/hilfe/mobilfunk/esim).,"[""page_content='Das umständliche manuelle Einsetzen der SIM-Karte in den Kartenschlitz entfällt. Stattdessen erhalten Sie einen QR-Code, den Sie mit Ihrem Gerät zur Installation der eSIM einscannen. Sie erhalten die eSIM auf dem Postweg. Weitere Informationen zur eSIM finden Sie unterhttps://www.telekom.de/hilfe/mobilfunk/esim\n\n'"", ""page_content='Das umständliche manuelle Einsetzen der SIM-Karte in den Kartenschlitz entfällt. Stattdessen erhalten Sie einen QR-Code, den Sie mit Ihrem Gerät zur Installation der eSIM einscannen. Sie erhalten die eSIM auf dem Postweg. Weitere Informationen zur eSIM finden Sie unterhttps://www.telekom.de/hilfe/mobilfunk/esim\n\n'"", ""page_content='Das umständliche manuelle Einsetzen der SIM-Karte in den Kartenschlitz entfällt. Stattdessen erhalten Sie einen QR-Code, den Sie mit Ihrem Gerät zur Installation der eSIM einscannen. Sie erhalten die eSIM auf dem Postweg. Weitere Informationen zur eSIM finden Sie unterhttps://www.telekom.de/hilfe/mobilfunk/esim\n\n'"", ""page_content='Das umständliche manuelle Einsetzen der SIM-Karte in den Kartenschlitz entfällt. Stattdessen erhalten Sie einen QR-Code, den Sie mit Ihrem Gerät zur Installation der eSIM einscannen. Sie erhalten die eSIM auf dem Postweg. Weitere Informationen zur eSIM finden Sie unterhttps://www.telekom.de/hilfe/mobilfunk/esim\n\n'""]","Die eSIM wird auf dem Postweg zugestellt. Der QR-Code spielt eine Rolle bei der Installation der eSIM, da er mit dem Gerät eingescannt werden muss, um die eSIM zu installieren.",571,0.00012749999999999998,93,4,231.27236318588257,0.9664566489742631,0.999999999975,1.0,1.0,0.08911703343001871,0.32608695652173914
What MagentaMobil plans are available for no-commitment users?,"Für Nutzer ohne langfristige Verpflichtung ist der MagentaMobil Tarif verfügbar, der folgende Merkmale aufweist:

- **Vertragsdauer**: 
  - Keine Mindestvertragslaufzeit.
  - Kündigungsfrist: ein Monat.

- **Monatliche Gebühr**: 24,95 € (zuzüglich einmaliger Hardwarekosten).

Dieser Tarif ist ideal für Nutzer, die einen flexiblen Mobilfunkvertrag suchen, ohne sich langfristig binden zu müssen, und bietet wettbewerbsfähige Datengeschwindigkeiten. Für detaillierte Bedingungen und weitere Informationen können Sie die Telekom-Website besuchen.","[""page_content='- Reduced after 5 GB usage: 16 kBit/s\n\n### Contract Information:\n- **Contract Duration**: \n  - No minimum contract term.\n  - Cancellation period: One month.\n  \n### Pricing:\n- **Monthly Fee**: €24.95 (excluding one-time hardware costs).\n\n### Additional Information:\n- Detailed terms and conditions are available on the Telekom website.\n\nThis plan is designed for users looking for a flexible mobile contract without a long-term commitment and offers competitive data speeds.'"", ""page_content='- Reduced after 5 GB usage: 16 kBit/s\n\n### Contract Information:\n- **Contract Duration**: \n  - No minimum contract term.\n  - Cancellation period: One month.\n  \n### Pricing:\n- **Monthly Fee**: €24.95 (excluding one-time hardware costs).\n\n### Additional Information:\n- Detailed terms and conditions are available on the Telekom website.\n\nThis plan is designed for users looking for a flexible mobile contract without a long-term commitment and offers competitive data speeds.'"", ""page_content='- Reduced after 5 GB usage: 16 kBit/s\n\n### Contract Information:\n- **Contract Duration**: \n  - No minimum contract term.\n  - Cancellation period: One month.\n  \n### Pricing:\n- **Monthly Fee**: €24.95 (excluding one-time hardware costs).\n\n### Additional Information:\n- Detailed terms and conditions are available on the Telekom website.\n\nThis plan is designed for users looking for a flexible mobile contract without a long-term commitment and offers competitive data speeds.'"", ""page_content='- Reduced after 5 GB usage: 16 kBit/s\n\n### Contract Information:\n- **Contract Duration**: \n  - No minimum contract term.\n  - Cancellation period: One month.\n  \n### Pricing:\n- **Monthly Fee**: €24.95 (excluding one-time hardware costs).\n\n### Additional Information:\n- Detailed terms and conditions are available on the Telekom website.\n\nThis plan is designed for users looking for a flexible mobile contract without a long-term commitment and offers competitive data speeds.'""]","The available MagentaMobil plans for no-commitment users include the MagentaMobil Prepaid M, MagentaMobil Prepaid L, MagentaMobil Prepaid XL, and MagentaMobil Prepaid Max. These plans allow users to make calls and send SMS in all German networks without additional charges and without a contractual obligation.",745,0.000168,125,4,241.43763613700867,0.9385464593414204,0.0,0.0,1.0,0.0028919892142542742,0.034782608695652174
