Question,Response,Contexts,Ground Truth,Token Count,Total Cost (USD),Completion Tokens,Number of Retrieved documents,Response time,answer_relevancy,context_precision,context_recall,faithfulness,BleuScore,RougeScore
What steps should I follow to set up an additional email address in the E-Mail Center?,"Um eine zusätzliche E-Mail-Adresse im E-Mail Center einzurichten, folgen Sie bitte diesen Schritten:

1. Gehen Sie zu den Einstellungen, indem Sie auf das Zahnrad klicken.
2. Wählen Sie ""Alle Einstellungen anzeigen"".
3. Klicken Sie auf ""E-Mail-Adressen"".
4. Wählen Sie ""Zusätzliche Adressen"".
5. Klicken Sie auf ""Neue E-Mail-Adresse anlegen"" und folgen Sie den Anweisungen.

Für weitere Informationen können Sie auch die [Hilfeseite von Telekom](https://www.telekom.de/hilfe/apps-dienste/e-mail/konto/weitere-adresse) besuchen.","['page_content=\'Source URL: https://www.telekom.de/hilfe/apps-dienste/e-mail/e-mail-center/zusaetzliche-ordner\n\nQuestion: Wie kann ich im E-Mail Center zusätzliche Ordner anlegen? Answer: Um zusätzliche Ordner imE-Mail Centeranzulegen, klicken Sie links neben ""Meine Ordner"" auf das ""+"" und vergeben einen Namen.\' metadata={\'source\': \'data/Apps & Dienste/https___www.telekom.de_hilfe_apps-dienste_e-mail_e-mail-center_zusaetzliche-ordner.txt\'}', ""page_content='' metadata={'source': 'data/Apps & Dienste/https___www.telekom.de_hilfe_apps-dienste_apps_telekom-mail-app_e-mail-konto-einrichten.txt'}"", ""page_content='Source URL: https://www.telekom.de/hilfe/apps-dienste/e-mail/konto/weitere-adresse\n\nQuestion: Wie richte ich eine zusätzliche E-Mail-Adresse ein? Answer: Eine zusätzliche E-Mail-Adresse können Sie sich imE-Mail Centerzu Ihrem bestehenden Postfach wie folgt dazubuchen:\nZahnrad > Alle Einstellungen anzeigen > E-Mail-Adressen > Zusätzliche Adressen > Neue E-Mail-Adresse anlegen\n\n' metadata={'source': 'data/Apps & Dienste/https___www.telekom.de_hilfe_apps-dienste_e-mail_konto_weitere-adresse.txt'}"", ""page_content='' metadata={'source': 'data/Apps & Dienste/https___www.telekom.de_hilfe_apps-dienste_e-mail_e-mail-center_pc-fax-versenden.txt'}"", 'page_content=\'Nach erfolgreicher Anmeldung sehen Sie oben rechts eine Begrüßung und per Klick darunter auf ""Zum E-Mail Center"" werden Ihnen Ihre E-Mails angezeigt. \' metadata={\'source\': \'data/Apps & Dienste/https___www.telekom.de_hilfe_apps-dienste_e-mail_e-mail-center_computer.txt\'}', ""page_content='' metadata={'source': 'data/Apps & Dienste/https___www.telekom.de_hilfe_apps-dienste_e-mail_einstellungen_signatur.txt'}"", ""page_content='' metadata={'source': 'data/Apps & Dienste/https___www.telekom.de_hilfe_apps-dienste_e-mail_e-mail-center_handbuch.txt'}"", ""page_content='Source URL: https://www.telekom.de/hilfe/apps-dienste/e-mail/e-mail-center/alternative-adresse\n\nQuestion: Wie lege ich eine alternative Adresse im E-Mail Center an? Answer: Melden Sie sich imE-Mail Centeran.' metadata={'source': 'data/Apps & Dienste/https___www.telekom.de_hilfe_apps-dienste_e-mail_e-mail-center_alternative-adresse.txt'}"", 'page_content=\'Answer: Die Haupt-E-Mail-Adresse wird in den Einstellungen desE-Mail-Centersverwaltet. Zu den Einstellungen gelangen Sie wie folgt:\nZahnrad > Alle Einstellungen anzeigen > E-Mail-Adressen > Haupt-Adresse\nKlicken Sie auf den Punkt ""Haupt-E-Mail-Adresse mit einer zusätzlichen E-Mail-Adresse tauschen"".\' metadata={\'source\': \'data/Apps & Dienste/https___www.telekom.de_hilfe_apps-dienste_e-mail_konto_hauptadresse-festlegen-tauschen.txt\'}', ""page_content='beruflich relevant sind. Ob mobil über die Telekom Mail App oder stationär am Computer – das E-Mail Center steht Ihnen sowohl über Ihren Browser als auch über dieTelekom Mail Appzur Verfügung. Question: Wie melde ich mich zum E-Mail Center an?' metadata={'source': 'data/Apps & Dienste/https___www.telekom.de_e-mail_e-mail-center.txt'}"", ""page_content='Answer: So erreichen Sie das E-Mail Center:\n1. Über das T-Online-Login: Klicken Sie oben auf „Login über T-Online“, Sie werden anschließend weitergeleitet. Melden Sie sich mit Ihrem Telekom-Benutzernamen und Ihrem Passwort in der Anmeldemaske an. 2. Über das Telekom Kundencenter: Klicken Sie oben auf „Login über Kundencenter“ und geben Sie Ihren Telekom-Benutzernamen sowie das Passwort ein, das Sie festgelegt haben. Im Kundencenter finden Sie dann den Button, der Sie direkt zum E-Mail Center führt.' metadata={'source': 'data/Apps & Dienste/https___www.telekom.de_e-mail_e-mail-center.txt'}""]","Um eine zusätzliche E-Mail-Adresse im E-Mail Center einzurichten, folgen Sie diesen Schritten: Zahnrad > Alle Einstellungen anzeigen > E-Mail-Adressen > Zusätzliche Adressen > Neue E-Mail-Adresse anlegen.",1295,0.0002541,133,11,64.66626620292664,0.9723065336931778,0.2916666666520833,1.0,0.75,0.15320019198133614,0.5166666666666667
Welche Zertifizierungen hat das Neebo Baby Sensor-Armband?,"Das Neebo Baby Sensor-Armband hat mehrere Zertifizierungen, um die Sicherheit zu gewährleisten. In den USA verfügt es über die Zertifizierungen FCC, Toy Safety Standard und Consumer Product Safety Improvement Act (CPSIA). In der EU hat es die CE-AGC (RED Directive), ROHS XRF+Chemical Test und WEEE-Zertifizierung. In Australien ist es mit der RCM zertifiziert.","[""page_content='Source URL: https://www.telekom.de/smarte-produkte/iot/baby-sensor-armband\n\nQuestion: Wie funktioniert das Baby Sensor-Armband von Neebo? Answer: Das Neebo Baby Sensor-Armband hat fünf Sensoren, die verschiedenste Daten sammeln und analysieren. Die wichtigsten Funktionen, die das Baby Wearable von Neebo überwacht, sind folgende:Die Herzfrequenz und die Sauerstoffsättigung Ihres Säuglings werden mit dem Baby Sensor-Armband optisch bzw. photoplethysmographisch (Messung von Volumenveränderung) überwacht.' metadata={'source': 'data/Apps & Dienste/https___www.telekom.de_smarte-produkte_iot_baby-sensor-armband.txt'}"", 'page_content=\'B. wenn Ihr Kind schon ein Jahr alt ist) anfangen, das Neebo Baby Sensor-Armband zu verwenden, dann kann es eine Herausforderung für Ihr Kind sein – hier gewöhnt es sich u.U. nicht unbedingt schnell an das Wearable.Es geht vor allem darum, wie die Eltern mit dem Kind kommunizieren sowie die Gewohnheit entwickeln, das Neebo Baby Sensor-Armband zu tragen. Question: Hat das Neebo Baby Sensor-Armband eine schädliche Strahlung? Answer: Das Neebo Baby Armband selbst verwendet Bluetooth Low Energy (BLE) für die Datenübertragung. Es erzeugt 56-mal weniger elektromagnetische Strahlung (EMR) als ein durchschnittliches Mobiltelefon. Die geringe Menge elektromagnetischer Strahlung, die vomBaby-Trackerausgestrahlt wird, ist nicht konstant und erscheint nur, wenn Daten an ein Smartphone übertragen werden, das die Neebo App verwendet. Das Neebo Baby Sensor-Armband arbeitet die meiste Zeit autonom. Question: Welche Zertifizierungen hat Neebo? Answer: Sicherheit ist immer unsere höchste Priorität.Neebo hat die folgenden Zertifizierungen:In den USA: FCC, Toy Safety Standard, Consumer Product, Safety Improvement Act (CPSIA)In der EU: CE-AGC (RED Directive), ROHS XRF+Chemical Test, WEEIn Australien: RCM\n\nQuestion: Wie richte ich das Baby Wearable ein und welches Zubehör brauche ich dazu? Answer: Um das Baby Sensor-Armband in Betrieb nehmen zu können, benötigen Sie nur ein Smartphone mit iOS-Betriebssystem. Alle dazugehörigen Geräte, wie die kabellose Ladestation mit Netzstecker sowie das Neebo Baby Sensor-Armband mit Kurzanleitung, erhalten Sie von uns beim Kauf des Geräts. Die Android-Version der Neebo-App wird demnächst veröffentlicht.Bitte stellen Sie bei der Einrichtung von Neebo sicher, dass eine drahtlose W-LAN Verbindung mit einer 2,4 Ghz-Frequenz besteht. Gehen Sie dazu in die Einstellungen Ihres Routers und prüfen Sie die Verbindung Ihres  Netzwerks für W-LAN.Wenn das Netzwerk, mit dem Sie verbunden sind, ""5G"" im Namen hat, wechseln Sie bitte zu dem Netzwerk ohne ""5G"". Sie können sich auch mit Ihrem Internet-Provider in Verbindung setzen, um zu erfahren, wie Sie sich mit einem 2.4 Ghz Wi-Fi-Netz verbinden können. Während der Einrichtung des Neebo Geräts sollten das Baby-Armband, die Ladestation und Ihr Smartphone, das die App enthält, nicht weiter als 10 Meter von Ihrem Router entfernt sein. Stellen Sie bitte auch während der Nutzung des Neebo Baby Sensor-Armbands sicher, dass die Entfernung zwischen dem Neebo Baby-Armband und der Ladestation nicht mehr als 10 Meter beträgt. \' metadata={\'source\': \'data/Apps & Dienste/https___www.telekom.de_smarte-produkte_iot_baby-sensor-armband.txt\'}', ""page_content='Source URL: https://www.telekom.de/hilfe/geraete-zubehoer/smarte-produkte\n\nQuestion: Welches Modell besitzen Sie? Answer: • Kids Watch\n• Safety Watch\n• Combi Protect\n• Neebo Baby Sensor-Armband\n\n' metadata={'source': 'data/Apps & Dienste/https___www.telekom.de_hilfe_geraete-zubehoer_smarte-produkte.txt'}"", ""page_content='B. Schweiß oder Speichel) können die Leistung des Geräts beeinträchtigen sowie Hautirritationen auslösen. • Stellen Sie sicher, dass die Haut Ihres Babys unter dem Armband trocken ist, da die Reibung an der feuchten Haut Irritationen verursachen kann. • Ziehen Sie das Neebo Baby Sensor-Armband nicht zu fest an, damit die normale Durchblutung sichergestellt ist. Question: Kann mein Kind das Armband selbst ausziehen? Answer: Das Live Tracking Armband ist individuell einstellbar. Ein Ende des Bandes befindet sich unter dem anderen Ende, um das Risiko zu vermindern, dass das Armband von dem Baby selbstständig ausgezogen werden kann. Wenn Ihr Kind jedoch besonders hartnäckig ist und es andauernd versucht, kann es passieren, dass es das Armband abmacht. Sie erhalten hierbei aber sofort eine Benachrichtigung über die Neebo App, wenn das Neebo Baby Sensor-Armband vom Handgelenk Ihres Kindes entfernt wird. Question: Was passiert, wenn Babys das Neebo Sensor-Armband kauen oder in den Mund nehmen? Answer: Neebo wird aus medizinisch zertifizierten Materialien hergestellt und die komplette Elektronik ist innerhalb des Gehäuses versiegelt. Kaut Ihr Baby auf dem Armband oder nimmt es dieses in den Mund, so ist dies unbedenklich. Question: Ist Neebo auch für Kleinkinder geeignet? Answer: Unsere Studien haben gezeigt, dass die meisten Kinder das Neebo Baby Sensor-Armband im Schlaf nicht bemerken. Unsere Ergebnisse bezüglich des Verhaltens der Kinder, die Neebo auch am Tag tragen, unterscheiden sich von Fall zu Fall und hängen vom Alter des Kindes ab. Je kleiner das Kind ist, desto wahrscheinlicher ist es, dass es Neebo als ein Teil seines Körpers akzeptiert. Wenn Sie aber erst später (z.' metadata={'source': 'data/Apps & Dienste/https___www.telekom.de_smarte-produkte_iot_baby-sensor-armband.txt'}""]","Neebo hat die folgenden Zertifizierungen: In den USA: FCC, Toy Safety Standard, Consumer Product, Safety Improvement Act (CPSIA). In der EU: CE-AGC (RED Directive), ROHS XRF+Chemical Test, WEE. In Australien: RCM.",1554,0.00027135,85,4,64.2295789718628,0.9073589817992053,0.49999999995,1.0,1.0,0.19460781861392548,0.6521739130434782
Warum ist eine frühzeitige Kontaktaufnahme mit dem Telekommunikationsunternehmen nach einem Umzug wichtig?,"Eine frühzeitige Kontaktaufnahme mit dem Telekommunikationsunternehmen nach einem Umzug ist wichtig, um sicherzustellen, dass Ihre Internet- und Telefonverbindungen nahtlos am neuen Wohnort verfügbar sind. Außerdem können Sie so rechtzeitig alle notwendigen Änderungen vornehmen, um Unterbrechungen oder Probleme mit Ihren Diensten zu vermeiden. Weitere Informationen finden Sie in unserem Umzugsratgeber auf der Telekom-Website.","[""page_content='Hinweis:Möchten Sie mit Ihrem Festnetz-Anschluss umziehen, finden Sie alle Informationen in unseremUmzugsratgeber.' metadata={'source': 'data/Apps & Dienste/https___www.telekom.de_hilfe_vertrag-rechnung_vertrag_aenderung_adressaenderung.txt'}"", ""page_content='Freemail oder immer noch mit meinem Festnetzvertrag verbunden?' metadata={'source': 'data/Apps & Dienste/telekomhilft.telekom.de_t5_E-Mail_Mail-vom-Inklusivnutzer_td-p_6982672_jump-to_first-unread-message.txt'}"", ""page_content='Alle Infos zum Datenschutz bei der Telekom finden Siehier. Question: Werde ich dann andauernd angerufen?' metadata={'source': 'data/Apps & Dienste/https___www.telekom.de_infoservice.txt'}"", ""page_content='Answer: Nein, denn wir kontaktieren Sie nur dann, wenn es Neuigkeiten gibt, die Sie nicht verpassen sollten und wenn es neue, auf Sie persönlich zugeschnittene Angebote gibt. Question: Wo kann ich meine Kontaktpräferenzen anpassen? Answer: Wenn Sie Ihre Präferenzen zur Kontaktaufnahme ändern möchten, können Sie dashier im Kundencenter. Question: Wo kann ich mich vom InfoService abmelden? Answer: Wenn Sie sich vom InfoService abmelden möchten, können Sie dashier im Kundencenteroder per E-Mail anwiderruf@telekom.de. ' metadata={'source': 'data/Apps & Dienste/https___www.telekom.de_infoservice.txt'}"", ""page_content='Sie haben 180 Tage nach Kündigung des Festnetz-Anschlusses dafür Zeit.' metadata={'source': 'data/Apps & Dienste/https___www.telekom.de_hilfe_apps-dienste_e-mail_konto_inklusivnutzer-behalten.txt'}"", ""page_content='Der neue Provider bietet neben Internet über Glasfaser auch die Übernahme des Festnetzanschlusses an.' metadata={'source': 'data/Apps & Dienste/telekomhilft.telekom.de_t5_E-Mail_Ubernahme-email-Adresse-und-bereits-empfangene-und-gesendete_td-p_6942533_jump-to_first-unread-message.txt'}"", ""page_content='Source URL: https://www.telekom.de/netz/glasfaser/interessenten-registrierung\n\nQuestion: Was sind die Vorteile einer Registrierung? Answer: In wenigen Schritten kostenlos vormerken lassen.' metadata={'source': 'data/Apps & Dienste/https___www.telekom.de_netz_glasfaser_interessenten-registrierung.txt'}"", ""page_content='Source URL: https://www.telekom.de/hilfe/apps-dienste/e-mail/konto/adresse-umziehen\n\nQuestion: Wie kann ich meine E-Mail-Adresse auf einem anderen oder ohne Festnetz-Anschluss nutzen? Answer: Wenn Sie Ihre @t-online.de/@magenta.de-Adresse auf einen anderen Anschluss umziehen oder als Freemail nutzen möchten, verwenden Sie dafür unser FormularÜbertragung, Löschung der E-Mail-Adresse/Postfach.' metadata={'source': 'data/Apps & Dienste/https___www.telekom.de_hilfe_apps-dienste_e-mail_konto_adresse-umziehen.txt'}""]","Eine frühzeitige Kontaktaufnahme mit dem Telekommunikationsunternehmen nach einem Umzug ist wichtig, um die Situation vor Ort zu überprüfen und den Auftrag rechtzeitig zu erledigen, damit Internetzugang gewährleistet werden kann.",987,0.00018585,84,8,65.62384009361267,0.9817456388058169,0.599999999985,1.0,0.2,0.21864860577611417,0.3595505617977528
"Can you surf the internet with Magenta TV One, and if so, how?","Ja, mit der Magenta TV One kannst du im Internet surfen. Um dies zu tun, benötigst du eine Internetverbindung und ein Google-Konto, da die Magenta TV One auf dem Betriebssystem Android TV basiert. Du kannst Apps über den Google Play Store herunterladen, die dir den Zugriff auf das Internet ermöglichen. Darüber hinaus kannst du auch eine USB-Tastatur anschließen, um die Navigation zu erleichtern. 

Wenn du weitere Informationen benötigst, empfehle ich dir, die offizielle Support-Seite zu besuchen: www.telekom.de/hilfe.","[""page_content='Source URL: https://telekomhilft.telekom.de/t5/TV/Internet-surfen-mit-Magenta-TV-One-geht-das/td-p/6966066/jump-to/first-unread-message\nSubject: Internet surfen mit Magenta TV One - geht das? Content: Hallo,eigentlich steht die Frage schon komplett im Betreff.Man kann ja mit einem Smart-TV im Internet surfen, wenn man den TV entsprechend angeschlossen hat.Kann man das eigentlich auch mit der Magenta TV One?Und wenn ja, wie?Ich habe heute mal wieder etwas an der Magenta TV One rumgespielt und geschaut, ob ich eine Möglichkeit finde, direkt ins Internet zu kommen.' metadata={'source': 'data/Apps & Dienste/telekomhilft.telekom.de_t5_TV_Internet-surfen-mit-Magenta-TV-One-geht-das_td-p_6966066_jump-to_first-unread-message.txt'}"", ""page_content='Source URL: https://www.telekom.de/hilfe/geraete-zubehoer/magenta-tv-geraete/magenta-tv-one/tipps-tricks\n\nQuestion: Wie kann ich die MagentaTV One steuern? Answer: Neben der im Lieferumfang enthaltenden Fernbedienung\xa0lässt sich die MagentaTV One auch via Sprachsteuerung des Google Assistant oder durch Einbindung eigener Bluetooth Gamepads steuern. Aber auch die Anbindung einer USB-Tastatur ist möglich. Question: Wie aktiviere ich die Funktion Zapping? Answer: Wenn Sie schnell zwischen den Sendern umschalten möchten, dann aktivieren Sie die Zapping-Funktion unter:\nEinstellungen > MagentaTV-Einstellungen > MEIN MAGENTA TV > Zapping aktivieren/deaktivieren\nJetzt können Sie nur mit den Pfeil-Tasten (hoch/runter) direkt den Sender wechseln, ohne die Okay-Taste betätigen zu müssen. Question: Funktioniert die MagentaTV One nur bei mir zu Hause? Answer: Nein, Sie können Ihre MagentaTV One über jede beliebige Internet-Verbindung nutzen. Question: Wie kann ich weitere Apps installieren und deinstallieren? Answer: Im Google Play Store stehen Ihnen alle von Google für die\xa0jeweilige Android TV-Version und die MagentaTV One freigegebenen Apps\xa0zur Verfügung. Apps installierenDamit Sie sich neben den Vorinstallierten\xa0weitere – Ihre bevorzugten – Apps installieren können, benötigen Sie ein Google-Konto.' metadata={'source': 'data/Apps & Dienste/https___www.telekom.de_hilfe_geraete-zubehoer_magenta-tv-geraete_magenta-tv-one_tipps-tricks.txt'}"", ""page_content='Source URL: https://www.telekom.de/hilfe/geraete-zubehoer/magenta-tv-geraete/magenta-tv-one/streaming\n\nQuestion: Welche Streaming-Dienste, Sender, Mediatheken und Apps sind über die MagentaTV One nutzbar? Answer: Neben MagentaTV sind RTL+, Disney+, Netflix, Prime Video, YouTube, DAZN, MagentaSport, WOW, Videoload, ARD Mediathek, ZDF Mediathek, ProSieben und Sat1 Mediathek, Spotify, Twitch und viele weitere verfügbar.Mehr Informationen finden Sie unterMagentaTV Streaming-Dienste & Partner. Über den Google Play Store sind weitere Apps verfügbar. Wie das funktioniert, erklären wir Ihnen in unsererEinrichtungshilfeim Schritt 8.' metadata={'source': 'data/Apps & Dienste/https___www.telekom.de_hilfe_geraete-zubehoer_magenta-tv-geraete_magenta-tv-one_streaming.txt'}"", ""page_content='' metadata={'source': 'data/Apps & Dienste/https___www.telekom.de_hilfe_geraete-zubehoer_magenta-tv-geraete_magenta-tv-one_streaming.txt'}"", ""page_content='' metadata={'source': 'data/Apps & Dienste/https___www.telekom.de_hilfe_tv_inhalte_magenta-sport_zeitgleich-nutzen.txt'}"", ""page_content='Gen.) nutzen? Answer: Die Voraussetzung für die Nutzung vonMagentaTVmit der MagentaTV One (2. Gen.) ist der Abschluss eines neuenMagentaTV Tarifes(z. B.MagentaTV Smart 2.0). Darüber hinaus benötigen Sie eine bestehende Internet\xadverbindung, um die Angebote von MagentaTV auf Ihrem Gerät zu sehen. Wir empfehlen Ihnen mindestens 10 MBit/s verfügbare Band\xadbreite. Für Ihre Internet\xadverbindung gelten die Bedingungen des jeweiligen Internet\xadanbieters. Nutzen Sie die MagentaTV One (2. Gen.) über das Mobilfunk-Datennetz, erfolgt die Belastung des Daten\xadvolumens beim jeweiligen Mobilfunk-Anbieter. Die MagentaTV One (2. Gen.) basiert auf dem Betriebssystem Android TV der Firma Google LLC. Daher ist es notwendig, dass Sie den Google Nutzungs\xadbedingungen, der Google Daten\xadschutz\xaderklärung sowie den Google Play Nutzungs\xadbedingungen zustimmen. Möchten Sie bestimmte Google Dienste wie den Google Play Store in Anspruch nehmen, benötigen Sie ein Google Konto. Zudem setzt die Nutzung der MagentaTV One (2. Gen.) eine verfügbare Steckdose mit Strom und einen Fernseher mit HDMI-Eingang voraus. Question: Welche Inhalte kann ich mit der MagentaTV One (2. Gen.) sehen? Answer: Verfügen Sie über einen MagentaTV 2.0 Tarif, genießen Sie mit der MagentaTV One (2. Gen.) über 160 TV-Senderin HD und haben die Möglichkeit, die TV-Vielfalt durch verschiedeneZubuchoptionenzu erweitern. MitMagentaTV+(ehemals Megathek), das in allen MagentaTV Tarifen immer enthalten ist, stehen zahlreiche Serien, Filme, Shows und Dokus auf Abruf zur Verfügung. Dazu haben Sie mit der MagentaTV One (2. Gen.) Zugriff auf viele Streaming-Dienste (z.' metadata={'source': 'data/Apps & Dienste/https___www.telekom.de_magenta-tv_geraete_magenta-tv-one.txt'}"", ""page_content='' metadata={'source': 'data/Apps & Dienste/https___www.telekom.de_hilfe_geraete-zubehoer_magenta-tv-geraete_magenta-tv-one_nutzung-tarif.txt'}"", ""page_content='' metadata={'source': 'data/Apps & Dienste/https___www.telekom.de_magenta-tv_tarife-und-optionen_magenta-tv-mit-app_zubuchoptionen.txt'}"", ""page_content='5 MagentaTV One zu Hause haben, können Sie auf 3 Geräten MagentaTV streamen und auf den anderen beiden Streams anderer Apps schauen. Hinweis:\xa0Ohne Telefonie- und Internet-Flat haben Sie\xa0die Auswahl zwischen 1 und 24 Monaten Laufzeit und jeweils zwei Tarifen – alle sind unabhängig vom Internet-Anbieter nutzbar.' metadata={'source': 'data/Apps & Dienste/https___www.telekom.de_hilfe_geraete-zubehoer_magenta-tv-geraete_magenta-tv-one_anzahl-parallele-streams.txt'}""]",The answer to given question is not present in context,1861,0.00033089999999999997,115,9,62.87145400047302,0.9036723984661869,0.0,1.0,0.875,0,0.0
"Was passiert mit den Daten, wenn Sie Ihren Router an eine neue Adresse anschließen?","Wenn Sie Ihren Router an eine neue Adresse anschließen, bleiben die von Ihnen konfigurierten Einstellungen in der Regel erhalten, wie z.B. das WLAN-Passwort und andere persönliche Anpassungen. Allerdings müssen Sie sicherstellen, dass der Router korrekt mit dem neuen Internetanschluss verbunden ist und möglicherweise die Zugangsdaten für die Internetverbindung anpassen. Es kann auch notwendig sein, den Router neu zu starten oder eine Einrichtung über die MagentaZuhause App durchzuführen, um eine optimale Verbindung sicherzustellen. 

Für detaillierte Informationen oder spezifische Anleitungen empfehle ich, die Webseite www.telekom.de/hilfe zu besuchen.","[""page_content='eine kleine Karte an der Unterseite, auf dem diese Angaben stehen. Wenn Sie einen Speeport Router an Ihrem Telekom Anschluss nutzen, können Sie alternativdasWLAN-Passwort in der MeinMagenta Appeinsehen und bei Bedarf ändern. Bei einigen Routern vergeben Sie das Gerätepasswort bei der Ersteinrichtung selbst.' metadata={'source': 'data/Apps & Dienste/https___www.telekom.de_hilfe_geraete-zubehoer_router_speedport_geraetepasswort-wlan-schluessel.txt'}"", ""page_content='Der Router und die zugehörigen Einstellungen betreffen hauptsächlich das Heimnetzwerk.SmartHome hingegen ist eine weitere Funktionalität der Speedport Routermodelle.' metadata={'source': 'data/Apps & Dienste/https___www.telekom.de_hilfe_apps-dienste_apps_magenta-zuhause-app_internet-tv-funktionen_speedport-router-zweimal-angezeigt.txt'}"", 'page_content=\'Einrichten der Internetverbindung\n4.Sie befinden sich nun auf der Startseite des Einrichtungsprogrammes. Um zu beginnen, klicken Sie auf ""Assistent starten"". 5.Tragen Sie in die jeweiligen Felder die Anschlusskennung, Ihre Zugangsnummer und das persönliche Kennwort ein. 6.Unter Router-Einstellungen wählen Sie ""Immer online"".Hinweis:Wählen Sie die Option ""Immer online"" aus, wenn Sie über Ihre Internet-Telefonnummer dauerhaft erreichbar sein wollen. Sollten Sie einen zeitbasierten Internettarif nutzen, kann diese Einstellung hohe Kosten verursachen. 7.Klicken Sie auf ""Speichern"".\' metadata={\'source\': \'data/Apps & Dienste/https___www.telekom.de_hilfe_geraete-zubehoer_router_speedport_900-serie_einrichtungsassistent-speedport-w-921v.txt\'}', ""page_content='Freemail oder immer noch mit meinem Festnetzvertrag verbunden?' metadata={'source': 'data/Apps & Dienste/telekomhilft.telekom.de_t5_E-Mail_Mail-vom-Inklusivnutzer_td-p_6982672_jump-to_first-unread-message.txt'}"", ""page_content='Source URL: https://www.telekom.de/hilfe/geraete-zubehoer/smart-home/geraete-fuer-die-nutzung-von-smart-home/bereits-speedport-smart-magenta-smarthome-nutzen\n\nQuestion: Ich habe bereits einen Speedport Smart Router gekauft. Kann ich Magenta SmartHome auch nutzen?' metadata={'source': 'data/Apps & Dienste/https___www.telekom.de_hilfe_geraete-zubehoer_smart-home_geraete-fuer-die-nutzung-von-smart-home_bereits-speedport-smart-magenta-smarthome-nutzen.txt'}"", ""page_content='Nach dieser initialen Aktivierung wird der Hinweis auf die Zentrale in der MagentaZuhause App nicht mehr angezeigt. Die SmartHome-Funktionen auf dem Speedport Router könnenmit wenigen Schritten aktiviert werden.' metadata={'source': 'data/Apps & Dienste/https___www.telekom.de_hilfe_apps-dienste_apps_magenta-zuhause-app_internet-tv-funktionen_speedport-router-zweimal-angezeigt.txt'}"", ""page_content='Answer: Unsere Router der Serien\xa0Speedport Smart bzw.' metadata={'source': 'data/Apps & Dienste/https___www.telekom.de_hilfe_apps-dienste_apps_magenta-zuhause-app_internet-tv-funktionen_router-verbinden.txt'}"", ""page_content='Oder geht es auch einfacher?Vielen Dank schonmal und einen schönen SonntagEll\n\nAccepted Solutions:\n- Also Folgendes:ich habe den Router einfach mal in der Zuhause App umbenannt. Und was soll ich sagen, es funktioniert wieder alles!😳Auch in der MeinMagenta App!Ob es jetzt Zufall ist, oder wirklich daran lag… Ich weiß es nicht! Aber vielleicht für alle, die das gleiche Problem haben, einfach mal versuchen.Vielen Dank für eure Antworten und Zeit!LG Ell\n- Also Folgendes:ich habe den Router einfach mal in der Zuhause App umbenannt. Und was soll ich sagen, es funktioniert wieder alles!😳Auch in der MeinMagenta App!Ob es jetzt Zufall ist, oder wirklich daran lag… Ich weiß es nicht!' metadata={'source': 'data/Apps & Dienste/telekomhilft.telekom.de_t5_Smart-Home_Speedport-Smart-4-WLAN-Passwort-geaendert_td-p_6975075_jump-to_first-unread-message.txt'}""]","Die Daten bleiben weiterhin gespeichert, wenn Sie Ihren Router zur neuen Adresse mitnehmen und ihn dort wieder anschließen.",1316,0.00025545,129,8,65.83795404434204,0.9532702178486151,0.0,0.0,0.5,0.013028201585429897,0.12068965517241377
What steps should be taken to access RTL+ on a TV after subscribing to Magenta TV?,"Um RTL+ auf Ihrem Fernseher nach der Buchung von Magenta TV zu nutzen, folgen Sie bitte diesen Schritten:

1. Verwenden Sie den Aktivierungslink, den Sie bei der Aktivierung von Magenta TV erhalten haben, um ein Konto bei RTL+ anzulegen.
2. Installieren Sie die RTL+ App auf dem Endgerät, das mit Ihrem TV verbunden ist, oder direkt auf dem Smart TV, falls dieser die App unterstützt.
3. Melden Sie sich mit den Zugangsdaten an, die Sie bei der Kontoerstellung verwendet haben.

Für weitere Informationen und Unterstützung können Sie auch die Seite [www.telekom.de/hilfe](https://www.telekom.de/hilfe) besuchen.","[""page_content='Source URL: https://telekomhilft.telekom.de/t5/TV/rtl/td-p/6962275/jump-to/first-unread-message\nSubject: rtl +\nContent: Mit Magenta tv habe ich rtl+ gebucht.Wie bekomme ich rtl+ auf de Fernseher? Accepted Solutions:\n- Du nimmst den Aktivierungslink den du bekommen hast bei Schaltung von MagentaTV, legst dir nen Account bei RTL+ an, installierst die App auf dem Endgerät (entweder das was an den TV angeschlossen ist oder ggfs der TV selber) und loggst dich dann mit den von dir erstellen Accountdaten ein\n- Dafür wäre eine RTL+ APP nötighttps://www.telekom.de/hilfe/festnetz-internet-tv/magentatv/rtlplus-premium/durchfuehrung-account-ve...' metadata={'source': 'data/Apps & Dienste/telekomhilft.telekom.de_t5_TV_rtl_td-p_6962275_jump-to_first-unread-message.txt'}"", ""page_content='RTL+ Family ohne Musik) Geräten zu streamen. Question: Kann ich meinen bestehenden RTL+ Account mit meinem MagentaTV Account verknüpfen? Answer: Um alle Vorteile Ihres jeweiligen RTL+ Pakets zu genießen, müssen Sie Ihren Account vervollständigen. Nur so können Sie das Streaming-Angebot mit Ihrem bestehenden Account weiternutzen.' metadata={'source': 'data/Apps & Dienste/https___www.telekom.de_magenta-tv_inhalte_rtl-plus.txt'}"", ""page_content='- Du nimmst den Aktivierungslink den du bekommen hast bei Schaltung von MagentaTV, legst dir nen Account bei RTL+ an, installierst die App auf dem Endgerät (entweder das was an den TV angeschlossen ist oder ggfs der TV selber) und loggst dich dann mit den von dir erstellen Accountdaten ein\n' metadata={'source': 'data/Apps & Dienste/telekomhilft.telekom.de_t5_TV_rtl_td-p_6962275_jump-to_first-unread-message.txt'}"", ""page_content='Source URL: https://www.telekom.de/magenta-tv/inhalte/rtl-plus\n\nQuestion: Welche Inhalte von RTL+ sind über MagentaTV verfügbar? Answer: Mit RTL+ (ehemals TVNOW) haben Sie Zugang zu exklusiven Inhalten, unterhaltsamen Shows, spannenden Filmen und den besten Serien sowie Sendungen von RTL. Zudem können Sie mit den ZubuchoptionenRTL+ Max by TelekomundRTL+ Family by TelekomIhr Paket um Musik und Podcasts erweitern. Sollten Sie bereits ein anderes Music Streaming Abo besitzen, sind die RTL+ Upgrades auf Max und Family jeweils auch „ohne Musik“ buchbar. Question: Fallen für den Zugang zu RTL+ Premium über MagentaTV zusätzliche Kosten an? Answer: RTL+ Premium ist unter anderem in den TarifenMagentaTV SmartStream,MagentaTV SmartundMagentaTV Smart Flexbereits enthalten. Im MagentaTV MegaStream ist RTL+ Max ohne Musik bereits inkludiert. Upgrades auf höherwertige RTL+ Varianten sind jeweils gegen einen geringen Aufpreis zubuchbar. Question: Kann ich RTL+ auf allen Geräten verwenden? Answer: Mit MagentaTV können Sie RTL+ und viele andere Sender auf Ihrem Smart TV, über dieMagentaTV Oneund denMagentaTV Stickin Deutschland empfangen. Darüber hinaus haben Sie die Möglichkeit, RTL+ auf weiteren Geräten, wie Ihrem Smartphone oder Tablet, mit der RTL+ App zu nutzen. Question: Kann ich die Inhalte von RTL+ herunterladen und offline ansehen? Answer: Die Download-Funktion ermöglicht es Ihnen, mit Ihrem Smartphone oder Tablet ausgewählte Inhalte von der RTL+ Mediathek herunterzuladen und offline anzusehen. Bitte beachten Sie, dass nicht alle Inhalte auf RTL+ zum Download angeboten werden.' metadata={'source': 'data/Apps & Dienste/https___www.telekom.de_magenta-tv_inhalte_rtl-plus.txt'}"", 'page_content=\'Source URL: https://www.telekom.de/hilfe/tv/inhalte/rtlplus/magenta-tv-nutzen\n\nQuestion: Kann ich mein bestehendes RTL+ Premium Paket auch mit MagentaTV nutzen? Answer: Ja, um Ihr bestehendes RTL+ Premium Abo mit MagentaTV zu nutzen, können Sie IhrenRTL+ Account mit dem Telekom Login verbinden. Anschließend loggen Sie sich aufhttps://my.plus.rtl.de/loginein und deaktivieren unter ""Paket"" Ihr aktuelles RTL+ Paket. Dieses wird zum nächsten Abrechnungsintervall deaktiviert und Sie nutzen dann nur noch das RTL+ Premium Paket aus Ihrem MagentaTV Tarif. Hinweis:Wurde das bestehende Abo nicht direkt über RTL+, sondern über einen Drittanbieter (z.\' metadata={\'source\': \'data/Apps & Dienste/https___www.telekom.de_hilfe_tv_inhalte_rtlplus_magenta-tv-nutzen.txt\'}', 'page_content=\'Source URL: https://www.telekom.de/hilfe/tv/magenta-tv-app/magenta-tv-plus-aufrufen\n\nQuestion: Wie kann ich MagentaTV+ in der MagentaTV App aufrufen? Answer: Um MagentaTV+ in der MagentaTV App aufzurufen, melden Sie sich mit Ihrem Telekom Login an und gehen Sie auf der Startseite auf den Reiter ""MagentaTV+"".\' metadata={\'source\': \'data/Apps & Dienste/https___www.telekom.de_hilfe_tv_magenta-tv-app_magenta-tv-plus-aufrufen.txt\'}', ""page_content='Eine Anleitung dazu finden Sie auf der Seite für dieAccount-Vervollständigung. Question: Sind die Inhalte von RTL+ in HD oder 4K verfügbar? Answer: Die Inhalte von RTL+ sind in HD verfügbar. Inhalte in der Qualität 4K werden derzeit nicht angeboten. Question: Was passiert mit meinem Zugang zu RTL+, wenn ich meinen Vertrag bei MagentaTV kündige? Answer: Wenn Sie Ihren Vertrag bei MagentaTV kündigen, verlieren Sie den Zugang zu den Inhalten von RTL+, da der Zugang zu RTL+ in Ihrem MagentaTV Tarif eingebunden ist. Question: Kann ich die Inhalte von RTL+ in anderen Sprachen oder mit Untertiteln ansehen?' metadata={'source': 'data/Apps & Dienste/https___www.telekom.de_magenta-tv_inhalte_rtl-plus.txt'}""]","To access RTL+ on a TV after subscribing to Magenta TV, you should take the following steps: 1. Use the activation link you received when subscribing to Magenta TV to create an account with RTL+. 2. Install the RTL+ app on the device connected to your TV or on the TV itself. 3. Log in using the account credentials you created.",1693,0.0003183,143,7,66.36015391349792,0.9536765229101469,0.8055555555287036,1.0,0.75,0.006364037606909632,0.1566265060240964
What sind die Schritte im Identifikationsprozess zur Überprüfung der Identität?,"Die Schritte im Identifikationsprozess zur Überprüfung der Identität hängen von der gewählten Methode ab. Hier sind die möglichen Optionen:

1. **Selfie-Ident-Verfahren**: Sie nutzen die Nect-Wallet App, um Ihre Identität zu überprüfen.
2. **Video-Ident**: Dies erfolgt über eine Video-Verbindung mit dem Kundenservice. Sie müssen dabei Ihr gültiges Ausweisdokument vor die Webcam halten.
3. **Identifikation im Telekom Shop**: Hier bringen Sie Ihren gültigen Ausweis (Personalausweis, Reisepass oder deutscher Aufenthaltstitel) mit.

Für genauere Informationen und Anleitungen zu den einzelnen Verfahren können Sie die Webseite [www.telekom.de/hilfe](https://www.telekom.de/hilfe) besuchen.","[""page_content='Wählen Sie zunächst aus, über welchen Weg Sie Ihre Identität überprüfen lassen\xa0möchten.' metadata={'source': 'data/Apps & Dienste/https___www.telekom.de_hilfe_mobilfunk_sim-karte_aktivieren_prepaid.txt'}"", ""page_content='Source URL: https://www.telekom.de/hilfe/mobilfunk/identifikation/moeglichkeiten\n\nQuestion: Welche Möglichkeiten der Identifikation gibt es? Answer: Sie können sich perSelfie-Ident-Verfahrenvia Nect-Wallet App,Video-Identoder imTelekom Shopmit Ihrem gültigen Ausweis (Personalausweis, Reisepass oder deutscher Aufenthaltstitel) identifizieren.' metadata={'source': 'data/Apps & Dienste/https___www.telekom.de_hilfe_mobilfunk_identifikation_moeglichkeiten.txt'}"", ""page_content='' metadata={'source': 'data/Apps & Dienste/https___www.telekom.de_hilfe_tv_pins-altersnachweis_benutzer-pin-erhalten.txt'}"", ""page_content='' metadata={'source': 'data/Apps & Dienste/https___www.telekom.de_hilfe_tv_pins-altersnachweis_registrieren-mehrere-vertragspartner.txt'}"", ""page_content='Source URL: https://www.telekom.de/hilfe/erleben/video-ident\n\nQuestion: Wie funktioniert Video-Ident? Answer: Sie können Video-Ident über einen PC mit Webcam und Mikrofon, mit Ihrem Smartphone oder Tablet durchführen. Die Online-Identifikation erfolgt über eine Video-Verbindung mit unserem Kundenservice und dauert nur drei bis fünf Minuten. Dabei werden Sie aufgefordert, Ihr gültiges Ausweisdokument mit Vorder- und Rückseite vor die Webcam zu halten, sodass das Hologramm und weitere Sicherheitsmerkmale geprüft werden können. Ihre Daten werden vollständig verschlüsselt empfangen und versendet.' metadata={'source': 'data/Apps & Dienste/https___www.telekom.de_hilfe_erleben_video-ident.txt'}"", ""page_content='Source URL: https://www.telekom.de/hilfe/erleben/sofort-ident\n\nQuestion: Wie funktioniert Sofort-Ident? Answer: Mit Sofort-Ident können Sie über die Anmeldung bei Ihrem\xa0Online-Banking Ihre Identität bestätigen.' metadata={'source': 'data/Apps & Dienste/https___www.telekom.de_hilfe_erleben_sofort-ident.txt'}"", ""page_content='' metadata={'source': 'data/Apps & Dienste/telekomhilft.telekom.de_t5_E-Mail_Mail-vom-Inklusivnutzer_td-p_6982672_jump-to_first-unread-message.txt'}"", ""page_content='' metadata={'source': 'data/Apps & Dienste/https___www.telekom.de_hilfe_mobilfunk_identifikation_moeglichkeiten.txt'}"", ""page_content='Question: Was brauche ich für die Durchführung von Sofort-Ident? Answer: Für die Identifikation durch Sofort-Ident benötigen Sie folgende Daten:\n• Die Zugangsdaten für Ihr Online-Banking und\n• die Möglichkeit, TANs zu empfangen. Question: Was passiert bei Sofort-Ident mit meinen Daten?' metadata={'source': 'data/Apps & Dienste/https___www.telekom.de_hilfe_erleben_sofort-ident.txt'}"", ""page_content='Answer: Bitte halten Sie eines der folgenden Dokumente zur Legitimierung bereit:\n• Deutscher Personalausweis,\n• Europäischer Personalausweis,\n• Reisepass oder\n• Aufenthaltstitel. ' metadata={'source': 'data/Apps & Dienste/https___www.telekom.de_hilfe_erleben_video-ident.txt'}""]","Die Schritte im Identifikationsprozess zur Überprüfung der Identität umfassen: Anmeldung, Akzeptieren der Datenschutzbestimmungen, Start der Video-Identifikation, Überprüfung der Sicherheitsmerkmale auf der Vorder- und Rückseite des Ausweises, Ablesen der Vorderseite des Ausweises und Vergleich der Daten mit den vorgelegten Informationen, sowie das Bedecken des Fotos auf dem Ausweis mit dem Finger. Nach Abschluss aller Schritte ist die Identifikation erfolgreich.",1159,0.00024494999999999996,158,10,70.38648414611816,0.9665622450570331,0.4499999999775,0.5,0.8333333333333334,0.0950514808959499,0.19883040935672516
What support does the online tool 'Telekom hilft' provide?,"Das Online-Tool 'Telekom hilft' bietet Unterstützung durch einen digitalen Assistenten, der Ihnen bei Ihren Anliegen hilft und Antworten auf Ihre Fragen bereitstellt. Sie können einfach eine Konversation mit der Telekom über WhatsApp beginnen, und der digitale Assistent wird zunächst Ihre Anliegen bearbeiten. Wenn Sie weitere Informationen oder spezifische Unterstützung benötigen, können Sie die Website www.telekom.de/hilfe besuchen.","[""page_content='Source URL: https://www.telekom.de/hilfe/whatsapp\n\nQuestion: Wie können wir Ihnen helfen? Answer: Chat jetzt starten\n\nQuestion: Wie funktioniert der Telekom Service über WhatsApp? Answer: Beginnen Sie einfach eine Konversation mit der Telekom über WhatsApp. Zu Beginn werden Ihre Anliegen von unserem digitalen Assistenten bearbeitet und beantwortet.' metadata={'source': 'data/Apps & Dienste/https___www.telekom.de_hilfe_whatsapp.txt'}"", ""page_content='Wie Sie ihn nutzen können? Antworten auf diese Fragen gibt Ihnen Stefan vom Telekom Service in diesem Video.' metadata={'source': 'data/Apps & Dienste/https___www.telekom.de_hilfe_apps-dienste_apps_whatsapp-service-video.txt'}"", ""page_content='Answer: Sie haben Fragen zu bestimmten Funktionen oder Probleme bei der Erstellung Ihrer Website? Unser Service steht Ihnen von Montag bis Sonntag von 8 Uhr bis 22 Uhr unter der Telefonnummer0800 330 1573gerne zur Verfügung. Sie erreichen uns außerdem per E-Mail unterhosting@telekom.de. Question: Kann ich auch mein eigenes Website-Design mit den Website-Lösungen der Telekom realisieren? Answer: Sie können unsere vorgefertigten Designvorlagen jederzeit nach Ihren Wünschen anpassen, zum Beispiel mit Ihren individuellen Farben, Schriften, Bildern, Videos und mehr.' metadata={'source': 'data/Apps & Dienste/https___www.telekom.de_zubuchoptionen_website-loesungen.txt'}"", ""page_content='Source URL: https://www.telekom.de/hilfe/mobilfunk/mailbox/mobilbox/abrufen\n\nQuestion: Wie kann ich meine Telekom Mobilbox abrufen?' metadata={'source': 'data/Apps & Dienste/https___www.telekom.de_hilfe_mobilfunk_mailbox_mobilbox_abrufen.txt'}"", ""page_content='Aktuell stehen Ihnen folgende Funktionen zur Verfügung:\nAbhängig vom Gerät:\nDiese Funktionen werden ständig erweitert und sind für Telekom Kunden kostenfrei nutzbar.' metadata={'source': 'data/Apps & Dienste/https___www.telekom.de_hilfe_geraete-zubehoer_einrichtung-support_easysupport_geraete-manager_was-ist-das.txt'}"", ""page_content='Source URL: https://www.telekom.de/hilfe/apps-dienste/apps/whatsapp-service-video\n\nQuestion: Kennen Sie unseren WhatsApp Service? Answer: Sie haben ein Anliegen und möchten es schnell und unkompliziert lösen?' metadata={'source': 'data/Apps & Dienste/https___www.telekom.de_hilfe_apps-dienste_apps_whatsapp-service-video.txt'}""]",The answer to given question is not present in context,832,0.00016035,79,6,56.09899401664734,0.9999999999999994,0.0,1.0,0.6,0,0.0
What steps should I take after logging into the E-Mail Center to transfer my contacts from the address book?,"Nach dem Login ins E-Mail Center wechseln Sie zum ""Adressbuch"". Dort können Sie die Kontakte, die Sie übertragen möchten, auswählen und die entsprechenden Schritte zur Übertragung durchführen. Wenn Sie weitere Details benötigen, empfehle ich Ihnen, die Anleitung auf www.telekom.de/hilfe zu besuchen.","['page_content=\'Source URL: https://www.telekom.de/hilfe/apps-dienste/e-mail/e-mail-center/adressbuch-uebertragen\n\nQuestion: Wie kann ich meine Kontakte aus dem Adressbuch im E-Mail Center übertragen? Answer: Nach dem Login ins E-Mail Center wechseln Sie zum ""Adressbuch"".\' metadata={\'source\': \'data/Apps & Dienste/https___www.telekom.de_hilfe_apps-dienste_e-mail_e-mail-center_adressbuch-uebertragen.txt\'}', 'page_content=\'Nach erfolgreicher Anmeldung sehen Sie oben rechts eine Begrüßung und per Klick darunter auf ""Zum E-Mail Center"" werden Ihnen Ihre E-Mails angezeigt. \' metadata={\'source\': \'data/Apps & Dienste/https___www.telekom.de_hilfe_apps-dienste_e-mail_e-mail-center_computer.txt\'}', ""page_content='' metadata={'source': 'data/Apps & Dienste/https___www.telekom.de_hilfe_apps-dienste_e-mail_e-mail-center_adressbuch-uebertragen.txt'}"", ""page_content='' metadata={'source': 'data/Apps & Dienste/https___www.telekom.de_hilfe_apps-dienste_e-mail_e-mail-center_zusaetzliche-ordner.txt'}"", ""page_content='' metadata={'source': 'data/Apps & Dienste/https___www.telekom.de_hilfe_apps-dienste_apps_sync-plus_android_auf-smartphone-einrichten.txt'}"", 'page_content=\'Source URL: https://www.telekom.de/hilfe/apps-dienste/e-mail/e-mail-center/adressbuch-gruppe\n\nQuestion: Wie kann ich im E-Mail Center eine Gruppe im Adressbuch anlegen? Answer: Um eine Gruppe imE-Mail Centeranzulegen, klicken Sie erst auf ""Adressbuch"" und in der Zeile ""Meine Gruppen"" auf das ""+"".\' metadata={\'source\': \'data/Apps & Dienste/https___www.telekom.de_hilfe_apps-dienste_e-mail_e-mail-center_adressbuch-gruppe.txt\'}', ""page_content='' metadata={'source': 'data/Apps & Dienste/https___www.telekom.de_hilfe_apps-dienste_e-mail_e-mail-center_papierkorb.txt'}"", ""page_content='Answer: So erreichen Sie das E-Mail Center:\n1. Über das T-Online-Login: Klicken Sie oben auf „Login über T-Online“, Sie werden anschließend weitergeleitet. Melden Sie sich mit Ihrem Telekom-Benutzernamen und Ihrem Passwort in der Anmeldemaske an. 2. Über das Telekom Kundencenter: Klicken Sie oben auf „Login über Kundencenter“ und geben Sie Ihren Telekom-Benutzernamen sowie das Passwort ein, das Sie festgelegt haben. Im Kundencenter finden Sie dann den Button, der Sie direkt zum E-Mail Center führt.' metadata={'source': 'data/Apps & Dienste/https___www.telekom.de_e-mail_e-mail-center.txt'}"", ""page_content='beruflich relevant sind. Ob mobil über die Telekom Mail App oder stationär am Computer – das E-Mail Center steht Ihnen sowohl über Ihren Browser als auch über dieTelekom Mail Appzur Verfügung. Question: Wie melde ich mich zum E-Mail Center an?' metadata={'source': 'data/Apps & Dienste/https___www.telekom.de_e-mail_e-mail-center.txt'}"", 'page_content=\'Answer: Die Haupt-E-Mail-Adresse wird in den Einstellungen desE-Mail-Centersverwaltet. Zu den Einstellungen gelangen Sie wie folgt:\nZahnrad > Alle Einstellungen anzeigen > E-Mail-Adressen > Haupt-Adresse\nKlicken Sie auf den Punkt ""Haupt-E-Mail-Adresse mit einer zusätzlichen E-Mail-Adresse tauschen"".\' metadata={\'source\': \'data/Apps & Dienste/https___www.telekom.de_hilfe_apps-dienste_e-mail_konto_hauptadresse-festlegen-tauschen.txt\'}', ""page_content='Source URL: https://www.telekom.de/hilfe/apps-dienste/e-mail/e-mail-center/alternative-adresse\n\nQuestion: Wie lege ich eine alternative Adresse im E-Mail Center an? Answer: Melden Sie sich imE-Mail Centeran.' metadata={'source': 'data/Apps & Dienste/https___www.telekom.de_hilfe_apps-dienste_e-mail_e-mail-center_alternative-adresse.txt'}""]","After logging into the E-Mail Center, you should switch to the ""Adressbuch"".",1212,0.00020789999999999998,58,11,66.0636420249939,0.8972795552149281,0.6666666666333333,1.0,0.25,0.005355924989097696,0.126984126984127
What does it mean when a message states that my Antrag unvollständig is?,"Wenn eine Nachricht den Status ""Antrag unvollständig"" anzeigt, bedeutet das, dass die eingereichte Meldung oder Antrag nicht alle erforderlichen Informationen enthält und daher noch nicht versendet werden konnte. Es ist wichtig, die fehlenden Angaben zu ergänzen, um den Antrag erfolgreich abzuschließen. Wenn Sie weitere Unterstützung benötigen, besuchen Sie bitte www.telekom.de/hilfe.","[""page_content='Source URL: https://www.telekom.de/hilfe/apps-dienste/apps/trassen-defender-app/trassen-defender-app-funktionen/status-stoerungsmeldung\n\nQuestion: Welche verschiedenen Status kann meine Störungsmeldung in der Trassen Defender App annehmen? Answer: Eine Störungsmeldung in der Trassen Defender App kann die folgenden Status zeigen:\n• Unvollständig(grau) – Die Meldung ist unvollständig und noch nicht verschickt. • Wird übertragen(gelb) – Die Meldung ist versendet und wird an die Telekom übertragen.' metadata={'source': 'data/Apps & Dienste/https___www.telekom.de_hilfe_apps-dienste_apps_trassen-defender-app_trassen-defender-app-funktionen_status-stoerungsmeldung.txt'}"", ""page_content='Eine Nachricht zum Herunterladen hatte ich zuvor leider nicht erhalten. - @Husky TomHallo Tom,erzähle mir doch bitte ein wenig mehr darüber. Bekommst du eine Fehlermeldung beim Öffnen der App? Kannst du darin nichts mehr anklicken oder kommst du gar nicht mehr rein?Freu mich, noch mal von dir zu hören.Für tiefgründige Infos, die App betreffend, kannst du dich gerne an die Entwickler wenden.Wieso, weshalb und warum, kann ich hier leider im Detail nicht beantworten. Per Mail ist eine Anfrage an meinmagenta-app@telekom.de ganz einfach möglich.Viele GrüßeSabrina\n' metadata={'source': 'data/Apps & Dienste/telekomhilft.telekom.de_t5_Mobilfunk_Ploetzliche-Fehlfunktion-bei-Android-App-quot-Mein-Magenta-quot_td-p_6952522_jump-to_first-unread-message.txt'}"", 'page_content=\'Ist dies innerhalb dieses Zeitfensters nicht möglich, wechselt der Status der Schadensmeldung endgültig in ""Fehlgeschlagen"".\' metadata={\'source\': \'data/Apps & Dienste/https___www.telekom.de_hilfe_apps-dienste_apps_trassen-defender-app_trassen-defender-app-technik-und-nutzung_meldung-nicht-uebertragen.txt\'}', ""page_content='Source URL: https://telekomhilft.telekom.de/t5/Festnetz-Internet/Bestellung-verschwunden/td-p/6957894/jump-to/first-unread-message\nSubject: Bestellung verschwunden! Content: Guten Tag,Am 26.09.24 habe ich über die MeinMagenta App Festnetz MagentaZuhause XL bestellt. Eine Eingangsbestätigungs E-Mail habe ich erhalten.' metadata={'source': 'data/Apps & Dienste/telekomhilft.telekom.de_t5_Festnetz-Internet_Bestellung-verschwunden_td-p_6957894_jump-to_first-unread-message.txt'}"", ""page_content='Source URL: https://www.telekom.de/hilfe/apps-dienste/apps/voicemail-app/benachrichtigung\n\nQuestion: Warum erhalte ich keine Benachrichtigung von der App, obwohl neue Sprachnachrichten vorliegen? Answer: Das kann verschiedene Ursachen haben:\n1.' metadata={'source': 'data/Apps & Dienste/https___www.telekom.de_hilfe_apps-dienste_apps_voicemail-app_benachrichtigung.txt'}"", ""page_content='Zur besseren Zuordnung bitten wir Sie, dass Sie im Freitext auf Ihre vorherige Meldung verweisen.' metadata={'source': 'data/Apps & Dienste/https___www.telekom.de_hilfe_apps-dienste_apps_trassen-defender-app_trassen-defender-app-funktionen_meldung-nachtraeglich-aendern.txt'}"", 'page_content=\'Source URL: https://www.telekom.de/hilfe/apps-dienste/apps/trassen-defender-app/trassen-defender-app-technik-und-nutzung/keine-info-erledigung\n\nQuestion: Wie erfahre ich, wann der gemeldete Schaden behoben worden ist? Answer: Wenn der Schaden behoben\xa0ist, ändert sich der Status der Meldung in der Trassen Defender App von ""In Bearbeitung"" auf ""Abgeschlossen"".\' metadata={\'source\': \'data/Apps & Dienste/https___www.telekom.de_hilfe_apps-dienste_apps_trassen-defender-app_trassen-defender-app-technik-und-nutzung_keine-info-erledigung.txt\'}', ""page_content='Source URL: https://www.telekom.de/hilfe/apps-dienste/apps/trassen-defender-app/trassen-defender-app-funktionen/meldung-nachtraeglich-aendern\n\nQuestion: Kann ich bereits verschickte Schadensmeldungen nachträglich ändern? Answer: Eine versendete Meldung kann nach dem Versenden leider nicht mehr geändert werden.' metadata={'source': 'data/Apps & Dienste/https___www.telekom.de_hilfe_apps-dienste_apps_trassen-defender-app_trassen-defender-app-funktionen_meldung-nachtraeglich-aendern.txt'}""]",The message stating that your Antrag unvollständig is means that your application is incomplete.,1357,0.00023864999999999997,78,8,59.96089315414429,0.9338980842621626,0.9999999999,1.0,0.5,0.00366753025392797,0.08108108108108107
What do 2 Media Receiver 401s mean for MagentaTV connections?,"Die Verwendung von zwei Media Receiver 401 für MagentaTV-Verbindungen bedeutet, dass Sie in der Lage sind, MagentaTV auf mehreren Geräten gleichzeitig zu nutzen. Der Media Receiver 401 ist ein Gerät, das Ihnen den Zugang zu MagentaTV-Inhalten ermöglicht. Mit zwei Receivern können beispielsweise verschiedene Programme in unterschiedlichen Räumen oder auf unterschiedlichen Fernsehern gleichzeitig angesehen werden. 

Es ist wichtig zu beachten, dass die Nutzung von Media Receivern je nach MagentaTV-Version (1.0 oder 2.0) unterschiedlich sein kann. Bei MagentaTV 2.0 funktioniert die Plattform anders, und herkömmliche Media Receiver wie der 401 können möglicherweise nicht mehr genutzt werden. 

Wenn Sie weitere Informationen zu den spezifischen Funktionen oder zur Nutzung benötigen, empfehle ich, die Telekom-Hilfeseite unter www.telekom.de/hilfe zu besuchen.","[""page_content='• Media Receiver 201, 401, 601\n• MagentaTV Box inkl.' metadata={'source': 'data/Apps & Dienste/https___www.telekom.de_hilfe_apps-dienste_apps_magenta-zuhause-app_internet-tv-funktionen_magenta-tv-geraete.txt'}"", ""page_content='B. Media Receiver 401 / 201 / 601 Sat, MagentaTV Box / PLAY) können damit leider nicht genutzt werden. Unterstützt werden die MagentaTV One, der MagentaTV Stick, Apple TV 4K und Apple TV HD, Fire TV Stick (ab FireTV OS 6), außerdem ist die Nutzung möglich überWebbrowsersowie über die MagentaTV App auf mobilen Endgeräten (ab iOS 15 und ab Android 8.1). Hinzu kommt eine App für die TV-Geräte von Samsung (ab 2018), LG Smart TVs ab webOS 5 und TV-Geräte mit Android 7.1 und höher, z.B. von Sony, Philips, Panasonic und Xiaomi.' metadata={'source': 'data/Apps & Dienste/https___www.telekom.de_magenta-tv_next-magenta-tv.txt'}"", ""page_content='Für das Magenta TV nutze ich den Media Receiver 401.Da Magenta TV Gen.' metadata={'source': 'data/Apps & Dienste/telekomhilft.telekom.de_t5_TV_Wechsel-in-Magenta-2-0-sinnvoll_td-p_6971637_jump-to_first-unread-message.txt'}"", ""page_content='Bei 1.0 sind etliche Sender nur über den Media Receiver empfangbar. Bei 2.0 ist es anders, da es hier eine komplett andere Plattform ist, wo die herkömmlichen Media Receiver nicht mehr funktionieren. - @Gelöschter NutzerDie Anzahl der Sender in der App bei MagentaTV 1.0 und 2.0 kann man nicht vergleichen. Bei 1.0 sind etliche Sender nur über den Media Receiver empfangbar.' metadata={'source': 'data/Apps & Dienste/telekomhilft.telekom.de_t5_TV_MagentaTV-Senderanzahl-bei-1-0-bzw-2-0_td-p_6940293_jump-to_first-unread-message.txt'}""]",The answer to given question is not present in context,847,0.00020714999999999997,178,4,67.89841318130493,0.9571202782889147,0.0,1.0,0.5555555555555556,0.0015807708760779049,0.01388888888888889
Which feature lets MagentaTV Stick be used from any angle?,"Der MagentaTV Stick verfügt über eine Funktion namens ""360-Grad-Fernbedienung"", die es ermöglicht, den Stick aus jedem Winkel zu steuern. Dies bedeutet, dass Sie die Fernbedienung nicht direkt auf den Stick richten müssen, um ihn zu bedienen.","[""page_content='PLAY\n• MagentaTV One\n• MagentaTV Stick\n\n' metadata={'source': 'data/Apps & Dienste/https___www.telekom.de_hilfe_apps-dienste_apps_magenta-zuhause-app_internet-tv-funktionen_magenta-tv-geraete.txt'}"", ""page_content='MagentaTV Stick, MagentaTV One, Amazon Fire TV Stick/Cube, Apple TV (ab 4. Generation) und Google Chromecast\n• Ihrem Smart TV – in unsererGeräteübersichterfahren Sie, ob die MagentaTV App für Ihren\xa0Fernseher zur Verfügung steht\n\n' metadata={'source': 'data/Apps & Dienste/https___www.telekom.de_hilfe_tv_magenta-tv-app_nutzen.txt'}"", ""page_content='Source URL: https://www.telekom.de/hilfe/geraete-zubehoer/magenta-tv-geraete/magenta-tv-stick/nutzungstipps\n\nQuestion: Wie kann ich den MagentaTV Stick steuern? Answer: Neben der im Lieferumfang enthaltenenFernbedienung, lässt sich der Stick auch via Sprachsteuerung des Google Assistant oder durch Einbindung eigener Bluetooth Gamepads steuern. Aber auch die Anbindung einer USB-Tastatur ist möglich. Ein Profil für Logitech Universal Remote ist ebenfalls in Planung. Question: Wie aktiviere ich die Funktion Zapping beim MagentaTV Stick? Answer: Wenn Sie schnell zwischen den Sendern umschalten möchten, dann aktivieren Sie die Zapping-Funktion unter:\nEinstellungen > MagentaTV-Einstellungen\xa0> Dein Stick\xa0-\xa0Zapping\nJetzt können Sie nur mit den Pfeil-Tasten (hoch/runter) direkt den Sender wechseln\xa0ohne die Okay-Taste betätigen zu müssen. Question: Funktioniert der MagentaTV Stick nur bei mir zu Hause? Answer: Nein, Sie können Ihren MagentaTV Stick über jede beliebige Internetverbindung nutzen. Gut zu wissen:MagentaTV ist nur innerhalb der EU nutzbar. Question: Welche Streaming-Dienste, Mediatheken und Apps sind über den MagentaTV Stick verfügbar? Answer: Neben MagentaTV sind Disney+,\xa0Netflix, Prime Video, YouTube, DAZN, MagentaSport, ARD Mediathek, ZDF Mediathek, ProSieben und Sat1 Mediathek, Spotify, Twitch\xa0und viele weitere Apps über denGoogle Play Storeverfügbar. Voraussetzungist, dass Sie ein Google-Konto mit Ihrem MagentaTV verknüpfen. Wie das funktioniert, erklären wir Ihnen in unsererEinrichtungshilfeim Schritt 8. Question: Wie kann ich weitere Apps installieren und deinstallieren? Answer: Im Google Play Store stehen Ihnen alle von Google für die\xa0jeweilige Android TV Version und den MagentaTV Stick freigegebenen Apps\xa0zur Verfügung. Apps installieren:\nDamit Sie sich neben den Vorinstallierten\xa0weitere – Ihre bevorzugten – Apps installieren können, benötigen Sie ein Google-Konto. Mit diesem haben Sie dann Zugriff auf den Google Play\xa0Store. DenGoogle Play Storefinden Sie unter demMenüpunkt\xa0Apps. Wie Sie sich ein Google-Konto einrichten bzw. Ihr vorhandenes verknüpfen,\xa0erklären wir Ihnen in unsererEinrichtungshilfeim Schritt 8. Apps deinstallieren:\nGut zu wissen:Wenn Sie\xa0später die App erneut nutzen möchten, müssen Sie die App erneut über den Google Play Store installieren.Google Apps wie YouTube oder den Google Play Store lassen sich nicht deinstallieren. Stattdessen können Sie\xa0diese deaktivieren bzw.' metadata={'source': 'data/Apps & Dienste/https___www.telekom.de_hilfe_geraete-zubehoer_magenta-tv-geraete_magenta-tv-stick_nutzungstipps.txt'}"", ""page_content='B. Media Receiver 401 / 201 / 601 Sat, MagentaTV Box / PLAY) können damit leider nicht genutzt werden. Unterstützt werden die MagentaTV One, der MagentaTV Stick, Apple TV 4K und Apple TV HD, Fire TV Stick (ab FireTV OS 6), außerdem ist die Nutzung möglich überWebbrowsersowie über die MagentaTV App auf mobilen Endgeräten (ab iOS 15 und ab Android 8.1). Hinzu kommt eine App für die TV-Geräte von Samsung (ab 2018), LG Smart TVs ab webOS 5 und TV-Geräte mit Android 7.1 und höher, z.B. von Sony, Philips, Panasonic und Xiaomi.' metadata={'source': 'data/Apps & Dienste/https___www.telekom.de_magenta-tv_next-magenta-tv.txt'}"", ""page_content='Auch im EU-Ausland benötigst du lediglich einen Fernseher mit HDMI-Anschluss und eine aktive WLAN-Verbindung. Question: Bietet MagentaTV besondere Funktionen, wie Restart, Cloud-Speicher und mehr? Answer: Mit MagentaTV kannst du bestimmen, wann du fernsiehst. Mit Restart startest du bereits laufende TV-Sendungen wieder von vorne, mit Timeshift stoppst du laufende Sendungen und schaust sie später weiter. Dank des Cloud-Speichers nimmst du Sendungen auf und schaust sie, wann immer du möchtest.' metadata={'source': 'data/Apps & Dienste/https___www.telekom.de_magenta-tv_tarife-und-optionen_magenta-tv-mit-app_amazon-fire-tv-stick.txt'}"", 'page_content=\'Deaktivierung taucht die entsprechende App\xa0nicht mehr in Ihrer\xa0Benutzeroberfläche auf. Question: Wie nehme ich mit dem MagentaTV Stick auf und wie groß ist der Aufnahmespeicher? Answer: Mit der Buchung von MagentaTV Smart bzw. MagentaTV Smart Flex\xa0(App) stehen Ihnen automatisch 24 Stunden Cloud-Recorder zur Verfügung. Sendungen, die Sie in Ihrem\xa0Cloud-Recorder speichern,\xa0können\xa0Sie über Ihren MagentaTV Stick sowie Ihrem Smartphone, Tablet oder PC/Laptop überall und jederzeit ansehen. Gut zu wissen:MagentaTV streamen, wenn Sie keinen Telekom Festnetz-Vertrag haben.MagentaTV Smart, wenn Sie Telekom Festnetz-Kunde sind. Aufnehmen:Auf dem MagentaTV Stick können Sie Aufnahmen direkt über die REC-Taste der Fernbedienung programmieren. Alternativ können Sie \xa0Aufnahmen über Ihr Smartphone, Tablet oder PC/Laptop programmieren. Aufnahmen verwalten:Zur Verwaltung Ihrer Aufnahmen gelangen Sie, indem Sie in der Kategorie ""Meine Aufnahmen"" die Kachel ""Alle anzeigen"" auswählen. Alternativ können Sie die Aufnahmen über Ihr Smartphone, Tablet oder PC/Laptop programmieren/verwalten. Question: Kann ich meine Senderliste sortieren? Answer: Die Sendersortierung ist direkt über das Menü des MagentaTV Sticks\xa0möglich: Einstellungen > MagentaTV Einstellungen > Dein Stick – Senderverwaltung\nGut zu wissen:Die Sortierung\xa0 können Sie auch über Ihre anderen Geräte (z. B.\' metadata={\'source\': \'data/Apps & Dienste/https___www.telekom.de_hilfe_geraete-zubehoer_magenta-tv-geraete_magenta-tv-stick_nutzungstipps.txt\'}']","The feature that lets the MagentaTV Stick be used from any angle is the Bluetooth connection of the remote control, which allows it to receive signals from any direction.",1774,0.0002913,56,6,60.27530121803284,0.8542279705161976,0.3333333333,0.0,0.0,0.01090602900579092,0.05714285714285715
What to do if Telekom offers 16 Mb but 250 Mb is available?,"Wenn Telekom Ihnen einen Tarif mit 16 Mb anbietet, aber Sie eine Verfügbarkeit von 250 Mb haben, können Sie Ihren Tarif möglicherweise upgraden. Um die besten Optionen zu erkunden, empfehle ich, sich im Kundencenter einzuloggen oder die MeinMagenta App zu nutzen, um einen Tarifwechsel vorzunehmen. Dort können Sie auch sehen, welche Tarife in Ihrer Region verfügbar sind.

Falls Sie weitere Hilfe benötigen, besuchen Sie bitte www.telekom.de/hilfe für detaillierte Unterstützung.","[""page_content='Mit unseren Tarifen für mobiles WLAN ist das möglich. Dafür benötigen Sie einen mobilen WLAN-Router wie dieTelekom Speedboxund einen passendenMagentaMobil Speedbox Tarif. Einfach mit Ihrem Endgerät verbinden und schon sind Sie im Netz.Mobiles Internet entdecken\n\nQuestion: Wie kann unbegrenztes Datenvolumen bei der Telekom gebucht werden? Answer: Wenn Sie noch kein Mobilfunkkunde bei der Telekom sind, können Sie entweder mit dem TarifMagentaMobil XLeinen Handyvertrag mit unbegrenztem Datenvolumen abschließen oder den Prepaid-TarifMagentaMobil Prepaid Maxohne Vertrag wählen. Hierbei fügen Sie Ihren gewünschten Tarif dem Warenkorb hinzu und setzen die Bestellung fort.Sollten Sie schon einen Laufzeitvertrag oder eine Prepaid-Karte von der Telekom besitzen, können Sie Ihren Tarif nach Einloggen imKundencenterändern.Zudem haben Sie die Möglichkeit, einePartnerkarteals Zusatzkarte zu buchen, wodurch sich der durchschnittliche Preis pro Karte reduziert. Question: Wie viel kostet unbegrenztes Datenvolumen bei der Telekom? Answer: Die Preise der Mobilfunktarife mit unbegrenztem Datenvolumen sind von Ihren individuellen Bedürfnissen abhängig. Sie haben die Wahl zwischen einem Prepaid-Tarif ohne Vertrag, einem regulären Handyvertrag mit fester Laufzeit über 24 Monate, einem monatlich kündbaren Mobilfunkvertrag und einem 24-Stundenpass. Question: Verschenkt die Telekom kostenloses Datenvolumen? Answer: Mit der Telekom als Anbieter bekommen Sie bei Nutzung derMeinMagenta Appzusätzliches, mobiles Datenvolumen geschenkt. Die Höhe des Datenbonus richtet sich danach, wie lange Sie Ihren laufenden Vertrag besitzen. Für jedes Jahr erhalten Sie 500 MB (beim Young-Tarif 1 GB) pro Monat extra alsDatenvolumen geschenkt, wenn Sie einen Vertrag der aktuellen Tarifgeneration besitzen.Auch wenn Sie Mobilfunk und Festnetz kombinieren, profitieren Sie als MagentaEINS-Kunde von einer Flatrate für mobiles Internet. Denn mit der Mobile Happy Hour stehen Ihnen in den MagentaMobil Tarifen Basic, S und M täglich eine Stunde unlimited surfen zu. Mit dem MagentaMobil L surfen Sie mit MagentaEINS dauerhaft mit unbegrenztem Datenvolumen. ' metadata={'source': 'data/Apps & Dienste/https___www.telekom.de_unterwegs_unbegrenztes-datenvolumen.txt'}"", ""page_content='Auch nach Rückinfo vom Telekom-Support bleibt mit also nichts anderes übrig, als min. 2 Jahre den Anbieter zu wechseln...Ich bin schon lange bei der Telekom und habe auch noch 25GB in der MagentaCloud (momentan gibt es wohl nur noch 15GB).Ich habe gehört, dass man die Telekom-Mailadresse auch ohne gültigen Vertrag weiterhin behalten kann wenn man das irgendwie auf einen kostenlosen Account umstellt.1. Wie funktioniert das praktisch, wenn man die alte Telekom-Mailadresse behalten will?2.' metadata={'source': 'data/Apps & Dienste/telekomhilft.telekom.de_t5_MagentaCLOUD_MagentaCloud-25GB-Pausieren-wegen-Glasfaserausbau_td-p_6948069_jump-to_first-unread-message.txt'}"", ""page_content='Source URL: https://telekomhilft.telekom.de/t5/TV/Wechsel-in-Magenta-2-0-sinnvoll/td-p/6971637/jump-to/first-unread-message\nSubject: Wechsel in Magenta 2.0 sinnvoll? Content: Hallo,ich habe aktuell den Tarif „Magenta Zuhause L + Magenta TV Smart“ mit einem Glasfaseranschluss.' metadata={'source': 'data/Apps & Dienste/telekomhilft.telekom.de_t5_TV_Wechsel-in-Magenta-2-0-sinnvoll_td-p_6971637_jump-to_first-unread-message.txt'}"", ""page_content='Question: Wann lohnt sich unbegrenztes Datenvolumen? Answer: Sie haben bei den Unlimited-Tarifen der Telekom die Wahl zwischen dem Prepaid-TarifMagentaMobil Prepaid Maxohne Vertragsbindung, dem TarifMagentaMobil XLmit einem Laufzeitvertrag von 24 Monaten sowie demMagentaMobil XL Flex, den Sie jeden Monat kündigen können. Bei allen drei Tarifen erhalten Sie zudem eine Telefon- und SMS-Flat in alle deutschen Netze (inkl.' metadata={'source': 'data/Apps & Dienste/https___www.telekom.de_unterwegs_unbegrenztes-datenvolumen.txt'}"", ""page_content='Source URL: https://www.telekom.de/hilfe/tv/inhalte/mega-sport/voraussetzung\n\nQuestion: Was ist die Voraussetzung, um MegaSport buchen zu können? Answer: Um dieMegaSport Optionbuchen zu können, benötigen Sie einen MagentaTV Tarif, egal ob Sie einen zugehörigen Internet- & Festnetz-Anschluss haben oder nur über die MagentaTV App streamen.' metadata={'source': 'data/Apps & Dienste/https___www.telekom.de_hilfe_tv_inhalte_mega-sport_voraussetzung.txt'}"", ""page_content='Festnetz) und eine HotSpot-Flatrate. Question: Sind die Unlimited-Tarife der Telekom monatlich kündbar? Answer: Sie arbeiten gerne ortsunabhängig oder sind viel unterwegs?' metadata={'source': 'data/Apps & Dienste/https___www.telekom.de_unterwegs_unbegrenztes-datenvolumen.txt'}"", ""page_content='Source URL: https://telekomhilft.telekom.de/t5/Festnetz-Internet/Corporate-Benefits-Fehlermeldung/td-p/6980957/jump-to/first-unread-message\nSubject: Corporate Benefits Fehlermeldung\nContent: Sehr geehrtes Telekom-Hilft-Team,ich bekomme bekomme eine Fehlermeldung, sobald ich das Angebot für Magenta Zuhause Giga nutzen möchte und meine Kundennummer, Vorwahl und Telefonnummer eingebe sowie mich einlogge.Ich habedie App gelöscht und neu installiert, den Adblocker deaktiviert und deinstalliert, den gesamten Browserverlauf bei Safari und Google Chrome gelöscht, das Handy neu gestartet und trotzdem kommt weiterhin die Fehlermeldung.Kann mir jemand weiterhelfen?Vielen Dank und viele Grüße\n\nAccepted Solutions:\n- Danke das war der goldene Tipp! Unter der Rufnummer erreicht man die Telekomabteilung, die für Corporate Benefits zuständig ist und man kann sofort telefonisch die Tarife zu den Corporate Benefits Konditionen buchen!' metadata={'source': 'data/Apps & Dienste/telekomhilft.telekom.de_t5_Festnetz-Internet_Corporate-Benefits-Fehlermeldung_td-p_6980957_jump-to_first-unread-message.txt'}"", ""page_content='Source URL: https://www.telekom.de/hilfe/vertrag-rechnung/vertrag/aenderung/festnetz-tarif\n\nQuestion: Wie kann ich meinen Festnetz-Tarif ändern? Answer: So können Sie Ihren Festnetz-Vertrag im Kundencenter und der MeinMagenta App ändern:\nHinweis: In einen höherwertigen Tarif können Sie bereits vor Ablauf der Mindestlaufzeit wechseln. In einen günstigeren oder gleichwertigen Tarif (z.' metadata={'source': 'data/Apps & Dienste/https___www.telekom.de_hilfe_vertrag-rechnung_vertrag_aenderung_festnetz-tarif.txt'}"", 'page_content=\'Accepted Solutions:\n- Guten Morgen@Metze.RWE,auch wenn ich jetzt noch keine Rückmeldung der Fachabteilung einsehen kann, kläre ich das hier auf.Wie hier bereits mehrfach geschrieben wurde, gilt der MagentaEINS Vorteil ""Happy Hour"" für die Tarife Magenta Mobil Basic bis Magenta Mobil M und der MagentaEINS Vorteil ""unbegrenztes Datenvolumen"" für den Magenta Mobil L.In dem von dir geteilten Bild ist zu sehen, dass es die Happy Hour gibt, jedoch der L Tarif stattdessen unbegrenztes Datenvolumen erhält, dies ist auch in der von@Stefangeteilten Grafik gut zu erkennen. Das unbegrenzte Datenvolumen greift jedoch nicht in der EU, da in diesem Fall die Fair Use Policy greift und statt unbegrenzt, dann 93 GB Datenvolumen zur Verfügung stehen.Kurz noch einmal zusammengefasst:Im Magenta Mobil L mit MagentaEINS gibt eskeineHappy Hour, dies ist auch wie von@CobraCanegeschrieben,\xa0 bei uns auf der Homepage nachzulesen. Hier noch einmal der Weg dorthin:https://www.telekom.de/magenta-eins#öffnen, etwas unter die Tarife scrollen, auf das Sternchen bei Happy Hour klicken und dort ist vermerkt, dass es nur für die Magenta Mobil Tarife Basic bis M greift.Ich freue mich, dass ich das Ganze aufklären konnte und bei Rückfragen immer her damit.Beste GrüßeMario Sa. - @Metze.RWEschrieb:In Deutschland habe ich ja eh unbegrenztes Datenvolumen.Dann hast du einen Magenta L oder XL ?Da gibt es nach der Grafik gar keine Möglichkeit eine Happy Hour zu buchen.In D wird aus dem L ein Unlimited und im Ausland zehrt er vom 93 GB Kontingent\n- @Metze.RWEschrieb:In Deutschland habe ich ja eh unbegrenztes Datenvolumen.Dann hast du einen Magenta L oder XL ?Da gibt es nach der Grafik gar keine Möglichkeit eine Happy Hour zu buchen.In D wird aus dem L ein Unlimited und im Ausland zehrt er vom 93 GB Kontingent\n- Guten Morgen@Metze.RWE,auch wenn ich jetzt noch keine Rückmeldung der Fachabteilung einsehen kann, kläre ich das hier auf.Wie hier bereits mehrfach geschrieben wurde, gilt der MagentaEINS Vorteil ""Happy Hour"" für die Tarife Magenta Mobil Basic bis Magenta Mobil M und der MagentaEINS Vorteil ""unbegrenztes Datenvolumen"" für den Magenta Mobil L.In dem von dir geteilten Bild ist zu sehen, dass es die Happy Hour gibt, jedoch der L Tarif stattdessen unbegrenztes Datenvolumen erhält, dies ist auch in der von@Stefangeteilten Grafik gut zu erkennen. Das unbegrenzte Datenvolumen greift jedoch nicht in der EU, da in diesem Fall die Fair Use Policy greift und statt unbegrenzt, dann 93 GB Datenvolumen zur Verfügung stehen.Kurz noch einmal zusammengefasst:Im Magenta Mobil L mit MagentaEINS gibt eskeineHappy Hour, dies ist auch wie von@CobraCanegeschrieben,\xa0 bei uns auf der Homepage nachzulesen.\' metadata={\'source\': \'data/Apps & Dienste/telekomhilft.telekom.de_t5_Mobilfunk_Happy-hour_td-p_6958636_jump-to_first-unread-message.txt\'}']",The answer to given question is not present in context,2628,0.0004400999999999999,102,9,70.40722417831421,0.0,0.0,0.0,0.7142857142857143,0.0026348495048119725,0.022222222222222227
Welche Hotline für Haustürgeschäfte bei Telekom?,"Die Hotline für Haustürgeschäfte bei Telekom ist die Nummer 0800 330 2202. Dort erhalten Sie Unterstützung zu verschiedenen Anliegen. Wenn Sie weitere Informationen benötigen, können Sie auch die Webseite www.telekom.de/hilfe besuchen.","[""page_content='Unter der Rufnummer erreicht man die Telekomabteilung, die für Corporate Benefits zuständig ist und man kann sofort telefonisch die Tarife zu den Corporate Benefits Konditionen buchen!' metadata={'source': 'data/Apps & Dienste/telekomhilft.telekom.de_t5_Festnetz-Internet_Corporate-Benefits-Fehlermeldung_td-p_6980957_jump-to_first-unread-message.txt'}"", ""page_content='Alle Infos zum Datenschutz bei der Telekom finden Siehier. Question: Werde ich dann andauernd angerufen?' metadata={'source': 'data/Apps & Dienste/https___www.telekom.de_infoservice.txt'}"", ""page_content='Oder, alternativ, die Hotline (08003301000) anrufen soll.😅Die 1000 geht nicht, da hier, zwingend, eine Rufnummer der Telekom gebraucht wird.Was kann man hier machen????' metadata={'source': 'data/Apps & Dienste/telekomhilft.telekom.de_t5_TV_MagentaTV-Smart-laeuft-nicht-auf-dem-Fernseher_td-p_6953060_jump-to_first-unread-message.txt'}"", ""page_content='Content: ...wird in der App nicht angezeigtTelefon Support der Telekom Hotline möchte mir nicht weiterhelfen.Gibt es hier bitte Hilfe.?' metadata={'source': 'data/Apps & Dienste/telekomhilft.telekom.de_t5_Mobilfunk_Happy-hour_td-p_6958636_jump-to_first-unread-message.txt'}"", ""page_content='Answer: Nein, denn wir kontaktieren Sie nur dann, wenn es Neuigkeiten gibt, die Sie nicht verpassen sollten und wenn es neue, auf Sie persönlich zugeschnittene Angebote gibt. Question: Wo kann ich meine Kontaktpräferenzen anpassen? Answer: Wenn Sie Ihre Präferenzen zur Kontaktaufnahme ändern möchten, können Sie dashier im Kundencenter. Question: Wo kann ich mich vom InfoService abmelden? Answer: Wenn Sie sich vom InfoService abmelden möchten, können Sie dashier im Kundencenteroder per E-Mail anwiderruf@telekom.de. ' metadata={'source': 'data/Apps & Dienste/https___www.telekom.de_infoservice.txt'}"", ""page_content='Source URL: https://telekomhilft.telekom.de/t5/Festnetz-Internet/Digitaler-Home-Service/td-p/6957368/jump-to/first-unread-message\nSubject: Digitaler Home Service\nContent: Zum Lachen oder vielleicht doch nicht ? Bei meinem Anruf bei dem Digitalen Home Service wurde mir heute morgen erklärt, dass der nur in der Adresse durchgeführt wird, die zu dessen Kunden Nummer gehört.' metadata={'source': 'data/Apps & Dienste/telekomhilft.telekom.de_t5_Festnetz-Internet_Digitaler-Home-Service_td-p_6957368_jump-to_first-unread-message.txt'}"", ""page_content='Was jetzt? Answer: In der E-Mail wird Ihnen mitgeteilt, warum Ihr Antrag nicht genehmigt worden ist. In einigen Fällen haben Sie die Möglichkeit sich neu zu registrieren – dies wird Ihnen in der E-Mail auch mitgeteilt. Question: Ich habe eine Nachricht bekommen, dass mein Antrag abgelehnt wurde. Warum? Answer: Leider scheint es, dass Sie die Teilnahmebedingungen zu unserer Aktion nicht erfüllen. In der E-Mail wird Ihnen mitgeteilt, aus welchem Grund Ihr Antrag abgelehnt worden ist. Bitte prüfen Sie noch einmal ausführlich die Teilnahmebedingungen. In einigen Fällen haben Sie die Möglichkeit sich neu zu registrieren – dies wird Ihnen in der E-Mail auch mitgeteilt. Question: Kann ich mich bei Fragen irgendwo telefonisch hinwenden? Answer: Bei Fragen können Sie sich selbstverständlich jederzeit an den Telekom Kundenservice0800 330 2202wenden. Question: Ich habe zwischenzeitlich meine Mobilfunkrufnummer getauscht. Mit welcher Rufnummer registriere ich mich für den Cashback? Answer: Bei der Cashback-Registrierung wird nur die aktuelle Rufnummer akzeptiert, daher muss bei einem Rufnummerntausch während des Aktionszeitraumes die aktuelle (neue) Rufnummer angegeben werden. Question: Ich habe mich registriert und alle Dokumente hochgeladen.' metadata={'source': 'data/Apps & Dienste/https___www.telekom.de_unterwegs_cashback_cashback-einloesen.txt'}"", ""page_content='Accepted Solutions:\n- Heute habe ich kompetente Hilfe über die Hotline erhalten können.' metadata={'source': 'data/Apps & Dienste/telekomhilft.telekom.de_t5_Smart-Home_Magenta-Zuhause-Pro-App-kaufen_td-p_6962231_jump-to_first-unread-message.txt'}"", ""page_content='Source URL: https://www.telekom.de/infoservice\n\nQuestion: Was ist der InfoService und wie melde ich mich an? Answer: Mit dem InfoService erhalten Sie immer die neuesten Infos, für Sie passende Angebote und Serviceinformationen. Über die Anmelde-Buttons weiter oben melden Sie sich an. Question: Was passiert beim InfoService mit meinen Daten?' metadata={'source': 'data/Apps & Dienste/https___www.telekom.de_infoservice.txt'}""]",Die Antwort auf die gegebene Frage ist im Kontext nicht vorhanden,1349,0.00022394999999999997,48,9,70.63682985305786,0.9007505666946057,0.0,1.0,0.3333333333333333,0.007939087147543497,0.07843137254901962
What are Einsenergie Sachsen's budget telephony options pre-fiber launch?,"Es tut mir leid, ich kann Ihnen dabei nicht helfen. Für Informationen zu den Budget-Telefonieoptionen von Einsenergie Sachsen vor dem Start des Glasfaserausbaus empfehle ich, die Webseite www.telekom.de/hilfe zu besuchen, wo Sie weitere Unterstützung finden können.","[""page_content='Source URL: https://telekomhilft.telekom.de/t5/TV/Wechsel-in-Magenta-2-0-sinnvoll/td-p/6971637/jump-to/first-unread-message\nSubject: Wechsel in Magenta 2.0 sinnvoll? Content: Hallo,ich habe aktuell den Tarif „Magenta Zuhause L + Magenta TV Smart“ mit einem Glasfaseranschluss.' metadata={'source': 'data/Apps & Dienste/telekomhilft.telekom.de_t5_TV_Wechsel-in-Magenta-2-0-sinnvoll_td-p_6971637_jump-to_first-unread-message.txt'}"", ""page_content='Festnetz) und eine HotSpot-Flatrate. Question: Sind die Unlimited-Tarife der Telekom monatlich kündbar? Answer: Sie arbeiten gerne ortsunabhängig oder sind viel unterwegs?' metadata={'source': 'data/Apps & Dienste/https___www.telekom.de_unterwegs_unbegrenztes-datenvolumen.txt'}"", ""page_content='' metadata={'source': 'data/Apps & Dienste/https___www.telekom.de_hilfe_internet-telefonie_telefonie_einstellungen-telefoniecenter_nummer-sperren.txt'}"", ""page_content='Der neue Provider bietet neben Internet über Glasfaser auch die Übernahme des Festnetzanschlusses an.' metadata={'source': 'data/Apps & Dienste/telekomhilft.telekom.de_t5_E-Mail_Ubernahme-email-Adresse-und-bereits-empfangene-und-gesendete_td-p_6942533_jump-to_first-unread-message.txt'}"", ""page_content='' metadata={'source': 'data/Apps & Dienste/telekomhilft.telekom.de_t5_Mobilfunk_Happy-hour_td-p_6958636_jump-to_first-unread-message.txt'}"", ""page_content='' metadata={'source': 'data/Apps & Dienste/https___www.telekom.de_netz_glasfaser_interessenten-registrierung.txt'}"", ""page_content='' metadata={'source': 'data/Apps & Dienste/telekomhilft.telekom.de_t5_Festnetz-Internet_Anrufweiterleitung-in-Kombination-mit-Fritz-box-Parallelruf_td-p_6956356_jump-to_first-unread-message.txt'}"", ""page_content='Question: Wie sieht die Planung aus? Answer: Mit Hilfe der Befahrungsdaten können unsere Planer ohne aufwändige Auskundungen den optimalen Standort für unsere Netzverteiler (die grauen Kästen am Straßenrand) finden und diese unkompliziert mit der Kommune abstimmen, da diese immer im Vorfeld zustimmen muss. Dadurch können wir auch Aufwände in der kommunalen Verwaltung reduzieren und den Glasfaserausbau beschleunigen.' metadata={'source': 'data/Apps & Dienste/https___www.telekom.de_netz_glasfaser-ausbauplanung-ki.txt'}"", 'page_content=\'- @Christian HeenemannIn diesem Beitrag findest du weitere Infoshttps://telekomhilft.telekom.de/t5/Festnetz-Internet/Wie-und-wo-kann-ich-eine-ausrangierte-Telefonze... - @Christian Heenemannschrieb:Sehr geehrte Damen und Herren, für unsere Gemeinde möchten wir eine alte Telefonzelle aus dem Lager in Michendorf als Bücherzelle kaufen. Unsere Gemeinde Ummanz im Landkreis Vorpommern-Rügen hat in diesem Jahr zum Bundeswettbewerb ""Unser Dorf hat Zukunft"" in Berlin ausgezeichnet worden. Damit wir noch schöner werden gibt es den Wunsch nach einer öffentlichen Bücherzelle, wie es sie in einigen Gemeinden bereits gibt. Ich, Christian Heenemann, bin Mitglied im Brauchtumsverein und möchte mich gern für unsere Gemeinde einsetzen hoffe, dass wir von Ihnen eine Telefonzelle kaufen können. Mit freundlichen Grüßen.Hier entlang, Kontaktformular nutzenhttps://telekomhilft.telekom.de/t5/Telefonie-Internet/Wie-und-wo-kann-ich-eine-ausrangierte-Telefonz...\' metadata={\'source\': \'data/Apps & Dienste/telekomhilft.telekom.de_t5_Sonstiges_alte-Telefonzelle-aus-Michendorf-nutzen-als-Buecherzelle_td-p_6964632_jump-to_first-unread-message.txt\'}', ""page_content='Source URL: https://www.telekom.de/netz/glasfaser/interessenten-registrierung\n\nQuestion: Was sind die Vorteile einer Registrierung? Answer: In wenigen Schritten kostenlos vormerken lassen.' metadata={'source': 'data/Apps & Dienste/https___www.telekom.de_netz_glasfaser_interessenten-registrierung.txt'}""]",The answer to given question is not present in context,1288,0.00021975,59,10,63.738117933273315,0.0,0.0,1.0,0.0,0,0.0
"Wie greift man als Vertragsinhaber auf Rechnungen zu, wenn es Probleme mit dem Nutzeraccount gibt?","Wenn Sie als Vertragsinhaber auf Ihre Rechnungen zugreifen möchten, aber Probleme mit Ihrem Nutzeraccount haben, können Sie dies über das Kundencenter tun. Dort können Sie unter ""Rechnungsübersicht"" Ihre Rechnungen einsehen. Alternativ können Sie auch die ""MeinMagenta-App"" auf Ihrem Smartphone oder Tablet installieren, um Ihre aktuellen und vergangenen Rechnungen zu finden.

Sollten Sie weiterhin Probleme haben, empfehle ich Ihnen, die Hilfeseite von Telekom zu besuchen: www.telekom.de/hilfe. Dort finden Sie weitere Unterstützung.","['page_content=\'- @Gelöschter NutzerOder du installierst auf deinem Smartphone oder Tablet die ""MeinMagenta-App"". Dort findest du dann unter ""Zahlungen"" immer deine aktuellen Rechnungen und die aus der Vergangenheit. - Hallo\xa0@Gelöschter NutzerIm Kundencenter-Rechnungsübersicht--Rechnung online einsehen-Gruß Marcel\n- @Gelöschter Nutzerschrieb:wie kann ich die\xa0 Rechnung ansehen und ausdrucken@Gelöschter NutzerAls Nutzer . Nie .Als Nutzer bist du nicht der Inhaber vom Anschluss oder Handyvertrag\n\' metadata={\'source\': \'data/Apps & Dienste/telekomhilft.telekom.de_t5_E-Mail_Telekom-Rechnung-ansehen-als-nutzer_td-p_6940366_jump-to_first-unread-message.txt\'}', ""page_content='' metadata={'source': 'data/Apps & Dienste/telekomhilft.telekom.de_t5_Mobilfunk_Verknuepfung-Mobil-und-Festnetz_td-p_6948111_jump-to_first-unread-message.txt'}"", ""page_content='' metadata={'source': 'data/Apps & Dienste/telekomhilft.telekom.de_t5_Sonstiges_Login-Online-Banking-klappt-nicht_td-p_6971773_jump-to_first-unread-message.txt'}"", ""page_content='Hierfür erhält man Zugangsdaten und kann entsprechende kostenpflichtige Dienste buchen. Die Abrechnung würde in diesem Fall auch über ein Bankkonto laufen.Viele GrüßeJürgen\n- Hallo@DerGeograph,@DerGeographschrieb: Ich habe das Problem zwischenzeitlich anders für mich gelöst, das Ticket kann von mir aus geschlossen werden.danke für das Feedback. Sehr gut, dass du eine Lösung gefunden hast.Mit den größeren und kostenpflichtigen Versionen der MagentaCloud ist es so, dass diese wahlweise zu einem Festnetz-Vertrag oder zu einem unabhängigen Telekom-Login hinzugebucht werden können. Beim Festnetz-Vertrag erfolgt die Abrechnung über das hinterlegte Bankkonto (SEPA-Mandat).Beim unabhängigen Telekom-Login gibt es dagegen nur die Auswahl von Kreditkarte oder PayPal.Aber es gäbe noch eine weitere Möglichkeit.' metadata={'source': 'data/Apps & Dienste/telekomhilft.telekom.de_t5_MagentaCLOUD_magentacloud-buchen_td-p_6959121_jump-to_first-unread-message.txt'}"", ""page_content='' metadata={'source': 'data/Apps & Dienste/telekomhilft.telekom.de_t5_Mobilfunk_Doppelte-Kundennummer_td-p_6964058_jump-to_first-unread-message.txt'}"", ""page_content='' metadata={'source': 'data/Apps & Dienste/telekomhilft.telekom.de_t5_E-Mail_Mail-vom-Inklusivnutzer_td-p_6982672_jump-to_first-unread-message.txt'}"", ""page_content='Hierfür erhält man Zugangsdaten und kann entsprechende kostenpflichtige Dienste buchen. Die Abrechnung würde in diesem Fall auch über ein Bankkonto laufen.Viele GrüßeJürgen\n' metadata={'source': 'data/Apps & Dienste/telekomhilft.telekom.de_t5_MagentaCLOUD_magentacloud-buchen_td-p_6959121_jump-to_first-unread-message.txt'}"", ""page_content='Welche Möglichkeit gibt es sich anzumelden wenn alle Zugangsdaten nicht mehr zur Verfügung stehen?' metadata={'source': 'data/Apps & Dienste/telekomhilft.telekom.de_t5_E-Mail_Zugangspasswort-Kundencenter-vergessen_td-p_6952105_jump-to_first-unread-message.txt'}"", 'page_content=\'Source URL: https://telekomhilft.telekom.de/t5/E-Mail/Telekom-Rechnung-ansehen-als-nutzer/td-p/6940366/jump-to/first-unread-message\nSubject: Telekom  Rechnung ansehen als nutzer\nContent: wie kann ich die\xa0 Rechnung ansehen und ausdrucken\n\nAccepted Solutions:\n- @Gelöschter Nutzerschrieb:wie kann ich die\xa0 Rechnung ansehen und ausdrucken@Gelöschter NutzerAls Nutzer . Nie .Als Nutzer bist du nicht der Inhaber vom Anschluss oder Handyvertrag\n- Hallo\xa0@Gelöschter NutzerIm Kundencenter-Rechnungsübersicht--Rechnung online einsehen-Gruß Marcel\n- @Gelöschter NutzerOder du installierst auf deinem Smartphone oder Tablet die ""MeinMagenta-App"".\' metadata={\'source\': \'data/Apps & Dienste/telekomhilft.telekom.de_t5_E-Mail_Telekom-Rechnung-ansehen-als-nutzer_td-p_6940366_jump-to_first-unread-message.txt\'}', ""page_content='Rechnungs-E-Mail, Kontakt-E-Mail etc.). Beim Log-In im Kundencenter ist mir jetzt aufgefallen, dass der Zugang trotz Änderung der Kundendaten noch unter dem alten Benutzernamen meines Vaters läuft (ok, Vertrag wurde samt Kundennummer übernommen). D.h.' metadata={'source': 'data/Apps & Dienste/telekomhilft.telekom.de_t5_Sonstiges_Zugangsdaten-Kundencenter-Magenta-App-aendern-bei_td-p_6942143_jump-to_first-unread-message.txt'}"", ""page_content='Source URL: https://www.telekom.de/hilfe/vertrag-rechnung/rechnung/ansehen\n\nQuestion: Wo kann ich meine Rechnung einsehen?' metadata={'source': 'data/Apps & Dienste/https___www.telekom.de_hilfe_vertrag-rechnung_rechnung_ansehen.txt'}"", 'page_content=\'Source URL: https://www.telekom.de/hilfe/vertrag-rechnung/telekom-login/vertragspartner-nutzer\n\nQuestion: Wie kann ich im Kundencenter herausfinden, ob mein Benutzername ""Vertragspartner"" oder ""Nutzer"" ist? Answer: Starten Sie dasKundencenterund klicken auf ""Jetzt einloggen"".\' metadata={\'source\': \'data/Apps & Dienste/https___www.telekom.de_hilfe_vertrag-rechnung_telekom-login_vertragspartner-nutzer.txt\'}']","Um als Vertragsinhaber auf Rechnungen zuzugreifen, wenn es Probleme mit dem Nutzeraccount gibt, sollte der Masternutzer auf die Vertragsnummer gebucht werden, was den Zugriff ermöglicht. Falls der Zugang weiterhin nicht funktioniert, könnte es hilfreich sein, den Masternutzer neu zu setzen oder sich erneut an die Hotline zu wenden, um Unterstützung zu erhalten.",1676,0.00030225,113,12,78.29975199699402,0.9373021403578273,0.5074074073904938,1.0,0.75,0.021265246285578906,0.2074074074074074
How to set up RTL+ on TV post-MagentaTV activation?,"Um RTL+ auf deinem Fernseher nach der Aktivierung von MagentaTV einzurichten, gehe bitte wie folgt vor:

1. **Aktivierungslink verwenden**: Nutze den Aktivierungslink, den du bei der Schaltung von MagentaTV erhalten hast.
2. **RTL+ Account erstellen**: Lege dir einen Account bei RTL+ an.
3. **RTL+ App installieren**: Installiere die RTL+ App auf dem Endgerät, das mit deinem Fernseher verbunden ist, oder direkt auf dem Fernseher, falls dieser die App unterstützt.
4. **Einloggen**: Logge dich mit deinen erstellten Accountdaten in der RTL+ App ein.

Falls du weitere Unterstützung benötigst, besuche bitte [www.telekom.de/hilfe](https://www.telekom.de/hilfe) für ausführliche Informationen.","[""page_content='Source URL: https://telekomhilft.telekom.de/t5/TV/rtl/td-p/6962275/jump-to/first-unread-message\nSubject: rtl +\nContent: Mit Magenta tv habe ich rtl+ gebucht.Wie bekomme ich rtl+ auf de Fernseher? Accepted Solutions:\n- Du nimmst den Aktivierungslink den du bekommen hast bei Schaltung von MagentaTV, legst dir nen Account bei RTL+ an, installierst die App auf dem Endgerät (entweder das was an den TV angeschlossen ist oder ggfs der TV selber) und loggst dich dann mit den von dir erstellen Accountdaten ein\n- Dafür wäre eine RTL+ APP nötighttps://www.telekom.de/hilfe/festnetz-internet-tv/magentatv/rtlplus-premium/durchfuehrung-account-ve...' metadata={'source': 'data/Apps & Dienste/telekomhilft.telekom.de_t5_TV_rtl_td-p_6962275_jump-to_first-unread-message.txt'}"", ""page_content='RTL+ Family ohne Musik) Geräten zu streamen. Question: Kann ich meinen bestehenden RTL+ Account mit meinem MagentaTV Account verknüpfen? Answer: Um alle Vorteile Ihres jeweiligen RTL+ Pakets zu genießen, müssen Sie Ihren Account vervollständigen. Nur so können Sie das Streaming-Angebot mit Ihrem bestehenden Account weiternutzen.' metadata={'source': 'data/Apps & Dienste/https___www.telekom.de_magenta-tv_inhalte_rtl-plus.txt'}"", ""page_content='Source URL: https://www.telekom.de/hilfe/tv/inhalte/rtlplus/app-problembehebung\n\nQuestion: Wie kann ich Probleme mit der RTL+ App auf meinem MagentaTV Gerät beheben? Answer: Wenn auf Ihrem MagentaTV Gerät das Bild einfriert oder andere Probleme mit der RTL+ App auftreten, lässt sich das in den meisten Fällen mit einem Neustart oder einem Zurücksetzen der App lösen.' metadata={'source': 'data/Apps & Dienste/https___www.telekom.de_hilfe_tv_inhalte_rtlplus_app-problembehebung.txt'}"", ""page_content='- Du nimmst den Aktivierungslink den du bekommen hast bei Schaltung von MagentaTV, legst dir nen Account bei RTL+ an, installierst die App auf dem Endgerät (entweder das was an den TV angeschlossen ist oder ggfs der TV selber) und loggst dich dann mit den von dir erstellen Accountdaten ein\n' metadata={'source': 'data/Apps & Dienste/telekomhilft.telekom.de_t5_TV_rtl_td-p_6962275_jump-to_first-unread-message.txt'}"", ""page_content='Source URL: https://www.telekom.de/hilfe/geraete-zubehoer/magenta-tv-geraete/magenta-tv-stick/nutzungstipps\n\nQuestion: Wie kann ich den MagentaTV Stick steuern? Answer: Neben der im Lieferumfang enthaltenenFernbedienung, lässt sich der Stick auch via Sprachsteuerung des Google Assistant oder durch Einbindung eigener Bluetooth Gamepads steuern. Aber auch die Anbindung einer USB-Tastatur ist möglich. Ein Profil für Logitech Universal Remote ist ebenfalls in Planung. Question: Wie aktiviere ich die Funktion Zapping beim MagentaTV Stick? Answer: Wenn Sie schnell zwischen den Sendern umschalten möchten, dann aktivieren Sie die Zapping-Funktion unter:\nEinstellungen > MagentaTV-Einstellungen\xa0> Dein Stick\xa0-\xa0Zapping\nJetzt können Sie nur mit den Pfeil-Tasten (hoch/runter) direkt den Sender wechseln\xa0ohne die Okay-Taste betätigen zu müssen. Question: Funktioniert der MagentaTV Stick nur bei mir zu Hause? Answer: Nein, Sie können Ihren MagentaTV Stick über jede beliebige Internetverbindung nutzen. Gut zu wissen:MagentaTV ist nur innerhalb der EU nutzbar. Question: Welche Streaming-Dienste, Mediatheken und Apps sind über den MagentaTV Stick verfügbar? Answer: Neben MagentaTV sind Disney+,\xa0Netflix, Prime Video, YouTube, DAZN, MagentaSport, ARD Mediathek, ZDF Mediathek, ProSieben und Sat1 Mediathek, Spotify, Twitch\xa0und viele weitere Apps über denGoogle Play Storeverfügbar. Voraussetzungist, dass Sie ein Google-Konto mit Ihrem MagentaTV verknüpfen. Wie das funktioniert, erklären wir Ihnen in unsererEinrichtungshilfeim Schritt 8. Question: Wie kann ich weitere Apps installieren und deinstallieren? Answer: Im Google Play Store stehen Ihnen alle von Google für die\xa0jeweilige Android TV Version und den MagentaTV Stick freigegebenen Apps\xa0zur Verfügung. Apps installieren:\nDamit Sie sich neben den Vorinstallierten\xa0weitere – Ihre bevorzugten – Apps installieren können, benötigen Sie ein Google-Konto. Mit diesem haben Sie dann Zugriff auf den Google Play\xa0Store. DenGoogle Play Storefinden Sie unter demMenüpunkt\xa0Apps. Wie Sie sich ein Google-Konto einrichten bzw. Ihr vorhandenes verknüpfen,\xa0erklären wir Ihnen in unsererEinrichtungshilfeim Schritt 8. Apps deinstallieren:\nGut zu wissen:Wenn Sie\xa0später die App erneut nutzen möchten, müssen Sie die App erneut über den Google Play Store installieren.Google Apps wie YouTube oder den Google Play Store lassen sich nicht deinstallieren. Stattdessen können Sie\xa0diese deaktivieren bzw.' metadata={'source': 'data/Apps & Dienste/https___www.telekom.de_hilfe_geraete-zubehoer_magenta-tv-geraete_magenta-tv-stick_nutzungstipps.txt'}"", ""page_content='- Hallo@hillehill51hier seht alles:https://www.telekom.de/hilfe/festnetz-internet-tv/magentatv/rtlplus-premium/durchfuehrung-account-ve...Innerhalb von 48 Std nach Bereittstellung MagentaTV, solltest du eine eMail mit dem Aktivierungslink erhalten. ' metadata={'source': 'data/Apps & Dienste/telekomhilft.telekom.de_t5_TV_RTL-Gebucht_td-p_6959623_jump-to_first-unread-message.txt'}"", ""page_content='Source URL: https://www.telekom.de/magenta-tv/tarife-und-optionen/magenta-tv-mit-app/lg-tv\n\nQuestion: Brauche ich Zusatzhardware, um MagentaTV auf einem LG Smart TV zu nutzen? Answer: Nein, MagentaTV läuft als App direkt auf deinem Fernseher (ab webOS 5).' metadata={'source': 'data/Apps & Dienste/https___www.telekom.de_magenta-tv_tarife-und-optionen_magenta-tv-mit-app_lg-tv.txt'}""]","To set up RTL+ on your TV after activating MagentaTV, you need to take the activation link you received when you activated MagentaTV, create an account with RTL+, install the RTL+ app on your device (either the device connected to the TV or the TV itself), and then log in with the account details you created.",1826,0.00035085,171,7,65.22699522972107,0.9696550121114756,0.7499999999625,1.0,0.8333333333333334,0.0025579476037043062,0.09815950920245396
"Welche Schritte für die Internetwiederherstellung nach einem Umzug, besonders bei Glasfaser?","Um Ihre Internetverbindung nach einem Umzug wiederherzustellen, insbesondere bei einem Glasfaseranschluss, sollten Sie die folgenden Schritte beachten:

1. **Umzugsmitteilung**: Informieren Sie die Telekom über Ihren Umzug. Dies können Sie in der Regel online über Ihr Telekom-Kundenkonto oder telefonisch tun.

2. **Neuen Anschluss beantragen**: Beantragen Sie den neuen Glasfaseranschluss an Ihrer neuen Adresse. Stellen Sie sicher, dass die Glasfasertechnologie an Ihrem neuen Wohnort verfügbar ist.

3. **Technische Überprüfung**: Die Telekom wird eine technische Überprüfung durchführen, um festzustellen, ob Ihre neue Adresse für einen Glasfaseranschluss geeignet ist.

4. **Installationstermin vereinbaren**: Wenn alles in Ordnung ist, erhalten Sie einen Installationstermin. Ein Techniker wird zu Ihnen kommen, um den Anschluss einzurichten.

5. **Router einrichten**: Nach der Installation müssen Sie Ihren Router einrichten. Folgen Sie den Anweisungen im Einrichtungsassistenten Ihres Routers, um die Internetverbindung herzustellen.

6. **Testen der Verbindung**: Überprüfen Sie nach der Einrichtung, ob Ihre Internetverbindung ordnungsgemäß funktioniert.

Für weitere Informationen und Hilfe bei Ihrem speziellen Fall besuchen Sie bitte die Webseite [www.telekom.de/hilfe](http://www.telekom.de/hilfe).","[""page_content='Der neue Provider bietet neben Internet über Glasfaser auch die Übernahme des Festnetzanschlusses an.' metadata={'source': 'data/Apps & Dienste/telekomhilft.telekom.de_t5_E-Mail_Ubernahme-email-Adresse-und-bereits-empfangene-und-gesendete_td-p_6942533_jump-to_first-unread-message.txt'}"", ""page_content='Question: Wie sieht die Planung aus? Answer: Mit Hilfe der Befahrungsdaten können unsere Planer ohne aufwändige Auskundungen den optimalen Standort für unsere Netzverteiler (die grauen Kästen am Straßenrand) finden und diese unkompliziert mit der Kommune abstimmen, da diese immer im Vorfeld zustimmen muss. Dadurch können wir auch Aufwände in der kommunalen Verwaltung reduzieren und den Glasfaserausbau beschleunigen.' metadata={'source': 'data/Apps & Dienste/https___www.telekom.de_netz_glasfaser-ausbauplanung-ki.txt'}"", ""page_content='' metadata={'source': 'data/Apps & Dienste/https___www.telekom.de_hilfe_internet-telefonie_tarife-optionen_sicherheitspaket_aktvieren.txt'}"", ""page_content='' metadata={'source': 'data/Apps & Dienste/https___www.telekom.de_hilfe_vertrag-rechnung_telekom-login_loeschen.txt'}"", ""page_content='' metadata={'source': 'data/Apps & Dienste/https___www.telekom.de_hilfe_geraete-zubehoer_smart-home_nutzung-und-funktionen-von-smart-home_nutzung-der-smart-home-app-und-der-home-base_speedport-smart-auf-werkseinstellungen-setzen.txt'}"", ""page_content='' metadata={'source': 'data/Apps & Dienste/https___www.telekom.de_netz_glasfaser_interessenten-registrierung.txt'}"", ""page_content='Seien Sie unter den Ersten, die Glasfaser-Internet bestellen können.' metadata={'source': 'data/Apps & Dienste/https___www.telekom.de_netz_glasfaser_interessenten-registrierung.txt'}"", ""page_content='Source URL: https://www.telekom.de/netz/glasfaser-ausbauplanung-ki\n\nQuestion: Was machen wir genau? Answer: In einem weiteren Schritt werden die entstandenen Fotos und 3D-Informationenen von einer künstlichen Intelligenz analysiert. Dadurch können wir automatisiert unterschiedliche Oberflächen wie Asphalt oder Kopfsteinpflaster erkennen und prüfen, ob Bäume oder Straßenlaternen die neuen Glasfasertrassen kreuzen. Übrigens, rund 80 Prozent der Kosten für den Glasfaserausbau entfallen auf die Tiefbauarbeiten, weshalb in der Planungsphase möglichst exakte Angaben benötigt werden. Question: Wie hilft künstliche Intelligenz? Answer: Unser Planungstool ermittelt nun automatisiert den effizientesten Weg zur Verlegung der neuen Glasfasertrassen. Hierbei kommt nicht nur der klassische Bagger zum Einsatz sondern auch alternative Verlegemethoden wie Trenching, Kabelpflug oder Spülbohrverfahren werden in der Planung berücksichtigt. Am Ende schaut aber immer noch einmal ein erfahrener Planer über das Ergebnis und optimiert dieses.' metadata={'source': 'data/Apps & Dienste/https___www.telekom.de_netz_glasfaser-ausbauplanung-ki.txt'}"", 'page_content=\'Source URL: https://telekomhilft.telekom.de/t5/Festnetz-Internet/MeinMagenta-geht-nicht-ueber-Glasfaseranschluss/td-p/6979678/jump-to/first-unread-message\nSubject: MeinMagenta geht nicht über Glasfaseranschluss\nContent: Liebe Community, ich habe ein kleines eigentümliches Problem: Ich habe vorübergehend zwei Internet-Anschlüsse: VDSL von der Telekom und Glasfaser der Deutschen Glasfaser. Und über das WLAN des Glasfasernetzes (Fritzbox 7490) läuft meine MeinMagenta-App auf dem Smartphone nicht. Immer die Fehlermeldung ""Die Seite konnte nicht geladen werden"". Über WLAN-Telekom und über Mobilfunk läuft sie einwandfrei.\' metadata={\'source\': \'data/Apps & Dienste/telekomhilft.telekom.de_t5_Festnetz-Internet_MeinMagenta-geht-nicht-ueber-Glasfaseranschluss_td-p_6979678_jump-to_first-unread-message.txt\'}', 'page_content=\'Einrichten der Internetverbindung\n4.Sie befinden sich nun auf der Startseite des Einrichtungsprogrammes. Um zu beginnen, klicken Sie auf ""Assistent starten"". 5.Tragen Sie in die jeweiligen Felder die Anschlusskennung, Ihre Zugangsnummer und das persönliche Kennwort ein. 6.Unter Router-Einstellungen wählen Sie ""Immer online"".Hinweis:Wählen Sie die Option ""Immer online"" aus, wenn Sie über Ihre Internet-Telefonnummer dauerhaft erreichbar sein wollen. Sollten Sie einen zeitbasierten Internettarif nutzen, kann diese Einstellung hohe Kosten verursachen. 7.Klicken Sie auf ""Speichern"".\' metadata={\'source\': \'data/Apps & Dienste/https___www.telekom.de_hilfe_geraete-zubehoer_router_speedport_900-serie_einrichtungsassistent-speedport-w-921v.txt\'}', ""page_content='Source URL: https://www.telekom.de/hilfe/hilfe-bei-stoerungen/verbunden-bleiben\n\nQuestion: Ihr Internet- oder Telefon-Anschluss funktioniert nicht? Answer: Bis die Störung behoben ist, können Sie verschiedene Einstellungen und Dienste nutzen, um weiter verbunden zu sein.' metadata={'source': 'data/Apps & Dienste/https___www.telekom.de_hilfe_hilfe-bei-stoerungen_verbunden-bleiben.txt'}"", ""page_content='wie kann ich es rückgängig machen?' metadata={'source': 'data/Apps & Dienste/telekomhilft.telekom.de_t5_E-Mail_ausversehen-mein-e-mail-postfach-statt-papierkorb-geloescht-vor_td-p_6970654_jump-to_first-unread-message.txt'}""]","Die Schritte für die Internetwiederherstellung nach einem Umzug, besonders bei Glasfaser, umfassen, sich so früh wie möglich mit dem Telekommunikationsunternehmen in Verbindung zu setzen, um die Situation vor Ort zu überprüfen. Wenn nach dem Umzug kein Internet vorhanden ist, weil der Anschluss nicht umgezogen wurde oder keine ausreichenden Leitungen verfügbar sind, bietet das Unternehmen Hilfe an. Kunden müssen sich beim Unternehmen melden, das dann eine Verbindung mit dem Vermieter herstellt, um die Leitung freizugeben oder bei Bedarf neue Leitungen in Neubauten zu installieren.",1857,0.00040724999999999995,286,12,77.07392406463623,0.8879705441689657,0.7777777777518519,1.0,0.0,0.0054428808143710174,0.11278195488721805
How can I update my contract details via Kundencenter or MeinMagenta App after moving?,"Um Ihre Vertragsdetails nach einem Umzug zu aktualisieren, können Sie dies entweder im Kundencenter oder in der MeinMagenta App selbstständig vornehmen. Melden Sie sich einfach mit Ihrem Telekom Login an und folgen Sie den weiteren Schritten zur Adressänderung. 

Für detaillierte Informationen können Sie auch die folgende Seite besuchen: [Telekom Hilfe - Adressänderung](https://www.telekom.de/hilfe/vertrag-rechnung/vertrag/aenderung/adressaenderung).","[""page_content='Source URL: https://www.telekom.de/hilfe/vertrag-rechnung/vertrag/aenderung/adressaenderung\n\nQuestion: Wie kann ich meine Adresse ändern? Answer: Wenn Sie umgezogen sind und Ihre Vertragsdaten ändern möchten, können Sie dies selbstständig über das Kundencenter oder die MeinMagenta App vornehmen.' metadata={'source': 'data/Apps & Dienste/https___www.telekom.de_hilfe_vertrag-rechnung_vertrag_aenderung_adressaenderung.txt'}"", ""page_content='Hinweis: Wenn Sie die Rechnungsdaten für einen Mobilfunk-Vertrag ändern, dann schicken wir Ihnen einen Bestätigungscode per SMS, mit der Sie die Adressänderung im Kundencenter oder in der MeinMagenta App bestätigen.' metadata={'source': 'data/Apps & Dienste/https___www.telekom.de_hilfe_vertrag-rechnung_rechnung_rechnungsdaten-aendern.txt'}"", ""page_content='KundencenterMelden Sie sich per Telekom Login imKundencenteran und folgen Sie den weiteren Schritten:\nMeinMagenta AppMelden Sie sich per Telekom Login in derMeinMagenta Appan und folgen Sie den weiteren Schritten:\nKontaktformularMöchten Sie die Änderung nicht selbst durchführen, melden Sie sich perKontaktformularbei uns.' metadata={'source': 'data/Apps & Dienste/https___www.telekom.de_hilfe_vertrag-rechnung_vertrag_aenderung_e-mail-adresse.txt'}"", ""page_content='Source URL: https://www.telekom.de/hilfe/vertrag-rechnung/rechnung/rechnungsdaten-aendern\n\nQuestion: Wie kann ich meine Rechnungsdaten ändern? Answer: Die Rechnungsanschrift und den Rechnungsempfänger können Sie im Kundencenter oder in der MeinMagenta App selbst anpassen.' metadata={'source': 'data/Apps & Dienste/https___www.telekom.de_hilfe_vertrag-rechnung_rechnung_rechnungsdaten-aendern.txt'}"", ""page_content='• Im Kundencenter:Vertragsdetails > Vertrag kündigen > Mit Kündigung fortfahren > Vertrag kündigen\n• In der MeinMagenta App:Vertrag > Vertrag anpassen > Vertrag kündigen\n\n' metadata={'source': 'data/Apps & Dienste/https___www.telekom.de_hilfe_tv_magenta-tv-app_kuendigen.txt'}""]","Wenn Sie umgezogen sind und Ihre Vertragsdaten ändern möchten, können Sie dies selbstständig über das Kundencenter oder die MeinMagenta App vornehmen.",791,0.00016365,100,5,57.354722023010254,0.9257788311717503,0.99999999998,1.0,1.0,0.029909967069885617,0.21978021978021975
What issues come up using Magenta TV on AB IPBOX via Aptoide vs. Fire TV Cube?,"Die Nutzung von Magenta TV auf einer AB IPBOX über Aptoide kann einige Probleme mit sich bringen. Zum einen ist die Magenta TV App möglicherweise nicht im Aptoide App-Store verfügbar, da die Box nicht alle Apps unterstützt. Benutzer berichten, dass nur eine tschechische Version der App angeboten wird, was auf die Herkunft der IPBOX hindeutet. Wenn die App nicht im Google Play Store verfügbar ist, gibt es meist keine alternative Möglichkeit, sie zu installieren.

Im Vergleich dazu ist die Nutzung von Magenta TV auf einem Fire TV Cube deutlich einfacher und problemloser. Der Fire TV Cube unterstützt die Magenta TV App direkt, und die Installation erfolgt unkompliziert über den Amazon App Store. Zudem benötigt man für die Nutzung des Fire TV Cube kein Amazon Prime Abonnement, sondern nur ein kostenloses Amazon-Konto in Kombination mit einem Magenta TV Tarif (außer Magenta TV Basic).

Zusammenfassend lässt sich sagen, dass die Nutzung von Magenta TV auf einem Fire TV Cube in der Regel weniger Schwierigkeiten bereitet als auf einer AB IPBOX über Aptoide.","[""page_content='Source URL: https://telekomhilft.telekom.de/t5/TV/Installation-der-Magenta-TV-App-auf-einem-AB-IPBOX-Android-TV/td-p/6953468/jump-to/first-unread-message\nSubject: Installation der Magenta TV App auf einem AB IPBOX Android TV\nContent: Hallo zusammen,ich würde gern die Magenta TV App auf meiner neuen o.a. TV-Box installieren.Eine Installation über GooglePlay Store ist nicht möglich, da dieser nicht von der Box unterstützt wird.Hier wird stattdessen der App-Store Aptoide verwendet, dieser bietet mir aber die Magenta TV App nicht an, lediglich eine tschechische Version (vermutlich, weil die IPBOX aus Tschechien stammt).Gibt es eine Möglichkeit, mein Gerät mit der Magenta TV App auszustatten?Vielen Dank im Voraus,Enneper\n\nAccepted Solutions:\n- @Enneperschrieb:Gibt es eine Möglichkeit, mein Gerät mit der Magenta TV App auszustatten?nein, dann nicht...Wenn die App gar nicht angeboten wird, im Google Play Store, dann gibt es keine Alternative für deine BoxDann nen FireStick oder MagentaTV One\n- @Enneperschrieb:Gibt es eine Möglichkeit, mein Gerät mit der Magenta TV App auszustatten?nein, dann nicht...Wenn die App gar nicht angeboten wird, im Google Play Store, dann gibt es keine Alternative für deine BoxDann nen FireStick oder MagentaTV One\n' metadata={'source': 'data/Apps & Dienste/telekomhilft.telekom.de_t5_TV_Installation-der-Magenta-TV-App-auf-einem-AB-IPBOX-Android-TV_td-p_6953468_jump-to_first-unread-message.txt'}"", ""page_content='MagentaTV Stick, MagentaTV One, Amazon Fire TV Stick/Cube, Apple TV (ab 4. Generation) und Google Chromecast\n• Ihrem Smart TV – in unsererGeräteübersichterfahren Sie, ob die MagentaTV App für Ihren\xa0Fernseher zur Verfügung steht\n\n' metadata={'source': 'data/Apps & Dienste/https___www.telekom.de_hilfe_tv_magenta-tv-app_nutzen.txt'}"", ""page_content='Die Bedienung erfolgt über die mitgelieferte Fernbedienung. Question: MagentaTV und Fire TV Stick – die perfekte Kombination? Answer: Mit dem Fire TV Stick kannst duMagentaTVin wenigen Minuten auf jedem Fernseher mit HDMI-Anschluss genießen. Dafür muss dein Fernseher nicht einmal smart sein, du brauchst nur eine WLAN-Verbindung. Einfach einstecken, installieren und losstreamen. Question: Brauche ich Amazon Prime, um MagentaTV mit dem Fire TV Stick zu nutzen? Answer: Nein, du brauchst kein Amazon Prime Abo. Ein kostenloses Amazon-Konto in Kombination mit einemMagentaTVTarif reicht aus (ausgenommen MagentaTV Basic). Question: Welcher MagentaTV Tarif ist für die Nutzung der App auf Fire TV notwendig? Answer: Du kannst alle MagentaTV Tarife (MagentaTV Basic ausgenommen) mit Amazon Fire TV nutzen. Question: Kann ich MagentaTV auf dem Fire TV Stick auch im Ausland nutzen? Answer: Ja, kannst du!' metadata={'source': 'data/Apps & Dienste/https___www.telekom.de_magenta-tv_tarife-und-optionen_magenta-tv-mit-app_amazon-fire-tv-stick.txt'}"", ""page_content='' metadata={'source': 'data/Apps & Dienste/https___www.telekom.de_hilfe_tv_inhalte_magenta-sport_empfangen.txt'}"", ""page_content='' metadata={'source': 'data/Apps & Dienste/https___www.telekom.de_hilfe_geraete-zubehoer_magenta-tv-geraete_magenta-tv-one_streaming.txt'}"", ""page_content='' metadata={'source': 'data/Apps & Dienste/https___www.telekom.de_hilfe_geraete-zubehoer_magenta-tv-geraete_magenta-tv-one_nutzung-tarif.txt'}"", ""page_content='B. Media Receiver 401 / 201 / 601 Sat, MagentaTV Box / PLAY) können damit leider nicht genutzt werden. Unterstützt werden die MagentaTV One, der MagentaTV Stick, Apple TV 4K und Apple TV HD, Fire TV Stick (ab FireTV OS 6), außerdem ist die Nutzung möglich überWebbrowsersowie über die MagentaTV App auf mobilen Endgeräten (ab iOS 15 und ab Android 8.1). Hinzu kommt eine App für die TV-Geräte von Samsung (ab 2018), LG Smart TVs ab webOS 5 und TV-Geräte mit Android 7.1 und höher, z.B. von Sony, Philips, Panasonic und Xiaomi.' metadata={'source': 'data/Apps & Dienste/https___www.telekom.de_magenta-tv_next-magenta-tv.txt'}"", ""page_content='' metadata={'source': 'data/Apps & Dienste/telekomhilft.telekom.de_t5_TV_Magenta-TV-App-Magenta-TV-2-0-bleibt-laufend-haengen_td-p_6942026_jump-to_first-unread-message.txt'}"", ""page_content='Magenta App funktioniert auf IPhone 15 Pro und IPad Pro (aktuelles Modell) im eigenem WLan ohne Probleme.Neustart des FireTV Cube, Deinstallation und Neuinstallation der Magenta App bringt kein Erfolg. Bis gestern funktionierte alles einwandfrei.' metadata={'source': 'data/Apps & Dienste/telekomhilft.telekom.de_t5_TV_Magenta-TV-App-Fehler-051104_td-p_6982345_jump-to_first-unread-message.txt'}""]","The context does not provide specific issues related to using Magenta TV on AB IPBOX via Aptoide compared to Fire TV Cube. It mentions that the Magenta TV App is not available on the AB IPBOX through Aptoide, while it works without problems on the Fire TV Cube.",1666,0.00034935,221,9,74.54717588424683,0.9673089866016827,0.0,1.0,1.0,0.010500649784144127,0.12173913043478261
